filename,video_id,start_time,end_time,duration,id,transcription,usability,bg_music,bg_noise,other_voice,only_music,only_noise,other_sounds,annotator,annotate_date_YYYYMMDD
AireenArellano_UCJqmGQTF2DgAEvV00Es6hTQ_854O5JEr76Q_528768_530544.wav,AireenArellano_UCJqmGQTF2DgAEvV00Es6hTQ_854O5JEr76Q,528768,530544,1776,99,ching chong sounds,1,0,0,0,0,0,0,DY,2021-06-21 10:43:24.037354
AireenArellano_UCJqmGQTF2DgAEvV00Es6hTQ_854O5JEr76Q_530816_531592.wav,AireenArellano_UCJqmGQTF2DgAEvV00Es6hTQ_854O5JEr76Q,530816,531592,776,100,out of their,1,0,0,0,0,0,0,DY,2021-06-21 10:43:30.347427
AireenArellano_UCJqmGQTF2DgAEvV00Es6hTQ_854O5JEr76Q_532096_534304.wav,AireenArellano_UCJqmGQTF2DgAEvV00Es6hTQ_854O5JEr76Q,532096,534304,2208,101,car I feel weird even just saying that,1,0,0,0,0,0,0,DY,2021-06-21 10:43:43.698999
AireenArellano_UCJqmGQTF2DgAEvV00Es6hTQ_854O5JEr76Q_534960_540024.wav,AireenArellano_UCJqmGQTF2DgAEvV00Es6hTQ_854O5JEr76Q,534960,540024,5064,102,uh it's so disrespectful I was the only one outside and they were definitely aiming that at me,1,0,0,0,0,0,0,DY,2021-06-21 10:43:55.410532
AireenArellano_UCJqmGQTF2DgAEvV00Es6hTQ_854O5JEr76Q_540320_541064.wav,AireenArellano_UCJqmGQTF2DgAEvV00Es6hTQ_854O5JEr76Q,540320,541064,744,103,and,1,0,0,0,0,0,0,DY,2021-06-21 10:44:02.340008
AireenArellano_UCJqmGQTF2DgAEvV00Es6hTQ_854O5JEr76Q_541824_544008.wav,AireenArellano_UCJqmGQTF2DgAEvV00Es6hTQ_854O5JEr76Q,541824,544008,2184,104,I didn't know what to say like and then I started,1,0,0,0,0,0,0,DY,2021-06-21 10:44:12.425913
AireenArellano_UCJqmGQTF2DgAEvV00Es6hTQ_854O5JEr76Q_544336_544680.wav,AireenArellano_UCJqmGQTF2DgAEvV00Es6hTQ_854O5JEr76Q,544336,544680,344,105,just,1,0,0,0,0,0,0,DY,2021-06-21 10:44:18.426950
AireenArellano_UCJqmGQTF2DgAEvV00Es6hTQ_854O5JEr76Q_545264_547680.wav,AireenArellano_UCJqmGQTF2DgAEvV00Es6hTQ_854O5JEr76Q,545264,547680,2416,106,hating my neighborhood after that and,1,0,0,0,0,0,0,DY,2021-06-21 10:44:28.136260
AireenArellano_UCJqmGQTF2DgAEvV00Es6hTQ_854O5JEr76Q_548000_554616.wav,AireenArellano_UCJqmGQTF2DgAEvV00Es6hTQ_854O5JEr76Q,548000,554616,6616,107,hating everyone after that and that was just one instance of bullying I- I can't imagine people who deal with that,1,0,0,0,0,0,0,DY,2021-06-21 10:44:40.745899
AireenArellano_UCJqmGQTF2DgAEvV00Es6hTQ_854O5JEr76Q_555224_561832.wav,AireenArellano_UCJqmGQTF2DgAEvV00Es6hTQ_854O5JEr76Q,555224,561832,6608,108,on a regular basis and how they feel about themselves and other people and their environments I remember telling my husband like you know,1,0,0,0,0,0,0,DY,2021-06-21 10:45:02.917669
AireenArellano_UCJqmGQTF2DgAEvV00Es6hTQ_854O5JEr76Q_562200_567616.wav,AireenArellano_UCJqmGQTF2DgAEvV00Es6hTQ_854O5JEr76Q,562200,567616,5416,109,this- this neighborhood sucks like we gotta move outta here there's no diversity it's definitely getting better out here,1,0,0,0,0,0,0,DY,2021-06-21 10:45:15.451912
AireenArellano_UCJqmGQTF2DgAEvV00Es6hTQ_854O5JEr76Q_568112_575756.wav,AireenArellano_UCJqmGQTF2DgAEvV00Es6hTQ_854O5JEr76Q,568112,575756,7644,110,in suburbia I am feeling better about it if this is a stereotype the fetishization saying like oh yeah,1,0,0,0,0,0,0,DY,2021-06-21 10:45:34.836743
AireenArellano_UCJqmGQTF2DgAEvV00Es6hTQ_854O5JEr76Q_575868_581180.wav,AireenArellano_UCJqmGQTF2DgAEvV00Es6hTQ_854O5JEr76Q,575868,581180,5312,111,Filipinos are beautiful a- both of the smart stereotype and the beautiful stereotype,1,0,0,0,0,0,0,DY,2021-06-21 10:45:46.083503
AireenArellano_UCJqmGQTF2DgAEvV00Es6hTQ_854O5JEr76Q_581300_586180.wav,AireenArellano_UCJqmGQTF2DgAEvV00Es6hTQ_854O5JEr76Q,581300,586180,4880,112,they're like nice stereotypes but you know what they're still stereotypes like nobody wants to be,1,0,0,0,0,0,0,DY,2021-06-21 10:45:58.832665
AireenArellano_UCJqmGQTF2DgAEvV00Es6hTQ_854O5JEr76Q_586292_587376.wav,AireenArellano_UCJqmGQTF2DgAEvV00Es6hTQ_854O5JEr76Q,586292,587376,1084,113,put into this big,1,0,0,0,0,0,0,DY,2021-06-21 10:46:07.864879
AireenArellano_UCJqmGQTF2DgAEvV00Es6hTQ_854O5JEr76Q_587824_589856.wav,AireenArellano_UCJqmGQTF2DgAEvV00Es6hTQ_854O5JEr76Q,587824,589856,2032,114,group to just be lumped together- that's always just,1,0,0,0,0,0,0,DY,2021-06-21 10:46:32.327111
AireenArellano_UCJqmGQTF2DgAEvV00Es6hTQ_854O5JEr76Q_590112_593712.wav,AireenArellano_UCJqmGQTF2DgAEvV00Es6hTQ_854O5JEr76Q,590112,593712,3600,115,awkward you know and then it becomes like about that person's weird,1,0,0,0,0,0,0,DY,2021-06-21 10:46:56.811697
AireenArellano_UCJqmGQTF2DgAEvV00Es6hTQ_854O5JEr76Q_594208_608832.wav,AireenArellano_UCJqmGQTF2DgAEvV00Es6hTQ_854O5JEr76Q,594208,608832,14624,116,fetishes and hang ups and then it's like not even about you as an individual anymore suddenly you're faced with like some person's weirdness I was always weirded out by the what are you question what are you human and I've heard the arguments well,1,0,0,0,0,0,0,DY,2021-06-21 10:47:24.624929
AireenArellano_UCJqmGQTF2DgAEvV00Es6hTQ_854O5JEr76Q_609088_613698.wav,AireenArellano_UCJqmGQTF2DgAEvV00Es6hTQ_854O5JEr76Q,609088,613698,4610,117,they're just being curious about you they just wanna know more about you and,1,0,0,0,0,0,0,DY,2021-06-21 10:47:36.887511
AireenArellano_UCJqmGQTF2DgAEvV00Es6hTQ_854O5JEr76Q_613874_618644.wav,AireenArellano_UCJqmGQTF2DgAEvV00Es6hTQ_854O5JEr76Q,613874,618644,4770,118,expand their own horizons and yeah but then again that's about them,1,0,0,0,0,0,0,DY,2021-06-21 10:47:53.760689
AireenArellano_UCJqmGQTF2DgAEvV00Es6hTQ_854O5JEr76Q_619216_631872.wav,AireenArellano_UCJqmGQTF2DgAEvV00Es6hTQ_854O5JEr76Q,619216,631872,12656,119,and you're not considering the feelings of the person that you're othering that's what I have a problem with the othering would you be asking me that if I was Caucasian probably not oh my gosh there was this one time at a,1,0,0,0,0,0,0,DY,2021-06-21 10:48:19.747093
AireenArellano_UCJqmGQTF2DgAEvV00Es6hTQ_854O5JEr76Q_631968_637416.wav,AireenArellano_UCJqmGQTF2DgAEvV00Es6hTQ_854O5JEr76Q,631968,637416,5448,120,bar my husband and I were just sitting outside minding our own business there was another couple,1,0,0,0,0,0,0,DY,2021-06-21 10:48:30.863000
AireenArellano_UCJqmGQTF2DgAEvV00Es6hTQ_854O5JEr76Q_637688_642264.wav,AireenArellano_UCJqmGQTF2DgAEvV00Es6hTQ_854O5JEr76Q,637688,642264,4576,121,sitting at another table one of them the guy comes over and he's like,1,0,0,0,0,0,0,DY,2021-06-21 10:48:44.040283
AireenArellano_UCJqmGQTF2DgAEvV00Es6hTQ_854O5JEr76Q_642768_645610.wav,AireenArellano_UCJqmGQTF2DgAEvV00Es6hTQ_854O5JEr76Q,642768,645610,2842,122,I'm sorry I just I just gotta know,1,0,0,0,0,0,0,DY,2021-06-21 10:48:55.602992
AireenArellano_UCJqmGQTF2DgAEvV00Es6hTQ_854O5JEr76Q_645698_657972.wav,AireenArellano_UCJqmGQTF2DgAEvV00Es6hTQ_854O5JEr76Q,645698,657972,12274,123,I_unn know_unn it's_unn coming_unn if you're asian american you know when you're gonna get the question y- like your spidey sense tingles and then you're like running through all the different kinds of answers that you could have at that time depending on your mood I was in a very,1,0,0,1,0,0,0,DY,2021-06-21 10:49:23.321170
AireenArellano_UCJqmGQTF2DgAEvV00Es6hTQ_854O5JEr76Q_658092_660000.wav,AireenArellano_UCJqmGQTF2DgAEvV00Es6hTQ_854O5JEr76Q,658092,660000,1908,124,chill mood at this time,1,0,0,0,0,0,0,DY,2021-06-21 10:49:30.911275
AireenArellano_UCJqmGQTF2DgAEvV00Es6hTQ_854O5JEr76Q_660224_675140.wav,AireenArellano_UCJqmGQTF2DgAEvV00Es6hTQ_854O5JEr76Q,660224,675140,14916,125,I_unn gotta_unn know_unn where_unn are_unn you_unn from_unn I know what that question means 'cause then I'm gonna say I'm from Chicago and then he's gonna say no where are you really from and then I have to be like my parents are from the Philippines and then,1,0,0,1,0,0,0,DY,2021-06-21 10:49:56.763296
AireenArellano_UCJqmGQTF2DgAEvV00Es6hTQ_854O5JEr76Q_675268_680816.wav,AireenArellano_UCJqmGQTF2DgAEvV00Es6hTQ_854O5JEr76Q,675268,680816,5548,126,oh_unn okay_unn yeah I'm glad it's okay for me to be here now I'm sure he,1,0,0,1,0,0,0,DY,2021-06-21 10:50:11.407156
AireenArellano_UCJqmGQTF2DgAEvV00Es6hTQ_854O5JEr76Q_681304_684848.wav,AireenArellano_UCJqmGQTF2DgAEvV00Es6hTQ_854O5JEr76Q,681304,684848,3544,127,means well and he just wants to connect but,1,0,0,0,0,0,0,DY,2021-06-21 10:50:21.261535
AireenArellano_UCJqmGQTF2DgAEvV00Es6hTQ_854O5JEr76Q_685560_692024.wav,AireenArellano_UCJqmGQTF2DgAEvV00Es6hTQ_854O5JEr76Q,685560,692024,6464,128,at the same time I don't appreciate the othering oh you're not from here are you and then it's just frustrating because,1,0,0,0,0,0,0,DY,2021-06-21 10:53:08.395178
AireenArellano_UCJqmGQTF2DgAEvV00Es6hTQ_854O5JEr76Q_692664_701904.wav,AireenArellano_UCJqmGQTF2DgAEvV00Es6hTQ_854O5JEr76Q,692664,701904,9240,129,hell yeah I'm from here I was born here I was raised here but I- I understand that's like the struggle that Asian Americans struggle with,1,0,0,0,0,0,0,DY,2021-06-21 10:53:24.573388
AireenArellano_UCJqmGQTF2DgAEvV00Es6hTQ_854O5JEr76Q_702376_716736.wav,AireenArellano_UCJqmGQTF2DgAEvV00Es6hTQ_854O5JEr76Q,702376,716736,14360,130,and I don't even want to say struggle it's a very strong word it's just like an internal it's a questioning it's a questioning if you're watching this and you've asked someone that question it's okay don't feel bad just know that,1,0,0,0,0,0,0,DY,2021-06-21 10:53:49.234524
AireenArellano_UCJqmGQTF2DgAEvV00Es6hTQ_854O5JEr76Q_717400_727128.wav,AireenArellano_UCJqmGQTF2DgAEvV00Es6hTQ_854O5JEr76Q,717400,727128,9728,131,y'know we might not be cool with that um maybe i- y'know there's some people who are cool with that if- I'm just kinda navigating my own life goin' about my business,1,0,0,0,0,0,0,DY,2021-06-21 10:54:51.652686
AireenArellano_UCJqmGQTF2DgAEvV00Es6hTQ_854O5JEr76Q_727344_729304.wav,AireenArellano_UCJqmGQTF2DgAEvV00Es6hTQ_854O5JEr76Q,727344,729304,1960,132,kinda one of the last things I want,1,0,0,0,0,0,0,DY,2021-06-21 10:55:00.207104
AireenArellano_UCJqmGQTF2DgAEvV00Es6hTQ_854O5JEr76Q_729728_733912.wav,AireenArellano_UCJqmGQTF2DgAEvV00Es6hTQ_854O5JEr76Q,729728,733912,4184,133,to hear is like hey you're different what are you like I don't really owe,1,0,0,0,0,0,0,DY,2021-06-21 10:55:12.230578
AireenArellano_UCJqmGQTF2DgAEvV00Es6hTQ_854O5JEr76Q_734280_734808.wav,AireenArellano_UCJqmGQTF2DgAEvV00Es6hTQ_854O5JEr76Q,734280,734808,528,134,you that,1,0,0,0,0,0,0,DY,2021-06-21 10:55:20.182516
AireenArellano_UCJqmGQTF2DgAEvV00Es6hTQ_854O5JEr76Q_734976_749928.wav,AireenArellano_UCJqmGQTF2DgAEvV00Es6hTQ_854O5JEr76Q,734976,749928,14952,135,answer comment down below if you have experience with that either way or if you've asked someone what they are or if you get that question a lot this might be kinda going off topic a little bit we- this is about,1,0,0,0,0,0,1,DY,2021-06-21 10:55:44.713590
AireenArellano_UCJqmGQTF2DgAEvV00Es6hTQ_854O5JEr76Q_750672_755328.wav,AireenArellano_UCJqmGQTF2DgAEvV00Es6hTQ_854O5JEr76Q,750672,755328,4656,136,being proud of our heritage I can understand Tagalog but I cannot,1,0,0,0,0,0,1,DY,2021-06-21 10:55:59.912446
AireenArellano_UCJqmGQTF2DgAEvV00Es6hTQ_854O5JEr76Q_755704_756256.wav,AireenArellano_UCJqmGQTF2DgAEvV00Es6hTQ_854O5JEr76Q,755704,756256,552,137,speak it,1,0,0,0,0,0,0,DY,2021-06-21 21:53:29.800618
AireenArellano_UCJqmGQTF2DgAEvV00Es6hTQ_854O5JEr76Q_756872_762970.wav,AireenArellano_UCJqmGQTF2DgAEvV00Es6hTQ_854O5JEr76Q,756872,762970,6098,138,and I think that comes from me learning it at a young age and then slowly growing out of it,1,0,0,0,0,0,0,DY,2021-06-21 21:53:40.401621
AireenArellano_UCJqmGQTF2DgAEvV00Es6hTQ_854O5JEr76Q_763122_774134.wav,AireenArellano_UCJqmGQTF2DgAEvV00Es6hTQ_854O5JEr76Q,763122,774134,11012,139,but I know for a fact that if I spent a couple solid months in the Philippines I would be able to pick it back up again because that's exactly what happened when my parents took me and my brother,1,0,0,0,0,0,0,DY,2021-06-21 21:53:59.042406
AireenArellano_UCJqmGQTF2DgAEvV00Es6hTQ_854O5JEr76Q_774254_778586.wav,AireenArellano_UCJqmGQTF2DgAEvV00Es6hTQ_854O5JEr76Q,774254,778586,4332,140,back to the Philippines for a couple vacations so my parents,1,0,0,0,0,0,0,DY,2021-06-21 21:54:08.765379
AireenArellano_UCJqmGQTF2DgAEvV00Es6hTQ_854O5JEr76Q_778722_786602.wav,AireenArellano_UCJqmGQTF2DgAEvV00Es6hTQ_854O5JEr76Q,778722,786602,7880,141,would speak Tagalog to each other and then they would speak English to me and my brother I think that comes from them,1,0,0,0,0,0,0,DY,2021-06-21 21:54:22.217649
AireenArellano_UCJqmGQTF2DgAEvV00Es6hTQ_854O5JEr76Q_787348_792340.wav,AireenArellano_UCJqmGQTF2DgAEvV00Es6hTQ_854O5JEr76Q,787348,792340,4992,142,really wanting us to assimilate to American culture,1,0,0,0,0,0,0,DY,2021-06-21 21:54:32.205791
AireenArellano_UCJqmGQTF2DgAEvV00Es6hTQ_854O5JEr76Q_792908_795200.wav,AireenArellano_UCJqmGQTF2DgAEvV00Es6hTQ_854O5JEr76Q,792908,795200,2292,143,and to not be,1,0,0,0,0,0,0,DY,2021-06-21 21:54:40.363657
AireenArellano_UCJqmGQTF2DgAEvV00Es6hTQ_854O5JEr76Q_795472_803840.wav,AireenArellano_UCJqmGQTF2DgAEvV00Es6hTQ_854O5JEr76Q,795472,803840,8368,144,for a lack of a better term held back by speaking Tagalog I think they just really wanted us to,1,0,1,0,0,0,0,DY,2021-06-21 21:54:54.705762
AireenArellano_UCJqmGQTF2DgAEvV00Es6hTQ_854O5JEr76Q_804104_812416.wav,AireenArellano_UCJqmGQTF2DgAEvV00Es6hTQ_854O5JEr76Q,804104,812416,8312,145,become American they'd worked so hard to get here and they wanted to make sure me and my brother assimilated I really wish they had,1,0,0,0,0,0,0,DY,2021-06-21 21:55:08.592828
AireenArellano_UCJqmGQTF2DgAEvV00Es6hTQ_854O5JEr76Q_812728_815960.wav,AireenArellano_UCJqmGQTF2DgAEvV00Es6hTQ_854O5JEr76Q,812728,815960,3232,146,kept teaching us at preserving that but,1,0,0,0,0,0,0,DY,2021-06-21 21:55:18.918391
AireenArellano_UCJqmGQTF2DgAEvV00Es6hTQ_854O5JEr76Q_816264_824218.wav,AireenArellano_UCJqmGQTF2DgAEvV00Es6hTQ_854O5JEr76Q,816264,824218,7954,147,hey you know if I wanted to continue learning I could've done that on my own and I didn't I am actively excited to,1,0,0,0,0,0,0,DY,2021-06-21 21:55:41.507694
AireenArellano_UCJqmGQTF2DgAEvV00Es6hTQ_854O5JEr76Q_824322_827130.wav,AireenArellano_UCJqmGQTF2DgAEvV00Es6hTQ_854O5JEr76Q,824322,827130,2808,148,take it all in and to relearn,1,0,0,0,0,0,0,DY,2021-06-21 21:55:49.216443
AireenArellano_UCJqmGQTF2DgAEvV00Es6hTQ_854O5JEr76Q_827274_834044.wav,AireenArellano_UCJqmGQTF2DgAEvV00Es6hTQ_854O5JEr76Q,827274,834044,6770,149,I'm excited about exploring my roots it's- it's something that I'm constantly working on it's definitely gonna be a lifelong process,1,0,0,0,0,0,0,DY,2021-06-21 21:56:02.105487
AireenArellano_UCJqmGQTF2DgAEvV00Es6hTQ_854O5JEr76Q_834148_838620.wav,AireenArellano_UCJqmGQTF2DgAEvV00Es6hTQ_854O5JEr76Q,834148,838620,4472,150,my cousins who were born here they kind of have the same thing they don't,1,0,0,0,0,0,0,DY,2021-06-21 21:56:13.056704
AireenArellano_UCJqmGQTF2DgAEvV00Es6hTQ_854O5JEr76Q_838732_849168.wav,AireenArellano_UCJqmGQTF2DgAEvV00Es6hTQ_854O5JEr76Q,838732,849168,10436,151,really speak the language because our parents encouraged us to fully assimilate I think we could've assimilated while still preserving the language,1,0,0,0,0,0,0,DY,2021-06-21 21:56:54.292418
AireenArellano_UCJqmGQTF2DgAEvV00Es6hTQ_854O5JEr76Q_849376_856064.wav,AireenArellano_UCJqmGQTF2DgAEvV00Es6hTQ_854O5JEr76Q,849376,856064,6688,152,but it's really interesting how that's not an uncommon story with Filipino American kids,1,0,0,0,0,0,0,DY,2021-06-21 21:57:07.035925
AireenArellano_UCJqmGQTF2DgAEvV00Es6hTQ_854O5JEr76Q_856352_856864.wav,AireenArellano_UCJqmGQTF2DgAEvV00Es6hTQ_854O5JEr76Q,856352,856864,512,153,kids,1,0,0,0,0,0,0,DY,2021-06-21 21:57:12.938003
AireenArellano_UCJqmGQTF2DgAEvV00Es6hTQ_854O5JEr76Q_857232_866032.wav,AireenArellano_UCJqmGQTF2DgAEvV00Es6hTQ_854O5JEr76Q,857232,866032,8800,154,is thirty five being a kid among Filipino Americans in my generation oh man language was never a barrier,1,0,0,0,0,0,1,DY,2021-06-21 21:57:30.678121
AireenArellano_UCJqmGQTF2DgAEvV00Es6hTQ_854O5JEr76Q_866344_880752.wav,AireenArellano_UCJqmGQTF2DgAEvV00Es6hTQ_854O5JEr76Q,866344,880752,14408,155,between me and my parents 'cause- they speak English extremely fluently I could have complex conversations about anything with my parents where there is a barrier was culturally oh my goodness 'cause my poor parents,1,0,0,0,0,0,1,DY,2021-06-21 21:58:08.238793
AireenArellano_UCJqmGQTF2DgAEvV00Es6hTQ_854O5JEr76Q_881032_881144.wav,AireenArellano_UCJqmGQTF2DgAEvV00Es6hTQ_854O5JEr76Q,881032,881144,112,156,,0,0,0,0,0,1,0,DY,2021-06-21 21:58:12.319414
AireenArellano_UCJqmGQTF2DgAEvV00Es6hTQ_854O5JEr76Q_881520_883352.wav,AireenArellano_UCJqmGQTF2DgAEvV00Es6hTQ_854O5JEr76Q,881520,883352,1832,157,they grew up one way,1,0,0,0,0,0,0,DY,2021-06-21 21:58:26.413333
AireenArellano_UCJqmGQTF2DgAEvV00Es6hTQ_854O5JEr76Q_883688_889752.wav,AireenArellano_UCJqmGQTF2DgAEvV00Es6hTQ_854O5JEr76Q,883688,889752,6064,158,and then they come to this new country they're struggling to figure out what's normal in America,1,0,1,0,0,0,0,DY,2021-06-21 21:58:38.493130
AireenArellano_UCJqmGQTF2DgAEvV00Es6hTQ_854O5JEr76Q_889952_891904.wav,AireenArellano_UCJqmGQTF2DgAEvV00Es6hTQ_854O5JEr76Q,889952,891904,1952,159,what is a good way to raise,1,0,0,0,0,0,0,DY,2021-06-21 21:58:45.689096
AireenArellano_UCJqmGQTF2DgAEvV00Es6hTQ_854O5JEr76Q_892232_893256.wav,AireenArellano_UCJqmGQTF2DgAEvV00Es6hTQ_854O5JEr76Q,892232,893256,1024,160,my kids,1,0,0,0,0,0,0,DY,2021-06-21 21:58:52.975263
AireenArellano_UCJqmGQTF2DgAEvV00Es6hTQ_854O5JEr76Q_893656_894616.wav,AireenArellano_UCJqmGQTF2DgAEvV00Es6hTQ_854O5JEr76Q,893656,894616,960,161,in America,1,0,0,0,0,0,0,DY,2021-06-21 21:59:01.064884
AireenArellano_UCJqmGQTF2DgAEvV00Es6hTQ_854O5JEr76Q_895064_895912.wav,AireenArellano_UCJqmGQTF2DgAEvV00Es6hTQ_854O5JEr76Q,895064,895912,848,162,while,1,0,0,0,0,0,0,DY,2021-06-21 21:59:07.680131
AireenArellano_UCJqmGQTF2DgAEvV00Es6hTQ_854O5JEr76Q_896184_898040.wav,AireenArellano_UCJqmGQTF2DgAEvV00Es6hTQ_854O5JEr76Q,896184,898040,1856,163,preserving the values that,1,0,0,0,0,0,0,DY,2021-06-21 21:59:14.161642
AireenArellano_UCJqmGQTF2DgAEvV00Es6hTQ_854O5JEr76Q_898384_901724.wav,AireenArellano_UCJqmGQTF2DgAEvV00Es6hTQ_854O5JEr76Q,898384,901724,3340,164,I have like I imagine that's the struggle that they dealt with,1,0,0,0,0,0,0,DY,2021-06-21 21:59:23.084083
AireenArellano_UCJqmGQTF2DgAEvV00Es6hTQ_854O5JEr76Q_901900_909012.wav,AireenArellano_UCJqmGQTF2DgAEvV00Es6hTQ_854O5JEr76Q,901900,909012,7112,165,where I was coming from my parents were stuck in the old ways and this is how kids are,1,0,0,0,0,0,0,DY,2021-06-21 21:59:36.225041
AireenArellano_UCJqmGQTF2DgAEvV00Es6hTQ_854O5JEr76Q_909164_915140.wav,AireenArellano_UCJqmGQTF2DgAEvV00Es6hTQ_854O5JEr76Q,909164,915140,5976,166,in this generation and in America I had to convince them that sleepovers are normal but,1,0,0,0,0,0,0,DY,2021-06-21 21:59:48.315557
AireenArellano_UCJqmGQTF2DgAEvV00Es6hTQ_854O5JEr76Q_915308_920884.wav,AireenArellano_UCJqmGQTF2DgAEvV00Es6hTQ_854O5JEr76Q,915308,920884,5576,167,they didn't grow up having sleepovers that's weird for them right so can you imagine your kids telling you that,1,0,0,0,0,0,0,DY,2021-06-21 22:00:00.542529
AireenArellano_UCJqmGQTF2DgAEvV00Es6hTQ_854O5JEr76Q_921060_931364.wav,AireenArellano_UCJqmGQTF2DgAEvV00Es6hTQ_854O5JEr76Q,921060,931364,10304,168,and you never experienced that and you're like that's a thing like that's- I don't think so I don't think you should be going over to other people's houses and sleeping in them that- that was one of many,1,0,0,0,0,0,0,DY,2021-06-21 22:00:46.103267
AireenArellano_UCJqmGQTF2DgAEvV00Es6hTQ_854O5JEr76Q_931532_932696.wav,AireenArellano_UCJqmGQTF2DgAEvV00Es6hTQ_854O5JEr76Q,931532,932696,1164,169,cultural,1,0,0,0,0,0,0,DY,2021-06-21 22:00:56.805816
AireenArellano_UCJqmGQTF2DgAEvV00Es6hTQ_854O5JEr76Q_933176_938304.wav,AireenArellano_UCJqmGQTF2DgAEvV00Es6hTQ_854O5JEr76Q,933176,938304,5128,170,generational clashes that we would have- oh my gosh high school high school was ,1,0,0,0,0,0,0,DY,2021-06-21 22:01:07.191573
AireenArellano_UCJqmGQTF2DgAEvV00Es6hTQ_854O5JEr76Q_938824_946632.wav,AireenArellano_UCJqmGQTF2DgAEvV00Es6hTQ_854O5JEr76Q,938824,946632,7808,171,such a struggle because that's where you do so much growing so quickly and it was,1,0,0,0,0,0,0,DY,2021-06-21 22:01:20.654863
AireenArellano_UCJqmGQTF2DgAEvV00Es6hTQ_854O5JEr76Q_946952_958632.wav,AireenArellano_UCJqmGQTF2DgAEvV00Es6hTQ_854O5JEr76Q,946952,958632,11680,172,again a constant battle of yes it's normal to go out hang out with friends to stay out this late to do this and to do that and I swear I wasn't tryna,1,0,0,0,0,0,0,DY,2021-06-21 22:01:40.045194
AireenArellano_UCJqmGQTF2DgAEvV00Es6hTQ_854O5JEr76Q_958768_961512.wav,AireenArellano_UCJqmGQTF2DgAEvV00Es6hTQ_854O5JEr76Q,958768,961512,2744,173,pull the wool over their eyes I just wanted to do normal,1,0,0,0,0,0,0,DY,2021-06-21 22:01:49.791135
AireenArellano_UCJqmGQTF2DgAEvV00Es6hTQ_854O5JEr76Q_961648_965545.wav,AireenArellano_UCJqmGQTF2DgAEvV00Es6hTQ_854O5JEr76Q,961648,965545,3897,174,American kid stuff that's where we were coming at from both sides because,1,0,0,0,0,0,0,DY,2021-06-21 22:02:07.970857
AireenArellano_UCJqmGQTF2DgAEvV00Es6hTQ_854O5JEr76Q_965978_968244.wav,AireenArellano_UCJqmGQTF2DgAEvV00Es6hTQ_854O5JEr76Q,965978,968244,2266,175,I was living a life that they,1,0,0,0,0,0,0,DY,2021-06-21 22:02:17.059491
AireenArellano_UCJqmGQTF2DgAEvV00Es6hTQ_854O5JEr76Q_968484_977804.wav,AireenArellano_UCJqmGQTF2DgAEvV00Es6hTQ_854O5JEr76Q,968484,977804,9320,176,couldn't even in that sense I give them mad props for taking themselves out of a place that they know and going to a completely new place,1,0,0,0,0,0,0,DY,2021-06-21 22:02:32.748878
AireenArellano_UCJqmGQTF2DgAEvV00Es6hTQ_854O5JEr76Q_978320_980576.wav,AireenArellano_UCJqmGQTF2DgAEvV00Es6hTQ_854O5JEr76Q,978320,980576,2256,177,and trying to raise a family in it that's,1,0,0,0,0,0,0,DY,2021-06-21 22:02:40.969662
AireenArellano_UCJqmGQTF2DgAEvV00Es6hTQ_854O5JEr76Q_980848_988472.wav,AireenArellano_UCJqmGQTF2DgAEvV00Es6hTQ_854O5JEr76Q,980848,988472,7624,178,that's insane they did a phenomenal job and I do thank them for it through the struggles through the fights,1,0,0,0,0,0,0,DY,2021-06-21 22:03:05.196107
AireenArellano_UCJqmGQTF2DgAEvV00Es6hTQ_854O5JEr76Q_988776_995952.wav,AireenArellano_UCJqmGQTF2DgAEvV00Es6hTQ_854O5JEr76Q,988776,995952,7176,179,they instilled really good values in me and my brother and that's- those are values that are really strong within me today,1,0,0,0,0,0,0,DY,2021-06-21 22:03:19.399983
AireenArellano_UCJqmGQTF2DgAEvV00Es6hTQ_854O5JEr76Q_996240_996480.wav,AireenArellano_UCJqmGQTF2DgAEvV00Es6hTQ_854O5JEr76Q,996240,996480,240,180,,0,0,0,0,0,1,0,DY,2021-06-21 22:03:23.915289
AireenArellano_UCJqmGQTF2DgAEvV00Es6hTQ_854O5JEr76Q_996480_996620.wav,AireenArellano_UCJqmGQTF2DgAEvV00Es6hTQ_854O5JEr76Q,996480,996620,140,181,,0,0,0,0,0,1,0,DY,2021-06-21 22:03:26.493494
AireenArellano_UCJqmGQTF2DgAEvV00Es6hTQ_854O5JEr76Q_997020_1005512.wav,AireenArellano_UCJqmGQTF2DgAEvV00Es6hTQ_854O5JEr76Q,997020,1005512,8492,182,family working hard and that sense of entrepreneurialism being loving and being kind that's something that can transcend,1,0,0,0,0,0,0,DY,2021-06-21 22:03:54.986962
AireenArellano_UCJqmGQTF2DgAEvV00Es6hTQ_854O5JEr76Q_1005752_1006728.wav,AireenArellano_UCJqmGQTF2DgAEvV00Es6hTQ_854O5JEr76Q,1005752,1006728,976,183,culture,1,0,0,0,0,0,0,DY,2021-06-21 22:04:00.407816
AireenArellano_UCJqmGQTF2DgAEvV00Es6hTQ_854O5JEr76Q_1007056_1010032.wav,AireenArellano_UCJqmGQTF2DgAEvV00Es6hTQ_854O5JEr76Q,1007056,1010032,2976,184,i- if you have those values and they're passed on,1,0,0,0,0,0,0,DY,2021-06-21 22:04:10.443002
AireenArellano_UCJqmGQTF2DgAEvV00Es6hTQ_854O5JEr76Q_1010184_1014980.wav,AireenArellano_UCJqmGQTF2DgAEvV00Es6hTQ_854O5JEr76Q,1010184,1014980,4796,185,that's- that's a really good foundation for future generation that I am thankful for,1,0,0,0,0,0,0,DY,2021-06-21 22:04:27.449810
AireenArellano_UCJqmGQTF2DgAEvV00Es6hTQ_854O5JEr76Q_1015132_1021296.wav,AireenArellano_UCJqmGQTF2DgAEvV00Es6hTQ_854O5JEr76Q,1015132,1021296,6164,186,my parents are amazing my parents are my heroes how long do you have I could wax on about,1,0,0,0,0,0,0,DY,2021-06-21 22:04:39.566033
AireenArellano_UCJqmGQTF2DgAEvV00Es6hTQ_854O5JEr76Q_1021696_1022960.wav,AireenArellano_UCJqmGQTF2DgAEvV00Es6hTQ_854O5JEr76Q,1021696,1022960,1264,187,how incredible,1,0,0,0,0,0,0,DY,2021-06-21 22:04:47.440734
AireenArellano_UCJqmGQTF2DgAEvV00Es6hTQ_854O5JEr76Q_1023584_1037888.wav,AireenArellano_UCJqmGQTF2DgAEvV00Es6hTQ_854O5JEr76Q,1023584,1037888,14304,188,my mother is and how hard working she is and she really set that example of putting your nose to the grindstone and working for what you want my dad has been so instrumental in being,1,0,0,0,0,0,0,DY,2021-06-21 22:06:19.153096
AireenArellano_UCJqmGQTF2DgAEvV00Es6hTQ_854O5JEr76Q_1038144_1041364.wav,AireenArellano_UCJqmGQTF2DgAEvV00Es6hTQ_854O5JEr76Q,1038144,1041364,3220,189,an amazing example for me and my brother about,1,0,0,0,0,0,0,DY,2021-06-21 22:06:27.473950
AireenArellano_UCJqmGQTF2DgAEvV00Es6hTQ_854O5JEr76Q_1041500_1042630.wav,AireenArellano_UCJqmGQTF2DgAEvV00Es6hTQ_854O5JEr76Q,1041500,1042630,1130,190,the importance,1,0,0,0,0,0,0,DY,2021-06-21 22:06:34.052366
AireenArellano_UCJqmGQTF2DgAEvV00Es6hTQ_854O5JEr76Q_1042750_1057296.wav,AireenArellano_UCJqmGQTF2DgAEvV00Es6hTQ_854O5JEr76Q,1042750,1057296,14546,191,of friendship and the importance of fostering a relationship with people who mean so much to you whether that's your actual family or chosen family what I am super grateful for with my parents is that they never once were like,1,0,0,0,0,0,0,DY,2021-06-21 22:07:24.835969
AireenArellano_UCJqmGQTF2DgAEvV00Es6hTQ_854O5JEr76Q_1057928_1062608.wav,AireenArellano_UCJqmGQTF2DgAEvV00Es6hTQ_854O5JEr76Q,1057928,1062608,4680,192,oh you have to go into a medical or professional,1,0,0,0,0,0,0,DY,2021-06-21 22:07:49.381110
