filename,video_id,start_time,end_time,duration,id,transcription,usability,bg_music,bg_noise,other_voice,only_music,only_noise,other_sounds,annotator,annotate_date_YYYYMMDD
AireenArellano_UCJqmGQTF2DgAEvV00Es6hTQ_854O5JEr76Q_1063280_1066024.wav,AireenArellano_UCJqmGQTF2DgAEvV00Es6hTQ_854O5JEr76Q,1063280,1066024,2744,193,field they saw right away that,1,0,0,0,0,0,0,DY,2021-06-21 22:07:57.644223
AireenArellano_UCJqmGQTF2DgAEvV00Es6hTQ_854O5JEr76Q_1066416_1073672.wav,AireenArellano_UCJqmGQTF2DgAEvV00Es6hTQ_854O5JEr76Q,1066416,1073672,7256,194,I was a creative person and they did everything they could to foster that and to encourage that so,1,0,0,0,0,0,0,DY,2021-06-21 22:08:11.661697
AireenArellano_UCJqmGQTF2DgAEvV00Es6hTQ_854O5JEr76Q_1073840_1078312.wav,AireenArellano_UCJqmGQTF2DgAEvV00Es6hTQ_854O5JEr76Q,1073840,1078312,4472,195,they invested in all of the art classes all of the art tools everything,1,0,0,0,0,0,0,DY,2021-06-21 22:08:21.818945
AireenArellano_UCJqmGQTF2DgAEvV00Es6hTQ_854O5JEr76Q_1078472_1078832.wav,AireenArellano_UCJqmGQTF2DgAEvV00Es6hTQ_854O5JEr76Q,1078472,1078832,360,196,and,1,0,0,0,0,0,0,DY,2021-06-21 22:08:28.530615
AireenArellano_UCJqmGQTF2DgAEvV00Es6hTQ_854O5JEr76Q_1079088_1080280.wav,AireenArellano_UCJqmGQTF2DgAEvV00Es6hTQ_854O5JEr76Q,1079088,1080280,1192,197,they definitely,1,0,0,0,0,0,0,DY,2021-06-21 22:08:34.938003
AireenArellano_UCJqmGQTF2DgAEvV00Es6hTQ_854O5JEr76Q_1080560_1085800.wav,AireenArellano_UCJqmGQTF2DgAEvV00Es6hTQ_854O5JEr76Q,1080560,1085800,5240,198,held fast to the adage that whatever you wanna do make sure you do it well ,1,0,0,0,0,0,0,DY,2021-06-21 22:08:49.035306
AireenArellano_UCJqmGQTF2DgAEvV00Es6hTQ_854O5JEr76Q_1086144_1087392.wav,AireenArellano_UCJqmGQTF2DgAEvV00Es6hTQ_854O5JEr76Q,1086144,1087392,1248,199,that's what I did and,1,0,0,0,0,0,0,DY,2021-06-21 22:08:56.490839
AireenArellano_UCJqmGQTF2DgAEvV00Es6hTQ_854O5JEr76Q_1088504_1089808.wav,AireenArellano_UCJqmGQTF2DgAEvV00Es6hTQ_854O5JEr76Q,1088504,1089808,1304,200,they're amazing for that,1,0,0,0,0,0,0,DY,2021-06-21 22:09:03.636559
AireenArellano_UCJqmGQTF2DgAEvV00Es6hTQ_854O5JEr76Q_1091024_1097992.wav,AireenArellano_UCJqmGQTF2DgAEvV00Es6hTQ_854O5JEr76Q,1091024,1097992,6968,201,I love it I'm proud to be Filipino American which is why exploring my roots is going to be a lifelong,1,0,0,0,0,0,1,DY,2021-06-21 22:09:16.431440
AireenArellano_UCJqmGQTF2DgAEvV00Es6hTQ_854O5JEr76Q_1098120_1099600.wav,AireenArellano_UCJqmGQTF2DgAEvV00Es6hTQ_854O5JEr76Q,1098120,1099600,1480,202,process I,1,0,0,0,0,0,0,DY,2021-06-21 22:09:23.273809
AireenArellano_UCJqmGQTF2DgAEvV00Es6hTQ_854O5JEr76Q_1099728_1109552.wav,AireenArellano_UCJqmGQTF2DgAEvV00Es6hTQ_854O5JEr76Q,1099728,1109552,9824,203,would love to learn the language again I would love to really dig my heels into the history of it again 'cause after a time in my younger years of rejecting it ,1,0,0,0,0,0,0,DY,2021-06-21 22:09:58.041731
AireenArellano_UCJqmGQTF2DgAEvV00Es6hTQ_854O5JEr76Q_1109952_1110640.wav,AireenArellano_UCJqmGQTF2DgAEvV00Es6hTQ_854O5JEr76Q,1109952,1110640,688,204,I think,1,0,0,0,0,0,0,DY,2021-06-21 22:10:05.031259
AireenArellano_UCJqmGQTF2DgAEvV00Es6hTQ_854O5JEr76Q_1111136_1118896.wav,AireenArellano_UCJqmGQTF2DgAEvV00Es6hTQ_854O5JEr76Q,1111136,1118896,7760,205,that had to happen for me to fully appreciate it so I wouldn't change a thing about my struggles with accepting Who I am,1,0,0,0,0,0,0,DY,2021-06-21 22:10:19.989393
AireenArellano_UCJqmGQTF2DgAEvV00Es6hTQ_854O5JEr76Q_1119416_1122856.wav,AireenArellano_UCJqmGQTF2DgAEvV00Es6hTQ_854O5JEr76Q,1119416,1122856,3440,206,for- a time from fourth grade when I moved to,1,0,0,0,0,0,0,DY,2021-06-21 22:10:29.261861
AireenArellano_UCJqmGQTF2DgAEvV00Es6hTQ_854O5JEr76Q_1123512_1130208.wav,AireenArellano_UCJqmGQTF2DgAEvV00Es6hTQ_854O5JEr76Q,1123512,1130208,6696,207,the southwest suburbs up until I was a sophomore junior in high school I was actively,1,0,0,0,0,0,0,DY,2021-06-21 22:10:42.130042
AireenArellano_UCJqmGQTF2DgAEvV00Es6hTQ_854O5JEr76Q_1130600_1131448.wav,AireenArellano_UCJqmGQTF2DgAEvV00Es6hTQ_854O5JEr76Q,1130600,1131448,848,208,rejecting ,1,0,0,0,0,0,0,DY,2021-06-21 22:10:46.947161
AireenArellano_UCJqmGQTF2DgAEvV00Es6hTQ_854O5JEr76Q_1132272_1133000.wav,AireenArellano_UCJqmGQTF2DgAEvV00Es6hTQ_854O5JEr76Q,1132272,1133000,728,209,my,1,0,0,0,0,0,0,DY,2021-06-21 22:10:53.362312
AireenArellano_UCJqmGQTF2DgAEvV00Es6hTQ_854O5JEr76Q_1133280_1134184.wav,AireenArellano_UCJqmGQTF2DgAEvV00Es6hTQ_854O5JEr76Q,1133280,1134184,904,210,heritage,1,0,0,0,0,0,0,DY,2021-06-21 22:11:00.853873
AireenArellano_UCJqmGQTF2DgAEvV00Es6hTQ_854O5JEr76Q_1134584_1136668.wav,AireenArellano_UCJqmGQTF2DgAEvV00Es6hTQ_854O5JEr76Q,1134584,1136668,2084,211,and then it wasn't until high school,1,0,0,0,0,0,0,DY,2021-06-21 22:11:12.985051
AireenArellano_UCJqmGQTF2DgAEvV00Es6hTQ_854O5JEr76Q_1137044_1144541.wav,AireenArellano_UCJqmGQTF2DgAEvV00Es6hTQ_854O5JEr76Q,1137044,1144541,7497,212,when one of my really good friends who was Caucasian she had to do this report on another country and she chose the Philippines which,1,0,0,0,0,0,0,DY,2021-06-21 22:11:25.702739
AireenArellano_UCJqmGQTF2DgAEvV00Es6hTQ_854O5JEr76Q_1144733_1146454.wav,AireenArellano_UCJqmGQTF2DgAEvV00Es6hTQ_854O5JEr76Q,1144733,1146454,1721,213,I felt two ways about it I was like,1,0,0,0,0,0,0,DY,2021-06-21 22:11:33.091439
AireenArellano_UCJqmGQTF2DgAEvV00Es6hTQ_854O5JEr76Q_1146622_1148376.wav,AireenArellano_UCJqmGQTF2DgAEvV00Es6hTQ_854O5JEr76Q,1146622,1148376,1754,214,flattered but I was also a little bit,1,0,0,0,0,0,0,DY,2021-06-21 22:11:40.354465
AireenArellano_UCJqmGQTF2DgAEvV00Es6hTQ_854O5JEr76Q_1148672_1159690.wav,AireenArellano_UCJqmGQTF2DgAEvV00Es6hTQ_854O5JEr76Q,1148672,1159690,11018,215,confused like why I was like there's_unn so_unn many_unn other_unn cooler_unn countries_unn that's awful but that's how I felt at the time I was being lifted from this pool of rejecting,1,0,0,0,0,0,0,DY,2021-06-21 22:12:02.019508
AireenArellano_UCJqmGQTF2DgAEvV00Es6hTQ_854O5JEr76Q_1159802_1172620.wav,AireenArellano_UCJqmGQTF2DgAEvV00Es6hTQ_854O5JEr76Q,1159802,1172620,12818,216,my heritage so that's what my friend was doing for me she had this book to do her report and she was showing me all these amazing pictures of the land and the people and the food and she was like oh my god the food is amazing,1,0,0,0,0,0,0,DY,2021-06-21 22:12:21.720615
AireenArellano_UCJqmGQTF2DgAEvV00Es6hTQ_854O5JEr76Q_1172772_1176104.wav,AireenArellano_UCJqmGQTF2DgAEvV00Es6hTQ_854O5JEr76Q,1172772,1176104,3332,217,whoa is this what you grew up eating and I was like,1,0,0,0,0,0,0,DY,2021-06-21 22:12:34.420838
AireenArellano_UCJqmGQTF2DgAEvV00Es6hTQ_854O5JEr76Q_1176328_1178170.wav,AireenArellano_UCJqmGQTF2DgAEvV00Es6hTQ_854O5JEr76Q,1176328,1178170,1842,218,yeah I was having flashbacks to-,1,0,0,0,0,0,0,DY,2021-06-21 22:12:47.581278
AireenArellano_UCJqmGQTF2DgAEvV00Es6hTQ_854O5JEr76Q_1178258_1185174.wav,AireenArellano_UCJqmGQTF2DgAEvV00Es6hTQ_854O5JEr76Q,1178258,1185174,6916,219,family parties where my aunt who is a caterer she would bring over amazing Filipino food and my grandma,1,0,0,0,0,0,0,DY,2021-06-21 22:13:14.415604
AireenArellano_UCJqmGQTF2DgAEvV00Es6hTQ_854O5JEr76Q_1185342_1194602.wav,AireenArellano_UCJqmGQTF2DgAEvV00Es6hTQ_854O5JEr76Q,1185342,1194602,9260,220,who lived with us for a time she would make Filipino food all day every day so yes that's another weird dilemma I would reject,1,0,0,0,0,0,0,DY,2021-06-21 22:13:29.053310
AireenArellano_UCJqmGQTF2DgAEvV00Es6hTQ_854O5JEr76Q_1194682_1194884.wav,AireenArellano_UCJqmGQTF2DgAEvV00Es6hTQ_854O5JEr76Q,1194682,1194884,202,221,t-,0,0,0,0,0,0,0,DY,2021-06-21 22:14:12.248114
AireenArellano_UCJqmGQTF2DgAEvV00Es6hTQ_854O5JEr76Q_1194996_1196432.wav,AireenArellano_UCJqmGQTF2DgAEvV00Es6hTQ_854O5JEr76Q,1194996,1196432,1436,222,being Filipino,1,0,0,0,0,0,0,DY,2021-06-21 22:14:23.548137
AireenArellano_UCJqmGQTF2DgAEvV00Es6hTQ_854O5JEr76Q_1196872_1200120.wav,AireenArellano_UCJqmGQTF2DgAEvV00Es6hTQ_854O5JEr76Q,1196872,1200120,3248,223,but I would also consume Filipino food,1,0,0,0,0,0,0,DY,2021-06-21 22:14:39.651108
AireenArellano_UCJqmGQTF2DgAEvV00Es6hTQ_854O5JEr76Q_1200552_1201480.wav,AireenArellano_UCJqmGQTF2DgAEvV00Es6hTQ_854O5JEr76Q,1200552,1201480,928,224,a- at home,1,0,0,0,0,0,0,DY,2021-06-21 22:14:45.827062
AireenArellano_UCJqmGQTF2DgAEvV00Es6hTQ_854O5JEr76Q_1202072_1210664.wav,AireenArellano_UCJqmGQTF2DgAEvV00Es6hTQ_854O5JEr76Q,1202072,1210664,8592,225,because my grandma would cook it all the time my lola you know what it was it felt like being two people it felt like I had to be- I was one way at home,1,0,1,0,0,0,0,DY,2021-06-21 22:15:00.858621
AireenArellano_UCJqmGQTF2DgAEvV00Es6hTQ_854O5JEr76Q_1211032_1212712.wav,AireenArellano_UCJqmGQTF2DgAEvV00Es6hTQ_854O5JEr76Q,1211032,1212712,1680,226,and then I had to be another way,1,0,0,0,0,0,0,DY,2021-06-21 22:15:08.430115
AireenArellano_UCJqmGQTF2DgAEvV00Es6hTQ_854O5JEr76Q_1213176_1223636.wav,AireenArellano_UCJqmGQTF2DgAEvV00Es6hTQ_854O5JEr76Q,1213176,1223636,10460,227,outside of the home I was just really embarrassed if anybody asked me about what I was or I was like out here with my Batman mask on so that's why it would really throw me off when anybody,1,0,0,0,0,0,0,DY,2021-06-21 22:16:16.959146
AireenArellano_UCJqmGQTF2DgAEvV00Es6hTQ_854O5JEr76Q_1223740_1235320.wav,AireenArellano_UCJqmGQTF2DgAEvV00Es6hTQ_854O5JEr76Q,1223740,1235320,11580,228,outside of the home would ask me like oh uh are you Filipino what are you and I'd be like whoa whoa whoa I'm out here with my with- with my mask on what are you doing asking me about that stuff I- I'm outside of the house not in the house so,1,0,0,0,0,0,0,DY,2021-06-21 22:18:03.947062
AireenArellano_UCJqmGQTF2DgAEvV00Es6hTQ_854O5JEr76Q_1235528_1241264.wav,AireenArellano_UCJqmGQTF2DgAEvV00Es6hTQ_854O5JEr76Q,1235528,1241264,5736,229,my friend who was really getting into this report it was fun rediscovering,1,0,0,0,0,0,0,DY,2021-06-21 22:18:14.591950
AireenArellano_UCJqmGQTF2DgAEvV00Es6hTQ_854O5JEr76Q_1241768_1245644.wav,AireenArellano_UCJqmGQTF2DgAEvV00Es6hTQ_854O5JEr76Q,1241768,1245644,3876,230,the Filipino culture through her eyes because it made me,1,0,0,0,0,0,0,DY,2021-06-21 22:18:24.193996
AireenArellano_UCJqmGQTF2DgAEvV00Es6hTQ_854O5JEr76Q_1245836_1257320.wav,AireenArellano_UCJqmGQTF2DgAEvV00Es6hTQ_854O5JEr76Q,1245836,1257320,11484,231,appreciate it she had turned on the light bulb of appreciation for my own culture she was asking me all these questions I felt really ashamed that I didn't know a lot of them,1,0,0,0,0,0,0,DY,2021-06-21 22:18:42.142941
AireenArellano_UCJqmGQTF2DgAEvV00Es6hTQ_854O5JEr76Q_1257984_1261704.wav,AireenArellano_UCJqmGQTF2DgAEvV00Es6hTQ_854O5JEr76Q,1257984,1261704,3720,232,in a way I was kind of doing my own personal report on,1,0,0,0,0,0,0,DY,2021-06-21 22:18:51.282432
AireenArellano_UCJqmGQTF2DgAEvV00Es6hTQ_854O5JEr76Q_1261848_1270816.wav,AireenArellano_UCJqmGQTF2DgAEvV00Es6hTQ_854O5JEr76Q,1261848,1270816,8968,233,the Philippines she was like oh my gosh next time you have a big family party can you invite me so I could have all the food and I was like yeah yeah sure totally so she came over,1,0,0,0,0,0,0,DY,2021-06-21 22:19:25.440588
AireenArellano_UCJqmGQTF2DgAEvV00Es6hTQ_854O5JEr76Q_1271048_1274960.wav,AireenArellano_UCJqmGQTF2DgAEvV00Es6hTQ_854O5JEr76Q,1271048,1274960,3912,234,and had some food and she was just like lovin' everything and,1,0,0,0,0,0,0,DY,2021-06-21 22:19:48.184567
AireenArellano_UCJqmGQTF2DgAEvV00Es6hTQ_854O5JEr76Q_1275104_1277632.wav,AireenArellano_UCJqmGQTF2DgAEvV00Es6hTQ_854O5JEr76Q,1275104,1277632,2528,235,it was really cool to see because,1,0,0,0,0,0,0,DY,2021-06-21 22:20:00.320863
AireenArellano_UCJqmGQTF2DgAEvV00Es6hTQ_854O5JEr76Q_1277928_1279592.wav,AireenArellano_UCJqmGQTF2DgAEvV00Es6hTQ_854O5JEr76Q,1277928,1279592,1664,236,these were foods that I had spent,1,0,0,0,0,0,0,DY,2021-06-21 22:20:06.941689
AireenArellano_UCJqmGQTF2DgAEvV00Es6hTQ_854O5JEr76Q_1279952_1280888.wav,AireenArellano_UCJqmGQTF2DgAEvV00Es6hTQ_854O5JEr76Q,1279952,1280888,936,237,my childhood,1,0,0,0,0,0,0,DY,2021-06-21 22:20:12.296036
AireenArellano_UCJqmGQTF2DgAEvV00Es6hTQ_854O5JEr76Q_1281224_1282992.wav,AireenArellano_UCJqmGQTF2DgAEvV00Es6hTQ_854O5JEr76Q,1281224,1282992,1768,238,keeping a secret from,1,0,0,0,0,0,0,DY,2021-06-21 22:20:19.350637
AireenArellano_UCJqmGQTF2DgAEvV00Es6hTQ_854O5JEr76Q_1283616_1293488.wav,AireenArellano_UCJqmGQTF2DgAEvV00Es6hTQ_854O5JEr76Q,1283616,1293488,9872,239,other kids at school there was this one incident where I brought this dish called pancit for lunch this kid in my class saw it and he was like,1,0,0,0,0,0,0,DY,2021-06-21 22:20:35.954664
AireenArellano_UCJqmGQTF2DgAEvV00Es6hTQ_854O5JEr76Q_1293664_1295536.wav,AireenArellano_UCJqmGQTF2DgAEvV00Es6hTQ_854O5JEr76Q,1293664,1295536,1872,240,being super rude about it he was like,1,0,0,0,0,0,0,DY,2021-06-21 22:20:43.134769
AireenArellano_UCJqmGQTF2DgAEvV00Es6hTQ_854O5JEr76Q_1295808_1296408.wav,AireenArellano_UCJqmGQTF2DgAEvV00Es6hTQ_854O5JEr76Q,1295808,1296408,600,241,oh_unn what_unn,0,0,0,1,0,0,0,DY,2021-06-21 22:20:53.892998
AireenArellano_UCJqmGQTF2DgAEvV00Es6hTQ_854O5JEr76Q_1296704_1304568.wav,AireenArellano_UCJqmGQTF2DgAEvV00Es6hTQ_854O5JEr76Q,1296704,1304568,7864,242,is_unn that_unn that's_unn so_unn gross_unn oh_unn my_unn god_unn what_unn is_unn that_unn I just remember just sitting there and like shamefully just ,1,0,0,1,0,0,0,DY,2021-06-21 22:21:14.009717
AireenArellano_UCJqmGQTF2DgAEvV00Es6hTQ_854O5JEr76Q_1304952_1307808.wav,AireenArellano_UCJqmGQTF2DgAEvV00Es6hTQ_854O5JEr76Q,1304952,1307808,2856,243,eating my food and keeping my head down while this,1,0,0,0,0,0,0,DY,2021-06-21 22:21:23.134336
AireenArellano_UCJqmGQTF2DgAEvV00Es6hTQ_854O5JEr76Q_1308528_1313472.wav,AireenArellano_UCJqmGQTF2DgAEvV00Es6hTQ_854O5JEr76Q,1308528,1313472,4944,244,was making fun of my food and it just kept happening I think that was the beginning of me,1,0,0,0,0,0,0,DY,2021-06-21 22:21:34.512252
AireenArellano_UCJqmGQTF2DgAEvV00Es6hTQ_854O5JEr76Q_1313816_1315472.wav,AireenArellano_UCJqmGQTF2DgAEvV00Es6hTQ_854O5JEr76Q,1313816,1315472,1656,245,rejecting my culture,1,0,0,0,0,0,0,DY,2021-06-21 22:21:42.495317
AireenArellano_UCJqmGQTF2DgAEvV00Es6hTQ_854O5JEr76Q_1316496_1317024.wav,AireenArellano_UCJqmGQTF2DgAEvV00Es6hTQ_854O5JEr76Q,1316496,1317024,528,246,but,1,0,0,0,0,0,0,DY,2021-06-21 22:21:50.168960
AireenArellano_UCJqmGQTF2DgAEvV00Es6hTQ_854O5JEr76Q_1317680_1324976.wav,AireenArellano_UCJqmGQTF2DgAEvV00Es6hTQ_854O5JEr76Q,1317680,1324976,7296,247,that's okay because that rejection I wouldn't change a thing because it really makes me appreciate my heritage and my culture even more,1,0,0,0,0,0,0,DY,2021-06-21 22:22:04.057036
AireenArellano_UCJqmGQTF2DgAEvV00Es6hTQ_854O5JEr76Q_1325464_1335560.wav,AireenArellano_UCJqmGQTF2DgAEvV00Es6hTQ_854O5JEr76Q,1325464,1335560,10096,248,y'know I appreciate the experiences that I have been through and that have enriched me as a person and now I have something to contribute to the world,1,0,0,0,0,0,1,DY,2021-06-21 22:22:22.140646
AireenArellano_UCJqmGQTF2DgAEvV00Es6hTQ_854O5JEr76Q_1335712_1343817.wav,AireenArellano_UCJqmGQTF2DgAEvV00Es6hTQ_854O5JEr76Q,1335712,1343817,8105,249,also I really love the values that I've learned that idea that you don't really quite feel Filipino and you don't really quite,1,0,1,0,0,0,0,DY,2021-06-21 22:23:01.016385
AireenArellano_UCJqmGQTF2DgAEvV00Es6hTQ_854O5JEr76Q_1344009_1355818.wav,AireenArellano_UCJqmGQTF2DgAEvV00Es6hTQ_854O5JEr76Q,1344009,1355818,11809,250,feel American that was so prevalent during one of my trips to the Philippines I was in high school and it was really crazy going there because everyone,1,0,1,0,0,0,0,DY,2021-06-21 22:23:31.231406
AireenArellano_UCJqmGQTF2DgAEvV00Es6hTQ_854O5JEr76Q_1356026_1364522.wav,AireenArellano_UCJqmGQTF2DgAEvV00Es6hTQ_854O5JEr76Q,1356026,1364522,8496,251,kinda looked like me and I really felt a sense of belonging but that was until I had to talk to anyone,1,0,1,0,0,0,0,DY,2021-06-21 22:23:55.543703
AireenArellano_UCJqmGQTF2DgAEvV00Es6hTQ_854O5JEr76Q_1364730_1368500.wav,AireenArellano_UCJqmGQTF2DgAEvV00Es6hTQ_854O5JEr76Q,1364730,1368500,3770,252,and it became very apparent that I was,1,0,1,0,0,0,0,DY,2021-06-21 22:24:06.113457
AireenArellano_UCJqmGQTF2DgAEvV00Es6hTQ_854O5JEr76Q_1368820_1369588.wav,AireenArellano_UCJqmGQTF2DgAEvV00Es6hTQ_854O5JEr76Q,1368820,1369588,768,253,American,1,0,0,0,0,0,0,DY,2021-06-21 22:24:12.787367
AireenArellano_UCJqmGQTF2DgAEvV00Es6hTQ_854O5JEr76Q_1369740_1374612.wav,AireenArellano_UCJqmGQTF2DgAEvV00Es6hTQ_854O5JEr76Q,1369740,1374612,4872,254,my mom and I were eating at a restaurant one day she kinda leans over to me and she's like hey those girls,1,0,0,0,0,0,0,DY,2021-06-21 22:24:24.313454
AireenArellano_UCJqmGQTF2DgAEvV00Es6hTQ_854O5JEr76Q_1374788_1380748.wav,AireenArellano_UCJqmGQTF2DgAEvV00Es6hTQ_854O5JEr76Q,1374788,1380748,5960,255,behind you they were kind of commenting on me I think it was m- more fascination than being rude,1,0,0,0,0,0,0,DY,2021-06-21 22:24:36.943802
AireenArellano_UCJqmGQTF2DgAEvV00Es6hTQ_854O5JEr76Q_1380980_1385212.wav,AireenArellano_UCJqmGQTF2DgAEvV00Es6hTQ_854O5JEr76Q,1380980,1385212,4232,256,again maybe a cultural thing my mom was like they can tell you're American,1,0,0,0,0,0,0,DY,2021-06-21 22:24:47.388961
AireenArellano_UCJqmGQTF2DgAEvV00Es6hTQ_854O5JEr76Q_1385412_1385948.wav,AireenArellano_UCJqmGQTF2DgAEvV00Es6hTQ_854O5JEr76Q,1385412,1385948,536,257,and I was like,1,0,0,0,0,0,0,DY,2021-06-21 22:24:54.180570
AireenArellano_UCJqmGQTF2DgAEvV00Es6hTQ_854O5JEr76Q_1386148_1393688.wav,AireenArellano_UCJqmGQTF2DgAEvV00Es6hTQ_854O5JEr76Q,1386148,1393688,7540,258,what how do they know the way you walk the way you hold yourself you're very American another example of that weird dilemma was,1,0,0,0,0,0,0,DY,2021-06-21 22:25:40.635672
AireenArellano_UCJqmGQTF2DgAEvV00Es6hTQ_854O5JEr76Q_1393848_1397412.wav,AireenArellano_UCJqmGQTF2DgAEvV00Es6hTQ_854O5JEr76Q,1393848,1397412,3564,259,this one time we were at a carnival and I was,1,0,0,0,0,0,0,DY,2021-06-21 22:25:49.960055
AireenArellano_UCJqmGQTF2DgAEvV00Es6hTQ_854O5JEr76Q_1397916_1407613.wav,AireenArellano_UCJqmGQTF2DgAEvV00Es6hTQ_854O5JEr76Q,1397916,1407613,9697,260,doing bumper cars and my bumper car broke down a mechanic came over to help me and he was instructing me to do something in Tagalog but,1,0,0,0,0,0,0,DY,2021-06-21 22:26:06.253027
AireenArellano_UCJqmGQTF2DgAEvV00Es6hTQ_854O5JEr76Q_1407765_1420493.wav,AireenArellano_UCJqmGQTF2DgAEvV00Es6hTQ_854O5JEr76Q,1407765,1420493,12728,261,I couldn't quite understand him it was loud and he was speaking really fast you know I probably have the vocabulary of a four five year old so I really felt out of my element like oh my god I I look,1,0,0,0,0,0,0,DY,2021-06-21 22:26:26.316250
AireenArellano_UCJqmGQTF2DgAEvV00Es6hTQ_854O5JEr76Q_1420613_1430670.wav,AireenArellano_UCJqmGQTF2DgAEvV00Es6hTQ_854O5JEr76Q,1420613,1430670,10057,262,like everyone but I don't quite fit in I was able to figure it out that was another incident which told me Wow okay so you belong here but you also,1,0,1,0,0,0,0,DY,2021-06-21 22:26:45.077111
AireenArellano_UCJqmGQTF2DgAEvV00Es6hTQ_854O5JEr76Q_1431264_1438304.wav,AireenArellano_UCJqmGQTF2DgAEvV00Es6hTQ_854O5JEr76Q,1431264,1438304,7040,263,don't now I think of that approach as not being a negative but being a positive it really adds dimension to,1,0,0,0,0,0,0,DY,2021-06-21 22:26:59.083254
AireenArellano_UCJqmGQTF2DgAEvV00Es6hTQ_854O5JEr76Q_1438472_1445592.wav,AireenArellano_UCJqmGQTF2DgAEvV00Es6hTQ_854O5JEr76Q,1438472,1445592,7120,264,my personal experience and I am grateful for that and I think that's one of the things I love about being Filipino American,1,0,0,0,0,0,0,DY,2021-06-21 22:27:17.048159
AireenArellano_UCJqmGQTF2DgAEvV00Es6hTQ_854O5JEr76Q_1445808_1447360.wav,AireenArellano_UCJqmGQTF2DgAEvV00Es6hTQ_854O5JEr76Q,1445808,1447360,1552,265,I also love,1,0,0,0,0,0,0,DY,2021-06-21 22:27:23.822691
AireenArellano_UCJqmGQTF2DgAEvV00Es6hTQ_854O5JEr76Q_1447536_1448984.wav,AireenArellano_UCJqmGQTF2DgAEvV00Es6hTQ_854O5JEr76Q,1447536,1448984,1448,266,the rich history,1,0,0,0,0,0,0,DY,2021-06-21 22:27:32.019835
AireenArellano_UCJqmGQTF2DgAEvV00Es6hTQ_854O5JEr76Q_1449176_1456704.wav,AireenArellano_UCJqmGQTF2DgAEvV00Es6hTQ_854O5JEr76Q,1449176,1456704,7528,267,of the Philippines there is so much more for me to learn I have a lot of cousins my mom's side there's-,1,0,0,0,0,0,0,DY,2021-06-21 22:27:56.792400
AireenArellano_UCJqmGQTF2DgAEvV00Es6hTQ_854O5JEr76Q_1456904_1459912.wav,AireenArellano_UCJqmGQTF2DgAEvV00Es6hTQ_854O5JEr76Q,1456904,1459912,3008,268,ten of them on my dad's side there're eight,1,0,0,0,0,0,0,DY,2021-06-21 22:28:07.632930
AireenArellano_UCJqmGQTF2DgAEvV00Es6hTQ_854O5JEr76Q_1460720_1472216.wav,AireenArellano_UCJqmGQTF2DgAEvV00Es6hTQ_854O5JEr76Q,1460720,1472216,11496,269,those are a lot of babies so can you imagine just how many cousins a bulk of them in the Philippines Canada all throughout the United States it's- are there a few in China oh,1,0,0,0,0,0,0,DY,2021-06-21 22:28:41.953154
AireenArellano_UCJqmGQTF2DgAEvV00Es6hTQ_854O5JEr76Q_1472416_1479736.wav,AireenArellano_UCJqmGQTF2DgAEvV00Es6hTQ_854O5JEr76Q,1472416,1479736,7320,270,I think there's one in Australia- that's what I love about my family specifically is that we are everywhere and,1,0,0,0,0,0,0,DY,2021-06-21 22:29:11.829957
AireenArellano_UCJqmGQTF2DgAEvV00Es6hTQ_854O5JEr76Q_1480056_1486660.wav,AireenArellano_UCJqmGQTF2DgAEvV00Es6hTQ_854O5JEr76Q,1480056,1486660,6604,271,to me that makes the world feel like a smaller place I feel like I can go and ,1,0,0,0,0,0,0,DY,2021-06-21 22:29:26.195699
AireenArellano_UCJqmGQTF2DgAEvV00Es6hTQ_854O5JEr76Q_1486796_1493128.wav,AireenArellano_UCJqmGQTF2DgAEvV00Es6hTQ_854O5JEr76Q,1486796,1493128,6332,272,visit them and say hey I have family here we have family all around the world now and,1,0,0,0,0,0,0,DY,2021-06-21 22:29:38.579275
AireenArellano_UCJqmGQTF2DgAEvV00Es6hTQ_854O5JEr76Q_1493464_1500680.wav,AireenArellano_UCJqmGQTF2DgAEvV00Es6hTQ_854O5JEr76Q,1493464,1500680,7216,273,that's what I'm gonna take away from it gosh this was a heavy one guys I mean I wasn't crying or anything but and hey hey hey hey hey,1,1,0,0,0,0,0,DY,2021-06-21 22:29:56.750498
AireenArellano_UCJqmGQTF2DgAEvV00Es6hTQ_854O5JEr76Q_1502008_1505616.wav,AireenArellano_UCJqmGQTF2DgAEvV00Es6hTQ_854O5JEr76Q,1502008,1505616,3608,274,sorry my dogs they're getting crazy_unn,1,0,0,1,0,0,0,DY,2021-06-21 22:30:21.217459
AireenArellano_UCJqmGQTF2DgAEvV00Es6hTQ_854O5JEr76Q_1505888_1512564.wav,AireenArellano_UCJqmGQTF2DgAEvV00Es6hTQ_854O5JEr76Q,1505888,1512564,6676,275,that's one thing that I've really admired about the Filipino people we are resilient and we can adapt,0,1,0,0,0,0,0,DY,2021-06-21 22:30:36.902639
AireenArellano_UCJqmGQTF2DgAEvV00Es6hTQ_854O5JEr76Q_1513068_1514356.wav,AireenArellano_UCJqmGQTF2DgAEvV00Es6hTQ_854O5JEr76Q,1513068,1514356,1288,276,we can bounce back,0,1,0,0,0,0,0,DY,2021-06-21 22:30:43.327064
AireenArellano_UCJqmGQTF2DgAEvV00Es6hTQ_854O5JEr76Q_1514692_1515988.wav,AireenArellano_UCJqmGQTF2DgAEvV00Es6hTQ_854O5JEr76Q,1514692,1515988,1296,277,make things happen,0,1,0,0,0,0,0,DY,2021-06-21 22:31:19.013662
AireenArellano_UCJqmGQTF2DgAEvV00Es6hTQ_854O5JEr76Q_1516260_1516608.wav,AireenArellano_UCJqmGQTF2DgAEvV00Es6hTQ_854O5JEr76Q,1516260,1516608,348,278,we are,0,1,0,0,0,0,0,DY,2021-06-21 22:31:24.780879
AireenArellano_UCJqmGQTF2DgAEvV00Es6hTQ_854O5JEr76Q_1516768_1524996.wav,AireenArellano_UCJqmGQTF2DgAEvV00Es6hTQ_854O5JEr76Q,1516768,1524996,8228,279,trepreneurial- we take initiative we are innovative and I am pretty darn proud of that so I wanna hear from you,0,1,0,0,0,0,0,DY,2021-06-21 22:31:44.447734
AireenArellano_UCJqmGQTF2DgAEvV00Es6hTQ_854O5JEr76Q_1525252_1527212.wav,AireenArellano_UCJqmGQTF2DgAEvV00Es6hTQ_854O5JEr76Q,1525252,1527212,1960,280,you have a story about being,0,1,0,0,0,0,0,DY,2021-06-21 22:31:57.336275
AireenArellano_UCJqmGQTF2DgAEvV00Es6hTQ_854O5JEr76Q_1527620_1529276.wav,AireenArellano_UCJqmGQTF2DgAEvV00Es6hTQ_854O5JEr76Q,1527620,1529276,1656,281,not just Filipino American,0,1,0,0,0,0,0,DY,2021-06-21 22:32:05.827458
AireenArellano_UCJqmGQTF2DgAEvV00Es6hTQ_854O5JEr76Q_1529684_1529940.wav,AireenArellano_UCJqmGQTF2DgAEvV00Es6hTQ_854O5JEr76Q,1529684,1529940,256,282,but,0,1,0,0,0,0,0,DY,2021-06-21 22:32:12.861196
AireenArellano_UCJqmGQTF2DgAEvV00Es6hTQ_854O5JEr76Q_1530276_1531340.wav,AireenArellano_UCJqmGQTF2DgAEvV00Es6hTQ_854O5JEr76Q,1530276,1531340,1064,283,Asian American,0,1,0,0,0,0,0,DY,2021-06-21 22:32:19.445115
AireenArellano_UCJqmGQTF2DgAEvV00Es6hTQ_854O5JEr76Q_1531876_1532444.wav,AireenArellano_UCJqmGQTF2DgAEvV00Es6hTQ_854O5JEr76Q,1531876,1532444,568,284,anything,0,1,0,0,0,0,0,DY,2021-06-21 22:32:24.917356
AireenArellano_UCJqmGQTF2DgAEvV00Es6hTQ_854O5JEr76Q_1532892_1533244.wav,AireenArellano_UCJqmGQTF2DgAEvV00Es6hTQ_854O5JEr76Q,1532892,1533244,352,285,plea-,0,1,0,0,0,0,0,DY,2021-06-21 22:32:32.369529
AireenArellano_UCJqmGQTF2DgAEvV00Es6hTQ_854O5JEr76Q_1533684_1534980.wav,AireenArellano_UCJqmGQTF2DgAEvV00Es6hTQ_854O5JEr76Q,1533684,1534980,1296,286,share your experience,0,1,0,0,0,0,0,DY,2021-06-21 22:32:43.306058
AireenArellano_UCJqmGQTF2DgAEvV00Es6hTQ_854O5JEr76Q_1535404_1540028.wav,AireenArellano_UCJqmGQTF2DgAEvV00Es6hTQ_854O5JEr76Q,1535404,1540028,4624,287,in the comments below I think people are ready to hear more about us and,0,1,0,0,0,0,1,DY,2021-06-21 22:32:55.128424
AireenArellano_UCJqmGQTF2DgAEvV00Es6hTQ_854O5JEr76Q_1540244_1546368.wav,AireenArellano_UCJqmGQTF2DgAEvV00Es6hTQ_854O5JEr76Q,1540244,1546368,6124,288,from us let's get out there let's share our stories I'm out here sharing mine and I would really really love,0,1,0,0,0,0,0,DY,2021-06-21 22:33:08.088394
