filename,video_id,start_time,end_time,duration,id,transcription,usability,bg_music,bg_noise,other_voice,only_music,only_noise,other_sounds,annotator,annotate_date_YYYYMMDD
Karin_UCrRusOoeeCCIVd6k8HJZYtg_NNLAU9kmqd0_460033_462913.wav,Karin_UCrRusOoeeCCIVd6k8HJZYtg_NNLAU9kmqd0,460033,462913,2880,114,which was way easier to spell than veterinarian,1,0,0,0,0,0,0,DY,2021-07-14 00:30:13.721709
Karin_UCrRusOoeeCCIVd6k8HJZYtg_NNLAU9kmqd0_463457_467233.wav,Karin_UCrRusOoeeCCIVd6k8HJZYtg_NNLAU9kmqd0,463457,467233,3776,115,my worst subjects in school were spelling and arithmetic,1,0,0,0,0,0,0,DY,2021-07-14 14:33:24.225434
Karin_UCrRusOoeeCCIVd6k8HJZYtg_NNLAU9kmqd0_467617_468801.wav,Karin_UCrRusOoeeCCIVd6k8HJZYtg_NNLAU9kmqd0,467617,468801,1184,116,I'm very good at like,1,0,0,0,0,0,0,DY,2021-07-14 14:33:34.674681
Karin_UCrRusOoeeCCIVd6k8HJZYtg_NNLAU9kmqd0_469649_473097.wav,Karin_UCrRusOoeeCCIVd6k8HJZYtg_NNLAU9kmqd0,469649,473097,3448,117,understanding concepts and applying concepts but,1,0,0,0,0,0,0,DY,2021-07-14 14:33:42.533508
Karin_UCrRusOoeeCCIVd6k8HJZYtg_NNLAU9kmqd0_473401_474985.wav,Karin_UCrRusOoeeCCIVd6k8HJZYtg_NNLAU9kmqd0,473401,474985,1584,118,memorizing things,1,0,0,0,0,0,0,DY,2021-07-14 14:34:02.336142
Karin_UCrRusOoeeCCIVd6k8HJZYtg_NNLAU9kmqd0_475273_479169.wav,Karin_UCrRusOoeeCCIVd6k8HJZYtg_NNLAU9kmqd0,475273,479169,3896,119,are really hard for me especially numbers so fun fact,1,0,0,0,0,0,0,DY,2021-07-14 14:34:23.584012
Karin_UCrRusOoeeCCIVd6k8HJZYtg_NNLAU9kmqd0_479793_482749.wav,Karin_UCrRusOoeeCCIVd6k8HJZYtg_NNLAU9kmqd0,479793,482749,2956,120,I never memorized the multiplication table,1,0,0,0,0,0,0,DY,2021-07-14 14:34:41.909961
Karin_UCrRusOoeeCCIVd6k8HJZYtg_NNLAU9kmqd0_482925_487525.wav,Karin_UCrRusOoeeCCIVd6k8HJZYtg_NNLAU9kmqd0,482925,487525,4600,121,like my parents made my sister memorize the multiplication table like they would ,1,0,0,0,0,0,0,DY,2021-07-14 14:35:06.838930
Karin_UCrRusOoeeCCIVd6k8HJZYtg_NNLAU9kmqd0_487717_489929.wav,Karin_UCrRusOoeeCCIVd6k8HJZYtg_NNLAU9kmqd0,487717,489929,2212,122,quiz her like with many things,1,0,0,0,0,0,0,DY,2021-07-14 14:35:17.878713
Karin_UCrRusOoeeCCIVd6k8HJZYtg_NNLAU9kmqd0_490337_492057.wav,Karin_UCrRusOoeeCCIVd6k8HJZYtg_NNLAU9kmqd0,490337,492057,1720,123,they got to me and they're like,1,0,0,0,0,0,0,DY,2021-07-14 14:35:24.782927
Karin_UCrRusOoeeCCIVd6k8HJZYtg_NNLAU9kmqd0_492321_500929.wav,Karin_UCrRusOoeeCCIVd6k8HJZYtg_NNLAU9kmqd0,492321,500929,8608,124,I already did it once with your older sister she figured it out you'll be fine and I took a lot of math classes like I wasn't bad at math like,1,0,0,0,0,0,0,DY,2021-07-14 14:35:50.700895
Karin_UCrRusOoeeCCIVd6k8HJZYtg_NNLAU9kmqd0_501201_502369.wav,Karin_UCrRusOoeeCCIVd6k8HJZYtg_NNLAU9kmqd0,501201,502369,1168,125,in terms of grades,1,0,0,0,0,0,0,DY,2021-07-14 14:35:57.492658
Karin_UCrRusOoeeCCIVd6k8HJZYtg_NNLAU9kmqd0_502737_509889.wav,Karin_UCrRusOoeeCCIVd6k8HJZYtg_NNLAU9kmqd0,502737,509889,7152,126,which is the craziest thing my favorite class in high school was probably biology another funny story about me as a kid,1,0,0,0,0,0,0,DY,2021-07-14 14:36:11.831907
Karin_UCrRusOoeeCCIVd6k8HJZYtg_NNLAU9kmqd0_510225_513369.wav,Karin_UCrRusOoeeCCIVd6k8HJZYtg_NNLAU9kmqd0,510225,513369,3144,127,is that as someone who is very passionate,1,0,0,0,0,0,0,DY,2021-07-14 14:36:20.624371
Karin_UCrRusOoeeCCIVd6k8HJZYtg_NNLAU9kmqd0_513633_519177.wav,Karin_UCrRusOoeeCCIVd6k8HJZYtg_NNLAU9kmqd0,513633,519177,5544,128,about education like I run an educational youtube channel I was not a good student,1,0,0,0,0,0,0,DY,2021-07-14 14:36:32.736809
Karin_UCrRusOoeeCCIVd6k8HJZYtg_NNLAU9kmqd0_519729_523313.wav,Karin_UCrRusOoeeCCIVd6k8HJZYtg_NNLAU9kmqd0,519729,523313,3584,129,for most of my life like probably not until high school,1,0,0,0,0,0,0,DY,2021-07-14 14:37:13.725606
Karin_UCrRusOoeeCCIVd6k8HJZYtg_NNLAU9kmqd0_523801_526321.wav,Karin_UCrRusOoeeCCIVd6k8HJZYtg_NNLAU9kmqd0,523801,526321,2520,130,and that is a lot because,1,0,0,0,0,0,0,DY,2021-07-14 14:37:31.770419
Karin_UCrRusOoeeCCIVd6k8HJZYtg_NNLAU9kmqd0_526665_533953.wav,Karin_UCrRusOoeeCCIVd6k8HJZYtg_NNLAU9kmqd0,526665,533953,7288,131,I daydreamed a ton in elementary and middle school I just could not pay attention at all I would just be like,1,0,0,0,0,0,0,DY,2021-07-14 14:37:54.565122
Karin_UCrRusOoeeCCIVd6k8HJZYtg_NNLAU9kmqd0_534233_535961.wav,Karin_UCrRusOoeeCCIVd6k8HJZYtg_NNLAU9kmqd0,534233,535961,1728,132,off in my own little bubble,1,0,0,0,0,0,0,DY,2021-07-14 14:38:03.250442
Karin_UCrRusOoeeCCIVd6k8HJZYtg_NNLAU9kmqd0_536185_539265.wav,Karin_UCrRusOoeeCCIVd6k8HJZYtg_NNLAU9kmqd0,536185,539265,3080,133,I would forget like homework assignments I would just like,1,0,0,0,0,0,0,DY,2021-07-14 14:38:19.921879
Karin_UCrRusOoeeCCIVd6k8HJZYtg_NNLAU9kmqd0_539489_544441.wav,Karin_UCrRusOoeeCCIVd6k8HJZYtg_NNLAU9kmqd0,539489,544441,4952,134,not even know they existed because I was daydreaming when the teacher was talking about it,1,0,0,0,0,0,0,DY,2021-07-14 14:38:38.283760
Karin_UCrRusOoeeCCIVd6k8HJZYtg_NNLAU9kmqd0_544793_546513.wav,Karin_UCrRusOoeeCCIVd6k8HJZYtg_NNLAU9kmqd0,544793,546513,1720,135,I've never broken any bones,1,0,0,0,0,0,0,DY,2021-07-14 14:38:45.052265
Karin_UCrRusOoeeCCIVd6k8HJZYtg_NNLAU9kmqd0_546841_553385.wav,Karin_UCrRusOoeeCCIVd6k8HJZYtg_NNLAU9kmqd0,546841,553385,6544,136,knock on wood but I have twisted my ankle twice and I'm pretty sure it's been the same ankle,1,0,1,0,0,0,0,DY,2021-07-14 14:38:58.541563
Karin_UCrRusOoeeCCIVd6k8HJZYtg_NNLAU9kmqd0_553673_558177.wav,Karin_UCrRusOoeeCCIVd6k8HJZYtg_NNLAU9kmqd0,553673,558177,4504,137,I suffer from migraine and I actually get ocular migraines as well,1,0,0,0,0,0,0,DY,2021-07-14 14:39:17.223740
Karin_UCrRusOoeeCCIVd6k8HJZYtg_NNLAU9kmqd0_558457_561753.wav,Karin_UCrRusOoeeCCIVd6k8HJZYtg_NNLAU9kmqd0,558457,561753,3296,138,which basically it's like when you get little white spot-,1,0,0,0,0,0,0,DY,2021-07-14 14:39:31.719416
Karin_UCrRusOoeeCCIVd6k8HJZYtg_NNLAU9kmqd0_562025_563801.wav,Karin_UCrRusOoeeCCIVd6k8HJZYtg_NNLAU9kmqd0,562025,563801,1776,139,like halos in your vision,1,0,0,0,0,0,0,DY,2021-07-14 14:39:43.220857
Karin_UCrRusOoeeCCIVd6k8HJZYtg_NNLAU9kmqd0_563953_566469.wav,Karin_UCrRusOoeeCCIVd6k8HJZYtg_NNLAU9kmqd0,563953,566469,2516,140,and some people only get one or the other,1,0,0,0,0,0,0,DY,2021-07-14 14:39:58.508630
Karin_UCrRusOoeeCCIVd6k8HJZYtg_NNLAU9kmqd0_566621_575063.wav,Karin_UCrRusOoeeCCIVd6k8HJZYtg_NNLAU9kmqd0,566621,575063,8442,141,but I get both which is really fun I'm definitely a morning person the one thing I need to wear every day is sunscreen I studied abroad twice,1,0,0,0,0,0,0,DY,2021-07-14 14:40:11.919675
Karin_UCrRusOoeeCCIVd6k8HJZYtg_NNLAU9kmqd0_575215_576705.wav,Karin_UCrRusOoeeCCIVd6k8HJZYtg_NNLAU9kmqd0,575215,576705,1490,142,both times in France,1,0,0,0,0,0,0,DY,2021-07-14 14:40:18.321387
Karin_UCrRusOoeeCCIVd6k8HJZYtg_NNLAU9kmqd0_576857_578433.wav,Karin_UCrRusOoeeCCIVd6k8HJZYtg_NNLAU9kmqd0,576857,578433,1576,143,but in different parts of Fran-,1,0,0,0,0,0,0,DY,2021-07-14 14:40:25.041158
Karin_UCrRusOoeeCCIVd6k8HJZYtg_NNLAU9kmqd0_578649_578993.wav,Karin_UCrRusOoeeCCIVd6k8HJZYtg_NNLAU9kmqd0,578649,578993,344,144,s- so,1,0,0,0,0,0,0,DY,2021-07-14 14:40:40.336704
Karin_UCrRusOoeeCCIVd6k8HJZYtg_NNLAU9kmqd0_579145_580825.wav,Karin_UCrRusOoeeCCIVd6k8HJZYtg_NNLAU9kmqd0,579145,580825,1680,145,the first program was in,1,0,0,0,0,0,0,DY,2021-07-14 14:40:55.959706
Karin_UCrRusOoeeCCIVd6k8HJZYtg_NNLAU9kmqd0_581113_585593.wav,Karin_UCrRusOoeeCCIVd6k8HJZYtg_NNLAU9kmqd0,581113,585593,4480,146,<unk> which is the southern part of France by the French Riviera,1,0,0,0,0,0,0,DY,2021-07-14 14:41:17.807291
Karin_UCrRusOoeeCCIVd6k8HJZYtg_NNLAU9kmqd0_585881_592681.wav,Karin_UCrRusOoeeCCIVd6k8HJZYtg_NNLAU9kmqd0,585881,592681,6800,147,it was beautiful by the beach we lived in a freaking castle and then part of the program was in Pari-,1,0,0,0,0,0,0,DY,2021-07-14 14:41:29.896687
Karin_UCrRusOoeeCCIVd6k8HJZYtg_NNLAU9kmqd0_593217_598585.wav,Karin_UCrRusOoeeCCIVd6k8HJZYtg_NNLAU9kmqd0,593217,598585,5368,148,and then I did another program that was in sort of the middle of nowhere countryside Fran-,1,0,0,0,0,0,0,DY,2021-07-14 14:41:44.034880
Karin_UCrRusOoeeCCIVd6k8HJZYtg_NNLAU9kmqd0_599185_605393.wav,Karin_UCrRusOoeeCCIVd6k8HJZYtg_NNLAU9kmqd0,599185,605393,6208,149,and I just painted and drew all day every day that summer everything we made we made about,1,0,0,0,0,0,0,DY,2021-07-14 14:42:06.722045
Karin_UCrRusOoeeCCIVd6k8HJZYtg_NNLAU9kmqd0_605945_607697.wav,Karin_UCrRusOoeeCCIVd6k8HJZYtg_NNLAU9kmqd0,605945,607697,1752,150,four hundred and fifty things,1,0,0,0,0,0,0,DY,2021-07-14 14:42:13.542749
Karin_UCrRusOoeeCCIVd6k8HJZYtg_NNLAU9kmqd0_608233_609585.wav,Karin_UCrRusOoeeCCIVd6k8HJZYtg_NNLAU9kmqd0,608233,609585,1352,151,I think someone counted,1,0,0,0,0,0,0,DY,2021-07-14 14:42:21.586909
Karin_UCrRusOoeeCCIVd6k8HJZYtg_NNLAU9kmqd0_609953_613785.wav,Karin_UCrRusOoeeCCIVd6k8HJZYtg_NNLAU9kmqd0,609953,613785,3832,152,and we picked out like a handful of our favorite-,1,0,0,0,0,0,0,DY,2021-07-14 14:42:44.362786
Karin_UCrRusOoeeCCIVd6k8HJZYtg_NNLAU9kmqd0_614345_616369.wav,Karin_UCrRusOoeeCCIVd6k8HJZYtg_NNLAU9kmqd0,614345,616369,2024,153,favorites shipped them back to America and,1,0,0,0,0,0,0,DY,2021-07-14 14:42:52.321127
Karin_UCrRusOoeeCCIVd6k8HJZYtg_NNLAU9kmqd0_616673_619729.wav,Karin_UCrRusOoeeCCIVd6k8HJZYtg_NNLAU9kmqd0,616673,619729,3056,154,burned the rest of them in a bonfire,1,0,0,0,0,0,0,DY,2021-07-14 14:43:00.832391
Karin_UCrRusOoeeCCIVd6k8HJZYtg_NNLAU9kmqd0_620641_620833.wav,Karin_UCrRusOoeeCCIVd6k8HJZYtg_NNLAU9kmqd0,620641,620833,192,155,yep,1,0,0,0,0,0,0,DY,2021-07-14 14:43:06.406945
Karin_UCrRusOoeeCCIVd6k8HJZYtg_NNLAU9kmqd0_621449_622433.wav,Karin_UCrRusOoeeCCIVd6k8HJZYtg_NNLAU9kmqd0,621449,622433,984,156,it was amazing,1,0,0,0,0,0,0,DY,2021-07-14 14:43:12.498022
Karin_UCrRusOoeeCCIVd6k8HJZYtg_NNLAU9kmqd0_622705_630009.wav,Karin_UCrRusOoeeCCIVd6k8HJZYtg_NNLAU9kmqd0,622705,630009,7304,157,a lot of times in my videos I'm quite positive and happy and smiley but I'm actually quite,1,0,0,0,0,0,0,DY,2021-07-14 14:43:27.305906
Karin_UCrRusOoeeCCIVd6k8HJZYtg_NNLAU9kmqd0_630401_637761.wav,Karin_UCrRusOoeeCCIVd6k8HJZYtg_NNLAU9kmqd0,630401,637761,7360,158,not- not really a cynical person but I'm quite a sarcastic in- in real life with my friends so a lot of times,1,0,0,0,0,0,0,DY,2021-07-14 14:43:40.678150
Karin_UCrRusOoeeCCIVd6k8HJZYtg_NNLAU9kmqd0_638065_638601.wav,Karin_UCrRusOoeeCCIVd6k8HJZYtg_NNLAU9kmqd0,638065,638601,536,159,I'll say,1,0,0,0,0,0,0,DY,2021-07-14 14:43:46.804791
Karin_UCrRusOoeeCCIVd6k8HJZYtg_NNLAU9kmqd0_639121_643333.wav,Karin_UCrRusOoeeCCIVd6k8HJZYtg_NNLAU9kmqd0,639121,643333,4212,160,kind of harsh things knowing that they're kind of harsh and I play off of that,1,0,0,0,0,0,0,DY,2021-07-14 14:44:07.852860
Karin_UCrRusOoeeCCIVd6k8HJZYtg_NNLAU9kmqd0_643685_645377.wav,Karin_UCrRusOoeeCCIVd6k8HJZYtg_NNLAU9kmqd0,643685,645377,1692,161,and it's just my sense of humor,1,0,0,0,0,0,0,DY,2021-07-14 14:44:15.690633
Karin_UCrRusOoeeCCIVd6k8HJZYtg_NNLAU9kmqd0_645817_651577.wav,Karin_UCrRusOoeeCCIVd6k8HJZYtg_NNLAU9kmqd0,645817,651577,5760,162,so let's talk about college for a while um first of all I'm twenty five years old so I'm a couple years out of,1,0,0,0,0,0,0,DY,2021-07-14 14:44:27.805729
Karin_UCrRusOoeeCCIVd6k8HJZYtg_NNLAU9kmqd0_651849_656265.wav,Karin_UCrRusOoeeCCIVd6k8HJZYtg_NNLAU9kmqd0,651849,656265,4416,163,college already I went to UCLA I was a double major in fine art-,1,0,0,0,0,0,0,DY,2021-07-14 14:44:38.292499
Karin_UCrRusOoeeCCIVd6k8HJZYtg_NNLAU9kmqd0_656401_656713.wav,Karin_UCrRusOoeeCCIVd6k8HJZYtg_NNLAU9kmqd0,656401,656713,312,164,and art,1,0,0,0,0,0,0,DY,2021-07-14 14:44:48.163535
Karin_UCrRusOoeeCCIVd6k8HJZYtg_NNLAU9kmqd0_656849_664033.wav,Karin_UCrRusOoeeCCIVd6k8HJZYtg_NNLAU9kmqd0,656849,664033,7184,165,history I don't have a driver's license which is actually kind of a stereotypical San Francisco thing I have taken the written test,1,0,0,0,0,0,0,DY,2021-07-14 14:45:14.435591
Karin_UCrRusOoeeCCIVd6k8HJZYtg_NNLAU9kmqd0_664465_665689.wav,Karin_UCrRusOoeeCCIVd6k8HJZYtg_NNLAU9kmqd0,664465,665689,1224,166,actually twice now,1,0,0,0,0,0,0,DY,2021-07-14 14:45:19.661214
Karin_UCrRusOoeeCCIVd6k8HJZYtg_NNLAU9kmqd0_666089_667001.wav,Karin_UCrRusOoeeCCIVd6k8HJZYtg_NNLAU9kmqd0,666089,667001,912,167,and I just,1,0,0,0,0,0,0,DY,2021-07-14 14:45:25.978665
Karin_UCrRusOoeeCCIVd6k8HJZYtg_NNLAU9kmqd0_667305_672737.wav,Karin_UCrRusOoeeCCIVd6k8HJZYtg_NNLAU9kmqd0,667305,672737,5432,168,haven't taken the test to actually get my license maybe it will happen,1,0,0,0,0,0,0,DY,2021-07-14 14:45:38.319124
Karin_UCrRusOoeeCCIVd6k8HJZYtg_NNLAU9kmqd0_673513_674921.wav,Karin_UCrRusOoeeCCIVd6k8HJZYtg_NNLAU9kmqd0,673513,674921,1408,169,this year_unn,1,0,0,1,0,0,0,DY,2021-07-14 14:45:49.269564
Karin_UCrRusOoeeCCIVd6k8HJZYtg_NNLAU9kmqd0_676481_683773.wav,Karin_UCrRusOoeeCCIVd6k8HJZYtg_NNLAU9kmqd0,676481,683773,7292,170,I actually never learned how to ride a bike either and that's just another thing that my parents taught my sister and never taught me,1,0,0,0,0,0,0,DY,2021-07-14 14:46:02.300410
Karin_UCrRusOoeeCCIVd6k8HJZYtg_NNLAU9kmqd0_683997_686821.wav,Karin_UCrRusOoeeCCIVd6k8HJZYtg_NNLAU9kmqd0,683997,686821,2824,171,I only have one sister by the way she's three years older,1,0,0,0,0,0,0,DY,2021-07-14 14:46:10.905583
Karin_UCrRusOoeeCCIVd6k8HJZYtg_NNLAU9kmqd0_687037_690353.wav,Karin_UCrRusOoeeCCIVd6k8HJZYtg_NNLAU9kmqd0,687037,690353,3316,172,if you've seen my other videos you've seen her in my videos,1,0,0,0,0,0,0,DY,2021-07-14 14:46:20.526646
Karin_UCrRusOoeeCCIVd6k8HJZYtg_NNLAU9kmqd0_690777_693889.wav,Karin_UCrRusOoeeCCIVd6k8HJZYtg_NNLAU9kmqd0,690777,693889,3112,173,and she's one of my best friends she's amazing,1,0,0,0,0,0,0,DY,2021-07-14 14:46:28.775454
Karin_UCrRusOoeeCCIVd6k8HJZYtg_NNLAU9kmqd0_694313_698377.wav,Karin_UCrRusOoeeCCIVd6k8HJZYtg_NNLAU9kmqd0,694313,698377,4064,174,um I work with her obviously but I really respect her,1,0,0,0,0,0,0,DY,2021-07-14 14:46:38.670288
Karin_UCrRusOoeeCCIVd6k8HJZYtg_NNLAU9kmqd0_698705_701337.wav,Karin_UCrRusOoeeCCIVd6k8HJZYtg_NNLAU9kmqd0,698705,701337,2632,175,and y'know a- all throughout life,1,0,0,0,0,0,0,DY,2021-07-14 14:46:56.812636
Karin_UCrRusOoeeCCIVd6k8HJZYtg_NNLAU9kmqd0_701641_702881.wav,Karin_UCrRusOoeeCCIVd6k8HJZYtg_NNLAU9kmqd0,701641,702881,1240,176,I actually owe,1,0,0,0,0,0,0,DY,2021-07-14 14:47:11.113549
Karin_UCrRusOoeeCCIVd6k8HJZYtg_NNLAU9kmqd0_703185_705577.wav,Karin_UCrRusOoeeCCIVd6k8HJZYtg_NNLAU9kmqd0,703185,705577,2392,177,a lot to my sister because,1,0,0,0,0,0,0,DY,2021-07-14 14:47:17.792710
Karin_UCrRusOoeeCCIVd6k8HJZYtg_NNLAU9kmqd0_706009_710241.wav,Karin_UCrRusOoeeCCIVd6k8HJZYtg_NNLAU9kmqd0,706009,710241,4232,178,she is so smart and driven and dedicated and,1,0,0,0,0,0,0,DY,2021-07-14 14:47:28.216851
Karin_UCrRusOoeeCCIVd6k8HJZYtg_NNLAU9kmqd0_710553_712193.wav,Karin_UCrRusOoeeCCIVd6k8HJZYtg_NNLAU9kmqd0,710553,712193,1640,179,giving and everything like that,1,0,0,0,0,0,0,DY,2021-07-14 14:47:35.441267
Karin_UCrRusOoeeCCIVd6k8HJZYtg_NNLAU9kmqd0_712657_713137.wav,Karin_UCrRusOoeeCCIVd6k8HJZYtg_NNLAU9kmqd0,712657,713137,480,180,um,1,0,0,0,0,0,0,DY,2021-07-14 14:47:41.743319
Karin_UCrRusOoeeCCIVd6k8HJZYtg_NNLAU9kmqd0_713441_715777.wav,Karin_UCrRusOoeeCCIVd6k8HJZYtg_NNLAU9kmqd0,713441,715777,2336,181,she has taken care of me a lot,1,0,0,0,0,0,0,DY,2021-07-14 14:47:49.263618
Karin_UCrRusOoeeCCIVd6k8HJZYtg_NNLAU9kmqd0_716049_718209.wav,Karin_UCrRusOoeeCCIVd6k8HJZYtg_NNLAU9kmqd0,716049,718209,2160,182,when I was younger and even now,1,0,0,0,0,0,0,DY,2021-07-14 14:47:57.467442
Karin_UCrRusOoeeCCIVd6k8HJZYtg_NNLAU9kmqd0_718625_722273.wav,Karin_UCrRusOoeeCCIVd6k8HJZYtg_NNLAU9kmqd0,718625,722273,3648,183,I said before I wasn't a really good student until high school,1,0,0,0,0,0,0,DY,2021-07-14 14:48:06.658791
Karin_UCrRusOoeeCCIVd6k8HJZYtg_NNLAU9kmqd0_722705_724489.wav,Karin_UCrRusOoeeCCIVd6k8HJZYtg_NNLAU9kmqd0,722705,724489,1784,184,a lot of the reason why,1,0,0,0,0,0,0,DY,2021-07-14 14:48:13.837788
Karin_UCrRusOoeeCCIVd6k8HJZYtg_NNLAU9kmqd0_724953_729041.wav,Karin_UCrRusOoeeCCIVd6k8HJZYtg_NNLAU9kmqd0,724953,729041,4088,185,I became a better student is because of my sister my sister,1,0,0,0,0,0,0,DY,2021-07-14 14:48:32.531453
Karin_UCrRusOoeeCCIVd6k8HJZYtg_NNLAU9kmqd0_729409_736377.wav,Karin_UCrRusOoeeCCIVd6k8HJZYtg_NNLAU9kmqd0,729409,736377,6968,186,was a very good student she was like straight A's everything so when I reached high school,1,0,0,0,0,0,0,DY,2021-07-14 14:48:44.930116
Karin_UCrRusOoeeCCIVd6k8HJZYtg_NNLAU9kmqd0_736793_739633.wav,Karin_UCrRusOoeeCCIVd6k8HJZYtg_NNLAU9kmqd0,736793,739633,2840,187,my goal in high school was to just,1,0,0,0,0,0,0,DY,2021-07-14 14:48:53.173432
Karin_UCrRusOoeeCCIVd6k8HJZYtg_NNLAU9kmqd0_740457_741745.wav,Karin_UCrRusOoeeCCIVd6k8HJZYtg_NNLAU9kmqd0,740457,741745,1288,188,be the same,1,0,0,0,0,0,0,DY,2021-07-14 14:48:59.576047
Karin_UCrRusOoeeCCIVd6k8HJZYtg_NNLAU9kmqd0_742225_743321.wav,Karin_UCrRusOoeeCCIVd6k8HJZYtg_NNLAU9kmqd0,742225,743321,1096,189,if not better,1,0,0,0,0,0,0,DY,2021-07-14 14:49:06.651116
Karin_UCrRusOoeeCCIVd6k8HJZYtg_NNLAU9kmqd0_743577_745897.wav,Karin_UCrRusOoeeCCIVd6k8HJZYtg_NNLAU9kmqd0,743577,745897,2320,190,but like especially just the same,1,0,0,0,0,0,0,DY,2021-07-14 14:49:17.987531
Karin_UCrRusOoeeCCIVd6k8HJZYtg_NNLAU9kmqd0_746153_747121.wav,Karin_UCrRusOoeeCCIVd6k8HJZYtg_NNLAU9kmqd0,746153,747121,968,191,as my sister,1,0,0,0,0,0,0,DY,2021-07-14 14:49:23.147537
Karin_UCrRusOoeeCCIVd6k8HJZYtg_NNLAU9kmqd0_747417_749561.wav,Karin_UCrRusOoeeCCIVd6k8HJZYtg_NNLAU9kmqd0,747417,749561,2144,192,and because I was just determined,1,0,0,0,0,0,0,DY,2021-07-14 14:49:29.735836
Karin_UCrRusOoeeCCIVd6k8HJZYtg_NNLAU9kmqd0_749977_751073.wav,Karin_UCrRusOoeeCCIVd6k8HJZYtg_NNLAU9kmqd0,749977,751073,1096,193,to like be,1,0,0,0,0,0,0,DY,2021-07-14 14:49:36.182463
Karin_UCrRusOoeeCCIVd6k8HJZYtg_NNLAU9kmqd0_751329_753609.wav,Karin_UCrRusOoeeCCIVd6k8HJZYtg_NNLAU9kmqd0,751329,753609,2280,194,like not worse than my sister,1,0,0,0,0,0,0,DY,2021-07-14 14:49:43.981285
Karin_UCrRusOoeeCCIVd6k8HJZYtg_NNLAU9kmqd0_754065_756857.wav,Karin_UCrRusOoeeCCIVd6k8HJZYtg_NNLAU9kmqd0,754065,756857,2792,195,I ended up having good grades and,1,0,0,0,0,0,0,DY,2021-07-14 14:49:52.524352
Karin_UCrRusOoeeCCIVd6k8HJZYtg_NNLAU9kmqd0_757281_758313.wav,Karin_UCrRusOoeeCCIVd6k8HJZYtg_NNLAU9kmqd0,757281,758313,1032,196,ended up doing,1,0,0,0,0,0,0,DY,2021-07-14 14:49:58.970056
Karin_UCrRusOoeeCCIVd6k8HJZYtg_NNLAU9kmqd0_758825_759057.wav,Karin_UCrRusOoeeCCIVd6k8HJZYtg_NNLAU9kmqd0,758825,759057,232,197,like,1,0,0,0,0,0,0,DY,2021-07-14 14:50:04.305973
Karin_UCrRusOoeeCCIVd6k8HJZYtg_NNLAU9kmqd0_759401_762657.wav,Karin_UCrRusOoeeCCIVd6k8HJZYtg_NNLAU9kmqd0,759401,762657,3256,198,pretty well in school and going to a good school and stuff like that,1,0,0,0,0,0,0,DY,2021-07-14 14:50:16.141524
Karin_UCrRusOoeeCCIVd6k8HJZYtg_NNLAU9kmqd0_763177_763841.wav,Karin_UCrRusOoeeCCIVd6k8HJZYtg_NNLAU9kmqd0,763177,763841,664,199,so,1,0,0,0,0,0,0,DY,2021-07-14 14:50:21.830084
Karin_UCrRusOoeeCCIVd6k8HJZYtg_NNLAU9kmqd0_764401_769545.wav,Karin_UCrRusOoeeCCIVd6k8HJZYtg_NNLAU9kmqd0,764401,769545,5144,200,it's all because of you Carmen can one of my facts be that I'm an auntie,1,0,0,0,0,0,0,DY,2021-07-14 14:50:40.485860
Karin_UCrRusOoeeCCIVd6k8HJZYtg_NNLAU9kmqd0_770025_772641.wav,Karin_UCrRusOoeeCCIVd6k8HJZYtg_NNLAU9kmqd0,770025,772641,2616,201,because I kind of love being an auntie,1,0,0,0,0,0,0,DY,2021-07-14 14:50:48.055212
Karin_UCrRusOoeeCCIVd6k8HJZYtg_NNLAU9kmqd0_772937_775321.wav,Karin_UCrRusOoeeCCIVd6k8HJZYtg_NNLAU9kmqd0,772937,775321,2384,202,I was younger I was like I don't know if I really like,1,0,0,0,0,0,0,DY,2021-07-14 14:51:02.818742
Karin_UCrRusOoeeCCIVd6k8HJZYtg_NNLAU9kmqd0_775481_775777.wav,Karin_UCrRusOoeeCCIVd6k8HJZYtg_NNLAU9kmqd0,775481,775777,296,203,kid-,0,0,0,0,0,0,0,DY,2021-07-14 14:51:07.527622
Karin_UCrRusOoeeCCIVd6k8HJZYtg_NNLAU9kmqd0_775953_783561.wav,Karin_UCrRusOoeeCCIVd6k8HJZYtg_NNLAU9kmqd0,775953,783561,7608,204,like I've tutored kids a lot when I was younger my experiences have always been kind of mediocre which is why I'm like not a teacher,1,0,0,0,0,0,0,DY,2021-07-14 14:51:31.592429
Karin_UCrRusOoeeCCIVd6k8HJZYtg_NNLAU9kmqd0_783849_786249.wav,Karin_UCrRusOoeeCCIVd6k8HJZYtg_NNLAU9kmqd0,783849,786249,2400,205,<lgh> I would not be a good teacher but since,1,0,0,0,0,0,0,DY,2021-07-14 14:51:58.881929
Karin_UCrRusOoeeCCIVd6k8HJZYtg_NNLAU9kmqd0_786649_788241.wav,Karin_UCrRusOoeeCCIVd6k8HJZYtg_NNLAU9kmqd0,786649,788241,1592,206,I've become an auntie like,1,0,0,0,0,0,0,DY,2021-07-14 14:52:05.572893
Karin_UCrRusOoeeCCIVd6k8HJZYtg_NNLAU9kmqd0_789137_793385.wav,Karin_UCrRusOoeeCCIVd6k8HJZYtg_NNLAU9kmqd0,789137,793385,4248,207,I was like oh yeah this kid's not too bad it's just kind of hilarious being an Auntie,1,0,0,0,0,0,0,DY,2021-07-14 14:52:16.449000
Karin_UCrRusOoeeCCIVd6k8HJZYtg_NNLAU9kmqd0_793649_800713.wav,Karin_UCrRusOoeeCCIVd6k8HJZYtg_NNLAU9kmqd0,793649,800713,7064,208,and like the best part is that I can like just play with her as much as I want to and then when she starts getting sassy I give her back to her mom,1,0,0,0,0,0,0,DY,2021-07-14 14:52:49.013374
Karin_UCrRusOoeeCCIVd6k8HJZYtg_NNLAU9kmqd0_801305_804193.wav,Karin_UCrRusOoeeCCIVd6k8HJZYtg_NNLAU9kmqd0,801305,804193,2888,209,I really freaking like just love eating,1,0,0,0,0,0,0,DY,2021-07-14 14:53:10.833335
Karin_UCrRusOoeeCCIVd6k8HJZYtg_NNLAU9kmqd0_804985_807889.wav,Karin_UCrRusOoeeCCIVd6k8HJZYtg_NNLAU9kmqd0,804985,807889,2904,210,which you- if you can't tell from this channel I just really,1,0,0,0,0,0,0,DY,2021-07-14 14:53:18.642906
Karin_UCrRusOoeeCCIVd6k8HJZYtg_NNLAU9kmqd0_808289_809369.wav,Karin_UCrRusOoeeCCIVd6k8HJZYtg_NNLAU9kmqd0,808289,809369,1080,211,ing- love to eat,1,0,0,0,0,0,0,DY,2021-07-14 14:53:35.748252
Karin_UCrRusOoeeCCIVd6k8HJZYtg_NNLAU9kmqd0_809993_817193.wav,Karin_UCrRusOoeeCCIVd6k8HJZYtg_NNLAU9kmqd0,809993,817193,7200,212,like everything I'm not a very picky eater there's only a few things I don't really prefer but even if I don't prefer them,1,0,0,0,0,0,0,DY,2021-07-14 14:53:49.065661
Karin_UCrRusOoeeCCIVd6k8HJZYtg_NNLAU9kmqd0_817465_818633.wav,Karin_UCrRusOoeeCCIVd6k8HJZYtg_NNLAU9kmqd0,817465,818633,1168,213,I would still eat them,1,0,0,0,0,0,0,DY,2021-07-14 14:54:00.755520
Karin_UCrRusOoeeCCIVd6k8HJZYtg_NNLAU9kmqd0_818993_822493.wav,Karin_UCrRusOoeeCCIVd6k8HJZYtg_NNLAU9kmqd0,818993,822493,3500,214,if I'm with someone who is not a very adventurous eater,1,0,0,0,0,0,0,DY,2021-07-14 14:54:22.091762
Karin_UCrRusOoeeCCIVd6k8HJZYtg_NNLAU9kmqd0_822765_825837.wav,Karin_UCrRusOoeeCCIVd6k8HJZYtg_NNLAU9kmqd0,822765,825837,3072,215,I am that annoying person who will be like you should try this,1,0,0,0,0,0,0,DY,2021-07-14 14:54:37.885918
Karin_UCrRusOoeeCCIVd6k8HJZYtg_NNLAU9kmqd0_826133_827049.wav,Karin_UCrRusOoeeCCIVd6k8HJZYtg_NNLAU9kmqd0,826133,827049,916,216,you should try this y-,1,0,0,0,0,0,0,DY,2021-07-14 14:54:44.167803
Karin_UCrRusOoeeCCIVd6k8HJZYtg_NNLAU9kmqd0_827321_833625.wav,Karin_UCrRusOoeeCCIVd6k8HJZYtg_NNLAU9kmqd0,827321,833625,6304,217,like this is- this is so crazy like you should try this part of it is because I wanna share things I like and like ,1,0,0,0,0,0,0,DY,2021-07-14 14:55:17.612065
Karin_UCrRusOoeeCCIVd6k8HJZYtg_NNLAU9kmqd0_833881_837153.wav,Karin_UCrRusOoeeCCIVd6k8HJZYtg_NNLAU9kmqd0,833881,837153,3272,218,give them this new experience I think is really exciting,1,0,0,0,0,0,0,DY,2021-07-14 14:55:35.960096
Karin_UCrRusOoeeCCIVd6k8HJZYtg_NNLAU9kmqd0_837577_843545.wav,Karin_UCrRusOoeeCCIVd6k8HJZYtg_NNLAU9kmqd0,837577,843545,5968,219,and part of it is because I'm like making fun of them for like having very arbitrary things they don't like,1,0,0,0,0,0,0,DY,2021-07-14 14:55:47.121010
Karin_UCrRusOoeeCCIVd6k8HJZYtg_NNLAU9kmqd0_843921_848385.wav,Karin_UCrRusOoeeCCIVd6k8HJZYtg_NNLAU9kmqd0,843921,848385,4464,220,but if I like something like I wanna share things I love with people I care about,1,0,0,0,0,0,0,DY,2021-07-14 14:55:58.071679
Karin_UCrRusOoeeCCIVd6k8HJZYtg_NNLAU9kmqd0_848825_853305.wav,Karin_UCrRusOoeeCCIVd6k8HJZYtg_NNLAU9kmqd0,848825,853305,4480,221,so it comes from a place of love okay if I could only eat one food,1,0,0,0,0,0,0,DY,2021-07-14 14:56:09.115497
Karin_UCrRusOoeeCCIVd6k8HJZYtg_NNLAU9kmqd0_853609_856937.wav,Karin_UCrRusOoeeCCIVd6k8HJZYtg_NNLAU9kmqd0,853609,856937,3328,222,for the rest of my life for all of my meals it would be sushi,1,0,0,0,0,0,0,DY,2021-07-14 14:56:20.856154
Karin_UCrRusOoeeCCIVd6k8HJZYtg_NNLAU9kmqd0_858009_858425.wav,Karin_UCrRusOoeeCCIVd6k8HJZYtg_NNLAU9kmqd0,858009,858425,416,223,and,1,0,0,0,0,0,0,DY,2021-07-14 14:56:25.821981
Karin_UCrRusOoeeCCIVd6k8HJZYtg_NNLAU9kmqd0_859217_866017.wav,Karin_UCrRusOoeeCCIVd6k8HJZYtg_NNLAU9kmqd0,859217,866017,6800,224,viewers of my other videos now I say sushi* a lot instead of sushi* uh- or sushi*,1,0,0,0,0,0,0,DY,2021-07-14 14:57:08.890915
Karin_UCrRusOoeeCCIVd6k8HJZYtg_NNLAU9kmqd0_866545_867977.wav,Karin_UCrRusOoeeCCIVd6k8HJZYtg_NNLAU9kmqd0,866545,867977,1432,225,<lgh> um,1,0,0,0,0,0,0,DY,2021-07-14 14:57:26.855541
Karin_UCrRusOoeeCCIVd6k8HJZYtg_NNLAU9kmqd0_868345_871985.wav,Karin_UCrRusOoeeCCIVd6k8HJZYtg_NNLAU9kmqd0,868345,871985,3640,226,working on that I've thought about this because sushi you can eat,1,0,0,0,0,0,0,DY,2021-07-14 14:59:27.899437
Karin_UCrRusOoeeCCIVd6k8HJZYtg_NNLAU9kmqd0_872305_876361.wav,Karin_UCrRusOoeeCCIVd6k8HJZYtg_NNLAU9kmqd0,872305,876361,4056,227,for breakfast lunch and dinner and it's not super savory or super sweet,1,0,0,0,0,0,0,DY,2021-07-14 14:59:37.294364
Karin_UCrRusOoeeCCIVd6k8HJZYtg_NNLAU9kmqd0_876625_878441.wav,Karin_UCrRusOoeeCCIVd6k8HJZYtg_NNLAU9kmqd0,876625,878441,1816,228,sushi is always just good,1,0,0,0,0,0,0,DY,2021-07-14 14:59:44.278381
Karin_UCrRusOoeeCCIVd6k8HJZYtg_NNLAU9kmqd0_879001_879321.wav,Karin_UCrRusOoeeCCIVd6k8HJZYtg_NNLAU9kmqd0,879001,879321,320,229,,0,0,0,0,0,1,0,DY,2021-07-14 14:59:49.372003
