filename,video_id,start_time,end_time,duration,id,transcription,usability,bg_music,bg_noise,other_voice,only_music,only_noise,other_sounds,annotator,annotate_date_YYYYMMDD
CameronCao_UCR3iEpRZDhavOacxel3hbA_eMgynE62qmw_1245880_1247816.wav,CameronCao_UCR3iEpRZDhavOacxel3hbA_eMgynE62qmw,1245880,1247816,1936,320,and it just it's just,1,0,0,0,0,0,0,DY,2021-09-24 15:08:05.260519
CameronCao_UCR3iEpRZDhavOacxel3hbA_eMgynE62qmw_1248112_1252576.wav,CameronCao_UCR3iEpRZDhavOacxel3hbA_eMgynE62qmw,1248112,1252576,4464,321,gross that you just think our culture is just an aesthetic for you to wear to,1,0,0,0,0,0,0,DY,2021-09-24 15:08:17.981045
CameronCao_UCR3iEpRZDhavOacxel3hbA_eMgynE62qmw_1253224_1257728.wav,CameronCao_UCR3iEpRZDhavOacxel3hbA_eMgynE62qmw,1253224,1257728,4504,322,eat food enjoy yourselves but not even care about the people behind it and the meaning behind it,1,0,1,0,0,0,0,DY,2021-09-24 15:08:32.799445
CameronCao_UCR3iEpRZDhavOacxel3hbA_eMgynE62qmw_1259424_1268536.wav,CameronCao_UCR3iEpRZDhavOacxel3hbA_eMgynE62qmw,1259424,1268536,9112,323,you use our stuff for your aesthetics and to make yourselves look better only to then not even give- when something's actually happening to the community behind it,1,0,0,0,0,0,0,DY,2021-09-24 15:09:11.721255
CameronCao_UCR3iEpRZDhavOacxel3hbA_eMgynE62qmw_1270264_1275848.wav,CameronCao_UCR3iEpRZDhavOacxel3hbA_eMgynE62qmw,1270264,1275848,5584,324,it's disgusting to see things we were originally mocked for our eyes our slanted eyes our,1,0,0,0,0,0,0,DY,2021-09-24 15:09:30.980284
CameronCao_UCR3iEpRZDhavOacxel3hbA_eMgynE62qmw_1276432_1280936.wav,CameronCao_UCR3iEpRZDhavOacxel3hbA_eMgynE62qmw,1276432,1280936,4504,325,our face just- i don't know everything about asians before that were mocked,1,0,0,0,0,0,0,DY,2021-09-24 15:09:41.486925
CameronCao_UCR3iEpRZDhavOacxel3hbA_eMgynE62qmw_1281216_1281560.wav,CameronCao_UCR3iEpRZDhavOacxel3hbA_eMgynE62qmw,1281216,1281560,344,326,,0,0,0,0,0,1,0,DY,2021-09-24 15:09:47.000721
CameronCao_UCR3iEpRZDhavOacxel3hbA_eMgynE62qmw_1282016_1289088.wav,CameronCao_UCR3iEpRZDhavOacxel3hbA_eMgynE62qmw,1282016,1289088,7072,327,you look on places like fucking_unc TikTok i hate TikTok i'm just going to say that right now i fucking_unc hate TikTok you take stuff like that you go on to-,1,0,1,0,0,0,0,DY,2021-09-24 15:10:23.621645
CameronCao_UCR3iEpRZDhavOacxel3hbA_eMgynE62qmw_1289408_1291792.wav,CameronCao_UCR3iEpRZDhavOacxel3hbA_eMgynE62qmw,1289408,1291792,2384,328,sorry you go onto apps like TikTok,1,0,0,0,0,0,0,DY,2021-09-24 15:10:33.160595
CameronCao_UCR3iEpRZDhavOacxel3hbA_eMgynE62qmw_1293272_1299688.wav,CameronCao_UCR3iEpRZDhavOacxel3hbA_eMgynE62qmw,1293272,1299688,6416,329,and you just see people be like nya_unn ichi_unn ni_unn san_unn nya_unn it's just so stupid like,1,0,0,1,0,0,0,DY,2021-09-24 15:10:46.748036
CameronCao_UCR3iEpRZDhavOacxel3hbA_eMgynE62qmw_1300040_1313304.wav,CameronCao_UCR3iEpRZDhavOacxel3hbA_eMgynE62qmw,1300040,1313304,13264,330,why you- like th- they'll go and use japanese sounds japanese this japanese that or korean stuff and they just turn it into their own little trend aesthetic and they're just like oh_unn my_unn god_unn this_unn is_unn so_unn cute_unn and then once it's all over they're just like,1,0,0,1,0,0,0,DY,2021-09-24 15:11:38.469132
CameronCao_UCR3iEpRZDhavOacxel3hbA_eMgynE62qmw_1313656_1315544.wav,CameronCao_UCR3iEpRZDhavOacxel3hbA_eMgynE62qmw,1313656,1315544,1888,331,okay_unn next_unn,0,0,0,1,0,0,0,DY,2021-09-24 15:11:44.142217
CameronCao_UCR3iEpRZDhavOacxel3hbA_eMgynE62qmw_1317312_1327960.wav,CameronCao_UCR3iEpRZDhavOacxel3hbA_eMgynE62qmw,1317312,1327960,10648,332,'cause they just wanna act quirky or some shit like that and i just think it's so stupid they make it a trend when originally if anybody or any asian for that matter was into anime K pop,1,0,0,0,0,0,0,DY,2021-09-24 15:12:00.757082
CameronCao_UCR3iEpRZDhavOacxel3hbA_eMgynE62qmw_1328112_1328480.wav,CameronCao_UCR3iEpRZDhavOacxel3hbA_eMgynE62qmw,1328112,1328480,368,333,,0,0,0,0,0,1,0,DY,2021-09-24 15:12:05.709936
CameronCao_UCR3iEpRZDhavOacxel3hbA_eMgynE62qmw_1328704_1330200.wav,CameronCao_UCR3iEpRZDhavOacxel3hbA_eMgynE62qmw,1328704,1330200,1496,334,eh- s- J rock,1,0,0,0,0,0,0,DY,2021-09-24 15:12:17.904514
CameronCao_UCR3iEpRZDhavOacxel3hbA_eMgynE62qmw_1330656_1334824.wav,CameronCao_UCR3iEpRZDhavOacxel3hbA_eMgynE62qmw,1330656,1334824,4168,335,stuff like that before we were all mocked for it we were called weird,1,0,0,0,0,0,0,DY,2021-09-24 15:12:27.973592
CameronCao_UCR3iEpRZDhavOacxel3hbA_eMgynE62qmw_1335656_1338808.wav,CameronCao_UCR3iEpRZDhavOacxel3hbA_eMgynE62qmw,1335656,1338808,3152,336,everything that asians used to do were considered weird,1,0,1,0,0,0,0,DY,2021-09-24 15:12:37.791739
CameronCao_UCR3iEpRZDhavOacxel3hbA_eMgynE62qmw_1339152_1340896.wav,CameronCao_UCR3iEpRZDhavOacxel3hbA_eMgynE62qmw,1339152,1340896,1744,337,creepy foreign,1,0,0,0,0,0,0,DY,2021-09-24 15:12:45.213785
CameronCao_UCR3iEpRZDhavOacxel3hbA_eMgynE62qmw_1341424_1348808.wav,CameronCao_UCR3iEpRZDhavOacxel3hbA_eMgynE62qmw,1341424,1348808,7384,338,and now it's a fucking trend for you all to enjoy and be like oh_unn my_unn god_unn this_unn is_unn actually_unn so_unn cute_unn and then after that you don't even give a f-,1,0,0,1,0,0,0,DY,2021-09-24 15:13:17.149033
CameronCao_UCR3iEpRZDhavOacxel3hbA_eMgynE62qmw_1349064_1351912.wav,CameronCao_UCR3iEpRZDhavOacxel3hbA_eMgynE62qmw,1349064,1351912,2848,339,behind the history behind that or just,1,0,0,0,0,0,0,DY,2021-09-24 15:13:39.708346
CameronCao_UCR3iEpRZDhavOacxel3hbA_eMgynE62qmw_1352752_1354676.wav,CameronCao_UCR3iEpRZDhavOacxel3hbA_eMgynE62qmw,1352752,1354676,1924,340,anything like that you just use it for a trend,1,0,0,0,0,0,0,DY,2021-09-24 15:13:47.221973
CameronCao_UCR3iEpRZDhavOacxel3hbA_eMgynE62qmw_1354828_1361376.wav,CameronCao_UCR3iEpRZDhavOacxel3hbA_eMgynE62qmw,1354828,1361376,6548,341,in which in a way i know some people can make the argument that oh we're grateful it's spreading asian culture but,1,0,0,0,0,0,0,DY,2021-09-24 15:14:10.676071
CameronCao_UCR3iEpRZDhavOacxel3hbA_eMgynE62qmw_1361896_1362256.wav,CameronCao_UCR3iEpRZDhavOacxel3hbA_eMgynE62qmw,1361896,1362256,360,342,they don't,1,0,0,0,0,0,0,DY,2021-09-24 15:14:17.505689
CameronCao_UCR3iEpRZDhavOacxel3hbA_eMgynE62qmw_1362592_1365204.wav,CameronCao_UCR3iEpRZDhavOacxel3hbA_eMgynE62qmw,1362592,1365204,2612,343,even know what's behind it they don't know,1,0,0,0,0,0,0,DY,2021-09-24 15:14:26.788914
CameronCao_UCR3iEpRZDhavOacxel3hbA_eMgynE62qmw_1365388_1367596.wav,CameronCao_UCR3iEpRZDhavOacxel3hbA_eMgynE62qmw,1365388,1367596,2208,344,the meaning of it they don't know what they're saying,1,0,0,0,0,0,0,DY,2021-09-24 15:14:34.239501
CameronCao_UCR3iEpRZDhavOacxel3hbA_eMgynE62qmw_1367788_1374864.wav,CameronCao_UCR3iEpRZDhavOacxel3hbA_eMgynE62qmw,1367788,1374864,7076,345,they don't even research or do anything about it they just use it for a trend because they see it they see other people do it and they're like okay i'll do it too,1,0,0,0,0,0,0,DY,2021-09-24 15:14:47.452059
CameronCao_UCR3iEpRZDhavOacxel3hbA_eMgynE62qmw_1375152_1377160.wav,CameronCao_UCR3iEpRZDhavOacxel3hbA_eMgynE62qmw,1375152,1377160,2008,346,get the views get the likes and then move on,1,0,0,0,0,0,0,DY,2021-09-24 15:14:52.495510
CameronCao_UCR3iEpRZDhavOacxel3hbA_eMgynE62qmw_1379096_1380936.wav,CameronCao_UCR3iEpRZDhavOacxel3hbA_eMgynE62qmw,1379096,1380936,1840,347,and i'm sick and tired of it,1,0,0,0,0,0,0,DY,2021-09-24 15:14:56.211503
CameronCao_UCR3iEpRZDhavOacxel3hbA_eMgynE62qmw_1383112_1383448.wav,CameronCao_UCR3iEpRZDhavOacxel3hbA_eMgynE62qmw,1383112,1383448,336,348,if,1,0,0,0,0,0,0,DY,2021-09-24 15:15:00.872314
CameronCao_UCR3iEpRZDhavOacxel3hbA_eMgynE62qmw_1383968_1390200.wav,CameronCao_UCR3iEpRZDhavOacxel3hbA_eMgynE62qmw,1383968,1390200,6232,349,for me i see white creators using drinking matcha eating sushi buying hello kitty or whatever,1,0,0,0,0,0,0,DY,2021-09-24 15:15:12.905498
CameronCao_UCR3iEpRZDhavOacxel3hbA_eMgynE62qmw_1390568_1392592.wav,CameronCao_UCR3iEpRZDhavOacxel3hbA_eMgynE62qmw,1390568,1392592,2024,350,i at least want you to at least say that,1,0,0,0,0,0,0,DY,2021-09-24 15:15:20.519094
CameronCao_UCR3iEpRZDhavOacxel3hbA_eMgynE62qmw_1393416_1397976.wav,CameronCao_UCR3iEpRZDhavOacxel3hbA_eMgynE62qmw,1393416,1397976,4560,351,say that stop asian hate just even post a small thing just a small thing,1,0,0,0,0,0,0,DY,2021-09-24 15:15:31.613026
CameronCao_UCR3iEpRZDhavOacxel3hbA_eMgynE62qmw_1398740_1411896.wav,CameronCao_UCR3iEpRZDhavOacxel3hbA_eMgynE62qmw,1398740,1411896,13156,352,even i see the anime community and K pop community right now they don't say that much about it either which is super disappointing for me 'cause i'm in both fandoms i'm part of the anime community and K pop community and it's so fucking disappointing to see that no one has said anything,1,0,1,0,0,0,0,DY,2021-09-24 15:15:54.822334
CameronCao_UCR3iEpRZDhavOacxel3hbA_eMgynE62qmw_1412512_1412856.wav,CameronCao_UCR3iEpRZDhavOacxel3hbA_eMgynE62qmw,1412512,1412856,344,353,and,1,0,0,0,0,0,0,DY,2021-09-24 15:16:00.059522
CameronCao_UCR3iEpRZDhavOacxel3hbA_eMgynE62qmw_1413224_1413768.wav,CameronCao_UCR3iEpRZDhavOacxel3hbA_eMgynE62qmw,1413224,1413768,544,354,,0,0,0,0,0,1,0,DY,2021-09-24 15:16:04.091701
CameronCao_UCR3iEpRZDhavOacxel3hbA_eMgynE62qmw_1414152_1420456.wav,CameronCao_UCR3iEpRZDhavOacxel3hbA_eMgynE62qmw,1414152,1420456,6304,355,it just makes me disappointed 'cause like the people that are behind the things that you love and enjoy are getting beat up on the street,1,0,0,0,0,0,0,DY,2021-09-24 15:16:36.868503
CameronCao_UCR3iEpRZDhavOacxel3hbA_eMgynE62qmw_1421144_1424160.wav,CameronCao_UCR3iEpRZDhavOacxel3hbA_eMgynE62qmw,1421144,1424160,3016,356,old people just minding their own business just walking around,1,0,0,0,0,0,0,DY,2021-09-24 15:16:44.845766
CameronCao_UCR3iEpRZDhavOacxel3hbA_eMgynE62qmw_1424504_1428576.wav,CameronCao_UCR3iEpRZDhavOacxel3hbA_eMgynE62qmw,1424504,1428576,4072,357,just uh- doing- just living their life they're just- ge- they're just getting beat up for no reason,1,0,0,0,0,0,0,DY,2021-09-24 15:17:10.031709
CameronCao_UCR3iEpRZDhavOacxel3hbA_eMgynE62qmw_1429016_1429152.wav,CameronCao_UCR3iEpRZDhavOacxel3hbA_eMgynE62qmw,1429016,1429152,136,358,,0,0,0,0,0,1,0,DY,2021-09-24 15:17:15.294757
CameronCao_UCR3iEpRZDhavOacxel3hbA_eMgynE62qmw_1429504_1430984.wav,CameronCao_UCR3iEpRZDhavOacxel3hbA_eMgynE62qmw,1429504,1430984,1480,359,reason for the sole purpose that they just-,1,0,0,0,0,0,0,DY,2021-09-24 15:17:21.124665
CameronCao_UCR3iEpRZDhavOacxel3hbA_eMgynE62qmw_1431440_1432672.wav,CameronCao_UCR3iEpRZDhavOacxel3hbA_eMgynE62qmw,1431440,1432672,1232,360,for our skin like-,1,0,0,0,0,0,0,DY,2021-09-24 15:17:25.371492
CameronCao_UCR3iEpRZDhavOacxel3hbA_eMgynE62qmw_1433904_1434016.wav,CameronCao_UCR3iEpRZDhavOacxel3hbA_eMgynE62qmw,1433904,1434016,112,361,,0,0,0,0,0,1,0,DY,2021-09-24 15:17:27.664941
CameronCao_UCR3iEpRZDhavOacxel3hbA_eMgynE62qmw_1435704_1436008.wav,CameronCao_UCR3iEpRZDhavOacxel3hbA_eMgynE62qmw,1435704,1436008,304,362,,0,0,0,0,0,1,0,DY,2021-09-24 15:17:30.644252
CameronCao_UCR3iEpRZDhavOacxel3hbA_eMgynE62qmw_1437248_1438456.wav,CameronCao_UCR3iEpRZDhavOacxel3hbA_eMgynE62qmw,1437248,1438456,1208,363,it's just,1,0,0,0,0,0,0,DY,2021-09-24 15:17:38.939611
CameronCao_UCR3iEpRZDhavOacxel3hbA_eMgynE62qmw_1439008_1439992.wav,CameronCao_UCR3iEpRZDhavOacxel3hbA_eMgynE62qmw,1439008,1439992,984,364,it's sad that,1,0,0,0,0,0,0,DY,2021-09-24 15:17:45.066921
CameronCao_UCR3iEpRZDhavOacxel3hbA_eMgynE62qmw_1440928_1447224.wav,CameronCao_UCR3iEpRZDhavOacxel3hbA_eMgynE62qmw,1440928,1447224,6296,365,our parents had to work so hard to get into this country only for their kids to suffer the consequences of,1,0,0,0,0,0,0,DY,2021-09-24 15:17:57.075100
CameronCao_UCR3iEpRZDhavOacxel3hbA_eMgynE62qmw_1447744_1448712.wav,CameronCao_UCR3iEpRZDhavOacxel3hbA_eMgynE62qmw,1447744,1448712,968,366,systematic racism,1,0,0,0,0,0,0,DY,2021-09-24 15:18:03.211317
CameronCao_UCR3iEpRZDhavOacxel3hbA_eMgynE62qmw_1449728_1451488.wav,CameronCao_UCR3iEpRZDhavOacxel3hbA_eMgynE62qmw,1449728,1451488,1760,367,and for them to say that,1,0,0,0,0,0,0,DY,2021-09-24 15:18:09.776033
CameronCao_UCR3iEpRZDhavOacxel3hbA_eMgynE62qmw_1451848_1453248.wav,CameronCao_UCR3iEpRZDhavOacxel3hbA_eMgynE62qmw,1451848,1453248,1400,368,it is okay because,1,0,0,0,0,0,0,DY,2021-09-24 15:18:16.910019
CameronCao_UCR3iEpRZDhavOacxel3hbA_eMgynE62qmw_1454080_1455312.wav,CameronCao_UCR3iEpRZDhavOacxel3hbA_eMgynE62qmw,1454080,1455312,1232,369,we should be grateful,1,0,0,0,0,0,0,DY,2021-09-24 15:18:23.565227
CameronCao_UCR3iEpRZDhavOacxel3hbA_eMgynE62qmw_1455816_1461144.wav,CameronCao_UCR3iEpRZDhavOacxel3hbA_eMgynE62qmw,1455816,1461144,5328,370,that we're even allowed here in the first place i uh the- the other day i had an argument with my mom and dad,1,0,1,0,0,0,0,DY,2021-09-24 15:18:32.249006
CameronCao_UCR3iEpRZDhavOacxel3hbA_eMgynE62qmw_1461800_1461920.wav,CameronCao_UCR3iEpRZDhavOacxel3hbA_eMgynE62qmw,1461800,1461920,120,371,,0,0,0,0,0,0,0,DY,2021-09-24 15:18:36.108137
CameronCao_UCR3iEpRZDhavOacxel3hbA_eMgynE62qmw_1462808_1464928.wav,CameronCao_UCR3iEpRZDhavOacxel3hbA_eMgynE62qmw,1462808,1464928,2120,372,about how they were like,1,0,0,0,0,0,0,DY,2021-09-24 15:18:45.420277
CameronCao_UCR3iEpRZDhavOacxel3hbA_eMgynE62qmw_1465248_1470064.wav,CameronCao_UCR3iEpRZDhavOacxel3hbA_eMgynE62qmw,1465248,1470064,4816,373,cameron_unn you're_unn being_unn too_unn sensitive_unn over_unn this_unn you're_unn playing_unn the_unn race_unn card_unn you_unn,0,0,0,1,0,0,0,DY,2021-09-24 15:18:56.687791
CameronCao_UCR3iEpRZDhavOacxel3hbA_eMgynE62qmw_1470272_1477544.wav,CameronCao_UCR3iEpRZDhavOacxel3hbA_eMgynE62qmw,1470272,1477544,7272,374,shouldn't_unn you_unn should_unn be_unn grateful_unn but_unn you_unn need_unn to_unn know_unn that_unn racism_unn will_unn always_unn be_unn there_unn and_unn that_unn we- you_unn can_unn never_unn change_unn anything_unn,0,0,0,1,0,0,0,DY,2021-09-24 15:19:10.699552
CameronCao_UCR3iEpRZDhavOacxel3hbA_eMgynE62qmw_1477960_1479812.wav,CameronCao_UCR3iEpRZDhavOacxel3hbA_eMgynE62qmw,1477960,1479812,1852,375,and i'm like yeah i get it,1,0,0,0,0,0,0,DY,2021-09-24 15:19:18.283661
CameronCao_UCR3iEpRZDhavOacxel3hbA_eMgynE62qmw_1479988_1487750.wav,CameronCao_UCR3iEpRZDhavOacxel3hbA_eMgynE62qmw,1479988,1487750,7762,376,i get that racism is always gonna be a thing it's never gonna completely a hundred percent go away there's always going to be some type of bias or stereotype,1,0,0,0,0,0,0,DY,2021-09-24 15:19:32.605785
CameronCao_UCR3iEpRZDhavOacxel3hbA_eMgynE62qmw_1487886_1492376.wav,CameronCao_UCR3iEpRZDhavOacxel3hbA_eMgynE62qmw,1487886,1492376,4490,377,i understand that but it doesn't hurt to make change it doesn't hurt,1,0,0,0,0,0,0,DY,2021-09-24 15:19:42.573946
CameronCao_UCR3iEpRZDhavOacxel3hbA_eMgynE62qmw_1492936_1499832.wav,CameronCao_UCR3iEpRZDhavOacxel3hbA_eMgynE62qmw,1492936,1499832,6896,378,to say something staying silent is being complicit staying silent about it is basically saying,1,0,1,0,0,0,0,DY,2021-09-24 15:19:56.172669
CameronCao_UCR3iEpRZDhavOacxel3hbA_eMgynE62qmw_1500568_1504072.wav,CameronCao_UCR3iEpRZDhavOacxel3hbA_eMgynE62qmw,1500568,1504072,3504,379,or- just accepting that we deserve it is not okay,1,0,0,0,0,0,0,DY,2021-09-24 15:20:10.157551
CameronCao_UCR3iEpRZDhavOacxel3hbA_eMgynE62qmw_1504416_1508952.wav,CameronCao_UCR3iEpRZDhavOacxel3hbA_eMgynE62qmw,1504416,1508952,4536,380,and like i asked i was like- and he- my- my fucking father he was like,1,0,0,0,0,0,0,DY,2021-09-24 15:20:22.037679
CameronCao_UCR3iEpRZDhavOacxel3hbA_eMgynE62qmw_1509560_1511228.wav,CameronCao_UCR3iEpRZDhavOacxel3hbA_eMgynE62qmw,1509560,1511228,1668,381,you_unn know_unn i_unn was_unn discriminated_unn against_unn,0,0,0,1,0,0,0,DY,2021-09-24 15:20:29.302246
CameronCao_UCR3iEpRZDhavOacxel3hbA_eMgynE62qmw_1511428_1518414.wav,CameronCao_UCR3iEpRZDhavOacxel3hbA_eMgynE62qmw,1511428,1518414,6986,382,by_unn viet_unn people_unn i was like what does that have to do with anything it's white people discriminating asian people and if you're discriminated_unc by asian people that's not- 'cause you're du- uh-,1,0,0,1,0,0,0,DY,2021-09-24 15:20:47.759049
CameronCao_UCR3iEpRZDhavOacxel3hbA_eMgynE62qmw_1518598_1519406.wav,CameronCao_UCR3iEpRZDhavOacxel3hbA_eMgynE62qmw,1518598,1519406,808,383,he's- he's like-,1,0,0,0,0,0,0,DY,2021-09-24 15:20:55.231590
CameronCao_UCR3iEpRZDhavOacxel3hbA_eMgynE62qmw_1519590_1522584.wav,CameronCao_UCR3iEpRZDhavOacxel3hbA_eMgynE62qmw,1519590,1522584,2994,384,he's like but_unn i'm_unn vietnamese_unn and_unn i_unn got_unn discriminated_unn by_unn vietnamese_unn people_unn i was like sure,1,0,0,1,0,0,0,DY,2021-09-24 15:21:08.340879
CameronCao_UCR3iEpRZDhavOacxel3hbA_eMgynE62qmw_1523160_1523736.wav,CameronCao_UCR3iEpRZDhavOacxel3hbA_eMgynE62qmw,1523160,1523736,576,385,yeah and,1,0,0,0,0,0,0,DY,2021-09-24 15:21:48.968762
CameronCao_UCR3iEpRZDhavOacxel3hbA_eMgynE62qmw_1526392_1531720.wav,CameronCao_UCR3iEpRZDhavOacxel3hbA_eMgynE62qmw,1526392,1531720,5328,386,people it doesn't matter the whole purpose of this whole stop asian hate,1,0,0,0,0,0,0,DY,2021-09-24 15:22:10.173440
CameronCao_UCR3iEpRZDhavOacxel3hbA_eMgynE62qmw_1532104_1532984.wav,CameronCao_UCR3iEpRZDhavOacxel3hbA_eMgynE62qmw,1532104,1532984,880,387,is so that,1,0,0,0,0,0,0,DY,2021-09-24 15:22:14.702703
CameronCao_UCR3iEpRZDhavOacxel3hbA_eMgynE62qmw_1533344_1540656.wav,CameronCao_UCR3iEpRZDhavOacxel3hbA_eMgynE62qmw,1533344,1540656,7312,388,asians don't have to get beat up on the street because of our race if it's asians against asians then that's a whole different,1,0,1,0,0,0,0,DY,2021-09-24 15:22:54.449892
CameronCao_UCR3iEpRZDhavOacxel3hbA_eMgynE62qmw_1540856_1542360.wav,CameronCao_UCR3iEpRZDhavOacxel3hbA_eMgynE62qmw,1540856,1542360,1504,389,that's a whole different type of thing,1,0,0,0,0,0,0,DY,2021-09-24 15:23:01.242594
CameronCao_UCR3iEpRZDhavOacxel3hbA_eMgynE62qmw_1542952_1544000.wav,CameronCao_UCR3iEpRZDhavOacxel3hbA_eMgynE62qmw,1542952,1544000,1048,390,that's a whole different type of thing,1,0,0,0,0,0,0,DY,2021-09-24 15:23:05.505842
CameronCao_UCR3iEpRZDhavOacxel3hbA_eMgynE62qmw_1544864_1545016.wav,CameronCao_UCR3iEpRZDhavOacxel3hbA_eMgynE62qmw,1544864,1545016,152,391,,0,0,0,0,0,0,0,DY,2021-09-24 15:23:10.242295
CameronCao_UCR3iEpRZDhavOacxel3hbA_eMgynE62qmw_1545632_1546864.wav,CameronCao_UCR3iEpRZDhavOacxel3hbA_eMgynE62qmw,1545632,1546864,1232,392,and it's just-,1,0,1,0,0,0,0,DY,2021-09-24 15:23:23.090670
CameronCao_UCR3iEpRZDhavOacxel3hbA_eMgynE62qmw_1547400_1547992.wav,CameronCao_UCR3iEpRZDhavOacxel3hbA_eMgynE62qmw,1547400,1547992,592,393,,0,0,0,0,0,1,0,DY,2021-09-24 15:23:27.139164
CameronCao_UCR3iEpRZDhavOacxel3hbA_eMgynE62qmw_1548568_1550600.wav,CameronCao_UCR3iEpRZDhavOacxel3hbA_eMgynE62qmw,1548568,1550600,2032,394,it's just really sad,1,0,0,0,0,0,0,DY,2021-09-24 15:23:43.400200
CameronCao_UCR3iEpRZDhavOacxel3hbA_eMgynE62qmw_1551512_1552672.wav,CameronCao_UCR3iEpRZDhavOacxel3hbA_eMgynE62qmw,1551512,1552672,1160,395,it's really heartbreaking,1,0,0,0,0,0,0,DY,2021-09-24 15:23:49.289426
CameronCao_UCR3iEpRZDhavOacxel3hbA_eMgynE62qmw_1553224_1556200.wav,CameronCao_UCR3iEpRZDhavOacxel3hbA_eMgynE62qmw,1553224,1556200,2976,396,the other day my younger brother came up to me he's like- like cameron,1,0,0,0,0,0,0,DY,2021-09-24 15:24:04.133578
CameronCao_UCR3iEpRZDhavOacxel3hbA_eMgynE62qmw_1556912_1557792.wav,CameronCao_UCR3iEpRZDhavOacxel3hbA_eMgynE62qmw,1556912,1557792,880,397,is it fair,1,0,0,0,0,0,0,DY,2021-09-24 15:24:10.330667
CameronCao_UCR3iEpRZDhavOacxel3hbA_eMgynE62qmw_1558120_1558456.wav,CameronCao_UCR3iEpRZDhavOacxel3hbA_eMgynE62qmw,1558120,1558456,336,398,that,1,0,0,0,0,0,0,DY,2021-09-24 15:24:15.983972
CameronCao_UCR3iEpRZDhavOacxel3hbA_eMgynE62qmw_1558960_1561784.wav,CameronCao_UCR3iEpRZDhavOacxel3hbA_eMgynE62qmw,1558960,1561784,2824,399,because i'm asian i'm never gonna accomplish my dreams,1,0,0,0,0,0,0,DY,2021-09-24 15:24:30.145406
CameronCao_UCR3iEpRZDhavOacxel3hbA_eMgynE62qmw_1562040_1562200.wav,CameronCao_UCR3iEpRZDhavOacxel3hbA_eMgynE62qmw,1562040,1562200,160,400,of-,0,0,0,0,0,0,0,DY,2021-09-24 15:24:34.408424
CameronCao_UCR3iEpRZDhavOacxel3hbA_eMgynE62qmw_1562512_1563296.wav,CameronCao_UCR3iEpRZDhavOacxel3hbA_eMgynE62qmw,1562512,1563296,784,401,doing anything,1,0,0,0,0,0,0,DY,2021-09-24 15:24:42.894148
CameronCao_UCR3iEpRZDhavOacxel3hbA_eMgynE62qmw_1563576_1563984.wav,CameronCao_UCR3iEpRZDhavOacxel3hbA_eMgynE62qmw,1563576,1563984,408,402,'cause,1,0,0,0,0,0,0,DY,2021-09-24 15:25:04.991874
CameronCao_UCR3iEpRZDhavOacxel3hbA_eMgynE62qmw_1564296_1565208.wav,CameronCao_UCR3iEpRZDhavOacxel3hbA_eMgynE62qmw,1564296,1565208,912,403,we were born this way,1,0,0,0,0,0,0,DY,2021-09-24 15:25:13.191560
CameronCao_UCR3iEpRZDhavOacxel3hbA_eMgynE62qmw_1565664_1566760.wav,CameronCao_UCR3iEpRZDhavOacxel3hbA_eMgynE62qmw,1565664,1566760,1096,404,and i told him,1,0,0,0,0,0,0,DY,2021-09-24 15:25:19.634077
CameronCao_UCR3iEpRZDhavOacxel3hbA_eMgynE62qmw_1567856_1568984.wav,CameronCao_UCR3iEpRZDhavOacxel3hbA_eMgynE62qmw,1567856,1568984,1128,405,i didn't know what to tell him,1,0,0,0,0,0,0,DY,2021-09-24 15:25:26.008224
CameronCao_UCR3iEpRZDhavOacxel3hbA_eMgynE62qmw_1569520_1570896.wav,CameronCao_UCR3iEpRZDhavOacxel3hbA_eMgynE62qmw,1569520,1570896,1376,406,i didn't really know what to tell him,1,0,0,0,0,0,0,DY,2021-09-24 15:25:33.596548
CameronCao_UCR3iEpRZDhavOacxel3hbA_eMgynE62qmw_1571824_1573016.wav,CameronCao_UCR3iEpRZDhavOacxel3hbA_eMgynE62qmw,1571824,1573016,1192,407,he was like cameron,1,0,0,0,0,0,0,DY,2021-09-24 15:25:39.682028
CameronCao_UCR3iEpRZDhavOacxel3hbA_eMgynE62qmw_1573448_1578208.wav,CameronCao_UCR3iEpRZDhavOacxel3hbA_eMgynE62qmw,1573448,1578208,4760,408,did we do anything in our wro- in our past lives to be born in this body and i was like,1,0,0,0,0,0,0,DY,2021-09-24 15:25:49.367371
CameronCao_UCR3iEpRZDhavOacxel3hbA_eMgynE62qmw_1578480_1579416.wav,CameronCao_UCR3iEpRZDhavOacxel3hbA_eMgynE62qmw,1578480,1579416,936,409,no ben,1,0,0,0,0,0,0,DY,2021-09-24 15:25:53.356418
CameronCao_UCR3iEpRZDhavOacxel3hbA_eMgynE62qmw_1580000_1580200.wav,CameronCao_UCR3iEpRZDhavOacxel3hbA_eMgynE62qmw,1580000,1580200,200,410,,0,0,0,0,0,0,0,DY,2021-09-24 15:25:56.984487
CameronCao_UCR3iEpRZDhavOacxel3hbA_eMgynE62qmw_1580960_1582632.wav,CameronCao_UCR3iEpRZDhavOacxel3hbA_eMgynE62qmw,1580960,1582632,1672,411,we didn't do anything wrong,1,0,0,0,0,0,0,DY,2021-09-24 15:26:05.955054
CameronCao_UCR3iEpRZDhavOacxel3hbA_eMgynE62qmw_1583128_1584752.wav,CameronCao_UCR3iEpRZDhavOacxel3hbA_eMgynE62qmw,1583128,1584752,1624,412,we were born this way,1,0,0,0,0,0,0,DY,2021-09-24 15:26:13.715138
CameronCao_UCR3iEpRZDhavOacxel3hbA_eMgynE62qmw_1585136_1585264.wav,CameronCao_UCR3iEpRZDhavOacxel3hbA_eMgynE62qmw,1585136,1585264,128,413,,0,0,0,0,0,0,0,DY,2021-09-24 15:26:24.312533
CameronCao_UCR3iEpRZDhavOacxel3hbA_eMgynE62qmw_1585808_1587872.wav,CameronCao_UCR3iEpRZDhavOacxel3hbA_eMgynE62qmw,1585808,1587872,2064,414,and_unc that's how it is and so be it,1,0,0,0,0,0,0,DY,2021-09-24 15:26:37.372818
CameronCao_UCR3iEpRZDhavOacxel3hbA_eMgynE62qmw_1588128_1594112.wav,CameronCao_UCR3iEpRZDhavOacxel3hbA_eMgynE62qmw,1588128,1594112,5984,415,we have to stay strong we have to stay- h- hold face in this- in this time of,1,0,0,0,0,0,0,DY,2021-09-24 15:26:58.577489
CameronCao_UCR3iEpRZDhavOacxel3hbA_eMgynE62qmw_1594408_1594616.wav,CameronCao_UCR3iEpRZDhavOacxel3hbA_eMgynE62qmw,1594408,1594616,208,416,,0,0,0,0,0,1,0,DY,2021-09-24 15:27:02.602277
CameronCao_UCR3iEpRZDhavOacxel3hbA_eMgynE62qmw_1594872_1596076.wav,CameronCao_UCR3iEpRZDhavOacxel3hbA_eMgynE62qmw,1594872,1596076,1204,417,hate and,1,0,0,0,0,0,0,DY,2021-09-24 15:27:13.389566
CameronCao_UCR3iEpRZDhavOacxel3hbA_eMgynE62qmw_1596428_1601686.wav,CameronCao_UCR3iEpRZDhavOacxel3hbA_eMgynE62qmw,1596428,1601686,5258,418,stuff like that especially with COVID and things getting worse i think it's really important that,1,0,1,0,0,0,0,DY,2021-09-24 15:27:31.963540
CameronCao_UCR3iEpRZDhavOacxel3hbA_eMgynE62qmw_1601926_1605304.wav,CameronCao_UCR3iEpRZDhavOacxel3hbA_eMgynE62qmw,1601926,1605304,3378,419,we have to stay strong and i really,1,0,0,0,0,0,0,DY,2021-09-24 15:27:39.925920
CameronCao_UCR3iEpRZDhavOacxel3hbA_eMgynE62qmw_1605568_1612584.wav,CameronCao_UCR3iEpRZDhavOacxel3hbA_eMgynE62qmw,1605568,1612584,7016,420,love that our community has gotten a lot stronger because we've all been able to stay together during this entire experience,1,0,1,0,0,0,0,DY,2021-09-24 15:27:50.198808
CameronCao_UCR3iEpRZDhavOacxel3hbA_eMgynE62qmw_1614184_1619216.wav,CameronCao_UCR3iEpRZDhavOacxel3hbA_eMgynE62qmw,1614184,1619216,5032,421,and really hold our own together and stay strong as a community,1,0,0,0,0,0,0,DY,2021-09-24 15:27:59.803538
CameronCao_UCR3iEpRZDhavOacxel3hbA_eMgynE62qmw_1619600_1621456.wav,CameronCao_UCR3iEpRZDhavOacxel3hbA_eMgynE62qmw,1619600,1621456,1856,422,and it's really good to see that but,1,0,0,0,0,0,0,DY,2021-09-24 15:28:06.776175
CameronCao_UCR3iEpRZDhavOacxel3hbA_eMgynE62qmw_1622008_1628552.wav,CameronCao_UCR3iEpRZDhavOacxel3hbA_eMgynE62qmw,1622008,1628552,6544,423,hearing my brother saying that he doesn't think he can ever c- accomplish a dream because he's not white makes me really disappointed,1,0,0,0,0,0,0,DY,2021-09-24 15:28:17.730948
CameronCao_UCR3iEpRZDhavOacxel3hbA_eMgynE62qmw_1628832_1629704.wav,CameronCao_UCR3iEpRZDhavOacxel3hbA_eMgynE62qmw,1628832,1629704,872,424,because,1,0,0,0,0,0,0,DY,2021-09-24 15:28:24.468286
CameronCao_UCR3iEpRZDhavOacxel3hbA_eMgynE62qmw_1630448_1636124.wav,CameronCao_UCR3iEpRZDhavOacxel3hbA_eMgynE62qmw,1630448,1636124,5676,425,sometimes i believe that too that i won't be able to accomplish anything i want to do because i am not white either,1,0,0,0,0,0,0,DY,2021-09-24 15:28:38.138352
CameronCao_UCR3iEpRZDhavOacxel3hbA_eMgynE62qmw_1636396_1639100.wav,CameronCao_UCR3iEpRZDhavOacxel3hbA_eMgynE62qmw,1636396,1639100,2704,426,there are times where i think most asian kids can,1,0,0,0,0,0,0,DY,2021-09-24 15:28:46.948373
