filename,video_id,start_time,end_time,duration,id,transcription,usability,bg_music,bg_noise,other_voice,only_music,only_noise,other_sounds,annotator,annotate_date_YYYYMMDD
ChannelofChi_UCLfwDGHe5jEZSSGtw3ifUiQ_avPFLbxQZOI_0_9408.wav,ChannelofChi_UCLfwDGHe5jEZSSGtw3ifUiQ_avPFLbxQZOI,0,9408,9408,0,,0,0,0,0,1,1,0,DY,2021-05-31 00:51:54.697751
ChannelofChi_UCLfwDGHe5jEZSSGtw3ifUiQ_avPFLbxQZOI_9520_20016.wav,ChannelofChi_UCLfwDGHe5jEZSSGtw3ifUiQ_avPFLbxQZOI,9520,20016,10496,1,hey guys what's up my name is Chi and welcome to channel of Chi if you guys are new to this channel make sure you hit that subscribe button down below and turn on my push* notifications because I'm on the road to a,1,0,0,0,0,0,0,DY,2021-05-31 00:52:15.818967
ChannelofChi_UCLfwDGHe5jEZSSGtw3ifUiQ_avPFLbxQZOI_20104_25328.wav,ChannelofChi_UCLfwDGHe5jEZSSGtw3ifUiQ_avPFLbxQZOI,20104,25328,5224,2,thousand subscribers if you guys are already part of my OG lil YouTube gang here ,1,0,0,0,0,0,0,DY,2021-05-31 00:52:28.214162
ChannelofChi_UCLfwDGHe5jEZSSGtw3ifUiQ_avPFLbxQZOI_25416_28464.wav,ChannelofChi_UCLfwDGHe5jEZSSGtw3ifUiQ_avPFLbxQZOI,25416,28464,3048,3,thank you so much for your consistent effort and your consistent sup-,1,0,1,0,0,0,0,DY,2021-05-31 00:52:48.375967
ChannelofChi_UCLfwDGHe5jEZSSGtw3ifUiQ_avPFLbxQZOI_28568_34432.wav,ChannelofChi_UCLfwDGHe5jEZSSGtw3ifUiQ_avPFLbxQZOI,28568,34432,5864,4,port- I really appreciate every single comment every single like and every single view it makes the biggest differen-,1,0,0,0,0,0,0,DY,2021-05-31 00:53:11.742331
ChannelofChi_UCLfwDGHe5jEZSSGtw3ifUiQ_avPFLbxQZOI_34560_34768.wav,ChannelofChi_UCLfwDGHe5jEZSSGtw3ifUiQ_avPFLbxQZOI,34560,34768,208,5,,0,0,0,0,0,1,0,DY,2021-05-31 00:53:21.116868
ChannelofChi_UCLfwDGHe5jEZSSGtw3ifUiQ_avPFLbxQZOI_35024_37488.wav,ChannelofChi_UCLfwDGHe5jEZSSGtw3ifUiQ_avPFLbxQZOI,35024,37488,2464,6,so with that being said getting all of that,1,0,0,0,0,0,0,DY,2021-05-31 00:53:36.872837
ChannelofChi_UCLfwDGHe5jEZSSGtw3ifUiQ_avPFLbxQZOI_37720_42936.wav,ChannelofChi_UCLfwDGHe5jEZSSGtw3ifUiQ_avPFLbxQZOI,37720,42936,5216,7,outta the way I also just have to make sure I say happy Chinese New Year's es-,1,0,0,0,0,0,0,DY,2021-05-31 00:54:38.240392
ChannelofChi_UCLfwDGHe5jEZSSGtw3ifUiQ_avPFLbxQZOI_43048_55824.wav,ChannelofChi_UCLfwDGHe5jEZSSGtw3ifUiQ_avPFLbxQZOI,43048,55824,12776,8,pecially- to the people who are the year of the rat because it's your year and for all of you guys who are the year of the tiger like me just you know sit tight and be patient be ready because in two years we're just going to,1,0,1,0,0,0,0,DY,2021-05-31 00:55:20.740031
ChannelofChi_UCLfwDGHe5jEZSSGtw3ifUiQ_avPFLbxQZOI_56048_59001.wav,ChannelofChi_UCLfwDGHe5jEZSSGtw3ifUiQ_avPFLbxQZOI,56048,59001,2953,9,you- basically ki- get all our blessings too we're gonna,1,0,1,0,0,0,0,DY,2021-05-31 00:55:34.626474
ChannelofChi_UCLfwDGHe5jEZSSGtw3ifUiQ_avPFLbxQZOI_59409_60729.wav,ChannelofChi_UCLfwDGHe5jEZSSGtw3ifUiQ_avPFLbxQZOI,59409,60729,1320,10,own it period like,1,0,0,0,0,0,0,DY,2021-05-31 00:55:41.509180
ChannelofChi_UCLfwDGHe5jEZSSGtw3ifUiQ_avPFLbxQZOI_61113_67273.wav,ChannelofChi_UCLfwDGHe5jEZSSGtw3ifUiQ_avPFLbxQZOI,61113,67273,6160,11,what else can I say so with that being said happy Chinese New Year's and I hope you guys all have a safe and happy blessed,1,0,0,0,0,0,0,DY,2021-05-31 00:55:55.661839
ChannelofChi_UCLfwDGHe5jEZSSGtw3ifUiQ_avPFLbxQZOI_67905_68185.wav,ChannelofChi_UCLfwDGHe5jEZSSGtw3ifUiQ_avPFLbxQZOI,67905,68185,280,12,year,1,0,0,0,0,0,0,DY,2021-05-31 00:56:03.202499
ChannelofChi_UCLfwDGHe5jEZSSGtw3ifUiQ_avPFLbxQZOI_68337_78939.wav,ChannelofChi_UCLfwDGHe5jEZSSGtw3ifUiQ_avPFLbxQZOI,68337,78939,10602,13,coming_unc up_unc so_unc if you're watching this video you probably are seeking to fill your curiosity or you're trying to gain some relatability just because of the nature of the video I'm gonna be talking about,1,0,0,0,0,0,0,DY,2021-05-31 00:56:32.632805
ChannelofChi_UCLfwDGHe5jEZSSGtw3ifUiQ_avPFLbxQZOI_79147_85485.wav,ChannelofChi_UCLfwDGHe5jEZSSGtw3ifUiQ_avPFLbxQZOI,79147,85485,6338,14,what it was like growing up Asian it's called the growing up Asian American tag and um I'm kinda new,1,0,0,0,0,0,0,DY,2021-05-31 00:57:15.704627
ChannelofChi_UCLfwDGHe5jEZSSGtw3ifUiQ_avPFLbxQZOI_85605_93005.wav,ChannelofChi_UCLfwDGHe5jEZSSGtw3ifUiQ_avPFLbxQZOI,85605,93005,7400,15,to the YouTube world obviously and I just feel like I don't know when this tag actually started but because it's Chinese New Year's I've been in-,1,0,0,0,0,0,0,DY,2021-05-31 00:57:48.481424
ChannelofChi_UCLfwDGHe5jEZSSGtw3ifUiQ_avPFLbxQZOI_93125_100245.wav,ChannelofChi_UCLfwDGHe5jEZSSGtw3ifUiQ_avPFLbxQZOI,93125,100245,7120,16,spired- and_unc I_unc just_unc thought_unc it'd_unc be_unc a_unc great_unc time_unc to make this video 'cause I've been wanting to for a while now so by the end of this video if you guys stay up-,1,0,0,0,0,0,1,DY,2021-05-31 00:58:34.320252
ChannelofChi_UCLfwDGHe5jEZSSGtw3ifUiQ_avPFLbxQZOI_100365_101373.wav,ChannelofChi_UCLfwDGHe5jEZSSGtw3ifUiQ_avPFLbxQZOI,100365,101373,1008,17,'til the very end,1,0,0,0,0,0,0,DY,2021-05-31 00:58:42.119635
ChannelofChi_UCLfwDGHe5jEZSSGtw3ifUiQ_avPFLbxQZOI_101493_105013.wav,ChannelofChi_UCLfwDGHe5jEZSSGtw3ifUiQ_avPFLbxQZOI,101493,105013,3520,18,you guys are gonna probably know more about me than basically I-,1,0,0,0,0,0,0,DY,2021-05-31 00:58:52.000484
ChannelofChi_UCLfwDGHe5jEZSSGtw3ifUiQ_avPFLbxQZOI_105125_107033.wav,ChannelofChi_UCLfwDGHe5jEZSSGtw3ifUiQ_avPFLbxQZOI,105125,107033,1908,19,people who know- see me and,1,0,0,0,0,0,0,DY,2021-05-31 00:59:04.984458
ChannelofChi_UCLfwDGHe5jEZSSGtw3ifUiQ_avPFLbxQZOI_107193_115513.wav,ChannelofChi_UCLfwDGHe5jEZSSGtw3ifUiQ_avPFLbxQZOI,107193,115513,8320,20,talk to me everyday that's crazy but after watching these videos you guys- you guys have to subscribe knowing all that stuff about me like seriously but um ,1,0,0,0,0,0,0,DY,2021-05-31 00:59:19.960723
ChannelofChi_UCLfwDGHe5jEZSSGtw3ifUiQ_avPFLbxQZOI_115673_118329.wav,ChannelofChi_UCLfwDGHe5jEZSSGtw3ifUiQ_avPFLbxQZOI,115673,118329,2656,21,anyways thanks for clicking on this video and I'm gonna get started,1,0,0,0,0,0,0,DY,2021-05-31 00:59:44.045714
ChannelofChi_UCLfwDGHe5jEZSSGtw3ifUiQ_avPFLbxQZOI_121521_121777.wav,ChannelofChi_UCLfwDGHe5jEZSSGtw3ifUiQ_avPFLbxQZOI,121521,121777,256,22,,0,0,0,0,0,1,0,DY,2021-05-31 00:59:49.984798
ChannelofChi_UCLfwDGHe5jEZSSGtw3ifUiQ_avPFLbxQZOI_121777_127017.wav,ChannelofChi_UCLfwDGHe5jEZSSGtw3ifUiQ_avPFLbxQZOI,121777,127017,5240,23,so the first question is what ethnicity are you guys I'm Chinese um,1,0,1,0,0,0,0,DY,2021-05-31 01:00:20.977208
ChannelofChi_UCLfwDGHe5jEZSSGtw3ifUiQ_avPFLbxQZOI_127257_141277.wav,ChannelofChi_UCLfwDGHe5jEZSSGtw3ifUiQ_avPFLbxQZOI,127257,141277,14020,24,for all you other Chinese people out there hey what's up and I know all you Asian Americans can relate to me when I say like how many times people ask me this question and oh my god it's so annoying especially* when people are like ,1,0,0,0,0,0,0,DY,2021-05-31 01:01:11.202745
ChannelofChi_UCLfwDGHe5jEZSSGtw3ifUiQ_avPFLbxQZOI_141405_146449.wav,ChannelofChi_UCLfwDGHe5jEZSSGtw3ifUiQ_avPFLbxQZOI,141405,146449,5044,25,all_unn Chinese_unn people_unn look_unn the_unn same_unn I_unn can't_unn tell_unn you_unn guys_unn apart_unn oh_unn my_unn god_unn sh- and it's like brah like,1,0,0,1,0,0,0,DY,2021-05-31 01:01:36.129088
ChannelofChi_UCLfwDGHe5jEZSSGtw3ifUiQ_avPFLbxQZOI_147201_153257.wav,ChannelofChi_UCLfwDGHe5jEZSSGtw3ifUiQ_avPFLbxQZOI,147201,153257,6056,26,leave me alone like just let me be Chinese in peace y'know like whatever moving on to the next questio-,1,0,1,0,0,0,0,DY,2021-05-31 01:02:11.936150
ChannelofChi_UCLfwDGHe5jEZSSGtw3ifUiQ_avPFLbxQZOI_156049_162137.wav,ChannelofChi_UCLfwDGHe5jEZSSGtw3ifUiQ_avPFLbxQZOI,156049,162137,6088,27,what generation are you so I was actually born in southern China I'm gonna put a map up right now,1,0,0,0,0,0,0,DY,2021-05-31 01:02:38.962873
ChannelofChi_UCLfwDGHe5jEZSSGtw3ifUiQ_avPFLbxQZOI_162929_163113.wav,ChannelofChi_UCLfwDGHe5jEZSSGtw3ifUiQ_avPFLbxQZOI,162929,163113,184,28,,0,0,0,0,0,0,0,DY,2021-05-31 01:02:43.944007
ChannelofChi_UCLfwDGHe5jEZSSGtw3ifUiQ_avPFLbxQZOI_163609_170873.wav,ChannelofChi_UCLfwDGHe5jEZSSGtw3ifUiQ_avPFLbxQZOI,163609,170873,7264,29,um so yeah that's where I was born it's Kunming_cs or my pronunciation in Chinese is very bad um,1,0,0,0,0,0,0,DY,2021-05-31 01:03:12.643466
ChannelofChi_UCLfwDGHe5jEZSSGtw3ifUiQ_avPFLbxQZOI_171729_183757.wav,ChannelofChi_UCLfwDGHe5jEZSSGtw3ifUiQ_avPFLbxQZOI,171729,183757,12028,30,yeah it's really embarrassing- roast me it took me a lot to actually say that but yeah so um I was born in southern China and I became asian american aka I became an American citizen when I was adopted,1,0,0,0,0,0,0,DY,2021-05-31 01:03:31.033625
ChannelofChi_UCLfwDGHe5jEZSSGtw3ifUiQ_avPFLbxQZOI_183949_187961.wav,ChannelofChi_UCLfwDGHe5jEZSSGtw3ifUiQ_avPFLbxQZOI,183949,187961,4012,31,um right before 2000 and I've been Asian American ever since,1,0,0,0,0,0,0,DY,2021-05-31 01:03:56.664835
ChannelofChi_UCLfwDGHe5jEZSSGtw3ifUiQ_avPFLbxQZOI_191153_196381.wav,ChannelofChi_UCLfwDGHe5jEZSSGtw3ifUiQ_avPFLbxQZOI,191153,196381,5228,32,n- question is what is the first time that you felt different slash you felt like you were a minority,1,0,0,0,0,0,0,DY,2021-05-31 01:04:33.285513
