filename,video_id,start_time,end_time,duration,id,transcription,usability,bg_music,bg_noise,other_voice,only_music,only_noise,other_sounds,annotator,annotate_date_YYYYMMDD
BreathofBeauty_UCB9eAHlm3hHwb9T1Dij0EA_iqRx7Sw5Erg_192_7248.wav,BreathofBeauty_UCB9eAHlm3hHwb9T1Dij0EA_iqRx7Sw5Erg,192,7248,7056,0,hi_unn friends_unn thank you so much for joining me today for another video so today I'm bringing you a s-,1,0,0,1,0,0,0,DY,56:01.5
BreathofBeauty_UCB9eAHlm3hHwb9T1Dij0EA_iqRx7Sw5Erg_7328_16272.wav,BreathofBeauty_UCB9eAHlm3hHwb9T1Dij0EA_iqRx7Sw5Erg,7328,16272,8944,1,lightly- different kind of video a tag_unn video_unn of course I was tagged by the wonderful and beautiful Jane Rocci,1,0,0,1,0,0,0,DY,56:20.6
BreathofBeauty_UCB9eAHlm3hHwb9T1Dij0EA_iqRx7Sw5Erg_16352_23128.wav,BreathofBeauty_UCB9eAHlm3hHwb9T1Dij0EA_iqRx7Sw5Erg,16352,23128,6776,2,if you guys don't know who she is I'll link her channel in the description below so basically she's a very gorgeous,1,0,0,0,0,0,0,DY,56:35.3
BreathofBeauty_UCB9eAHlm3hHwb9T1Dij0EA_iqRx7Sw5Erg_23208_24768.wav,BreathofBeauty_UCB9eAHlm3hHwb9T1Dij0EA_iqRx7Sw5Erg,23208,24768,1560,3,fellow makeup enthusiast,1,0,0,0,0,0,0,DY,56:46.3
BreathofBeauty_UCB9eAHlm3hHwb9T1Dij0EA_iqRx7Sw5Erg_24928_27392.wav,BreathofBeauty_UCB9eAHlm3hHwb9T1Dij0EA_iqRx7Sw5Erg,24928,27392,2464,4,and I follow her on Instagram and,1,0,0,0,0,0,0,DY,56:54.1
BreathofBeauty_UCB9eAHlm3hHwb9T1Dij0EA_iqRx7Sw5Erg_27584_38936.wav,BreathofBeauty_UCB9eAHlm3hHwb9T1Dij0EA_iqRx7Sw5Erg,27584,38936,11352,5,yeah I guess she tagged me in this video so Jane if you are watching my name twin thank you for tagging me I'm very excited to do this tag and I certainly really enjoyed watching your tag Jane so,1,0,0,0,0,0,0,DY,57:32.2
BreathofBeauty_UCB9eAHlm3hHwb9T1Dij0EA_iqRx7Sw5Erg_39320_47936.wav,BreathofBeauty_UCB9eAHlm3hHwb9T1Dij0EA_iqRx7Sw5Erg,39320,47936,8616,6,thank you for tagging me girly and real quick if you are new and this is the first video you're stumbling upon on my channel I am,1,0,0,0,0,0,0,DY,57:46.9
BreathofBeauty_UCB9eAHlm3hHwb9T1Dij0EA_iqRx7Sw5Erg_48256_56080.wav,BreathofBeauty_UCB9eAHlm3hHwb9T1Dij0EA_iqRx7Sw5Erg,48256,56080,7824,7,so glad you are here welcome I'm sure you'll get to know me a little bit better through this video for obvious reasons because I'll be answering questions about my-,1,0,0,0,0,0,0,DY,58:54.5
BreathofBeauty_UCB9eAHlm3hHwb9T1Dij0EA_iqRx7Sw5Erg_56208_56816.wav,BreathofBeauty_UCB9eAHlm3hHwb9T1Dij0EA_iqRx7Sw5Erg,56208,56816,608,8,self- and my,1,0,0,0,0,0,0,DY,59:07.8
BreathofBeauty_UCB9eAHlm3hHwb9T1Dij0EA_iqRx7Sw5Erg_56952_58536.wav,BreathofBeauty_UCB9eAHlm3hHwb9T1Dij0EA_iqRx7Sw5Erg,56952,58536,1584,9,channel- and if you like what you s-,1,0,0,0,0,0,0,DY,59:28.8
BreathofBeauty_UCB9eAHlm3hHwb9T1Dij0EA_iqRx7Sw5Erg_58664_71368.wav,BreathofBeauty_UCB9eAHlm3hHwb9T1Dij0EA_iqRx7Sw5Erg,58664,71368,12704,10,see- I invite you to join the breath of beauty family because we really are a good bunch here alright_unn let's_unn get_unn on_unn with_unn the_unn tag_unn <sfx> okay_unc so I have the questions here on my phone so I apologize if I'm looking down,1,0,0,0,0,0,1,DY,00:12.3
BreathofBeauty_UCB9eAHlm3hHwb9T1Dij0EA_iqRx7Sw5Erg_71672_72832.wav,BreathofBeauty_UCB9eAHlm3hHwb9T1Dij0EA_iqRx7Sw5Erg,71672,72832,1160,11,but that is what I'm looking at-,1,0,0,0,0,0,0,DY,00:21.2
BreathofBeauty_UCB9eAHlm3hHwb9T1Dij0EA_iqRx7Sw5Erg_73088_79016.wav,BreathofBeauty_UCB9eAHlm3hHwb9T1Dij0EA_iqRx7Sw5Erg,73088,79016,5928,12,right here so the first question is what inspired you to start making videos,1,0,0,0,0,0,0,DY,00:43.4
BreathofBeauty_UCB9eAHlm3hHwb9T1Dij0EA_iqRx7Sw5Erg_79712_80456.wav,BreathofBeauty_UCB9eAHlm3hHwb9T1Dij0EA_iqRx7Sw5Erg,79712,80456,744,13,so,1,0,0,0,0,0,0,DY,00:51.3
BreathofBeauty_UCB9eAHlm3hHwb9T1Dij0EA_iqRx7Sw5Erg_80840_89396.wav,BreathofBeauty_UCB9eAHlm3hHwb9T1Dij0EA_iqRx7Sw5Erg,80840,89396,8556,14,um I had made other channels in the past and made other videos in the past um but they quickly flopped because I didn't really,1,0,0,0,0,0,0,DY,01:05.0
BreathofBeauty_UCB9eAHlm3hHwb9T1Dij0EA_iqRx7Sw5Erg_89652_89805.wav,BreathofBeauty_UCB9eAHlm3hHwb9T1Dij0EA_iqRx7Sw5Erg,89652,89805,153,15,,0,0,0,0,0,1,0,DY,01:10.0
BreathofBeauty_UCB9eAHlm3hHwb9T1Dij0EA_iqRx7Sw5Erg_89973_93557.wav,BreathofBeauty_UCB9eAHlm3hHwb9T1Dij0EA_iqRx7Sw5Erg,89973,93557,3584,16,have the grit behind y'know what it takes to,1,0,0,0,0,0,0,DY,01:38.5
BreathofBeauty_UCB9eAHlm3hHwb9T1Dij0EA_iqRx7Sw5Erg_93653_94645.wav,BreathofBeauty_UCB9eAHlm3hHwb9T1Dij0EA_iqRx7Sw5Erg,93653,94645,992,17,make videos and,1,0,0,0,0,0,0,DY,01:44.3
BreathofBeauty_UCB9eAHlm3hHwb9T1Dij0EA_iqRx7Sw5Erg_94741_100773.wav,BreathofBeauty_UCB9eAHlm3hHwb9T1Dij0EA_iqRx7Sw5Erg,94741,100773,6032,18,consistently create content finally this year I decided to make videos now I have faced,1,0,0,0,0,0,0,DY,01:56.4
BreathofBeauty_UCB9eAHlm3hHwb9T1Dij0EA_iqRx7Sw5Erg_100853_114669.wav,BreathofBeauty_UCB9eAHlm3hHwb9T1Dij0EA_iqRx7Sw5Erg,100853,114669,13816,19,a lot of opposition from my family regarding making videos for some reason they were just really against it so that's another reason why I didn't really keep up making YouTube videos but when I became a working adult an independent adult that can make,1,0,0,0,0,0,0,DY,02:15.7
BreathofBeauty_UCB9eAHlm3hHwb9T1Dij0EA_iqRx7Sw5Erg_114781_119285.wav,BreathofBeauty_UCB9eAHlm3hHwb9T1Dij0EA_iqRx7Sw5Erg,114781,119285,4504,20,her own decisions and like live her own life without feeling obligated,1,0,0,0,0,0,0,DY,02:26.1
BreathofBeauty_UCB9eAHlm3hHwb9T1Dij0EA_iqRx7Sw5Erg_119413_122509.wav,BreathofBeauty_UCB9eAHlm3hHwb9T1Dij0EA_iqRx7Sw5Erg,119413,122509,3096,21,to obey other people <lgh> because of,1,0,0,0,0,0,0,DY,02:34.8
BreathofBeauty_UCB9eAHlm3hHwb9T1Dij0EA_iqRx7Sw5Erg_122637_136445.wav,BreathofBeauty_UCB9eAHlm3hHwb9T1Dij0EA_iqRx7Sw5Erg,122637,136445,13808,22,financial dependency for example um I decided hey I've always wanted to make videos relating to beauty um I really fell in love with beauty like middle school so it was pretty young age,1,0,0,0,0,0,0,DY,02:54.5
BreathofBeauty_UCB9eAHlm3hHwb9T1Dij0EA_iqRx7Sw5Erg_136605_142885.wav,BreathofBeauty_UCB9eAHlm3hHwb9T1Dij0EA_iqRx7Sw5Erg,136605,142885,6280,23,um and I- I just was so interested and I w- really really wanted to create my own beauty content,1,0,0,0,0,0,0,DY,03:06.5
BreathofBeauty_UCB9eAHlm3hHwb9T1Dij0EA_iqRx7Sw5Erg_143069_146765.wav,BreathofBeauty_UCB9eAHlm3hHwb9T1Dij0EA_iqRx7Sw5Erg,143069,146765,3696,24,so uh April of this year I finally decided,1,0,0,0,0,0,0,DY,03:15.6
BreathofBeauty_UCB9eAHlm3hHwb9T1Dij0EA_iqRx7Sw5Erg_146917_148533.wav,BreathofBeauty_UCB9eAHlm3hHwb9T1Dij0EA_iqRx7Sw5Erg,146917,148533,1616,25,to make videos,1,0,0,0,0,0,0,DY,03:22.5
BreathofBeauty_UCB9eAHlm3hHwb9T1Dij0EA_iqRx7Sw5Erg_149038_154782.wav,BreathofBeauty_UCB9eAHlm3hHwb9T1Dij0EA_iqRx7Sw5Erg,149038,154782,5744,26,and uh the inspiration just comes from me loving to create content I'm a creator,1,0,0,0,0,0,0,DY,03:35.7
BreathofBeauty_UCB9eAHlm3hHwb9T1Dij0EA_iqRx7Sw5Erg_154902_167710.wav,BreathofBeauty_UCB9eAHlm3hHwb9T1Dij0EA_iqRx7Sw5Erg,154902,167710,12808,27,and also my love of beauty products and all things related to beauty not just outer beauty but inner beauty as well <sfx> okay second question is how long have you been on YouTube and have you had other channels I,1,0,0,0,0,0,0,DY,03:53.9
BreathofBeauty_UCB9eAHlm3hHwb9T1Dij0EA_iqRx7Sw5Erg_167814_170702.wav,BreathofBeauty_UCB9eAHlm3hHwb9T1Dij0EA_iqRx7Sw5Erg,167814,170702,2888,28,kind of already touched on this in the first question,1,0,0,0,0,0,0,DY,04:03.4
BreathofBeauty_UCB9eAHlm3hHwb9T1Dij0EA_iqRx7Sw5Erg_170822_171942.wav,BreathofBeauty_UCB9eAHlm3hHwb9T1Dij0EA_iqRx7Sw5Erg,170822,171942,1120,29,yes I've,1,0,0,0,0,0,0,DY,04:09.6
BreathofBeauty_UCB9eAHlm3hHwb9T1Dij0EA_iqRx7Sw5Erg_172150_175926.wav,BreathofBeauty_UCB9eAHlm3hHwb9T1Dij0EA_iqRx7Sw5Erg,172150,175926,3776,30,had other channels and this current channel I've had since,1,0,0,0,0,0,0,DY,04:19.2
BreathofBeauty_UCB9eAHlm3hHwb9T1Dij0EA_iqRx7Sw5Erg_176150_186472.wav,BreathofBeauty_UCB9eAHlm3hHwb9T1Dij0EA_iqRx7Sw5Erg,176150,186472,10322,31,April so not very long a little over six months I'd say it's pretty young <lgh> so uh I'm still really proud of it I'm honestly pretty surprised at myself for ,1,0,0,0,0,0,0,DY,04:54.0
BreathofBeauty_UCB9eAHlm3hHwb9T1Dij0EA_iqRx7Sw5Erg_186776_194296.wav,BreathofBeauty_UCB9eAHlm3hHwb9T1Dij0EA_iqRx7Sw5Erg,186776,194296,7520,32,keeping it up all this time um I kind of am notorious for being really passionate about something and then like really getting sick of it,1,0,0,0,0,0,0,DY,05:06.2
BreathofBeauty_UCB9eAHlm3hHwb9T1Dij0EA_iqRx7Sw5Erg_194448_200056.wav,BreathofBeauty_UCB9eAHlm3hHwb9T1Dij0EA_iqRx7Sw5Erg,194448,200056,5608,33,soon after but this has stuck and I have the perseverance,1,0,0,0,0,0,0,DY,05:18.1
BreathofBeauty_UCB9eAHlm3hHwb9T1Dij0EA_iqRx7Sw5Erg_200320_210537.wav,BreathofBeauty_UCB9eAHlm3hHwb9T1Dij0EA_iqRx7Sw5Erg,200320,210537,10217,34,so far in creating content every week and I don't plan to stop anytime soon and I've been loving it it's been so great getting to know some of you guys and like creating,1,0,0,0,0,0,0,DY,05:34.1
BreathofBeauty_UCB9eAHlm3hHwb9T1Dij0EA_iqRx7Sw5Erg_210641_215025.wav,BreathofBeauty_UCB9eAHlm3hHwb9T1Dij0EA_iqRx7Sw5Erg,210641,215025,4384,35,a lot of friends that are really interested in makeup just as I am,1,0,0,0,0,0,0,DY,05:43.9
BreathofBeauty_UCB9eAHlm3hHwb9T1Dij0EA_iqRx7Sw5Erg_215161_218226.wav,BreathofBeauty_UCB9eAHlm3hHwb9T1Dij0EA_iqRx7Sw5Erg,215161,218226,3065,36,so it's been really awesome <sfx> okay so question number th-,1,0,0,0,0,0,0,DY,05:57.4
BreathofBeauty_UCB9eAHlm3hHwb9T1Dij0EA_iqRx7Sw5Erg_218346_218938.wav,BreathofBeauty_UCB9eAHlm3hHwb9T1Dij0EA_iqRx7Sw5Erg,218346,218938,592,37,three-,0,0,0,0,0,0,0,DY,06:15.5
BreathofBeauty_UCB9eAHlm3hHwb9T1Dij0EA_iqRx7Sw5Erg_219188_224032.wav,BreathofBeauty_UCB9eAHlm3hHwb9T1Dij0EA_iqRx7Sw5Erg,219188,224032,4844,38,where do you see yourself and your YouTube channel in five years,1,0,1,0,0,0,0,DY,07:41.1
BreathofBeauty_UCB9eAHlm3hHwb9T1Dij0EA_iqRx7Sw5Erg_225776_228640.wav,BreathofBeauty_UCB9eAHlm3hHwb9T1Dij0EA_iqRx7Sw5Erg,225776,228640,2864,39,y'know I've never really been good at,1,0,0,0,0,0,0,DY,07:53.4
BreathofBeauty_UCB9eAHlm3hHwb9T1Dij0EA_iqRx7Sw5Erg_229120_233074.wav,BreathofBeauty_UCB9eAHlm3hHwb9T1Dij0EA_iqRx7Sw5Erg,229120,233074,3954,40,like long term planning and I consider five years down the line,1,0,0,0,0,0,0,DY,08:03.4
BreathofBeauty_UCB9eAHlm3hHwb9T1Dij0EA_iqRx7Sw5Erg_233154_234802.wav,BreathofBeauty_UCB9eAHlm3hHwb9T1Dij0EA_iqRx7Sw5Erg,233154,234802,1648,41,long term planning,1,0,0,0,0,0,0,DY,08:17.9
BreathofBeauty_UCB9eAHlm3hHwb9T1Dij0EA_iqRx7Sw5Erg_234882_247676.wav,BreathofBeauty_UCB9eAHlm3hHwb9T1Dij0EA_iqRx7Sw5Erg,234882,247676,12794,42,and I honestly don't really see a point in trying to plan out your life personally because I know most of it's not gonna happen and I'm just gonna let God do whatever he wants to do to guide me through-,1,0,0,0,0,0,0,DY,08:39.1
BreathofBeauty_UCB9eAHlm3hHwb9T1Dij0EA_iqRx7Sw5Erg_247892_248512.wav,BreathofBeauty_UCB9eAHlm3hHwb9T1Dij0EA_iqRx7Sw5Erg,247892,248512,620,43,out- the-,0,0,0,0,0,0,0,DY,08:50.8
BreathofBeauty_UCB9eAHlm3hHwb9T1Dij0EA_iqRx7Sw5Erg_248912_255484.wav,BreathofBeauty_UCB9eAHlm3hHwb9T1Dij0EA_iqRx7Sw5Erg,248912,255484,6572,44,I guess next five ten twenty thirty years of my life and so I don't really make it a point of like,1,0,0,0,0,0,0,DY,09:06.3
BreathofBeauty_UCB9eAHlm3hHwb9T1Dij0EA_iqRx7Sw5Erg_255684_257384.wav,BreathofBeauty_UCB9eAHlm3hHwb9T1Dij0EA_iqRx7Sw5Erg,255684,257384,1700,45,planning everything but,1,0,0,0,0,0,0,DY,09:13.6
BreathofBeauty_UCB9eAHlm3hHwb9T1Dij0EA_iqRx7Sw5Erg_257864_262466.wav,BreathofBeauty_UCB9eAHlm3hHwb9T1Dij0EA_iqRx7Sw5Erg,257864,262466,4602,46,if I'm just daydreaming in five years I'll be thirty,1,0,0,0,0,0,0,DY,09:25.6
BreathofBeauty_UCB9eAHlm3hHwb9T1Dij0EA_iqRx7Sw5Erg_262722_264363.wav,BreathofBeauty_UCB9eAHlm3hHwb9T1Dij0EA_iqRx7Sw5Erg,262722,264363,1641,47,so hopefully,1,0,0,0,0,0,0,DY,09:32.1
BreathofBeauty_UCB9eAHlm3hHwb9T1Dij0EA_iqRx7Sw5Erg_264523_276899.wav,BreathofBeauty_UCB9eAHlm3hHwb9T1Dij0EA_iqRx7Sw5Erg,264523,276899,12376,48,I don't know I might be having thoughts about having a child like a kid um I might be having another dog_unn which_unn I'm_unn so_unn excited_unn about_unn like I- I really want another dog um,1,0,0,0,0,0,0,DY,09:49.3
BreathofBeauty_UCB9eAHlm3hHwb9T1Dij0EA_iqRx7Sw5Erg_277059_279108.wav,BreathofBeauty_UCB9eAHlm3hHwb9T1Dij0EA_iqRx7Sw5Erg,277059,279108,2049,49,and in five years,1,0,0,0,0,0,0,DY,09:56.4
BreathofBeauty_UCB9eAHlm3hHwb9T1Dij0EA_iqRx7Sw5Erg_279300_279416.wav,BreathofBeauty_UCB9eAHlm3hHwb9T1Dij0EA_iqRx7Sw5Erg,279300,279416,116,50,,0,0,0,0,0,1,0,DY,10:00.4
BreathofBeauty_UCB9eAHlm3hHwb9T1Dij0EA_iqRx7Sw5Erg_279984_284036.wav,BreathofBeauty_UCB9eAHlm3hHwb9T1Dij0EA_iqRx7Sw5Erg,279984,284036,4052,51,I don't know um in terms of my youtube channel I,1,0,0,0,0,0,0,DY,10:19.1
BreathofBeauty_UCB9eAHlm3hHwb9T1Dij0EA_iqRx7Sw5Erg_284204_289342.wav,BreathofBeauty_UCB9eAHlm3hHwb9T1Dij0EA_iqRx7Sw5Erg,284204,289342,5138,52,have no idea honestly um I had made a commitment to myself,1,0,0,0,0,0,0,DY,10:30.3
BreathofBeauty_UCB9eAHlm3hHwb9T1Dij0EA_iqRx7Sw5Erg_289542_291936.wav,BreathofBeauty_UCB9eAHlm3hHwb9T1Dij0EA_iqRx7Sw5Erg,289542,291936,2394,53,when I started this channel that I would,1,0,0,0,0,0,0,DY,10:39.9
BreathofBeauty_UCB9eAHlm3hHwb9T1Dij0EA_iqRx7Sw5Erg_292352_293968.wav,BreathofBeauty_UCB9eAHlm3hHwb9T1Dij0EA_iqRx7Sw5Erg,292352,293968,1616,54,keep doing what I'm doing for th-,1,0,0,0,0,0,0,DY,10:53.8
BreathofBeauty_UCB9eAHlm3hHwb9T1Dij0EA_iqRx7Sw5Erg_294096_296056.wav,BreathofBeauty_UCB9eAHlm3hHwb9T1Dij0EA_iqRx7Sw5Erg,294096,296056,1960,55,three- years at least,1,0,0,0,0,0,0,DY,11:03.4
BreathofBeauty_UCB9eAHlm3hHwb9T1Dij0EA_iqRx7Sw5Erg_296144_302436.wav,BreathofBeauty_UCB9eAHlm3hHwb9T1Dij0EA_iqRx7Sw5Erg,296144,302436,6292,56,three years at least and you guys that's actually a pretty long time for me because like I said I get sick of things super super fast,1,0,0,0,0,0,0,DY,11:17.3
BreathofBeauty_UCB9eAHlm3hHwb9T1Dij0EA_iqRx7Sw5Erg_302516_309044.wav,BreathofBeauty_UCB9eAHlm3hHwb9T1Dij0EA_iqRx7Sw5Erg,302516,309044,6528,57,and this is really different like I'm really passionate about it and I'm really tryna keep it up and,1,0,0,0,0,0,0,DY,11:32.1
BreathofBeauty_UCB9eAHlm3hHwb9T1Dij0EA_iqRx7Sw5Erg_309124_318456.wav,BreathofBeauty_UCB9eAHlm3hHwb9T1Dij0EA_iqRx7Sw5Erg,309124,318456,9332,58,just keep the passion going and persevere through the hard times or like the slumps and I've been really enjoying it so far it's been quite a ride already,1,0,0,0,0,0,0,DY,11:50.4
BreathofBeauty_UCB9eAHlm3hHwb9T1Dij0EA_iqRx7Sw5Erg_318536_319720.wav,BreathofBeauty_UCB9eAHlm3hHwb9T1Dij0EA_iqRx7Sw5Erg,318536,319720,1184,59,so um,1,0,0,0,0,0,0,DY,11:57.0
BreathofBeauty_UCB9eAHlm3hHwb9T1Dij0EA_iqRx7Sw5Erg_320288_327060.wav,BreathofBeauty_UCB9eAHlm3hHwb9T1Dij0EA_iqRx7Sw5Erg,320288,327060,6772,60,I know I'm gonna keep it up for at least three years and if I keep it up for five years that'd be so awesome and,1,0,0,0,0,0,0,DY,12:09.6
BreathofBeauty_UCB9eAHlm3hHwb9T1Dij0EA_iqRx7Sw5Erg_327188_332550.wav,BreathofBeauty_UCB9eAHlm3hHwb9T1Dij0EA_iqRx7Sw5Erg,327188,332550,5362,61,maybe even more than five years who knows right who knows what youtube's gonna be like in five years,1,0,0,0,0,0,0,DY,12:20.5
BreathofBeauty_UCB9eAHlm3hHwb9T1Dij0EA_iqRx7Sw5Erg_332630_333246.wav,BreathofBeauty_UCB9eAHlm3hHwb9T1Dij0EA_iqRx7Sw5Erg,332630,333246,616,62,but,1,0,0,0,0,0,0,DY,12:26.6
BreathofBeauty_UCB9eAHlm3hHwb9T1Dij0EA_iqRx7Sw5Erg_333342_343918.wav,BreathofBeauty_UCB9eAHlm3hHwb9T1Dij0EA_iqRx7Sw5Erg,333342,343918,10576,63,um I don't really have like a subscriber number in mind or or video views in mind 'cause that's not really that important to me what really matters to me is that,1,0,0,0,0,0,0,DY,13:14.1
BreathofBeauty_UCB9eAHlm3hHwb9T1Dij0EA_iqRx7Sw5Erg_344014_348192.wav,BreathofBeauty_UCB9eAHlm3hHwb9T1Dij0EA_iqRx7Sw5Erg,344014,348192,4178,64,through my videos and through my channel somebody,1,0,0,0,0,0,0,DY,13:24.5
BreathofBeauty_UCB9eAHlm3hHwb9T1Dij0EA_iqRx7Sw5Erg_348744_352992.wav,BreathofBeauty_UCB9eAHlm3hHwb9T1Dij0EA_iqRx7Sw5Erg,348744,352992,4248,65,will really be able to see that they are beautiful like that,1,0,0,0,0,0,0,DY,13:33.9
BreathofBeauty_UCB9eAHlm3hHwb9T1Dij0EA_iqRx7Sw5Erg_353656_354616.wav,BreathofBeauty_UCB9eAHlm3hHwb9T1Dij0EA_iqRx7Sw5Erg,353656,354616,960,66,if I'm able to make,1,0,0,0,0,0,0,DY,13:40.6
BreathofBeauty_UCB9eAHlm3hHwb9T1Dij0EA_iqRx7Sw5Erg_354888_360664.wav,BreathofBeauty_UCB9eAHlm3hHwb9T1Dij0EA_iqRx7Sw5Erg,354888,360664,5776,67,one person feel like they are really truly beautiful then,1,0,0,0,0,0,0,DY,13:51.3
BreathofBeauty_UCB9eAHlm3hHwb9T1Dij0EA_iqRx7Sw5Erg_362864_365880.wav,BreathofBeauty_UCB9eAHlm3hHwb9T1Dij0EA_iqRx7Sw5Erg,362864,365880,3016,68,what more can I say <lgh> yeah I honestly feel like,1,0,0,0,0,0,0,DY,13:58.6
BreathofBeauty_UCB9eAHlm3hHwb9T1Dij0EA_iqRx7Sw5Erg_366152_369616.wav,BreathofBeauty_UCB9eAHlm3hHwb9T1Dij0EA_iqRx7Sw5Erg,366152,369616,3464,69,yeah if I'm able to be a positive influence,1,0,0,0,0,0,0,DY,14:05.9
BreathofBeauty_UCB9eAHlm3hHwb9T1Dij0EA_iqRx7Sw5Erg_370216_372720.wav,BreathofBeauty_UCB9eAHlm3hHwb9T1Dij0EA_iqRx7Sw5Erg,370216,372720,2504,70,on a number of people in five years,1,0,0,0,0,0,0,DY,14:12.8
BreathofBeauty_UCB9eAHlm3hHwb9T1Dij0EA_iqRx7Sw5Erg_373336_374632.wav,BreathofBeauty_UCB9eAHlm3hHwb9T1Dij0EA_iqRx7Sw5Erg,373336,374632,1296,71,that's all I would want,1,0,0,0,0,0,0,DY,14:19.1
BreathofBeauty_UCB9eAHlm3hHwb9T1Dij0EA_iqRx7Sw5Erg_374848_377320.wav,BreathofBeauty_UCB9eAHlm3hHwb9T1Dij0EA_iqRx7Sw5Erg,374848,377320,2472,72,honestly <sfx> question number four,1,0,0,0,0,0,1,DY,14:34.7
BreathofBeauty_UCB9eAHlm3hHwb9T1Dij0EA_iqRx7Sw5Erg_377448_390984.wav,BreathofBeauty_UCB9eAHlm3hHwb9T1Dij0EA_iqRx7Sw5Erg,377448,390984,13536,73,what message are you tryna get across with your videos so I guess I touched on this one too but the biggest and most important message that I'm trying to get across through my videos is that you the viewer,1,0,0,0,0,0,0,DY,15:07.8
BreathofBeauty_UCB9eAHlm3hHwb9T1Dij0EA_iqRx7Sw5Erg_391768_392896.wav,BreathofBeauty_UCB9eAHlm3hHwb9T1Dij0EA_iqRx7Sw5Erg,391768,392896,1128,74,are truly,1,0,0,0,0,0,0,DY,15:14.9
BreathofBeauty_UCB9eAHlm3hHwb9T1Dij0EA_iqRx7Sw5Erg_393768_394784.wav,BreathofBeauty_UCB9eAHlm3hHwb9T1Dij0EA_iqRx7Sw5Erg,393768,394784,1016,75,magnificent,1,0,0,0,0,0,0,DY,15:21.5
BreathofBeauty_UCB9eAHlm3hHwb9T1Dij0EA_iqRx7Sw5Erg_395760_396504.wav,BreathofBeauty_UCB9eAHlm3hHwb9T1Dij0EA_iqRx7Sw5Erg,395760,396504,744,76,beautiful,1,0,0,0,0,0,0,DY,15:27.9
BreathofBeauty_UCB9eAHlm3hHwb9T1Dij0EA_iqRx7Sw5Erg_397320_398336.wav,BreathofBeauty_UCB9eAHlm3hHwb9T1Dij0EA_iqRx7Sw5Erg,397320,398336,1016,77,and wonderful,1,0,0,0,0,0,0,DY,15:33.9
BreathofBeauty_UCB9eAHlm3hHwb9T1Dij0EA_iqRx7Sw5Erg_398984_402184.wav,BreathofBeauty_UCB9eAHlm3hHwb9T1Dij0EA_iqRx7Sw5Erg,398984,402184,3200,78,that is the number one message,1,0,0,0,0,0,0,DY,15:42.5
BreathofBeauty_UCB9eAHlm3hHwb9T1Dij0EA_iqRx7Sw5Erg_402456_403488.wav,BreathofBeauty_UCB9eAHlm3hHwb9T1Dij0EA_iqRx7Sw5Erg,402456,403488,1032,79,that I want,1,0,0,0,0,0,0,DY,15:47.8
BreathofBeauty_UCB9eAHlm3hHwb9T1Dij0EA_iqRx7Sw5Erg_403648_410600.wav,BreathofBeauty_UCB9eAHlm3hHwb9T1Dij0EA_iqRx7Sw5Erg,403648,410600,6952,80,you the viewer to hear from me and now I say this because I'm a Christian and that is,1,0,0,0,0,0,0,DY,16:01.3
BreathofBeauty_UCB9eAHlm3hHwb9T1Dij0EA_iqRx7Sw5Erg_410896_414576.wav,BreathofBeauty_UCB9eAHlm3hHwb9T1Dij0EA_iqRx7Sw5Erg,410896,414576,3680,81,the most integral part of my life that is my life,1,0,0,0,0,0,0,DY,16:10.4
BreathofBeauty_UCB9eAHlm3hHwb9T1Dij0EA_iqRx7Sw5Erg_414680_422232.wav,BreathofBeauty_UCB9eAHlm3hHwb9T1Dij0EA_iqRx7Sw5Erg,414680,422232,7552,82,that is my life and I think the most important thing is for people to see themselves as how God sees them and that's,1,0,0,0,0,0,0,DY,16:23.7
BreathofBeauty_UCB9eAHlm3hHwb9T1Dij0EA_iqRx7Sw5Erg_422344_436080.wav,BreathofBeauty_UCB9eAHlm3hHwb9T1Dij0EA_iqRx7Sw5Erg,422344,436080,13736,83,loved beautiful wonderful um accepted amazing a work of art like that's how I want people to view themselves and that's the most important message that I want to,1,0,0,0,0,0,0,DY,16:43.2
BreathofBeauty_UCB9eAHlm3hHwb9T1Dij0EA_iqRx7Sw5Erg_436296_437736.wav,BreathofBeauty_UCB9eAHlm3hHwb9T1Dij0EA_iqRx7Sw5Erg,436296,437736,1440,84,get across to you guys,1,0,0,0,0,0,0,DY,16:49.8
BreathofBeauty_UCB9eAHlm3hHwb9T1Dij0EA_iqRx7Sw5Erg_437896_440248.wav,BreathofBeauty_UCB9eAHlm3hHwb9T1Dij0EA_iqRx7Sw5Erg,437896,440248,2352,85,through my videos and that's why at the end of ,1,0,0,0,0,0,0,DY,16:57.8
BreathofBeauty_UCB9eAHlm3hHwb9T1Dij0EA_iqRx7Sw5Erg_440408_454488.wav,BreathofBeauty_UCB9eAHlm3hHwb9T1Dij0EA_iqRx7Sw5Erg,440408,454488,14080,86,every single one of my videos I will tell you that you guys are beautiful you're wonderful and I'm so grateful that you guys are my friends because that's truly how I feel and uh I hope you guys really know that that's really sincerely from my heart is,1,0,0,0,0,0,0,DY,17:18.4
BreathofBeauty_UCB9eAHlm3hHwb9T1Dij0EA_iqRx7Sw5Erg_454960_463552.wav,BreathofBeauty_UCB9eAHlm3hHwb9T1Dij0EA_iqRx7Sw5Erg,454960,463552,8592,87,I feel like you guys are really beautiful and you're amazing humans each- and every one of you are unique each and every one of you are loved,1,0,0,0,0,0,0,DY,17:53.2
BreathofBeauty_UCB9eAHlm3hHwb9T1Dij0EA_iqRx7Sw5Erg_463808_465700.wav,BreathofBeauty_UCB9eAHlm3hHwb9T1Dij0EA_iqRx7Sw5Erg,463808,465700,1892,88,each and every one of you are,1,0,0,0,0,0,0,DY,18:02.2
BreathofBeauty_UCB9eAHlm3hHwb9T1Dij0EA_iqRx7Sw5Erg_465852_467532.wav,BreathofBeauty_UCB9eAHlm3hHwb9T1Dij0EA_iqRx7Sw5Erg,465852,467532,1680,89,awesome and that's,1,0,0,0,0,0,0,DY,18:10.0
BreathofBeauty_UCB9eAHlm3hHwb9T1Dij0EA_iqRx7Sw5Erg_467660_468692.wav,BreathofBeauty_UCB9eAHlm3hHwb9T1Dij0EA_iqRx7Sw5Erg,467660,468692,1032,90,what I wanna get across,1,0,0,0,0,0,0,DY,18:17.9
BreathofBeauty_UCB9eAHlm3hHwb9T1Dij0EA_iqRx7Sw5Erg_468876_483396.wav,BreathofBeauty_UCB9eAHlm3hHwb9T1Dij0EA_iqRx7Sw5Erg,468876,483396,14520,91,otherwise another message I w- wanna get across is that I really love beauty and I- just wanna share my thoughts on certain products and I just want to talk about makeup with fellow Beauty enthusiasts and if I get to help any beginners along the way that's awesome,1,0,0,0,0,0,0,DY,19:30.9
BreathofBeauty_UCB9eAHlm3hHwb9T1Dij0EA_iqRx7Sw5Erg_483524_484668.wav,BreathofBeauty_UCB9eAHlm3hHwb9T1Dij0EA_iqRx7Sw5Erg,483524,484668,1144,92,you know so,1,0,0,0,0,0,0,DY,19:37.5
BreathofBeauty_UCB9eAHlm3hHwb9T1Dij0EA_iqRx7Sw5Erg_484844_490712.wav,BreathofBeauty_UCB9eAHlm3hHwb9T1Dij0EA_iqRx7Sw5Erg,484844,490712,5868,93,that's that <sfx> question number five_unn is do people from school find your channel,1,0,0,0,0,0,1,DY,19:58.1
BreathofBeauty_UCB9eAHlm3hHwb9T1Dij0EA_iqRx7Sw5Erg_491272_496896.wav,BreathofBeauty_UCB9eAHlm3hHwb9T1Dij0EA_iqRx7Sw5Erg,491272,496896,5624,94,um  I don't think so I'm- I'm pretty small still so,1,0,0,0,0,0,0,DY,20:10.6
BreathofBeauty_UCB9eAHlm3hHwb9T1Dij0EA_iqRx7Sw5Erg_497000_506920.wav,BreathofBeauty_UCB9eAHlm3hHwb9T1Dij0EA_iqRx7Sw5Erg,497000,506920,9920,95,I don't think people from school find me I guess if they're like friends and they see me like as suggested on their Instagram um feed or something and they,1,0,0,0,0,0,0,DY,20:28.8
BreathofBeauty_UCB9eAHlm3hHwb9T1Dij0EA_iqRx7Sw5Erg_507200_521233.wav,BreathofBeauty_UCB9eAHlm3hHwb9T1Dij0EA_iqRx7Sw5Erg,507200,521233,14033,96,follow me and that's how they find out about my channel I can't really do anything about that but I do kind of like to keep my channel a little private when it comes to my friends like only like a handful of my close friends know about my channel,1,0,0,0,0,0,0,DY,21:05.4
BreathofBeauty_UCB9eAHlm3hHwb9T1Dij0EA_iqRx7Sw5Erg_521377_529281.wav,BreathofBeauty_UCB9eAHlm3hHwb9T1Dij0EA_iqRx7Sw5Erg,521377,529281,7904,97,otherwise like I don't go around broadcasting it and telling people I have a youtube channel 'cause it's like so precious and then still mine and like,1,0,0,0,0,0,0,DY,21:56.9
BreathofBeauty_UCB9eAHlm3hHwb9T1Dij0EA_iqRx7Sw5Erg_529441_530394.wav,BreathofBeauty_UCB9eAHlm3hHwb9T1Dij0EA_iqRx7Sw5Erg,529441,530394,953,98,I don't really ,1,0,0,0,0,0,0,DY,22:06.8
BreathofBeauty_UCB9eAHlm3hHwb9T1Dij0EA_iqRx7Sw5Erg_530658_532772.wav,BreathofBeauty_UCB9eAHlm3hHwb9T1Dij0EA_iqRx7Sw5Erg,530658,532772,2114,99,feel like going around telling everybody that I,1,0,0,0,0,0,0,DY,22:14.2
BreathofBeauty_UCB9eAHlm3hHwb9T1Dij0EA_iqRx7Sw5Erg_533036_533776.wav,BreathofBeauty_UCB9eAHlm3hHwb9T1Dij0EA_iqRx7Sw5Erg,533036,533776,740,100,do this,1,0,0,0,0,0,0,DY,22:19.8
BreathofBeauty_UCB9eAHlm3hHwb9T1Dij0EA_iqRx7Sw5Erg_534416_542032.wav,BreathofBeauty_UCB9eAHlm3hHwb9T1Dij0EA_iqRx7Sw5Erg,534416,542032,7616,101,um <sfx>  so yeah question number six is what does your username mean so I think it's,1,0,0,0,0,0,1,DY,22:59.2
BreathofBeauty_UCB9eAHlm3hHwb9T1Dij0EA_iqRx7Sw5Erg_542208_548848.wav,BreathofBeauty_UCB9eAHlm3hHwb9T1Dij0EA_iqRx7Sw5Erg,542208,548848,6640,102,pretty straightforward my username is breath of beauty and when I was first starting out,1,0,0,0,0,0,0,DY,23:29.9
BreathofBeauty_UCB9eAHlm3hHwb9T1Dij0EA_iqRx7Sw5Erg_549232_553616.wav,BreathofBeauty_UCB9eAHlm3hHwb9T1Dij0EA_iqRx7Sw5Erg,549232,553616,4384,103,y'know creating this channel I kind of envisioned that this,1,0,0,0,0,0,0,DY,23:39.8
BreathofBeauty_UCB9eAHlm3hHwb9T1Dij0EA_iqRx7Sw5Erg_553944_559480.wav,BreathofBeauty_UCB9eAHlm3hHwb9T1Dij0EA_iqRx7Sw5Erg,553944,559480,5536,104,channel my my videos would be a place where you guys can come and just take,1,0,0,0,0,0,0,DY,23:51.5
BreathofBeauty_UCB9eAHlm3hHwb9T1Dij0EA_iqRx7Sw5Erg_559808_561584.wav,BreathofBeauty_UCB9eAHlm3hHwb9T1Dij0EA_iqRx7Sw5Erg,559808,561584,1776,105,a breath of beauty,1,0,0,0,0,0,0,DY,23:58.8
