filename,video_id,start_time,end_time,duration,id,transcription,usability,bg_music,bg_noise,other_voice,only_music,only_noise,other_sounds,annotator,annotate_date_YYYYMMDD
Mikealla_UCdQQg32M0O4ZQMogV1Wfcig_aAIYRzD9Ho_597224_599448.wav,Mikealla_UCdQQg32M0O4ZQMogV1Wfcig_aAIYRzD9Ho,597224,599448,2224,84,a stationery if you guys don't know that about me i love,1,0,0,0,0,0,0,RP,2021-07-08 13:42:58.242820
Mikealla_UCdQQg32M0O4ZQMogV1Wfcig_aAIYRzD9Ho_599640_608160.wav,Mikealla_UCdQQg32M0O4ZQMogV1Wfcig_aAIYRzD9Ho,599640,608160,8520,85,pens or if i would write my own book but i want something to my name so i would love to make my own brand one day so i would just have to think of ideas and,1,0,0,0,0,0,0,RP,2021-07-08 13:43:13.536062
Mikealla_UCdQQg32M0O4ZQMogV1Wfcig_aAIYRzD9Ho_608608_609489.wav,Mikealla_UCdQQg32M0O4ZQMogV1Wfcig_aAIYRzD9Ho,608608,609489,881,86,work my way there,1,0,0,0,0,0,0,RP,2021-07-08 13:43:17.196371
Mikealla_UCdQQg32M0O4ZQMogV1Wfcig_aAIYRzD9Ho_609609_613601.wav,Mikealla_UCdQQg32M0O4ZQMogV1Wfcig_aAIYRzD9Ho,609609,613601,3992,87,somebody said what do you want people to know about your personality and,1,0,0,0,0,0,0,RP,2021-07-08 13:43:26.377117
Mikealla_UCdQQg32M0O4ZQMogV1Wfcig_aAIYRzD9Ho_613705_624921.wav,Mikealla_UCdQQg32M0O4ZQMogV1Wfcig_aAIYRzD9Ho,613705,624921,11216,88,something i would love for you guys to know is that i am a very very driven person um i am somebody that's constantly wanting to create and do new things i think we all have that one person in our life where they talk,1,0,0,0,0,0,0,RP,2021-07-08 13:43:45.079992
Mikealla_UCdQQg32M0O4ZQMogV1Wfcig_aAIYRzD9Ho_625009_640857.wav,Mikealla_UCdQQg32M0O4ZQMogV1Wfcig_aAIYRzD9Ho,625009,640857,15848,89,to you and it's like every single time they talk to you they're doing something new and it's so funny because i feel like i have like people in my life that kind of evil eye me like i have like family members or friends and when i tell them i want to start a new project they're kind of like oh_unn like_unn why_unn don't_unn you_unn finish_unn the_unn last_unn one_unn you_unn started_unn,1,0,0,1,0,0,0,RP,2021-07-08 13:44:47.281426
Mikealla_UCdQQg32M0O4ZQMogV1Wfcig_aAIYRzD9Ho_640937_645513.wav,Mikealla_UCdQQg32M0O4ZQMogV1Wfcig_aAIYRzD9Ho,640937,645513,4576,90,but that's just never me i'm constantly on the move and i'm constantly wanting to grow,1,0,0,0,0,0,0,RP,2021-07-08 13:44:58.981011
Mikealla_UCdQQg32M0O4ZQMogV1Wfcig_aAIYRzD9Ho_645593_651073.wav,Mikealla_UCdQQg32M0O4ZQMogV1Wfcig_aAIYRzD9Ho,645593,651073,5480,91,and i am just like i have big dreams and big goals and i plan on attaining every single one of them,1,0,0,0,0,0,0,RP,2021-07-08 13:45:15.932911
Mikealla_UCdQQg32M0O4ZQMogV1Wfcig_aAIYRzD9Ho_651169_656290.wav,Mikealla_UCdQQg32M0O4ZQMogV1Wfcig_aAIYRzD9Ho,651169,656290,5121,92,so if i could let you guys know anything about my personality is that like baby i dream big and i-,1,0,0,0,0,0,0,RP,2021-07-08 13:45:26.011550
Mikealla_UCdQQg32M0O4ZQMogV1Wfcig_aAIYRzD9Ho_656474_664314.wav,Mikealla_UCdQQg32M0O4ZQMogV1Wfcig_aAIYRzD9Ho,656474,664314,7840,93,i go for it so everything i want in life i genuinely go out there and i put my effort in to achieve so that is something i would love for you guys to know about me,1,0,0,0,0,0,0,RP,2021-07-08 13:45:40.481462
Mikealla_UCdQQg32M0O4ZQMogV1Wfcig_aAIYRzD9Ho_664482_673411.wav,Mikealla_UCdQQg32M0O4ZQMogV1Wfcig_aAIYRzD9Ho,664482,673411,8929,94,so now we're gonna go more into like the youtube based questions because i received a lot of those but i was saving those towards the end just because i wanted you guys to get to know me on a more personal level first,1,0,0,0,0,0,0,RP,2021-07-08 13:45:55.794125
Mikealla_UCdQQg32M0O4ZQMogV1Wfcig_aAIYRzD9Ho_673547_685379.wav,Mikealla_UCdQQg32M0O4ZQMogV1Wfcig_aAIYRzD9Ho,673547,685379,11832,95,a whole bunch of people ask me what made you start your youtube channel so i think it is very apparent that i do love talking in front of the camera but that is actually not the reason why i started my youtube channel i started my youtube channel genuinely because i love,1,0,0,0,0,0,0,RP,2021-07-08 13:46:14.994350
Mikealla_UCdQQg32M0O4ZQMogV1Wfcig_aAIYRzD9Ho_685491_689299.wav,Mikealla_UCdQQg32M0O4ZQMogV1Wfcig_aAIYRzD9Ho,685491,689299,3808,96,talking to other people not just talking to a camera so,1,0,0,0,0,0,0,RP,2021-07-08 13:46:22.523067
Mikealla_UCdQQg32M0O4ZQMogV1Wfcig_aAIYRzD9Ho_689403_689876.wav,Mikealla_UCdQQg32M0O4ZQMogV1Wfcig_aAIYRzD9Ho,689403,689876,473,97,i,1,0,0,0,0,0,0,RP,2021-07-08 13:46:26.039807
Mikealla_UCdQQg32M0O4ZQMogV1Wfcig_aAIYRzD9Ho_690116_707756.wav,Mikealla_UCdQQg32M0O4ZQMogV1Wfcig_aAIYRzD9Ho,690116,707756,17640,98,started my youtube channel to talk to the camera but i continued going and continue to make videos because of the comments that you guys leave to me i don't think you guys realize that when you guys leave me a comment that makes my entire day way that you guys can tell me about how your day's going and tell me what products you're into and telling me like you know just,1,0,0,0,0,0,0,RP,2021-07-08 13:46:48.822705
Mikealla_UCdQQg32M0O4ZQMogV1Wfcig_aAIYRzD9Ho_707836_709620.wav,Mikealla_UCdQQg32M0O4ZQMogV1Wfcig_aAIYRzD9Ho,707836,709620,1784,99,anything about yourself makes me,1,0,0,0,0,0,0,RP,2021-07-08 13:46:54.217527
Mikealla_UCdQQg32M0O4ZQMogV1Wfcig_aAIYRzD9Ho_709764_710077.wav,Mikealla_UCdQQg32M0O4ZQMogV1Wfcig_aAIYRzD9Ho,709764,710077,313,100,so,1,0,0,0,0,0,0,RP,2021-07-08 13:46:58.801830
Mikealla_UCdQQg32M0O4ZQMogV1Wfcig_aAIYRzD9Ho_710173_719541.wav,Mikealla_UCdQQg32M0O4ZQMogV1Wfcig_aAIYRzD9Ho,710173,719541,9368,101,so happy and that's really why i started my youtube channel was just to get to know other people and to make friends and just to y'know grow in who i know in this world and i think that's,1,0,0,0,0,0,0,RP,2021-07-08 13:47:24.410248
Mikealla_UCdQQg32M0O4ZQMogV1Wfcig_aAIYRzD9Ho_719637_732981.wav,Mikealla_UCdQQg32M0O4ZQMogV1Wfcig_aAIYRzD9Ho,719637,732981,13344,102,so beautiful about youtube is that how i have friends literally in the philippines right now i have friends in new jersey right now i have friends all over the world you guys tell me you're from the UK or india and it just makes me so happy and that's why i started my youtube channel was just to talk to people,1,0,0,0,0,0,0,RP,2021-07-08 13:47:43.302248
Mikealla_UCdQQg32M0O4ZQMogV1Wfcig_aAIYRzD9Ho_733149_736910.wav,Mikealla_UCdQQg32M0O4ZQMogV1Wfcig_aAIYRzD9Ho,733149,736910,3761,103,like you guys the next question i received is how long have you been monetized,1,0,0,0,0,0,0,RP,2021-07-08 13:48:28.570412
Mikealla_UCdQQg32M0O4ZQMogV1Wfcig_aAIYRzD9Ho_737062_742424.wav,Mikealla_UCdQQg32M0O4ZQMogV1Wfcig_aAIYRzD9Ho,737062,742424,5362,104,slash how long have you been doing youtube so i have been monetized i think since like february like,1,0,0,0,0,0,0,RP,2021-07-08 13:48:44.676756
Mikealla_UCdQQg32M0O4ZQMogV1Wfcig_aAIYRzD9Ho_742920_753572.wav,Mikealla_UCdQQg32M0O4ZQMogV1Wfcig_aAIYRzD9Ho,742920,753572,10652,105,fifteenth or sixteenth some- some day like that um somewhere in mid february um and how long have you been doing youtube it honestly depends what you consider um because i used to make like-,1,0,0,0,0,0,0,RP,2021-07-08 13:49:00.870890
Mikealla_UCdQQg32M0O4ZQMogV1Wfcig_aAIYRzD9Ho_753732_765544.wav,Mikealla_UCdQQg32M0O4ZQMogV1Wfcig_aAIYRzD9Ho,753732,765544,11812,106,i think in like two thousand seventeen i made one video i think in two thousand eighteen i made one video i think in two thousand nineteen i make two videos like y'know what i'm saying like it depends what you really consider when did i start consis-,1,0,0,0,0,0,0,RP,2021-07-08 13:49:18.409821
Mikealla_UCdQQg32M0O4ZQMogV1Wfcig_aAIYRzD9Ho_765696_767308.wav,Mikealla_UCdQQg32M0O4ZQMogV1Wfcig_aAIYRzD9Ho,765696,767308,1612,107,-ly making videos was,1,0,0,0,0,0,0,RP,2021-07-08 13:49:43.578352
Mikealla_UCdQQg32M0O4ZQMogV1Wfcig_aAIYRzD9Ho_767476_768732.wav,Mikealla_UCdQQg32M0O4ZQMogV1Wfcig_aAIYRzD9Ho,767476,768732,1256,108,in december,1,0,0,0,0,0,0,RP,2021-07-08 13:49:48.596879
Mikealla_UCdQQg32M0O4ZQMogV1Wfcig_aAIYRzD9Ho_768844_789021.wav,Mikealla_UCdQQg32M0O4ZQMogV1Wfcig_aAIYRzD9Ho,768844,789021,20177,109,so december of twenty twenty is when i consistently started making videos the next question is how do you deal with hate and i don't know if you guys know this but i actually do receive a lot of hate which was funny but not funny because i didn't think i would get hate until i became like a bigger channel i do cou- still consider myself a small youtuber and i never thought i would receive hate like,1,0,0,0,0,0,0,RP,2021-07-08 13:50:40.513266
Mikealla_UCdQQg32M0O4ZQMogV1Wfcig_aAIYRzD9Ho_789173_789833.wav,Mikealla_UCdQQg32M0O4ZQMogV1Wfcig_aAIYRzD9Ho,789173,789833,660,110,at the amounts,1,0,0,0,0,0,0,RP,2021-07-08 13:50:45.693534
Mikealla_UCdQQg32M0O4ZQMogV1Wfcig_aAIYRzD9Ho_789961_800997.wav,Mikealla_UCdQQg32M0O4ZQMogV1Wfcig_aAIYRzD9Ho,789961,800997,11036,111,that i did but one thing that i always remind myself and it's funny because jasmine said this in her video and i- it's so- when she said that my jaw dropped because i literally tell my friends that same exact thing all the time and it's that,1,0,0,0,0,0,0,RP,2021-07-08 13:51:04.049506
Mikealla_UCdQQg32M0O4ZQMogV1Wfcig_aAIYRzD9Ho_801125_812878.wav,Mikealla_UCdQQg32M0O4ZQMogV1Wfcig_aAIYRzD9Ho,801125,812878,11753,112,people that like send me hate online would never have the audacity to say that stuff to my face like you literally would not be able to walk up to me and talk to me the way that you do and it's just funny how like behind the,1,0,0,0,0,0,0,RP,2021-07-08 13:51:21.325057
Mikealla_UCdQQg32M0O4ZQMogV1Wfcig_aAIYRzD9Ho_813014_820014.wav,Mikealla_UCdQQg32M0O4ZQMogV1Wfcig_aAIYRzD9Ho,813014,820014,7000,113,screen people just get this wave of confidence to be rude to other people and it's like okay but would you say that to my face though,1,0,0,0,0,0,0,RP,2021-07-08 13:51:31.884537
Mikealla_UCdQQg32M0O4ZQMogV1Wfcig_aAIYRzD9Ho_820142_823616.wav,Mikealla_UCdQQg32M0O4ZQMogV1Wfcig_aAIYRzD9Ho,820142,823616,3474,114,so that's something that i remind myself is that like y'know people,1,0,0,0,0,0,0,RP,2021-07-08 13:51:38.986452
Mikealla_UCdQQg32M0O4ZQMogV1Wfcig_aAIYRzD9Ho_823872_825450.wav,Mikealla_UCdQQg32M0O4ZQMogV1Wfcig_aAIYRzD9Ho,823872,825450,1578,115,are this way just because it's,1,0,0,0,0,0,0,RP,2021-07-08 13:51:46.090622
Mikealla_UCdQQg32M0O4ZQMogV1Wfcig_aAIYRzD9Ho_825554_831107.wav,Mikealla_UCdQQg32M0O4ZQMogV1Wfcig_aAIYRzD9Ho,825554,831107,5553,116,the internet but one of the biggest things i do to help myself with hate is genuinely look at the nice comments,1,0,0,0,0,0,0,RP,2021-07-08 13:52:01.062213
Mikealla_UCdQQg32M0O4ZQMogV1Wfcig_aAIYRzD9Ho_831195_832859.wav,Mikealla_UCdQQg32M0O4ZQMogV1Wfcig_aAIYRzD9Ho,831195,832859,1664,117,for every hate comment i rece-,1,0,0,0,0,0,0,RP,2021-07-08 13:52:07.917543
Mikealla_UCdQQg32M0O4ZQMogV1Wfcig_aAIYRzD9Ho_832947_835483.wav,Mikealla_UCdQQg32M0O4ZQMogV1Wfcig_aAIYRzD9Ho,832947,835483,2536,118,-ive i receive like twenty nice comments,1,0,0,0,0,0,0,RP,2021-07-08 13:52:33.539855
Mikealla_UCdQQg32M0O4ZQMogV1Wfcig_aAIYRzD9Ho_835571_847971.wav,Mikealla_UCdQQg32M0O4ZQMogV1Wfcig_aAIYRzD9Ho,835571,847971,12400,119,and that genuinely keeps me going that's the main thing i do if i ever receive a hate comment i will just go and i'll find a positive comment and i'll read it i'll remind myself that there are really really awesome people out there in this world and you just gotta choose,1,0,0,0,0,0,0,RP,2021-07-08 13:52:52.255910
Mikealla_UCdQQg32M0O4ZQMogV1Wfcig_aAIYRzD9Ho_848051_855419.wav,Mikealla_UCdQQg32M0O4ZQMogV1Wfcig_aAIYRzD9Ho,848051,855419,7368,120,to acknowledge them over the shitty people next question is what is your all time favorite scent bare vanilla by victoria's secret of course,1,0,0,0,0,0,0,RP,2021-07-08 13:53:03.855580
Mikealla_UCdQQg32M0O4ZQMogV1Wfcig_aAIYRzD9Ho_855507_855715.wav,Mikealla_UCdQQg32M0O4ZQMogV1Wfcig_aAIYRzD9Ho,855507,855715,208,121,,0,0,0,0,0,1,0,RP,2021-07-08 13:53:08.036704
Mikealla_UCdQQg32M0O4ZQMogV1Wfcig_aAIYRzD9Ho_855795_869548.wav,Mikealla_UCdQQg32M0O4ZQMogV1Wfcig_aAIYRzD9Ho,855795,869548,13753,122,somebody said what supplements do you take slash recommend i unfortunately cannot recommend you guys any supplements since i'm not your guys doctors but i will let you guys know what supplements i do take personally i take B twelve for energy because i don't really eat meat like that,1,0,0,0,0,0,0,RP,2021-07-08 13:53:57.281286
Mikealla_UCdQQg32M0O4ZQMogV1Wfcig_aAIYRzD9Ho_869708_878038.wav,Mikealla_UCdQQg32M0O4ZQMogV1Wfcig_aAIYRzD9Ho,869708,878038,8330,123,so i do take B twelve i take a cranberry like gummy i don't take the pills i take the gummies um i take a woman's multivitamin and,1,0,0,0,0,0,0,RP,2021-07-08 13:54:18.478509
Mikealla_UCdQQg32M0O4ZQMogV1Wfcig_aAIYRzD9Ho_878158_882478.wav,Mikealla_UCdQQg32M0O4ZQMogV1Wfcig_aAIYRzD9Ho,878158,882478,4320,124,that's basically it i don't really take a lot of like vitamins or supplements um ,1,0,0,0,0,0,0,RP,2021-07-08 13:54:30.299668
Mikealla_UCdQQg32M0O4ZQMogV1Wfcig_aAIYRzD9Ho_882590_898863.wav,Mikealla_UCdQQg32M0O4ZQMogV1Wfcig_aAIYRzD9Ho,882590,898863,16273,125,but yeah i do use protein powder in my smoothies but like that's just protein powder somebody asked how long did it take you to perfect your routine it's still going my routine is not perfect literally i promise you guys there are things where i- every single day i learn something new about my body and i learn what works and what doesn't work for me,1,0,0,0,0,0,0,RP,2021-07-08 13:56:36.160339
Mikealla_UCdQQg32M0O4ZQMogV1Wfcig_aAIYRzD9Ho_898975_904984.wav,Mikealla_UCdQQg32M0O4ZQMogV1Wfcig_aAIYRzD9Ho,898975,904984,6009,126,so i'm still working on it i'm twenty years old we still- we still thriving like it is a journey self care is a journey,1,0,0,0,0,0,0,RP,2021-07-08 13:56:50.380550
Mikealla_UCdQQg32M0O4ZQMogV1Wfcig_aAIYRzD9Ho_905416_906792.wav,Mikealla_UCdQQg32M0O4ZQMogV1Wfcig_aAIYRzD9Ho,905416,906792,1376,127,somebody said must have,1,0,0,0,0,0,0,RP,2021-07-08 14:01:02.866786
Mikealla_UCdQQg32M0O4ZQMogV1Wfcig_aAIYRzD9Ho_906896_913352.wav,Mikealla_UCdQQg32M0O4ZQMogV1Wfcig_aAIYRzD9Ho,906896,913352,6456,128,-in care products i will be making a skincare routine but i promise you guys my skincare routine is super simple like i do not do,1,0,0,0,0,0,0,RP,2021-07-09 15:24:37.726350
Mikealla_UCdQQg32M0O4ZQMogV1Wfcig_aAIYRzD9Ho_913448_923496.wav,Mikealla_UCdQQg32M0O4ZQMogV1Wfcig_aAIYRzD9Ho,913448,923496,10048,129,-oo much um favorite vanilla scents i'm gonna make a whole video talking just about my favorite gourmand scents i'm just trying to get all my products together um but at the moment,1,0,0,0,0,0,0,RP,2021-07-09 15:35:46.444597
Mikealla_UCdQQg32M0O4ZQMogV1Wfcig_aAIYRzD9Ho_923616_927360.wav,Mikealla_UCdQQg32M0O4ZQMogV1Wfcig_aAIYRzD9Ho,923616,927360,3744,130,um i've been loving the EOS vanilla cashmere lotion,1,0,0,0,0,0,0,RP,2021-07-09 15:35:56.199896
Mikealla_UCdQQg32M0O4ZQMogV1Wfcig_aAIYRzD9Ho_927584_931288.wav,Mikealla_UCdQQg32M0O4ZQMogV1Wfcig_aAIYRzD9Ho,927584,931288,3704,131,bomb um i love the OGX shea body wash,1,0,0,0,0,0,0,RP,2021-07-09 15:36:06.272410
Mikealla_UCdQQg32M0O4ZQMogV1Wfcig_aAIYRzD9Ho_931584_934272.wav,Mikealla_UCdQQg32M0O4ZQMogV1Wfcig_aAIYRzD9Ho,931584,934272,2688,132,bomb and then of course bare vanilla like,1,0,0,0,0,0,0,RP,2021-07-09 15:36:14.283420
Mikealla_UCdQQg32M0O4ZQMogV1Wfcig_aAIYRzD9Ho_934568_948137.wav,Mikealla_UCdQQg32M0O4ZQMogV1Wfcig_aAIYRzD9Ho,934568,948137,13569,133,come on y'all know me y'all know i love me a bare vanilla but i will be making a whole video talking about my favorite vanilla scents don't worry i got you boo so the next question is what got you into fragrances so i've always been into hygiene i've been watching hygiene youtube since i was in like,1,0,0,0,0,0,0,RP,2021-07-09 15:36:35.072138
Mikealla_UCdQQg32M0O4ZQMogV1Wfcig_aAIYRzD9Ho_948321_960378.wav,Mikealla_UCdQQg32M0O4ZQMogV1Wfcig_aAIYRzD9Ho,948321,960378,12057,134,sixth grade like that's how long i've been watching the hygiene side of youtube it was a very small community but like it was still there um so i've always been into the hygiene side but i didn't get into fragrances until december,1,0,0,0,0,0,0,RP,2021-07-09 15:38:56.800046
Mikealla_UCdQQg32M0O4ZQMogV1Wfcig_aAIYRzD9Ho_960506_972595.wav,Mikealla_UCdQQg32M0O4ZQMogV1Wfcig_aAIYRzD9Ho,960506,972595,12089,135,so i started watching Tik Tok and there was a like hygiene like shower Tik Tok and on shower Tik Tok everyone was obsessed with a thousand wishes and into the night from bath and body works and i didn't know what those were,1,0,0,0,0,0,0,RP,2021-07-09 15:40:22.010815
Mikealla_UCdQQg32M0O4ZQMogV1Wfcig_aAIYRzD9Ho_972715_979715.wav,Mikealla_UCdQQg32M0O4ZQMogV1Wfcig_aAIYRzD9Ho,972715,979715,7000,136,so i was like okay so i just went onto the bath and body works website and they happened to have a five ninety five body care day the day that i,1,0,0,0,0,0,0,RP,2021-07-09 15:40:37.833173
Mikealla_UCdQQg32M0O4ZQMogV1Wfcig_aAIYRzD9Ho_979795_992012.wav,Mikealla_UCdQQg32M0O4ZQMogV1Wfcig_aAIYRzD9Ho,979795,992012,12217,137,searched it and i was like oh okay everything's on sale i'll just buy like a whole bunch of crap so like i just bought a whole bunch of stuff and my package came in and i was like you know what i haven't made a youtube video in a cool minute i'm gonna record this,1,0,0,0,0,0,0,RP,2021-07-09 15:40:56.798860
Mikealla_UCdQQg32M0O4ZQMogV1Wfcig_aAIYRzD9Ho_992172_992348.wav,Mikealla_UCdQQg32M0O4ZQMogV1Wfcig_aAIYRzD9Ho,992172,992348,176,138,,0,0,0,0,0,1,0,RP,2021-07-09 15:41:03.309813
Mikealla_UCdQQg32M0O4ZQMogV1Wfcig_aAIYRzD9Ho_992508_999182.wav,Mikealla_UCdQQg32M0O4ZQMogV1Wfcig_aAIYRzD9Ho,992508,999182,6674,139,so i recorded it and it literally changed my life you guys like loved that video and i met so many awesome people through that video,1,0,0,0,0,0,0,RP,2021-07-09 15:41:31.206711
Mikealla_UCdQQg32M0O4ZQMogV1Wfcig_aAIYRzD9Ho_999310_1010846.wav,Mikealla_UCdQQg32M0O4ZQMogV1Wfcig_aAIYRzD9Ho,999310,1010846,11536,140,so i'm so blessed and so grateful that you know i was able to make that video and then once i made that video you guys started like sending in recommendations and asking me to try out certain scents and that's how i really got into fragrances,1,0,0,0,0,0,0,RP,2021-07-09 15:42:01.107541
Mikealla_UCdQQg32M0O4ZQMogV1Wfcig_aAIYRzD9Ho_1010974_1015135.wav,Mikealla_UCdQQg32M0O4ZQMogV1Wfcig_aAIYRzD9Ho,1010974,1015135,4161,141,so if you guys did not know i didn't get into fragrances until around january of th-,1,0,0,0,0,0,0,RP,2021-07-09 15:42:15.707183
Mikealla_UCdQQg32M0O4ZQMogV1Wfcig_aAIYRzD9Ho_1015247_1027967.wav,Mikealla_UCdQQg32M0O4ZQMogV1Wfcig_aAIYRzD9Ho,1015247,1027967,12720,142,this year so the last question that i received is one that i specifically saved for last and it is how are you and i thought this was a great question just to end off on so thank you guys so much a lot of you guys asked me how i was so thank you,1,0,0,0,0,0,0,RP,2021-07-09 15:42:36.623952
Mikealla_UCdQQg32M0O4ZQMogV1Wfcig_aAIYRzD9Ho_1028087_1041087.wav,Mikealla_UCdQQg32M0O4ZQMogV1Wfcig_aAIYRzD9Ho,1028087,1041087,13000,143,right now your girl is a little stressed it is that time of the school year where teachers are just really cracking down on their assignments so i have a whole bunch of assignments i have work as you guys know like i said earlier i do work full time,1,0,0,0,0,0,0,RP,2021-07-09 15:43:08.736240
Mikealla_UCdQQg32M0O4ZQMogV1Wfcig_aAIYRzD9Ho_1041183_1056631.wav,Mikealla_UCdQQg32M0O4ZQMogV1Wfcig_aAIYRzD9Ho,1041183,1056631,15448,144,so I work like four days a week and I also go to school four days a week and now i have my beautiful youtube channel so i am a little stressed trying to balance everything out with that being said i am so abundantly blessed and grateful and i like to view all the things that i see as stress in my life as,1,0,0,0,0,0,0,RP,2021-07-09 15:44:28.314704
Mikealla_UCdQQg32M0O4ZQMogV1Wfcig_aAIYRzD9Ho_1056727_1057615.wav,Mikealla_UCdQQg32M0O4ZQMogV1Wfcig_aAIYRzD9Ho,1056727,1057615,888,145,good stress,1,0,0,0,0,0,0,RP,2021-07-09 15:44:33.776438
Mikealla_UCdQQg32M0O4ZQMogV1Wfcig_aAIYRzD9Ho_1057703_1059512.wav,Mikealla_UCdQQg32M0O4ZQMogV1Wfcig_aAIYRzD9Ho,1057703,1059512,1809,146,so like instead of viewing it like,1,0,0,0,0,0,0,RP,2021-07-09 15:44:46.509943
Mikealla_UCdQQg32M0O4ZQMogV1Wfcig_aAIYRzD9Ho_1059784_1071692.wav,Mikealla_UCdQQg32M0O4ZQMogV1Wfcig_aAIYRzD9Ho,1059784,1071692,11908,147,oh like i have school work to do i'm always like oh well at least i'm getting my education like i always try to flip things on me and remind myself that the things i stress about are good stressors and they're healthy for me and they just help,1,0,0,0,0,0,0,RP,2021-07-09 15:45:03.818537
Mikealla_UCdQQg32M0O4ZQMogV1Wfcig_aAIYRzD9Ho_1071812_1092576.wav,Mikealla_UCdQQg32M0O4ZQMogV1Wfcig_aAIYRzD9Ho,1071812,1092576,20764,148,to boost me to where i want to be eventually in life but with that being said i am going to end off today's video if you watch the end please comment down below because i don't know who would watch to the end of this video but if you did just know i love you you're my- you're my fave so i am going to talk to you guys very very soon i love you i love you i love you have an amazing rest of your day and i'll talk to you very soon,1,0,0,0,0,0,0,RP,2021-07-09 15:45:31.965762
Mikealla_UCdQQg32M0O4ZQMogV1Wfcig_aAIYRzD9Ho_1092880_1093104.wav,Mikealla_UCdQQg32M0O4ZQMogV1Wfcig_aAIYRzD9Ho,1092880,1093104,224,149,bye,1,0,0,0,0,0,0,RP,2021-07-09 15:45:37.325857
Mikealla_UCdQQg32M0O4ZQMogV1Wfcig_aAIYRzD9Ho_1093392_1093528.wav,Mikealla_UCdQQg32M0O4ZQMogV1Wfcig_aAIYRzD9Ho,1093392,1093528,136,150,,0,0,0,0,0,0,0,RP,2021-07-09 15:45:39.359211
