filename,video_id,start_time,end_time,duration,id,transcription,usability,bg_music,bg_noise,other_voice,only_music,only_noise,other_sounds,annotator,annotate_date_YYYYMMDD
DaibyDai_UCgS7sRyvIFwoYFOhOKmi6g_SmHCyfa6zaA_275_14452.wav,DaibyDai_UCgS7sRyvIFwoYFOhOKmi6g_SmHCyfa6zaA,275,14452,14177,0,greetings daisies today's video I'm gonna be doing the new youtuber challenge I've been a little sporadic with um uploading videos mainly like a couple of travel blogs et cetera but y'know twenty eighteen planning some new things for day by day,1,0,0,0,0,0,0,DY,2021-08-30 15:08:12.348884
DaibyDai_UCgS7sRyvIFwoYFOhOKmi6g_SmHCyfa6zaA_14588_16853.wav,DaibyDai_UCgS7sRyvIFwoYFOhOKmi6g_SmHCyfa6zaA,14588,16853,2265,1,starting ok it's fifteen questions,1,0,0,0,0,0,0,DY,2021-08-30 15:08:19.991507
DaibyDai_UCgS7sRyvIFwoYFOhOKmi6g_SmHCyfa6zaA_17013_27902.wav,DaibyDai_UCgS7sRyvIFwoYFOhOKmi6g_SmHCyfa6zaA,17013,27902,10889,2,what is your name my name is Daizha <lgh> this is- that's a funny question no okay yeah my name is Daizha um spelled D A I Z H A so,1,0,1,0,0,0,0,DY,2021-08-30 15:09:36.900817
DaibyDai_UCgS7sRyvIFwoYFOhOKmi6g_SmHCyfa6zaA_28070_38042.wav,DaibyDai_UCgS7sRyvIFwoYFOhOKmi6g_SmHCyfa6zaA,28070,38042,9972,3,creative spelling of Daizha question number two where are you from so I kinda have like a two part answer to this question every time someone asks me I'm like,1,0,0,0,0,0,0,DY,2021-08-30 15:09:54.088938
DaibyDai_UCgS7sRyvIFwoYFOhOKmi6g_SmHCyfa6zaA_38170_38374.wav,DaibyDai_UCgS7sRyvIFwoYFOhOKmi6g_SmHCyfa6zaA,38170,38374,204,4,,0,0,0,0,0,1,0,DY,2021-08-30 15:09:58.537081
DaibyDai_UCgS7sRyvIFwoYFOhOKmi6g_SmHCyfa6zaA_38734_40455.wav,DaibyDai_UCgS7sRyvIFwoYFOhOKmi6g_SmHCyfa6zaA,38734,40455,1721,5,this is what I'm gonna say anyway <lgh>,1,0,0,0,0,0,0,DY,2021-08-30 15:10:10.644029
DaibyDai_UCgS7sRyvIFwoYFOhOKmi6g_SmHCyfa6zaA_40759_46739.wav,DaibyDai_UCgS7sRyvIFwoYFOhOKmi6g_SmHCyfa6zaA,40759,46739,5980,6,so I was born in Champaign Urbana Illinois but yeah so I lived there,1,0,0,0,0,0,0,DY,2021-08-30 15:10:21.478083
DaibyDai_UCgS7sRyvIFwoYFOhOKmi6g_SmHCyfa6zaA_47067_49807.wav,DaibyDai_UCgS7sRyvIFwoYFOhOKmi6g_SmHCyfa6zaA,47067,49807,2740,7,uh born there and lived there for nine years,1,0,0,0,0,0,0,DY,2021-08-30 15:10:30.166450
DaibyDai_UCgS7sRyvIFwoYFOhOKmi6g_SmHCyfa6zaA_49975_55657.wav,DaibyDai_UCgS7sRyvIFwoYFOhOKmi6g_SmHCyfa6zaA,49975,55657,5682,8,then I moved to Phoenix Arizona from- when I was nine to eleven and so I lived there,1,0,0,0,0,0,0,DY,2021-08-30 15:10:41.489547
DaibyDai_UCgS7sRyvIFwoYFOhOKmi6g_SmHCyfa6zaA_55825_58179.wav,DaibyDai_UCgS7sRyvIFwoYFOhOKmi6g_SmHCyfa6zaA,55825,58179,2354,9,uh for a little bit and it was so hot,1,0,0,0,0,0,0,DY,2021-08-30 15:11:19.505389
DaibyDai_UCgS7sRyvIFwoYFOhOKmi6g_SmHCyfa6zaA_58827_62431.wav,DaibyDai_UCgS7sRyvIFwoYFOhOKmi6g_SmHCyfa6zaA,58827,62431,3604,10,I can't- I can't imagine living somewhere that's over a hundred degrees,1,0,0,0,0,0,0,DY,2021-08-30 15:12:49.269837
DaibyDai_UCgS7sRyvIFwoYFOhOKmi6g_SmHCyfa6zaA_62751_65979.wav,DaibyDai_UCgS7sRyvIFwoYFOhOKmi6g_SmHCyfa6zaA,62751,65979,3228,11,on a regular basis I can't I don't even go outside here,1,0,0,0,0,0,0,DY,2021-08-30 15:12:58.869320
DaibyDai_UCgS7sRyvIFwoYFOhOKmi6g_SmHCyfa6zaA_66395_71283.wav,DaibyDai_UCgS7sRyvIFwoYFOhOKmi6g_SmHCyfa6zaA,66395,71283,4888,12,if it's above like eighty five so that was a little stint in the hot desert,1,0,0,0,0,0,0,DY,2021-08-30 15:13:09.610800
DaibyDai_UCgS7sRyvIFwoYFOhOKmi6g_SmHCyfa6zaA_71643_74691.wav,DaibyDai_UCgS7sRyvIFwoYFOhOKmi6g_SmHCyfa6zaA,71643,74691,3048,13,but uh for majority of my like,1,0,0,0,0,0,0,DY,2021-08-30 15:13:17.730493
DaibyDai_UCgS7sRyvIFwoYFOhOKmi6g_SmHCyfa6zaA_74947_82243.wav,DaibyDai_UCgS7sRyvIFwoYFOhOKmi6g_SmHCyfa6zaA,74947,82243,7296,14,adolescent teen young adult life I've been living in Seattle Washington well technically Tacoma,1,0,1,0,0,0,0,DY,2021-08-30 15:13:48.243740
DaibyDai_UCgS7sRyvIFwoYFOhOKmi6g_SmHCyfa6zaA_82491_83115.wav,DaibyDai_UCgS7sRyvIFwoYFOhOKmi6g_SmHCyfa6zaA,82491,83115,624,15,but,1,0,0,0,0,0,0,DY,2021-08-30 15:13:55.276651
DaibyDai_UCgS7sRyvIFwoYFOhOKmi6g_SmHCyfa6zaA_83339_91331.wav,DaibyDai_UCgS7sRyvIFwoYFOhOKmi6g_SmHCyfa6zaA,83339,91331,7992,16,Seattle for college so a long story short uh born and partially raised in Illinois and now,1,0,0,0,0,0,0,DY,2021-08-30 15:14:09.153070
DaibyDai_UCgS7sRyvIFwoYFOhOKmi6g_SmHCyfa6zaA_91539_93527.wav,DaibyDai_UCgS7sRyvIFwoYFOhOKmi6g_SmHCyfa6zaA,91539,93527,1988,17,in Seattle Washington so,1,0,0,0,0,0,0,DY,2021-08-30 15:14:20.906491
DaibyDai_UCgS7sRyvIFwoYFOhOKmi6g_SmHCyfa6zaA_93735_101209.wav,DaibyDai_UCgS7sRyvIFwoYFOhOKmi6g_SmHCyfa6zaA,93735,101209,7474,18,there's my story with that <lgh> next question how tall are you I am five foot five inches,1,0,1,0,0,0,0,DY,2021-08-30 15:14:39.843724
DaibyDai_UCgS7sRyvIFwoYFOhOKmi6g_SmHCyfa6zaA_101609_105611.wav,DaibyDai_UCgS7sRyvIFwoYFOhOKmi6g_SmHCyfa6zaA,101609,105611,4002,19,I've been five five since seventh grade I thought I was gonna get taller,1,0,0,0,0,0,0,DY,2021-08-30 15:14:48.246138
DaibyDai_UCgS7sRyvIFwoYFOhOKmi6g_SmHCyfa6zaA_105787_106723.wav,DaibyDai_UCgS7sRyvIFwoYFOhOKmi6g_SmHCyfa6zaA,105787,106723,936,20,but,1,0,0,0,0,0,0,DY,2021-08-30 15:14:55.411513
DaibyDai_UCgS7sRyvIFwoYFOhOKmi6g_SmHCyfa6zaA_106907_109587.wav,DaibyDai_UCgS7sRyvIFwoYFOhOKmi6g_SmHCyfa6zaA,106907,109587,2680,21,I've been five five since I was twelve years old so,1,0,0,0,0,0,0,DY,2021-08-30 15:15:03.321552
DaibyDai_UCgS7sRyvIFwoYFOhOKmi6g_SmHCyfa6zaA_109843_115331.wav,DaibyDai_UCgS7sRyvIFwoYFOhOKmi6g_SmHCyfa6zaA,109843,115331,5488,22,how many siblings do you have I have one older sister she is thirty one years old,1,0,0,0,0,0,0,DY,2021-08-30 15:15:23.867146
DaibyDai_UCgS7sRyvIFwoYFOhOKmi6g_SmHCyfa6zaA_115483_118235.wav,DaibyDai_UCgS7sRyvIFwoYFOhOKmi6g_SmHCyfa6zaA,115483,118235,2752,23,um so that means we are nine years apart,1,0,0,0,0,0,0,DY,2021-08-30 15:15:31.866919
DaibyDai_UCgS7sRyvIFwoYFOhOKmi6g_SmHCyfa6zaA_118403_129091.wav,DaibyDai_UCgS7sRyvIFwoYFOhOKmi6g_SmHCyfa6zaA,118403,129091,10688,24,and yeah she lives in the same area is this your first channel yes this is my first channel um I started a YouTube channel if you scroll all the way back my first video was about,1,0,0,0,0,0,0,DY,2021-08-30 15:15:47.821174
DaibyDai_UCgS7sRyvIFwoYFOhOKmi6g_SmHCyfa6zaA_129243_140715.wav,DaibyDai_UCgS7sRyvIFwoYFOhOKmi6g_SmHCyfa6zaA,129243,140715,11472,25,five years ago was_unn it_unn five_unn years_unn five years ago and it was just me and my friend dancing in bathroom in high school um but yeah this is my first channel um I'm pretty sure I changed the name right around,1,0,0,1,0,0,0,DY,2021-08-30 15:16:24.151357
DaibyDai_UCgS7sRyvIFwoYFOhOKmi6g_SmHCyfa6zaA_140899_154275.wav,DaibyDai_UCgS7sRyvIFwoYFOhOKmi6g_SmHCyfa6zaA,140899,154275,13376,26,probably last June when I started to do like hair videos and I wanted it to coincide with the name of my blog day by day um yeah so it was originally called diva Daizha and I just changed the use- username to fit my new theme,1,0,0,0,0,0,0,DY,2021-08-30 15:17:52.330006
DaibyDai_UCgS7sRyvIFwoYFOhOKmi6g_SmHCyfa6zaA_154451_155475.wav,DaibyDai_UCgS7sRyvIFwoYFOhOKmi6g_SmHCyfa6zaA,154451,155475,1024,27,so,1,0,0,0,0,0,0,DY,2021-08-30 15:17:59.833949
DaibyDai_UCgS7sRyvIFwoYFOhOKmi6g_SmHCyfa6zaA_155755_157803.wav,DaibyDai_UCgS7sRyvIFwoYFOhOKmi6g_SmHCyfa6zaA,155755,157803,2048,28,yeah um so,1,0,0,0,0,0,0,DY,2021-08-30 15:18:15.020423
DaibyDai_UCgS7sRyvIFwoYFOhOKmi6g_SmHCyfa6zaA_158307_162621.wav,DaibyDai_UCgS7sRyvIFwoYFOhOKmi6g_SmHCyfa6zaA,158307,162621,4314,29,within the past five years I uploaded a couple dance videos back in high school,1,0,0,0,0,0,0,DY,2021-08-30 15:18:30.895202
DaibyDai_UCgS7sRyvIFwoYFOhOKmi6g_SmHCyfa6zaA_162725_170229.wav,DaibyDai_UCgS7sRyvIFwoYFOhOKmi6g_SmHCyfa6zaA,162725,170229,7504,30,then I like restarted trying to do like hair videos in twenty sixteen and when I studied abroad I was uploading some frequent uh,1,0,0,0,0,0,0,DY,2021-08-30 15:18:48.903158
DaibyDai_UCgS7sRyvIFwoYFOhOKmi6g_SmHCyfa6zaA_170341_180471.wav,DaibyDai_UCgS7sRyvIFwoYFOhOKmi6g_SmHCyfa6zaA,170341,180471,10130,31,um study abroad vlogs when I was travelling throughout Europe and now I'm back here with a new you know new plan to upload content more frequently and,1,0,0,0,0,0,0,DY,2021-08-30 15:19:02.808318
DaibyDai_UCgS7sRyvIFwoYFOhOKmi6g_SmHCyfa6zaA_180647_180971.wav,DaibyDai_UCgS7sRyvIFwoYFOhOKmi6g_SmHCyfa6zaA,180647,180971,324,32,y'know,1,0,0,0,0,0,0,DY,2021-08-30 15:19:19.427531
DaibyDai_UCgS7sRyvIFwoYFOhOKmi6g_SmHCyfa6zaA_181707_184347.wav,DaibyDai_UCgS7sRyvIFwoYFOhOKmi6g_SmHCyfa6zaA,181707,184347,2640,33,qua- qual- more quality content I guess,1,0,0,0,0,0,0,DY,2021-08-30 15:19:36.657237
DaibyDai_UCgS7sRyvIFwoYFOhOKmi6g_SmHCyfa6zaA_185035_186812.wav,DaibyDai_UCgS7sRyvIFwoYFOhOKmi6g_SmHCyfa6zaA,185035,186812,1777,34,what is your channel about,1,0,0,0,0,0,0,DY,2021-08-30 15:19:42.678066
DaibyDai_UCgS7sRyvIFwoYFOhOKmi6g_SmHCyfa6zaA_186948_196365.wav,DaibyDai_UCgS7sRyvIFwoYFOhOKmi6g_SmHCyfa6zaA,186948,196365,9417,35,day by day is about taking things step by step and day by day so what that means basically so with travel taking that day by day my natural hair journey,1,0,0,0,0,0,0,DY,2021-08-30 15:19:58.383581
DaibyDai_UCgS7sRyvIFwoYFOhOKmi6g_SmHCyfa6zaA_196469_198541.wav,DaibyDai_UCgS7sRyvIFwoYFOhOKmi6g_SmHCyfa6zaA,196469,198541,2072,36,it is day by day even though y'know,1,0,0,0,0,0,0,DY,2021-08-30 15:20:05.738233
DaibyDai_UCgS7sRyvIFwoYFOhOKmi6g_SmHCyfa6zaA_198653_205485.wav,DaibyDai_UCgS7sRyvIFwoYFOhOKmi6g_SmHCyfa6zaA,198653,205485,6832,37,you think you know everything about your hair and then year three you have to figure out how to keep it moisturized still with the new length so,1,0,0,0,0,0,0,DY,2021-08-30 15:20:27.137368
DaibyDai_UCgS7sRyvIFwoYFOhOKmi6g_SmHCyfa6zaA_205589_217141.wav,DaibyDai_UCgS7sRyvIFwoYFOhOKmi6g_SmHCyfa6zaA,205589,217141,11552,38,everything really is day by day with life in my twenties as- thirties fourties fifties sixties everything really is a day by day process and so my channel is about doing the things that I love things that I like things that I'm learning I just wanna,1,0,0,0,0,0,0,DY,2021-08-30 15:20:58.423345
DaibyDai_UCgS7sRyvIFwoYFOhOKmi6g_SmHCyfa6zaA_217269_218023.wav,DaibyDai_UCgS7sRyvIFwoYFOhOKmi6g_SmHCyfa6zaA,217269,218023,754,39,share,1,0,0,0,0,0,0,DY,2021-08-30 15:21:03.640451
DaibyDai_UCgS7sRyvIFwoYFOhOKmi6g_SmHCyfa6zaA_218327_224171.wav,DaibyDai_UCgS7sRyvIFwoYFOhOKmi6g_SmHCyfa6zaA,218327,224171,5844,40,my journey with other viewers and also just do something I like I really like creating and,1,0,0,0,0,0,0,DY,2021-08-30 15:21:23.747850
DaibyDai_UCgS7sRyvIFwoYFOhOKmi6g_SmHCyfa6zaA_224603_233267.wav,DaibyDai_UCgS7sRyvIFwoYFOhOKmi6g_SmHCyfa6zaA,224603,233267,8664,41,y'know doing things that are fun I love hair so just like y'know putting my own creative spirit out there y'know having my own piece of,1,0,0,0,0,0,0,DY,2021-08-30 15:21:56.778772
DaibyDai_UCgS7sRyvIFwoYFOhOKmi6g_SmHCyfa6zaA_233523_234955.wav,DaibyDai_UCgS7sRyvIFwoYFOhOKmi6g_SmHCyfa6zaA,233523,234955,1432,42,YouTube piece of the internet I guess,1,0,0,0,0,0,0,DY,2021-08-30 15:22:06.326882
DaibyDai_UCgS7sRyvIFwoYFOhOKmi6g_SmHCyfa6zaA_235155_248083.wav,DaibyDai_UCgS7sRyvIFwoYFOhOKmi6g_SmHCyfa6zaA,235155,248083,12928,43,why should anyone subscribe to your channel you should subscribe to my channel to become a daisy but basically I'll be doing some fun DIY tutorials for natural hair um I think I'll be having some creative,1,0,0,0,0,0,0,DY,2021-08-30 15:22:23.818541
DaibyDai_UCgS7sRyvIFwoYFOhOKmi6g_SmHCyfa6zaA_248443_254683.wav,DaibyDai_UCgS7sRyvIFwoYFOhOKmi6g_SmHCyfa6zaA,248443,254683,6240,44,content coming up y'know based on my natural hair journey subscribe for some college advice I'm almost,1,0,0,0,0,0,0,DY,2021-08-30 15:22:35.133331
DaibyDai_UCgS7sRyvIFwoYFOhOKmi6g_SmHCyfa6zaA_255043_257267.wav,DaibyDai_UCgS7sRyvIFwoYFOhOKmi6g_SmHCyfa6zaA,255043,257267,2224,45,a graduate so I could my,1,0,0,0,0,0,0,DY,2021-08-30 15:22:41.946838
DaibyDai_UCgS7sRyvIFwoYFOhOKmi6g_SmHCyfa6zaA_257387_260419.wav,DaibyDai_UCgS7sRyvIFwoYFOhOKmi6g_SmHCyfa6zaA,257387,260419,3032,46,college student y'know study abroad,1,0,0,0,0,0,0,DY,2021-08-30 15:23:15.080851
DaibyDai_UCgS7sRyvIFwoYFOhOKmi6g_SmHCyfa6zaA_260499_269523.wav,DaibyDai_UCgS7sRyvIFwoYFOhOKmi6g_SmHCyfa6zaA,260499,269523,9024,47,interviews securing the bag getting a job things of that nature so um I really hope to share things like that subscribe for inspiration whether that is,1,0,0,0,0,0,0,DY,2021-08-30 15:23:42.100568
DaibyDai_UCgS7sRyvIFwoYFOhOKmi6g_SmHCyfa6zaA_269619_272891.wav,DaibyDai_UCgS7sRyvIFwoYFOhOKmi6g_SmHCyfa6zaA,269619,272891,3272,48,with traveling how to travel on a budget how to study abroad,1,0,0,0,0,0,0,DY,2021-08-30 15:23:54.850500
DaibyDai_UCgS7sRyvIFwoYFOhOKmi6g_SmHCyfa6zaA_273043_273851.wav,DaibyDai_UCgS7sRyvIFwoYFOhOKmi6g_SmHCyfa6zaA,273043,273851,808,49,on a budget,1,0,0,0,0,0,0,DY,2021-08-30 15:23:59.299412
DaibyDai_UCgS7sRyvIFwoYFOhOKmi6g_SmHCyfa6zaA_273955_281083.wav,DaibyDai_UCgS7sRyvIFwoYFOhOKmi6g_SmHCyfa6zaA,273955,281083,7128,50,basically subscribe for some positive vibes some good content some creative content and a smiling face,1,0,0,0,0,0,0,DY,2021-08-30 15:24:25.226140
DaibyDai_UCgS7sRyvIFwoYFOhOKmi6g_SmHCyfa6zaA_283155_293435.wav,DaibyDai_UCgS7sRyvIFwoYFOhOKmi6g_SmHCyfa6zaA,283155,293435,10280,51,ok um where do you see yourself and your YouTube channel in five years so in five years I can't believe the question there's no question of my age well,1,0,0,0,0,0,0,DY,2021-08-30 15:24:54.822039
DaibyDai_UCgS7sRyvIFwoYFOhOKmi6g_SmHCyfa6zaA_294299_299739.wav,DaibyDai_UCgS7sRyvIFwoYFOhOKmi6g_SmHCyfa6zaA,294299,299739,5440,52,anyway in five years I will be twenty seven years old Wow_unn,1,0,0,1,0,0,0,DY,2021-08-30 15:25:34.977827
DaibyDai_UCgS7sRyvIFwoYFOhOKmi6g_SmHCyfa6zaA_301699_316260.wav,DaibyDai_UCgS7sRyvIFwoYFOhOKmi6g_SmHCyfa6zaA,301699,316260,14561,53,dang_unn <lgh> well that- that honestly that lowkey sounds like_unn whoa_unn you're_unn like_unn almost_unn thirty_unn you're basically thirty so okay I see myself at twenty seven years old I like just see myself just like living out my dream traveling,1,0,0,1,0,0,0,DY,2021-08-30 15:27:42.613587
DaibyDai_UCgS7sRyvIFwoYFOhOKmi6g_SmHCyfa6zaA_316364_319580.wav,DaibyDai_UCgS7sRyvIFwoYFOhOKmi6g_SmHCyfa6zaA,316364,319580,3216,54,every month couple times a month um,1,0,0,0,0,0,0,DY,2021-08-30 15:27:51.930243
DaibyDai_UCgS7sRyvIFwoYFOhOKmi6g_SmHCyfa6zaA_319724_319829.wav,DaibyDai_UCgS7sRyvIFwoYFOhOKmi6g_SmHCyfa6zaA,319724,319829,105,55,,0,0,0,0,0,1,0,DY,2021-08-30 15:27:56.614266
DaibyDai_UCgS7sRyvIFwoYFOhOKmi6g_SmHCyfa6zaA_320029_325159.wav,DaibyDai_UCgS7sRyvIFwoYFOhOKmi6g_SmHCyfa6zaA,320029,325159,5130,56,myself I see my hair just like waist length it better be waist length in five years,1,0,0,0,0,0,0,DY,2021-08-30 15:28:22.119156
DaibyDai_UCgS7sRyvIFwoYFOhOKmi6g_SmHCyfa6zaA_325391_326631.wav,DaibyDai_UCgS7sRyvIFwoYFOhOKmi6g_SmHCyfa6zaA,325391,326631,1240,57,it has to be,1,0,0,0,0,0,0,DY,2021-08-30 15:28:27.671387
DaibyDai_UCgS7sRyvIFwoYFOhOKmi6g_SmHCyfa6zaA_326759_340111.wav,DaibyDai_UCgS7sRyvIFwoYFOhOKmi6g_SmHCyfa6zaA,326759,340111,13352,58,creating things that are mine having my own business um my own brand my own business working for myself so I see day by day as a global brand that inspires and encourages young women of color to be,1,0,0,0,0,0,0,DY,2021-08-30 15:29:04.865964
DaibyDai_UCgS7sRyvIFwoYFOhOKmi6g_SmHCyfa6zaA_340239_352855.wav,DaibyDai_UCgS7sRyvIFwoYFOhOKmi6g_SmHCyfa6zaA,340239,352855,12616,59,their best selves and taking it step by step and day by day and whatever it means to them so um helping women all over the- the world with self care natural hair um entrepreneurship,1,0,0,0,0,0,0,DY,2021-08-30 15:29:23.760548
DaibyDai_UCgS7sRyvIFwoYFOhOKmi6g_SmHCyfa6zaA_353007_356327.wav,DaibyDai_UCgS7sRyvIFwoYFOhOKmi6g_SmHCyfa6zaA,353007,356327,3320,60,and really like helping other women start their own businesses,1,0,1,0,0,0,0,DY,2021-08-30 15:29:37.401928
DaibyDai_UCgS7sRyvIFwoYFOhOKmi6g_SmHCyfa6zaA_356575_358723.wav,DaibyDai_UCgS7sRyvIFwoYFOhOKmi6g_SmHCyfa6zaA,356575,358723,2148,61,that's where I see it like in a big scale of things,1,0,0,0,0,0,0,DY,2021-08-30 15:29:48.927565
DaibyDai_UCgS7sRyvIFwoYFOhOKmi6g_SmHCyfa6zaA_359227_361411.wav,DaibyDai_UCgS7sRyvIFwoYFOhOKmi6g_SmHCyfa6zaA,359227,361411,2184,62,day by day is gonna be something that,1,0,0,0,0,0,0,DY,2021-08-30 15:29:52.932938
DaibyDai_UCgS7sRyvIFwoYFOhOKmi6g_SmHCyfa6zaA_361867_366735.wav,DaibyDai_UCgS7sRyvIFwoYFOhOKmi6g_SmHCyfa6zaA,361867,366735,4868,63,makes a stand in the world so yeah that's business side YouTube,1,0,0,0,0,0,0,DY,2021-08-30 15:30:03.658628
DaibyDai_UCgS7sRyvIFwoYFOhOKmi6g_SmHCyfa6zaA_367015_368297.wav,DaibyDai_UCgS7sRyvIFwoYFOhOKmi6g_SmHCyfa6zaA,367015,368297,1282,64,in five years,1,0,0,0,0,0,0,DY,2021-08-30 15:30:11.043254
DaibyDai_UCgS7sRyvIFwoYFOhOKmi6g_SmHCyfa6zaA_368537_376843.wav,DaibyDai_UCgS7sRyvIFwoYFOhOKmi6g_SmHCyfa6zaA,368537,376843,8306,65,let's say a million subscribers in five years I see day by day having one million subscribers with lots of um,1,0,0,0,0,0,0,DY,2021-08-30 15:30:25.195543
DaibyDai_UCgS7sRyvIFwoYFOhOKmi6g_SmHCyfa6zaA_377243_386523.wav,DaibyDai_UCgS7sRyvIFwoYFOhOKmi6g_SmHCyfa6zaA,377243,386523,9280,66,collaborations with other youtu- other youtubers my favorite brands doing collaborations having my uh my input with,1,0,0,0,0,0,0,DY,2021-08-30 15:30:50.617334
DaibyDai_UCgS7sRyvIFwoYFOhOKmi6g_SmHCyfa6zaA_386827_388435.wav,DaibyDai_UCgS7sRyvIFwoYFOhOKmi6g_SmHCyfa6zaA,386827,388435,1608,67,brand um,1,0,0,0,0,0,0,DY,2021-08-30 15:31:03.473521
DaibyDai_UCgS7sRyvIFwoYFOhOKmi6g_SmHCyfa6zaA_388699_401467.wav,DaibyDai_UCgS7sRyvIFwoYFOhOKmi6g_SmHCyfa6zaA,388699,401467,12768,68,product product marketing product innovations just being in um having my creative insight to help other brands um but also uh having day by day as a brand that is a major staple in the natural hair world,1,0,0,0,0,0,0,DY,2021-08-30 15:31:40.024047
DaibyDai_UCgS7sRyvIFwoYFOhOKmi6g_SmHCyfa6zaA_401619_405251.wav,DaibyDai_UCgS7sRyvIFwoYFOhOKmi6g_SmHCyfa6zaA,401619,405251,3632,69,so big dreams big dreams with YouTube um,1,0,0,0,0,0,0,DY,2021-08-30 15:31:56.100714
DaibyDai_UCgS7sRyvIFwoYFOhOKmi6g_SmHCyfa6zaA_405443_406995.wav,DaibyDai_UCgS7sRyvIFwoYFOhOKmi6g_SmHCyfa6zaA,405443,406995,1552,70,also crossing it,1,0,0,0,0,0,0,DY,2021-08-30 15:32:05.049294
DaibyDai_UCgS7sRyvIFwoYFOhOKmi6g_SmHCyfa6zaA_407339_414923.wav,DaibyDai_UCgS7sRyvIFwoYFOhOKmi6g_SmHCyfa6zaA,407339,414923,7584,71,as in one whole brand YouTube um my day by day blog I see day by day apparel,1,0,0,0,0,0,0,DY,2021-08-30 15:32:29.451539
DaibyDai_UCgS7sRyvIFwoYFOhOKmi6g_SmHCyfa6zaA_415075_417275.wav,DaibyDai_UCgS7sRyvIFwoYFOhOKmi6g_SmHCyfa6zaA,415075,417275,2200,72,I see some day by day,1,0,0,0,0,0,0,DY,2021-08-30 15:32:36.720740
DaibyDai_UCgS7sRyvIFwoYFOhOKmi6g_SmHCyfa6zaA_417435_431355.wav,DaibyDai_UCgS7sRyvIFwoYFOhOKmi6g_SmHCyfa6zaA,417435,431355,13920,73,apps coming out you're about to have some day by day journals and planners some day by day hair products some day by day travel gear all of that five years let's get it <lgh>,1,0,0,0,0,0,0,DY,2021-08-30 15:32:56.559780
DaibyDai_UCgS7sRyvIFwoYFOhOKmi6g_SmHCyfa6zaA_431515_443087.wav,DaibyDai_UCgS7sRyvIFwoYFOhOKmi6g_SmHCyfa6zaA,431515,443087,11572,74,gotta dream big y'know I see it I see it who are some of your favorite youtubers some of my favorite youtubers oh my gosh I wish I had all the names memorized I don't know them uh the names by heart,1,0,0,0,0,0,0,DY,2021-08-30 15:33:13.489980
DaibyDai_UCgS7sRyvIFwoYFOhOKmi6g_SmHCyfa6zaA_443247_448815.wav,DaibyDai_UCgS7sRyvIFwoYFOhOKmi6g_SmHCyfa6zaA,443247,448815,5568,75,but uh nappyfu is fun <lgh> she has four C hair just like I do,1,0,0,0,0,0,0,DY,2021-08-30 15:33:39.336888
DaibyDai_UCgS7sRyvIFwoYFOhOKmi6g_SmHCyfa6zaA_448975_454987.wav,DaibyDai_UCgS7sRyvIFwoYFOhOKmi6g_SmHCyfa6zaA,448975,454987,6012,76,Jackie aina for makeup I don't know to do that much ar- uh,1,0,0,0,0,0,0,DY,2021-08-30 15:33:56.478617
DaibyDai_UCgS7sRyvIFwoYFOhOKmi6g_SmHCyfa6zaA_455435_461531.wav,DaibyDai_UCgS7sRyvIFwoYFOhOKmi6g_SmHCyfa6zaA,455435,461531,6096,77,advanced makeup like that as you see I keep it pretty simple but I'm getting there I'm gonna,1,0,1,0,0,0,0,DY,2021-08-30 15:34:20.984815
DaibyDai_UCgS7sRyvIFwoYFOhOKmi6g_SmHCyfa6zaA_461835_467357.wav,DaibyDai_UCgS7sRyvIFwoYFOhOKmi6g_SmHCyfa6zaA,461835,467357,5522,78,get a nice beat one of these days patricia bright I'm kinda naming all the big huge ones but it's okay,1,0,0,0,0,0,0,DY,2021-08-30 15:34:50.010536
DaibyDai_UCgS7sRyvIFwoYFOhOKmi6g_SmHCyfa6zaA_467525_475143.wav,DaibyDai_UCgS7sRyvIFwoYFOhOKmi6g_SmHCyfa6zaA,467525,475143,7618,79,um natural natural eighty five you know Whitney I'll post them all below cuz I really can't memorize,1,0,0,0,0,0,0,DY,2021-08-30 15:35:04.805058
DaibyDai_UCgS7sRyvIFwoYFOhOKmi6g_SmHCyfa6zaA_475359_477219.wav,DaibyDai_UCgS7sRyvIFwoYFOhOKmi6g_SmHCyfa6zaA,475359,477219,1860,80,y'know the usernames like that I just feel like,1,0,0,0,0,0,0,DY,2021-08-30 15:35:13.386172
DaibyDai_UCgS7sRyvIFwoYFOhOKmi6g_SmHCyfa6zaA_477531_478303.wav,DaibyDai_UCgS7sRyvIFwoYFOhOKmi6g_SmHCyfa6zaA,477531,478303,772,81,watchin' stuff-,1,0,0,0,0,0,0,DY,2021-08-30 15:35:25.952571
DaibyDai_UCgS7sRyvIFwoYFOhOKmi6g_SmHCyfa6zaA_478439_487291.wav,DaibyDai_UCgS7sRyvIFwoYFOhOKmi6g_SmHCyfa6zaA,478439,487291,8852,82,so advice for new youtubers be consistent and make videos that you're actually interested in because it'll be more fun to actually edit,1,0,0,0,0,0,0,DY,2021-08-30 15:35:55.011472
DaibyDai_UCgS7sRyvIFwoYFOhOKmi6g_SmHCyfa6zaA_487403_494571.wav,DaibyDai_UCgS7sRyvIFwoYFOhOKmi6g_SmHCyfa6zaA,487403,494571,7168,83,and you'll be more inspired to actually post it being consistent is my own like advice for myself,1,0,0,0,0,0,0,DY,2021-08-30 15:36:06.939377
DaibyDai_UCgS7sRyvIFwoYFOhOKmi6g_SmHCyfa6zaA_494675_506111.wav,DaibyDai_UCgS7sRyvIFwoYFOhOKmi6g_SmHCyfa6zaA,494675,506111,11436,84,and to you that's all the questions for the new youtuber tag um it was fun pretty simple to answer the questions about yourself so if you're a new youtuber tag you're it <lgh>,1,0,0,0,0,0,0,DY,2021-08-30 15:36:36.334721
DaibyDai_UCgS7sRyvIFwoYFOhOKmi6g_SmHCyfa6zaA_506255_509483.wav,DaibyDai_UCgS7sRyvIFwoYFOhOKmi6g_SmHCyfa6zaA,506255,509483,3228,85,no one tagged me but just thought I'd hop along but,1,0,0,0,0,0,0,DY,2021-08-30 15:36:43.882471
DaibyDai_UCgS7sRyvIFwoYFOhOKmi6g_SmHCyfa6zaA_510163_513515.wav,DaibyDai_UCgS7sRyvIFwoYFOhOKmi6g_SmHCyfa6zaA,510163,513515,3352,86,thank you for watching this video don't forget to like comment and,1,0,0,0,0,0,0,DY,2021-08-30 15:37:01.222344
DaibyDai_UCgS7sRyvIFwoYFOhOKmi6g_SmHCyfa6zaA_513795_514099.wav,DaibyDai_UCgS7sRyvIFwoYFOhOKmi6g_SmHCyfa6zaA,513795,514099,304,87,cribe-,0,0,0,0,0,0,0,DY,2021-08-30 15:37:12.402031
DaibyDai_UCgS7sRyvIFwoYFOhOKmi6g_SmHCyfa6zaA_514459_516747.wav,DaibyDai_UCgS7sRyvIFwoYFOhOKmi6g_SmHCyfa6zaA,514459,516747,2288,88,and of course take it step by step and day by day,1,0,0,0,0,0,0,DY,2021-08-30 15:37:29.590395
