filename,video_id,start_time,end_time,duration,id,transcription,usability,bg_music,bg_noise,other_voice,only_music,only_noise,other_sounds,annotator,annotate_date_YYYYMMDD
DaibyDai_UCgS7sRyvIFwoYFOhOKmi6g_R8CmQ9PurvY_549295_553407.wav,DaibyDai_UCgS7sRyvIFwoYFOhOKmi6g_R8CmQ9PurvY,549295,553407,4112,119,<lgh> that's a bad example but really I need to eat and wash <unk>,1,0,0,0,0,0,0,DY,12:30.7
DaibyDai_UCgS7sRyvIFwoYFOhOKmi6g_R8CmQ9PurvY_553703_555087.wav,DaibyDai_UCgS7sRyvIFwoYFOhOKmi6g_R8CmQ9PurvY,553703,555087,1384,120,during that time so,1,0,0,0,0,0,0,DY,12:43.8
DaibyDai_UCgS7sRyvIFwoYFOhOKmi6g_R8CmQ9PurvY_555527_557591.wav,DaibyDai_UCgS7sRyvIFwoYFOhOKmi6g_R8CmQ9PurvY,555527,557591,2064,121,Imma try to be responsible and take it off at,1,0,0,0,0,0,0,DY,12:51.0
DaibyDai_UCgS7sRyvIFwoYFOhOKmi6g_R8CmQ9PurvY_557935_565753.wav,DaibyDai_UCgS7sRyvIFwoYFOhOKmi6g_R8CmQ9PurvY,557935,565753,7818,122,a good amount of time- alright- and just like that another successful wash day has been completed I'm all done deep conditioning my hair,1,0,0,0,0,0,0,DY,13:16.9
DaibyDai_UCgS7sRyvIFwoYFOhOKmi6g_R8CmQ9PurvY_565889_570769.wav,DaibyDai_UCgS7sRyvIFwoYFOhOKmi6g_R8CmQ9PurvY,565889,570769,4880,123,and just gonna put it in four sections four like giant bantu knots wrap my hair,1,0,0,0,0,0,0,DY,13:33.7
DaibyDai_UCgS7sRyvIFwoYFOhOKmi6g_R8CmQ9PurvY_570913_581109.wav,DaibyDai_UCgS7sRyvIFwoYFOhOKmi6g_R8CmQ9PurvY,570913,581109,10196,124,and call it a day thank you all for watching my video don't forget to Like comment and subscribe I'm officially doing one video a week so new videos every Sunday,1,0,1,0,0,0,0,DY,13:48.8
DaibyDai_UCgS7sRyvIFwoYFOhOKmi6g_R8CmQ9PurvY_581237_585421.wav,DaibyDai_UCgS7sRyvIFwoYFOhOKmi6g_R8CmQ9PurvY,581237,585421,4184,125,and yeah stay tuned for more content as always take it step by s-,1,0,1,0,0,0,0,DY,13:59.3
DaibyDai_UCgS7sRyvIFwoYFOhOKmi6g_R8CmQ9PurvY_585637_590385.wav,DaibyDai_UCgS7sRyvIFwoYFOhOKmi6g_R8CmQ9PurvY,585637,590385,4748,126,see I almost made it through one video without Spencer coming into it he's-,1,0,1,0,0,0,0,DY,14:11.1
DaibyDai_UCgS7sRyvIFwoYFOhOKmi6g_R8CmQ9PurvY_590521_597299.wav,DaibyDai_UCgS7sRyvIFwoYFOhOKmi6g_R8CmQ9PurvY,590521,597299,6778,127,okay he asked to make an appearance you guys um so as always take it step by step and day by day,1,0,0,0,0,0,0,DY,14:24.8
