yt_id,author,code,name,ID,url,title,description,keywords,length,publish_date,views,rating,captions,scrape_time,corrected
zYLsz3BAlTQ,Teleah Miranda,TM,TeleahMiranda,UC7zIxbN6IR8BA5PqeSnmtQ,https://www.youtube.com/watch?v=zYLsz3BAlTQ,"PREGNANCY Q&A | Cravings, Baby Names, & More!","Hey Guys!   Thank you to those who sent me questions via instagram.  I tried to get through all of them but my video would have been too long.   Thank you for tuning in today!  XOXO, Teleah  ______________________________________________________________  FOLLOW ME ON...  instagram: @teleahmiranda snapchat: @sillytilly11 email (business purposes only): teleahmiranda@gmail.com  ______________________________________________________________  MUSIC BY JOAKIM KARUD https://www.youtube.com/joakimkarud","['pregnancy', 'q&a', 'pregnancy q&a', 'pregnancy cravings', 'pregnant', 'young and pregnant', 'baby boy', 'gender', 'baby names', 'gender reveal', 'story time', 'baby bump', 'bumpdate', 'cravings']",1022,2019-04-25 00:00:00,156,4.6923075,"[('a.en', 'English (auto-generated)')]",2021-08-06_11:33:05,0
cdar6iWzqNw,JayelynJanine,J,JayelynJanine,UC860cozg2pvSAbJsWsg4sQ,https://www.youtube.com/watch?v=cdar6iWzqNw,THE BLACK GIRL TAG,Hey guys! In this video I answer common black girl questions!! I hope you enjoy!    ♡  SUBSCRIBE TO MY YOUTUBE CHANEL: https://www.youtube.com/channel/UC860...  ♡  CHECK OUT MY LAST VIDEO:   ♥ APARTMENT HUNTING | TIPS FOR FINDING YOUR FIRST APARTMENT https://www.youtube.com/watch?v=CA9UMxnV5TQ&t=7s   ♡  MY OTHER VIDEOS VIDEOS: BEGINNER SKIN CARE ROUTINE FOR DRY SKIN https://www.youtube.com/watch?v=DIdTU...  ♥ HOW TO: BRAIDLESS CROCHET HAIRSTYLE |HALF UP HALF DOWN | 4C HAIR https://www.youtube.com/watch?v=4-79p...  ♥ APARTMENT HUNTING IN HOUSTON 2019 https://www.youtube.com/watch?v=Z5ex5...   ♥ SISTER TAG https://www.youtube.com/watch?v=4FMuB...    0:00:00 I Sneaky Adventure  Sneaky Adventure by Kevin MacLeod https://incompetech.com/ Promoted by MrSnooze https://youtu.be/I2m1h0ALpY4 Creative Commons — CC BY 3.0 https://goo.gl/A7jRXA   #Blackgirltag #blackwomen,"['Black girl tag', 'black girl questions', 'common black girl tag', 'natural hair', 'natural', 'black women', 'common white girl tag', 'the common black girl tag', 'black beauty guru', 'challenge', 'tag', 'black girls rock', 'new and improved black girl tag', 'black girl tag', 'black lives matter']",1017,2019-12-21 00:00:00,496,5.0,"[('a.en', 'English (auto-generated)')]",2021-08-06_11:33:10,0
Egoxe0DkLA,Anna Gantt,AG,AnnaGantt,UClQ6hWSFeiJBWh6lG0Qy1A,https://www.youtube.com/watch?v=Egoxe0D-kLA,chit chat get ready with me,"i love get ready with me videos, so i tried making one of my own. hope you guys enjoy. let me know if you want more!!!  xoxoxoxox anna instagram: avm.mod agency: alexandri models","['makeup', 'get ready with me', 'grwm', 'tutorial', 'life', 'talking', 'asmr', 'beauty', 'style', 'dragoncon', 'long video makeup', 'trich', 'trichotillomania', 'eyelashes', 'ocd']",1033,2017-09-02 00:00:00,380,5.0,"[('a.en', 'English (auto-generated)')]",2021-08-06_11:33:14,0
Oph3wbC0eG8,Kiki Holly,KH,KikiHolly,UCtAnGdJpKplr2BpQzAdF6Pw,https://www.youtube.com/watch?v=Oph3wbC0eG8,GET TO KNOW ME TAG!,In this video get to know me a little bit better. I answer questions from the get to know me tag. Let me know if you have any additional questions!!!  Insta: kikholly,"['get to know me', 'tag', 'get to know me tag', 'q&a', 'questions and answers', 'q & a', 'black girl', 'black vlogger', 'millionaire', 'double upload', 'triple upload', 'intro video', 'travel vlog', 'beyonce', 'intro', 'new youtuber', 'vlogger', 'black', 'black women', 'new vlogger', 'new beauty vlogger', 'about me', 'new youtuber tag', 'small youtuber tag 2018', 'small youtuber tag questions', 'facts about me']",1248,2018-10-21 00:00:00,118,5.0,"[('a.en', 'English (auto-generated)')]",2021-08-06_11:33:19,0
8gDPK84kb2E,Dwa Lew,DL,DwaLew,UCGSBXMYDx6VZ9A5q7GdZew,https://www.youtube.com/watch?v=8gDPK84kb2E,My 23andMe DNA Results !!!!! | African American,"#23andMe #DNAResults  RESULTS START @ 10:59  This video was very fun to make, in no way or form am I trying to be offensive, just a young black girl excited to know a little more about herself! Hope you enjoy ;)  Don't forget to LIKE, COMMENT & SUBSCRIBE!!!   - - -Social Media- - - Instagram: dwa.lew SnapChat: dwa.101 Twitter:dwaneigeez_ Email: dwalew101@gmail.com","['23andMe', 'DNA results', 'African American', 'Black 23andMe', 'Ethnicity', '23andMe results', '23andme dna', 'dna', '23andme ancestry', '23andme test', '23 and me', 'DNA test']",1093,2018-11-03 00:00:00,9420,4.6977777,"[('en', 'English'), ('a.en', 'English (auto-generated)')]",2021-08-06_11:33:24,0
V23cjJ1YU,ThatsSoChey,T,ThatsSoChey,UCveTgb3LAhwrlKv3axH5drw,https://www.youtube.com/watch?v=V23c-jJ_1YU,"LIFE UPDATE GRWM- Dropping Out School, Starting Business, New Starts | ThatsSoChey","I'm sorry yall! Don't stop love mi ------------------------WATCH IN HD! 1080p ----------------------------- COMMENT, LIKE, SHARE, AND SUBSCRIBEEEE!!!  ---------------------------------------- STAY CONNECTED: Email- thatssocheyyy@gmail.com Insta- xocheywilson Twitter- xocheywilson  CAUTION--- I do not own any of the music  Intro, Outro and Banner done by @jaeshayna on instagram","['ThatsSoChey', 'Chit chat grwm', 'GRWM', 'ghosting', 'new start', 'heart break', 'break up', 'dropping out of school', 'moving out', 'love life', 'goals', 'accomplishments', 'business', 'CrownedByChey', 'wig business', 'Dangerous Meek Mill', 'Growth', 'Life Update', 'Business endeavours', 'Life']",1103,2018-11-16 00:00:00,1501,4.920792,"[('a.en', 'English (auto-generated)')]",2021-08-06_11:33:29,0
SmHCyfa6zaA,DaibyDai,D,DaibyDai,UCgS7sRyvIFwoYFOhOKmi6g,https://www.youtube.com/watch?v=SmHCyfa6zaA,Get to Know Me! New Youtuber Tag 2018,Hey Daizies! Here's a video for you all to get to know a little bit about me. Thanks for 200 subscribers! I ended up answering about 11 questions since the remaining 4 were kind of redundant. Here are the questions:  1. What is your name? 2. Where are you from? 3. How tall are you? 4. How many siblings do you have? 5. Is this your first channel? 6. What is your channel about? 7. Why should anyone subscriber to your channel? 8. Where do you see yourself (and your YouTube channel) in 5 years? 9. What inspired you to start making videos? 10. Who are some of your favorite YouTubers? 11. Any advice for new YouTubers?  If you haven't subscribed already go ahead and click that subscribe button! I hope 2018 is going well for you. Take it step by step and daibydai :)  Blog: www.daibydai.com IG: @divadaizha,"['new youtuber', 'daizies', 'daibydai', 'new youtubers in 2018', 'new youtuber tag', 'get to know me', 'facts about me', 'new black youtubers', 'new hair youtubers', 'advice for college freshmen', 'advice for college students', 'lifestyle advice', 'new years resolution', 'advice for new youtubers', 'small black youtube', 'youtuber tag', 'new youtuber tag 2018', 'grow your youtube channel']",517,2018-01-08 00:00:00,298,5.0,"[('a.en', 'English (auto-generated)')]",2021-08-06_11:33:33,0
R8CmQ9PurvY,DaibyDai,D,DaibyDai,UCgS7sRyvIFwoYFOhOKmi6g,https://www.youtube.com/watch?v=R8CmQ9PurvY,Wash Day Chit Chat! How I Learned to Accept My Natural 4C Hair,"Weekly wash day routine with a little conversation. Today I’m using Kreyol Essence’s Deep Conditioner from Imani Beauty Boutique. I deep condition EVERY SINGLE WEEK no matter what. This helps to maintain moisture and hydration for my hair.   In this video I briefly talk about my journey first transitioning to natural hair and then accepting my type of natural hair; kinks, coils and ALL!    Instagram https://www.instagram.com/divadaizha/  Blog https://daibydai.com/  Imani beauty boutique  https://imanibeautyboutique.com/","['product review', 'daibydai', 'natural hair storytime', 'GRWM', 'how to take care of 4c hair', '4c hair goals', 'deep conditioners for 4c hair', 'natural hair goals']",598,2019-10-20 00:00:00,69,4.3333335,"[('a.en', 'English (auto-generated)')]",2021-08-06_11:33:37,0
