filename,video_id,start_time,end_time,duration,id,transcription,usability,bg_music,bg_noise,other_voice,only_music,only_noise,other_sounds,annotator,annotate_date_YYYYMMDD
emmachamberlain_UC78cxCAcp7JfQPgKxYdyGrg_53uiE2rZb44_483184_487520.wav,emmachamberlain_UC78cxCAcp7JfQPgKxYdyGrg_53uiE2rZb44,483184,487520,4336,90,This is also kind of cliche but I don't like things like going to the movies. I don't like things like a dinner,1,0,0,0,0,0,0,RP,2021-06-26 15:21:08.097410
emmachamberlain_UC78cxCAcp7JfQPgKxYdyGrg_53uiE2rZb44_488144_496920.wav,emmachamberlain_UC78cxCAcp7JfQPgKxYdyGrg_53uiE2rZb44,488144,496920,8776,91,Because that's just like really boring to me like just so like awkward well with a movie It's just awkward because you can't talk and it's just weird and then if you like went to dinner? You're like Forced to like,1,0,0,0,0,0,0,RP,2021-06-26 15:21:33.214153
emmachamberlain_UC78cxCAcp7JfQPgKxYdyGrg_53uiE2rZb44_497112_509052.wav,emmachamberlain_UC78cxCAcp7JfQPgKxYdyGrg_53uiE2rZb44,497112,509052,11940,92,"look at the other person in the face, and then they have to watch you eat I don't know just something about that's just too boring um something like really fun like an adventure like Driving somewhere kind of far away like driving to the beach or something like",1,0,0,0,0,0,0,RP,2021-06-26 15:22:09.915040
emmachamberlain_UC78cxCAcp7JfQPgKxYdyGrg_53uiE2rZb44_509188_514836.wav,emmachamberlain_UC78cxCAcp7JfQPgKxYdyGrg_53uiE2rZb44,509188,514836,5648,93,swimming in the ocean at like two AM Or something okay? That's actually good a good one that would be really fun something like that that would be like,1,0,0,0,0,0,0,RP,2021-06-26 15:22:31.889343
emmachamberlain_UC78cxCAcp7JfQPgKxYdyGrg_53uiE2rZb44_514980_516664.wav,emmachamberlain_UC78cxCAcp7JfQPgKxYdyGrg_53uiE2rZb44,514980,516664,1684,94,really memorable and like special,1,0,0,0,0,0,0,RP,2021-06-26 15:22:58.741039
emmachamberlain_UC78cxCAcp7JfQPgKxYdyGrg_53uiE2rZb44_516976_517144.wav,emmachamberlain_UC78cxCAcp7JfQPgKxYdyGrg_53uiE2rZb44,516976,517144,168,95,,0,0,0,0,0,1,0,RP,2021-06-26 15:23:00.943897
emmachamberlain_UC78cxCAcp7JfQPgKxYdyGrg_53uiE2rZb44_517304_527184.wav,emmachamberlain_UC78cxCAcp7JfQPgKxYdyGrg_53uiE2rZb44,517304,527184,9880,96,so what is something you look for in a partner um I'm sixteen and I have basically no experience in this topic But I would say just like somebody who,1,0,0,0,0,0,0,RP,2021-06-26 15:23:34.069924
emmachamberlain_UC78cxCAcp7JfQPgKxYdyGrg_53uiE2rZb44_527520_538266.wav,emmachamberlain_UC78cxCAcp7JfQPgKxYdyGrg_53uiE2rZb44,527520,538266,10746,97,is like willing to put in equal effort into the relationship But also like somebody who you can trust and like the trust is mutual so like you're not worried about like where they are all the time or who they're talking to or whatever like,1,0,0,0,0,0,0,RP,2021-06-26 15:31:02.992003
emmachamberlain_UC78cxCAcp7JfQPgKxYdyGrg_53uiE2rZb44_538514_546100.wav,emmachamberlain_UC78cxCAcp7JfQPgKxYdyGrg_53uiE2rZb44,538514,546100,7586,98,Somebody who like trusts me enough that like I could like hang out with another guy friend and like the guy wouldn't care y'know also Just somebody who's like genuinely kind and like,1,0,0,0,0,0,0,RP,2021-06-26 15:31:17.126988
emmachamberlain_UC78cxCAcp7JfQPgKxYdyGrg_53uiE2rZb44_546396_549156.wav,emmachamberlain_UC78cxCAcp7JfQPgKxYdyGrg_53uiE2rZb44,546396,549156,2760,99,thoughtful of me and my feelings 'cause I'm like emo as f-,1,0,0,0,0,0,0,RP,2021-06-26 15:31:27.123818
emmachamberlain_UC78cxCAcp7JfQPgKxYdyGrg_53uiE2rZb44_549628_556478.wav,emmachamberlain_UC78cxCAcp7JfQPgKxYdyGrg_53uiE2rZb44,549628,556478,6850,100,"no I'm kidding um but like yes, somebody who's like- really like considers your feelings. I'm bad at this stuff. Who is your role model? I would say like",1,0,0,0,0,0,0,RP,2021-06-26 15:31:42.023935
emmachamberlain_UC78cxCAcp7JfQPgKxYdyGrg_53uiE2rZb44_556638_567631.wav,emmachamberlain_UC78cxCAcp7JfQPgKxYdyGrg_53uiE2rZb44,556638,567631,10993,101,definitely my parents. I mean for sure like that's an obvious one I also think like a really inspirational person is like Casey neistat the youtuber. He's a great perso- I don't know. He's really inspirational to me which one of your parents Are you more like,1,0,0,0,0,0,0,RP,2021-06-26 15:32:38.525232
emmachamberlain_UC78cxCAcp7JfQPgKxYdyGrg_53uiE2rZb44_567759_574344.wav,emmachamberlain_UC78cxCAcp7JfQPgKxYdyGrg_53uiE2rZb44,567759,574344,6585,102,"depends like really similar to my dad because we like the same music We like doing the same things he has a Youtube channel, too We both like to like go",1,0,0,0,0,0,0,RP,2021-06-26 15:33:12.928703
emmachamberlain_UC78cxCAcp7JfQPgKxYdyGrg_53uiE2rZb44_574632_583312.wav,emmachamberlain_UC78cxCAcp7JfQPgKxYdyGrg_53uiE2rZb44,574632,583312,8680,103,Like explore in the City and like y'know like get coffee and stuff like that so I think we have a- a lot of like I also think I'm alike with my mom because y'know we both like enjoy it sort Of,1,0,0,0,0,0,0,RP,2021-06-26 15:33:29.561124
emmachamberlain_UC78cxCAcp7JfQPgKxYdyGrg_53uiE2rZb44_583512_588120.wav,emmachamberlain_UC78cxCAcp7JfQPgKxYdyGrg_53uiE2rZb44,583512,588120,4608,104,women parts of life- like life like shopping and like stuff like that So it kind of depends,1,0,0,0,0,0,0,RP,2021-06-26 15:33:43.020643
emmachamberlain_UC78cxCAcp7JfQPgKxYdyGrg_53uiE2rZb44_588320_591352.wav,emmachamberlain_UC78cxCAcp7JfQPgKxYdyGrg_53uiE2rZb44,588320,591352,3032,105,which one of your parents are you closest to this is also kind of like,1,0,0,0,0,0,0,RP,2021-06-26 15:33:53.559920
emmachamberlain_UC78cxCAcp7JfQPgKxYdyGrg_53uiE2rZb44_591744_599240.wav,emmachamberlain_UC78cxCAcp7JfQPgKxYdyGrg_53uiE2rZb44,591744,599240,7496,106,I don't have one or the other I'm close with both equally in like different ways because I'm an only child Only children get really close with their parents,1,0,0,0,0,0,0,RP,2021-06-26 15:34:30.894751
emmachamberlain_UC78cxCAcp7JfQPgKxYdyGrg_53uiE2rZb44_599496_614200.wav,emmachamberlain_UC78cxCAcp7JfQPgKxYdyGrg_53uiE2rZb44,599496,614200,14704,107,so both honestly What is the last book you read um I don't read like I genuinely do not read ever because I hate it I don't know why I just don't like reading unless I find like a really really good book that I like really love I Just don't read so,1,0,0,0,0,0,0,RP,2021-06-26 15:36:33.798273
emmachamberlain_UC78cxCAcp7JfQPgKxYdyGrg_53uiE2rZb44_614632_618322.wav,emmachamberlain_UC78cxCAcp7JfQPgKxYdyGrg_53uiE2rZb44,614632,618322,3690,108,I don't have an answer for that. What is your favorite fairy tale? pfft,1,0,0,0,0,0,0,RP,2021-06-26 15:36:44.880780
emmachamberlain_UC78cxCAcp7JfQPgKxYdyGrg_53uiE2rZb44_618474_623068.wav,emmachamberlain_UC78cxCAcp7JfQPgKxYdyGrg_53uiE2rZb44,618474,623068,4594,109,I don't freaking know like I haven't- like what- what even is a fairy tale like I mean I know but like I don't-,1,0,0,0,0,0,0,RP,2021-06-26 15:36:59.632853
emmachamberlain_UC78cxCAcp7JfQPgKxYdyGrg_53uiE2rZb44_623236_627166.wav,emmachamberlain_UC78cxCAcp7JfQPgKxYdyGrg_53uiE2rZb44,623236,627166,3930,110,I don't Have an answer What is your favorite quote I hate reading quotes,1,0,0,0,0,0,0,RP,2021-06-26 15:37:16.420424
emmachamberlain_UC78cxCAcp7JfQPgKxYdyGrg_53uiE2rZb44_627310_636056.wav,emmachamberlain_UC78cxCAcp7JfQPgKxYdyGrg_53uiE2rZb44,627310,636056,8746,111,out loud like something about that is so corny to me But let me look at my pinterest on my quote board And I'll just read one that I find I'll just keep it simple good things are coming,1,0,0,0,0,0,0,RP,2021-06-26 15:37:33.363061
emmachamberlain_UC78cxCAcp7JfQPgKxYdyGrg_53uiE2rZb44_636592_644712.wav,emmachamberlain_UC78cxCAcp7JfQPgKxYdyGrg_53uiE2rZb44,636592,644712,8120,112,That's a good one remember that kids just keep doing that good mindset. Y'know favorite subject in school um probably science It's the most interesting to me uh,1,0,0,0,0,0,0,RP,2021-06-26 15:38:16.046228
emmachamberlain_UC78cxCAcp7JfQPgKxYdyGrg_53uiE2rZb44_645096_652800.wav,emmachamberlain_UC78cxCAcp7JfQPgKxYdyGrg_53uiE2rZb44,645096,652800,7704,113,"It's also one of the hardest classes in school for me, but I do enjoy science so probably that I like biology more than chemistry",1,0,0,0,0,0,0,RP,2021-06-26 15:38:30.765092
emmachamberlain_UC78cxCAcp7JfQPgKxYdyGrg_53uiE2rZb44_653120_665960.wav,emmachamberlain_UC78cxCAcp7JfQPgKxYdyGrg_53uiE2rZb44,653120,665960,12840,114,"definitely subject you were best at Honestly like depends because like I don't think I'm very like- it depends on like if you mean like which on do I personally think I strive at or like which one has a better grade like that's just different, but like I think I'm",1,0,0,0,0,0,0,RP,2021-06-26 15:39:07.836932
emmachamberlain_UC78cxCAcp7JfQPgKxYdyGrg_53uiE2rZb44_666360_670296.wav,emmachamberlain_UC78cxCAcp7JfQPgKxYdyGrg_53uiE2rZb44,666360,670296,3936,115,"Okay, at like history and stuff like that, but I absolutely hate it",1,0,0,0,0,0,0,RP,2021-06-26 15:39:18.785737
emmachamberlain_UC78cxCAcp7JfQPgKxYdyGrg_53uiE2rZb44_670568_677048.wav,emmachamberlain_UC78cxCAcp7JfQPgKxYdyGrg_53uiE2rZb44,670568,677048,6480,116,"So it's like I dunno like I'm probably better at history and English, than I am at like math and science But like I enjoy math and science more",1,0,0,0,0,0,0,RP,2021-06-26 15:39:39.028629
emmachamberlain_UC78cxCAcp7JfQPgKxYdyGrg_53uiE2rZb44_677664_686976.wav,emmachamberlain_UC78cxCAcp7JfQPgKxYdyGrg_53uiE2rZb44,677664,686976,9312,117,Don't ask me why favorite teacher um honestly? I don't have an answer I liked all of my teachers in Elementary school and the second I got to high school um,1,0,0,0,0,0,0,RP,2021-06-26 15:39:52.448580
emmachamberlain_UC78cxCAcp7JfQPgKxYdyGrg_53uiE2rZb44_688368_688544.wav,emmachamberlain_UC78cxCAcp7JfQPgKxYdyGrg_53uiE2rZb44,688368,688544,176,118,,0,0,0,0,0,1,0,RP,2021-06-26 15:39:57.948843
emmachamberlain_UC78cxCAcp7JfQPgKxYdyGrg_53uiE2rZb44_688976_689736.wav,emmachamberlain_UC78cxCAcp7JfQPgKxYdyGrg_53uiE2rZb44,688976,689736,760,119,the relationships,1,0,0,0,0,0,0,RP,2021-06-26 15:40:08.553091
emmachamberlain_UC78cxCAcp7JfQPgKxYdyGrg_53uiE2rZb44_690312_695024.wav,emmachamberlain_UC78cxCAcp7JfQPgKxYdyGrg_53uiE2rZb44,690312,695024,4712,120,"Weren't as good in high school, and I'm still in high school Yeah, it's just a lot more",1,0,0,0,0,0,0,RP,2021-06-26 15:40:21.928745
emmachamberlain_UC78cxCAcp7JfQPgKxYdyGrg_53uiE2rZb44_695152_702912.wav,emmachamberlain_UC78cxCAcp7JfQPgKxYdyGrg_53uiE2rZb44,695152,702912,7760,121,on the line a lot more tension. So that's that. Who has left the biggest impact on your life? probably my parents because,1,0,0,0,0,0,0,RP,2021-06-26 15:40:37.116819
emmachamberlain_UC78cxCAcp7JfQPgKxYdyGrg_53uiE2rZb44_703680_710444.wav,emmachamberlain_UC78cxCAcp7JfQPgKxYdyGrg_53uiE2rZb44,703680,710444,6764,122,They've always been there my whole entire life So there's really nobody else in this entire universe who could have more of an impact on me than my parents because I've ,1,0,0,0,0,0,0,RP,2021-06-26 15:40:58.920712
emmachamberlain_UC78cxCAcp7JfQPgKxYdyGrg_53uiE2rZb44_710644_714392.wav,emmachamberlain_UC78cxCAcp7JfQPgKxYdyGrg_53uiE2rZb44,710644,714392,3748,123,"been around Them my whole life, and I'm an only child and they're like the biggest influence on me",1,0,0,0,0,0,0,RP,2021-06-26 15:41:09.395288
emmachamberlain_UC78cxCAcp7JfQPgKxYdyGrg_53uiE2rZb44_714520_722756.wav,emmachamberlain_UC78cxCAcp7JfQPgKxYdyGrg_53uiE2rZb44,714520,722756,8236,124,"What app do you use most? Probably Instagram or Visco. What piece of technology could you not live without? Honestly, I don't just have one. Phone, laptop",1,0,0,0,0,0,0,RP,2021-06-26 15:41:24.364627
emmachamberlain_UC78cxCAcp7JfQPgKxYdyGrg_53uiE2rZb44_722956_724784.wav,emmachamberlain_UC78cxCAcp7JfQPgKxYdyGrg_53uiE2rZb44,722956,724784,1828,125,"very important, and camera",1,0,0,0,0,0,0,RP,2021-06-26 15:41:31.486028
emmachamberlain_UC78cxCAcp7JfQPgKxYdyGrg_53uiE2rZb44_725048_732154.wav,emmachamberlain_UC78cxCAcp7JfQPgKxYdyGrg_53uiE2rZb44,725048,732154,7106,126,also very important But if for some reason I couldn't have a camera the phone as the camera so probably phone and laptop. What countries Have you visited,1,0,0,0,0,0,0,RP,2021-06-26 15:41:55.792291
emmachamberlain_UC78cxCAcp7JfQPgKxYdyGrg_53uiE2rZb44_732330_742356.wav,emmachamberlain_UC78cxCAcp7JfQPgKxYdyGrg_53uiE2rZb44,732330,742356,10026,127,"well I've been out of the country twice. I went to Ireland and then I went to the Dominican Republic What countries would you like to visit? If it was up to me, I would visit every country in the entire universe",1,0,0,0,0,0,0,RP,2021-06-26 15:42:13.111476
emmachamberlain_UC78cxCAcp7JfQPgKxYdyGrg_53uiE2rZb44_742516_744520.wav,emmachamberlain_UC78cxCAcp7JfQPgKxYdyGrg_53uiE2rZb44,742516,744520,2004,128,... so... Most embarrassing memory,1,0,0,0,0,0,0,RP,2021-06-26 15:42:23.213874
emmachamberlain_UC78cxCAcp7JfQPgKxYdyGrg_53uiE2rZb44_745040_755233.wav,emmachamberlain_UC78cxCAcp7JfQPgKxYdyGrg_53uiE2rZb44,745040,755233,10193,129,"Oh my God, okay This is really good_unc So_unc basically like I did cello in fifth grade um which is weird considering I was literally four foot six inches and probably weighed fifty pounds and",1,0,1,0,0,0,0,RP,2021-06-26 15:43:23.583378
emmachamberlain_UC78cxCAcp7JfQPgKxYdyGrg_53uiE2rZb44_755345_766802.wav,emmachamberlain_UC78cxCAcp7JfQPgKxYdyGrg_53uiE2rZb44,755345,766802,11457,130,"was basically the size of a cello But anyway it was the end of the school year and we had like our last recital thing, parents were there Grandparents were there uncles, aunts, everybody you can think of was there. The crowd",1,0,0,0,0,0,0,RP,2021-06-26 15:44:06.077620
emmachamberlain_UC78cxCAcp7JfQPgKxYdyGrg_53uiE2rZb44_766938_777578.wav,emmachamberlain_UC78cxCAcp7JfQPgKxYdyGrg_53uiE2rZb44,766938,777578,10640,131,was going Wild when we finally finished our fifth grade orchestra performance and all of us sucked. We probably sounded like actual crap considering we were literally fifth graders and,1,0,0,0,0,0,0,RP,2021-06-26 15:44:25.162416
emmachamberlain_UC78cxCAcp7JfQPgKxYdyGrg_53uiE2rZb44_777722_785228.wav,emmachamberlain_UC78cxCAcp7JfQPgKxYdyGrg_53uiE2rZb44,777722,785228,7506,132,"Barely had brains developed yet, just kidding that's not true But you know what I mean um anyway, so obviously at the end of the year they",1,0,0,0,0,0,0,RP,2021-06-26 15:44:42.257049
emmachamberlain_UC78cxCAcp7JfQPgKxYdyGrg_53uiE2rZb44_785484_794096.wav,emmachamberlain_UC78cxCAcp7JfQPgKxYdyGrg_53uiE2rZb44,785484,794096,8612,133,gave out awards for people who are really outstanding So I was sitting there in my chair. You know I wasn't expecting to get an award because well,1,0,0,0,0,0,0,RP,2021-06-26 15:44:56.348662
emmachamberlain_UC78cxCAcp7JfQPgKxYdyGrg_53uiE2rZb44_794856_799528.wav,emmachamberlain_UC78cxCAcp7JfQPgKxYdyGrg_53uiE2rZb44,794856,799528,4672,134,I- I just didn't play like I literally move my fingers and just like lightly put my,1,0,0,0,0,0,0,RP,2021-06-26 15:45:08.324458
emmachamberlain_UC78cxCAcp7JfQPgKxYdyGrg_53uiE2rZb44_799824_800376.wav,emmachamberlain_UC78cxCAcp7JfQPgKxYdyGrg_53uiE2rZb44,799824,800376,552,135,bow-,1,0,0,0,0,0,0,RP,2021-06-26 15:45:16.005907
emmachamberlain_UC78cxCAcp7JfQPgKxYdyGrg_53uiE2rZb44_800536_816072.wav,emmachamberlain_UC78cxCAcp7JfQPgKxYdyGrg_53uiE2rZb44,800536,816072,15536,136,"the bow I'll insert a- okay Bow across like the thing I wouldn't even make any noise with my actual cello I would just kind of like fake it the whole time, so I wasn't really expecting um an award because I really didn't deserve it basically I heard our conductor guy",1,0,0,0,0,0,0,RP,2021-06-26 15:45:42.739354
emmachamberlain_UC78cxCAcp7JfQPgKxYdyGrg_53uiE2rZb44_816224_816832.wav,emmachamberlain_UC78cxCAcp7JfQPgKxYdyGrg_53uiE2rZb44,816224,816832,608,137,say like,1,0,0,0,0,0,0,RP,2021-06-26 15:45:48.321082
emmachamberlain_UC78cxCAcp7JfQPgKxYdyGrg_53uiE2rZb44_817496_826192.wav,emmachamberlain_UC78cxCAcp7JfQPgKxYdyGrg_53uiE2rZb44,817496,826192,8696,138,"all of the people who play cello stand up That's what I heard in my brain, okay? I don't know why I heard this because that is not what he said",1,0,0,0,0,0,0,RP,2021-06-26 15:46:04.255038
emmachamberlain_UC78cxCAcp7JfQPgKxYdyGrg_53uiE2rZb44_826376_827704.wav,emmachamberlain_UC78cxCAcp7JfQPgKxYdyGrg_53uiE2rZb44,826376,827704,1328,139,blank name,1,0,0,0,0,0,0,RP,2021-06-26 15:46:15.990859
emmachamberlain_UC78cxCAcp7JfQPgKxYdyGrg_53uiE2rZb44_827880_833440.wav,emmachamberlain_UC78cxCAcp7JfQPgKxYdyGrg_53uiE2rZb44,827880,833440,5560,140,"stand up I thought he said all the people who play cello stand up, but it turns out. He said like",1,0,0,0,0,0,0,RP,2021-06-26 15:46:39.434859
emmachamberlain_UC78cxCAcp7JfQPgKxYdyGrg_53uiE2rZb44_833928_840952.wav,emmachamberlain_UC78cxCAcp7JfQPgKxYdyGrg_53uiE2rZb44,833928,840952,7024,141,"This cello player stand up, and then said her name, and then she stood up well, I stood up with her But I didn't win the award though",1,0,0,0,0,0,0,RP,2021-06-26 15:49:20.485490
emmachamberlain_UC78cxCAcp7JfQPgKxYdyGrg_53uiE2rZb44_842696_845560.wav,emmachamberlain_UC78cxCAcp7JfQPgKxYdyGrg_53uiE2rZb44,842696,845560,2864,142,<sfx>,0,0,0,0,0,0,1,RP,2021-06-26 15:49:33.585595
emmachamberlain_UC78cxCAcp7JfQPgKxYdyGrg_53uiE2rZb44_846888_850272.wav,emmachamberlain_UC78cxCAcp7JfQPgKxYdyGrg_53uiE2rZb44,846888,850272,3384,143,"Okay, moving on. How many relationships have you been in ",1,0,0,0,0,0,0,RP,2021-06-26 15:50:10.737629
emmachamberlain_UC78cxCAcp7JfQPgKxYdyGrg_53uiE2rZb44_850624_852280.wav,emmachamberlain_UC78cxCAcp7JfQPgKxYdyGrg_53uiE2rZb44,850624,852280,1656,144,one in Fifth grade,1,0,0,0,0,0,0,RP,2021-06-26 15:50:18.282735
emmachamberlain_UC78cxCAcp7JfQPgKxYdyGrg_53uiE2rZb44_853928_861964.wav,emmachamberlain_UC78cxCAcp7JfQPgKxYdyGrg_53uiE2rZb44,853928,861964,8036,145,"so but I mean I guess when you're sixteen you don't need to be in a relationship, so I guess it's fine, but I'm ah No, I'm just kidding. I'm good. I'm good Single life is the best life, y'know",1,0,0,0,0,0,0,RP,2021-06-26 15:50:49.435720
emmachamberlain_UC78cxCAcp7JfQPgKxYdyGrg_53uiE2rZb44_862092_867336.wav,emmachamberlain_UC78cxCAcp7JfQPgKxYdyGrg_53uiE2rZb44,862092,867336,5244,146,"If you could give your younger self any advice, what would it be? You will never regret being kind",1,0,0,0,0,0,0,RP,2021-06-26 15:51:06.235885
emmachamberlain_UC78cxCAcp7JfQPgKxYdyGrg_53uiE2rZb44_868360_872848.wav,emmachamberlain_UC78cxCAcp7JfQPgKxYdyGrg_53uiE2rZb44,868360,872848,4488,147,one thing that you know now that you wish you would've known as a kid that's like the same question,1,0,0,0,0,0,0,RP,2021-06-26 15:51:26.076333
emmachamberlain_UC78cxCAcp7JfQPgKxYdyGrg_53uiE2rZb44_873272_877072.wav,emmachamberlain_UC78cxCAcp7JfQPgKxYdyGrg_53uiE2rZb44,873272,877072,3800,148,and I'll say it again. You will never regret being kind,1,0,0,0,0,0,0,RP,2021-06-26 15:51:45.579312
emmachamberlain_UC78cxCAcp7JfQPgKxYdyGrg_53uiE2rZb44_877584_878352.wav,emmachamberlain_UC78cxCAcp7JfQPgKxYdyGrg_53uiE2rZb44,877584,878352,768,149,ever,1,0,0,0,0,0,0,RP,2021-06-26 15:51:52.099945
emmachamberlain_UC78cxCAcp7JfQPgKxYdyGrg_53uiE2rZb44_878896_888896.wav,emmachamberlain_UC78cxCAcp7JfQPgKxYdyGrg_53uiE2rZb44,878896,888896,10000,150,Okay uh Like I just remember how me and everybody was in Middle school to each other and it was just the norm y'know Second grade self girl would steal your sticker and ,1,0,0,0,0,0,0,RP,2021-06-26 15:52:22.261231
emmachamberlain_UC78cxCAcp7JfQPgKxYdyGrg_53uiE2rZb44_889072_891368.wav,emmachamberlain_UC78cxCAcp7JfQPgKxYdyGrg_53uiE2rZb44,889072,891368,2296,151,talk about a fricking fight and like,1,0,0,0,0,0,0,RP,2021-06-26 15:52:33.558009
emmachamberlain_UC78cxCAcp7JfQPgKxYdyGrg_53uiE2rZb44_891648_902940.wav,emmachamberlain_UC78cxCAcp7JfQPgKxYdyGrg_53uiE2rZb44,891648,902940,11292,152,"at this point in my life I've learned y'know just be the bigger person always be kind no matter what anybody says or does to you being kind you will Never regret it m'kay. Tea, or coffee? Okay coffee. um sorry",1,0,0,0,0,0,0,RP,2021-06-26 15:53:04.252658
emmachamberlain_UC78cxCAcp7JfQPgKxYdyGrg_53uiE2rZb44_903228_905984.wav,emmachamberlain_UC78cxCAcp7JfQPgKxYdyGrg_53uiE2rZb44,903228,905984,2756,153,That's just like not even a question. I don't even-,1,0,0,0,0,0,0,RP,2021-06-26 15:53:12.196714
emmachamberlain_UC78cxCAcp7JfQPgKxYdyGrg_53uiE2rZb44_906648_909200.wav,emmachamberlain_UC78cxCAcp7JfQPgKxYdyGrg_53uiE2rZb44,906648,909200,2552,154,Like ah we don't even need to discuss it okay coffee,1,0,0,0,0,0,0,RP,2021-06-26 15:53:32.669749
emmachamberlain_UC78cxCAcp7JfQPgKxYdyGrg_53uiE2rZb44_909968_910128.wav,emmachamberlain_UC78cxCAcp7JfQPgKxYdyGrg_53uiE2rZb44,909968,910128,160,155,,0,0,0,0,0,0,1,RP,2021-06-26 15:53:38.259723
emmachamberlain_UC78cxCAcp7JfQPgKxYdyGrg_53uiE2rZb44_910584_917192.wav,emmachamberlain_UC78cxCAcp7JfQPgKxYdyGrg_53uiE2rZb44,910584,917192,6608,156,How tall are you I am five three and a half but I think I'm five four now so I don't know. Cats or dogs?,1,0,0,0,0,0,0,RP,2021-06-26 15:53:51.994168
emmachamberlain_UC78cxCAcp7JfQPgKxYdyGrg_53uiE2rZb44_917400_918824.wav,emmachamberlain_UC78cxCAcp7JfQPgKxYdyGrg_53uiE2rZb44,917400,918824,1424,157,um Dogs,1,0,0,0,0,0,0,RP,2021-06-26 15:53:57.506885
emmachamberlain_UC78cxCAcp7JfQPgKxYdyGrg_53uiE2rZb44_919024_924888.wav,emmachamberlain_UC78cxCAcp7JfQPgKxYdyGrg_53uiE2rZb44,919024,924888,5864,158,"I mean, I don't know I just like dogs better. Sorry. All you cat people, no hate I have cats and dogs so like",1,0,0,0,0,0,0,RP,2021-06-26 15:54:21.647892
emmachamberlain_UC78cxCAcp7JfQPgKxYdyGrg_53uiE2rZb44_925176_929440.wav,emmachamberlain_UC78cxCAcp7JfQPgKxYdyGrg_53uiE2rZb44,925176,929440,4264,159,"yeah, but dogs are just better. I feel like everybody who doesn't like dogs doesn't have one",1,0,0,0,0,0,0,RP,2021-06-26 15:57:52.494023
