filename,video_id,start_time,end_time,duration,id,transcription,usability,bg_music,bg_noise,other_voice,only_music,only_noise,other_sounds,annotator,annotate_date_YYYYMMDD
TeleahMiranda_UC7zIxbN6IR8BA5PqeSnmtQ_UFl8udEGE_493018_500874.wav,TeleahMiranda_UC7zIxbN6IR8BA5PqeSnmtQ_UFl8udEGE,493018,500874,7856,100,so I thought that was pretty interesting and if I'm translating this correctly I think it means that like the coptic egyptian is like,1,0,0,0,0,0,0,DY,2021-09-14 23:12:50.488972
TeleahMiranda_UC7zIxbN6IR8BA5PqeSnmtQ_UFl8udEGE_501474_506146.wav,TeleahMiranda_UC7zIxbN6IR8BA5PqeSnmtQ_UFl8udEGE,501474,506146,4672,101,the egyptians who were there like way before like King Tut which i think is,1,0,0,0,0,0,0,DY,2021-09-14 23:12:57.408857
TeleahMiranda_UC7zIxbN6IR8BA5PqeSnmtQ_UFl8udEGE_506458_507246.wav,TeleahMiranda_UC7zIxbN6IR8BA5PqeSnmtQ_UFl8udEGE,506458,507246,788,102,awesome,1,0,0,0,0,0,0,DY,2021-09-14 23:13:02.330260
TeleahMiranda_UC7zIxbN6IR8BA5PqeSnmtQ_UFl8udEGE_507502_513079.wav,TeleahMiranda_UC7zIxbN6IR8BA5PqeSnmtQ_UFl8udEGE,507502,513079,5577,103,what if I'm related to like King Tut or Nefertiti and going back to my,1,0,0,0,0,0,0,DY,2021-09-14 23:13:12.878562
TeleahMiranda_UC7zIxbN6IR8BA5PqeSnmtQ_UFl8udEGE_513199_524128.wav,TeleahMiranda_UC7zIxbN6IR8BA5PqeSnmtQ_UFl8udEGE,513199,524128,10929,104,ancestry composition it says that I am point four percent North African and then one point two percent broadly Western Asian and North African so- the Western Asian I can assume that that's like the middle-_unc,1,0,1,0,0,0,0,DY,2021-09-14 23:14:45.365559
TeleahMiranda_UC7zIxbN6IR8BA5PqeSnmtQ_UFl8udEGE_524256_526754.wav,TeleahMiranda_UC7zIxbN6IR8BA5PqeSnmtQ_UFl8udEGE,524256,526754,2498,105,hi_unn ha_unn ha_unn ha_unn,0,0,1,1,0,0,0,DY,2021-09-14 23:14:56.750987
TeleahMiranda_UC7zIxbN6IR8BA5PqeSnmtQ_UFl8udEGE_527042_533022.wav,TeleahMiranda_UC7zIxbN6IR8BA5PqeSnmtQ_UFl8udEGE,527042,533022,5980,106,c- I'm one point two percent broadly Western Asian and North African and then point four percent North African,1,0,0,0,0,0,0,DY,2021-09-14 23:16:00.648113
TeleahMiranda_UC7zIxbN6IR8BA5PqeSnmtQ_UFl8udEGE_533462_537074.wav,TeleahMiranda_UC7zIxbN6IR8BA5PqeSnmtQ_UFl8udEGE,533462,537074,3612,107,and I can assume that's just like the rest of North Africa like,1,0,0,0,0,0,0,DY,2021-09-14 23:16:08.383150
TeleahMiranda_UC7zIxbN6IR8BA5PqeSnmtQ_UFl8udEGE_537298_542406.wav,TeleahMiranda_UC7zIxbN6IR8BA5PqeSnmtQ_UFl8udEGE,537298,542406,5108,108,Morocco Libya and the Western Asian part would be like Middle Eastern so,1,0,0,0,0,0,0,DY,2021-09-14 23:16:18.622657
TeleahMiranda_UC7zIxbN6IR8BA5PqeSnmtQ_UFl8udEGE_542590_547610.wav,TeleahMiranda_UC7zIxbN6IR8BA5PqeSnmtQ_UFl8udEGE,542590,547610,5020,109,I think that that's what that means again correct me if I am wrong,1,0,0,0,0,0,0,DY,2021-09-14 23:16:31.768097
TeleahMiranda_UC7zIxbN6IR8BA5PqeSnmtQ_UFl8udEGE_548026_554522.wav,TeleahMiranda_UC7zIxbN6IR8BA5PqeSnmtQ_UFl8udEGE,548026,554522,6496,110,oh- if I go to trace ancestry it says I'm point nine percent trace ancestry I think that means just,1,0,0,0,0,0,0,DY,2021-09-14 23:16:44.204529
TeleahMiranda_UC7zIxbN6IR8BA5PqeSnmtQ_UFl8udEGE_554834_554970.wav,TeleahMiranda_UC7zIxbN6IR8BA5PqeSnmtQ_UFl8udEGE,554834,554970,136,111,,0,0,0,0,0,0,0,DY,2021-09-14 23:16:48.657722
TeleahMiranda_UC7zIxbN6IR8BA5PqeSnmtQ_UFl8udEGE_555506_560162.wav,TeleahMiranda_UC7zIxbN6IR8BA5PqeSnmtQ_UFl8udEGE,555506,560162,4656,112,Native American maybe because it says I'm point four percent Native American,1,0,0,0,0,0,0,DY,2021-09-14 23:17:12.087680
TeleahMiranda_UC7zIxbN6IR8BA5PqeSnmtQ_UFl8udEGE_560514_565958.wav,TeleahMiranda_UC7zIxbN6IR8BA5PqeSnmtQ_UFl8udEGE,560514,565958,5444,113,and then I'm point three percent broadly southern South Asian and point two percent broadly Central and South Asian,1,0,0,0,0,0,0,DY,2021-09-14 23:17:21.983011
TeleahMiranda_UC7zIxbN6IR8BA5PqeSnmtQ_UFl8udEGE_566142_575106.wav,TeleahMiranda_UC7zIxbN6IR8BA5PqeSnmtQ_UFl8udEGE,566142,575106,8964,114,which means like Sri Lanka and India which I thought was pretty cool those are my results I think that it is beautiful I'm from all of these different,1,0,0,0,0,0,0,DY,2021-09-14 23:17:36.252395
TeleahMiranda_UC7zIxbN6IR8BA5PqeSnmtQ_UFl8udEGE_575410_576470.wav,TeleahMiranda_UC7zIxbN6IR8BA5PqeSnmtQ_UFl8udEGE,575410,576470,1060,115,cultures,1,0,0,0,0,0,0,DY,2021-09-14 23:17:39.664289
TeleahMiranda_UC7zIxbN6IR8BA5PqeSnmtQ_UFl8udEGE_576662_587082.wav,TeleahMiranda_UC7zIxbN6IR8BA5PqeSnmtQ_UFl8udEGE,576662,587082,10420,116,and countries ton of anything I'm just like a little bit of everything within those countries so I think it's awesome I'm really really happy that I got to do this test because,1,0,0,0,0,0,0,DY,2021-09-14 23:17:54.206363
TeleahMiranda_UC7zIxbN6IR8BA5PqeSnmtQ_UFl8udEGE_587618_588254.wav,TeleahMiranda_UC7zIxbN6IR8BA5PqeSnmtQ_UFl8udEGE,587618,588254,636,117,again,1,0,0,0,0,0,0,DY,2021-09-14 23:18:00.161433
TeleahMiranda_UC7zIxbN6IR8BA5PqeSnmtQ_UFl8udEGE_588510_595328.wav,TeleahMiranda_UC7zIxbN6IR8BA5PqeSnmtQ_UFl8udEGE,588510,595328,6818,118,I just wanted to know more about my ancestry and this was a perfect way to find out so I did take the twenty three and me DNA test,1,0,0,0,0,0,0,DY,2021-09-14 23:18:34.525681
TeleahMiranda_UC7zIxbN6IR8BA5PqeSnmtQ_UFl8udEGE_595496_603554.wav,TeleahMiranda_UC7zIxbN6IR8BA5PqeSnmtQ_UFl8udEGE,595496,603554,8058,119,and I got my results back in like three weeks super super easy uh- but something I did want to point out was I was told in my family that we are,1,0,0,0,0,0,0,DY,2021-09-14 23:18:47.857094
TeleahMiranda_UC7zIxbN6IR8BA5PqeSnmtQ_UFl8udEGE_603842_609146.wav,TeleahMiranda_UC7zIxbN6IR8BA5PqeSnmtQ_UFl8udEGE,603842,609146,5304,120,like both sides my family have Native American and then my mom said my family has Jewish,1,0,0,0,0,0,0,DY,2021-09-14 23:18:59.011021
TeleahMiranda_UC7zIxbN6IR8BA5PqeSnmtQ_UFl8udEGE_609362_614410.wav,TeleahMiranda_UC7zIxbN6IR8BA5PqeSnmtQ_UFl8udEGE,609362,614410,5048,121,now I don't know where they got that from because I don't see any Jewish on here at all,1,0,0,0,0,0,0,DY,2021-09-14 23:19:06.525465
TeleahMiranda_UC7zIxbN6IR8BA5PqeSnmtQ_UFl8udEGE_614994_615306.wav,TeleahMiranda_UC7zIxbN6IR8BA5PqeSnmtQ_UFl8udEGE,614994,615306,312,122,like,1,0,0,0,0,0,0,DY,2021-09-14 23:19:11.099379
TeleahMiranda_UC7zIxbN6IR8BA5PqeSnmtQ_UFl8udEGE_615570_616050.wav,TeleahMiranda_UC7zIxbN6IR8BA5PqeSnmtQ_UFl8udEGE,615570,616050,480,123,at_unn,0,0,0,1,0,0,0,DY,2021-09-14 23:19:17.504183
TeleahMiranda_UC7zIxbN6IR8BA5PqeSnmtQ_UFl8udEGE_616442_625122.wav,TeleahMiranda_UC7zIxbN6IR8BA5PqeSnmtQ_UFl8udEGE,616442,625122,8680,124,all_unn like there's no Jewish in fact if I go into another report it says they're zero point zero percent Ashkenazi Jewish which is what I was told that we are,1,0,0,1,0,0,0,DY,2021-09-14 23:19:31.113592
TeleahMiranda_UC7zIxbN6IR8BA5PqeSnmtQ_UFl8udEGE_625282_625970.wav,TeleahMiranda_UC7zIxbN6IR8BA5PqeSnmtQ_UFl8udEGE,625282,625970,688,125,so,1,0,0,0,0,0,0,DY,2021-09-14 23:19:33.503272
TeleahMiranda_UC7zIxbN6IR8BA5PqeSnmtQ_UFl8udEGE_626202_627042.wav,TeleahMiranda_UC7zIxbN6IR8BA5PqeSnmtQ_UFl8udEGE,626202,627042,840,126,I don't know,1,0,0,0,0,0,0,DY,2021-09-14 23:19:40.204510
TeleahMiranda_UC7zIxbN6IR8BA5PqeSnmtQ_UFl8udEGE_627410_631938.wav,TeleahMiranda_UC7zIxbN6IR8BA5PqeSnmtQ_UFl8udEGE,627410,631938,4528,127,but it doesn't say anything about being Jewish on here I'm- point four percent Native American,1,0,0,0,0,0,0,DY,2021-09-14 23:19:50.437233
TeleahMiranda_UC7zIxbN6IR8BA5PqeSnmtQ_UFl8udEGE_632722_637902.wav,TeleahMiranda_UC7zIxbN6IR8BA5PqeSnmtQ_UFl8udEGE,632722,637902,5180,128,and I don't know where- what side of my family that comes from I don't know anything about that,1,0,0,0,0,0,0,DY,2021-09-14 23:20:01.764953
TeleahMiranda_UC7zIxbN6IR8BA5PqeSnmtQ_UFl8udEGE_638078_642554.wav,TeleahMiranda_UC7zIxbN6IR8BA5PqeSnmtQ_UFl8udEGE,638078,642554,4476,129,I just know that I was told I'm more Native American than that like I expected maybe like,1,0,0,0,0,0,0,DY,2021-09-14 23:20:09.048629
TeleahMiranda_UC7zIxbN6IR8BA5PqeSnmtQ_UFl8udEGE_642978_649643.wav,TeleahMiranda_UC7zIxbN6IR8BA5PqeSnmtQ_UFl8udEGE,642978,649643,6665,130,fifteen percent Native American I just wanna know like where my family heard this stuff or did somebody just make it up,1,0,1,0,0,0,0,DY,2021-09-14 23:20:20.549391
TeleahMiranda_UC7zIxbN6IR8BA5PqeSnmtQ_UFl8udEGE_649891_660955.wav,TeleahMiranda_UC7zIxbN6IR8BA5PqeSnmtQ_UFl8udEGE,649891,660955,11064,131,like I don't know but I'm a smidge Native American and not Jewish at all so that was kinda surprising but other than that my tests were pretty accurate to what I,1,0,1,0,0,0,0,DY,2021-09-14 23:20:39.026021
TeleahMiranda_UC7zIxbN6IR8BA5PqeSnmtQ_UFl8udEGE_661139_666363.wav,TeleahMiranda_UC7zIxbN6IR8BA5PqeSnmtQ_UFl8udEGE,661139,666363,5224,132,expected them to be I love it I think it's so cool I'm so glad that I know,1,0,1,0,0,0,0,DY,2021-09-14 23:20:49.258505
TeleahMiranda_UC7zIxbN6IR8BA5PqeSnmtQ_UFl8udEGE_666515_674427.wav,TeleahMiranda_UC7zIxbN6IR8BA5PqeSnmtQ_UFl8udEGE,666515,674427,7912,133,comment down below if you have ever taken this test tell me what your results were if they were accurate if they shocked you if they were exactly what you thought they were like,1,0,0,0,0,0,0,DY,2021-09-14 23:21:13.752798
TeleahMiranda_UC7zIxbN6IR8BA5PqeSnmtQ_UFl8udEGE_674539_679171.wav,TeleahMiranda_UC7zIxbN6IR8BA5PqeSnmtQ_UFl8udEGE,674539,679171,4632,134,tell me what it is make sure you subscribe to my channel if you are a new viewer,1,0,0,0,0,0,0,DY,2021-09-14 23:21:23.657063
TeleahMiranda_UC7zIxbN6IR8BA5PqeSnmtQ_UFl8udEGE_679283_682811.wav,TeleahMiranda_UC7zIxbN6IR8BA5PqeSnmtQ_UFl8udEGE,679283,682811,3528,135,thank you so much for tuning in today and I will see you guys in my next video,1,0,0,0,0,0,0,DY,2021-09-14 23:21:30.407367
TeleahMiranda_UC7zIxbN6IR8BA5PqeSnmtQ_UFl8udEGE_683003_690004.wav,TeleahMiranda_UC7zIxbN6IR8BA5PqeSnmtQ_UFl8udEGE,683003,690004,7001,136,[Music],0,0,0,0,1,0,0,DY,2021-09-14 23:21:39.200994
