filename,video_id,start_time,end_time,duration,id,transcription,usability,bg_music,bg_noise,other_voice,only_music,only_noise,other_sounds,annotator,annotate_date_YYYYMMDD
TeleahMiranda_UC7zIxbN6IR8BA5PqeSnmtQ_UFl8udEGE_0_129.wav,TeleahMiranda_UC7zIxbN6IR8BA5PqeSnmtQ_UFl8udEGE,0,129,129,0,,0,0,0,0,0,0,0,DY,2021-09-14 22:36:40.396507
TeleahMiranda_UC7zIxbN6IR8BA5PqeSnmtQ_UFl8udEGE_129_11065.wav,TeleahMiranda_UC7zIxbN6IR8BA5PqeSnmtQ_UFl8udEGE,129,11065,10936,1,hey everybody welcome back to my channel today's video is super exciting because I am showing you guys I'm sharing my DNA resul-,1,0,0,0,0,0,0,DY,2021-09-14 22:37:19.344714
TeleahMiranda_UC7zIxbN6IR8BA5PqeSnmtQ_UFl8udEGE_11201_14042.wav,TeleahMiranda_UC7zIxbN6IR8BA5PqeSnmtQ_UFl8udEGE,11201,14042,2841,2,ts- I took a DNA test turns out_unc,1,0,0,0,0,0,0,DY,2021-09-14 22:37:42.297999
TeleahMiranda_UC7zIxbN6IR8BA5PqeSnmtQ_UFl8udEGE_15514_15626.wav,TeleahMiranda_UC7zIxbN6IR8BA5PqeSnmtQ_UFl8udEGE,15514,15626,112,3,,0,0,0,0,0,1,0,DY,2021-09-14 22:37:46.026065
TeleahMiranda_UC7zIxbN6IR8BA5PqeSnmtQ_UFl8udEGE_16074_22418.wav,TeleahMiranda_UC7zIxbN6IR8BA5PqeSnmtQ_UFl8udEGE,16074,22418,6344,4,I got my results back yesterday so I actually filmed my reaction however the car ride was just kinda like,1,0,0,0,0,0,0,DY,2021-09-14 22:37:59.446142
TeleahMiranda_UC7zIxbN6IR8BA5PqeSnmtQ_UFl8udEGE_22586_24450.wav,TeleahMiranda_UC7zIxbN6IR8BA5PqeSnmtQ_UFl8udEGE,22586,24450,1864,5,bumpy and,1,0,0,0,0,0,0,DY,2021-09-14 22:38:06.433427
TeleahMiranda_UC7zIxbN6IR8BA5PqeSnmtQ_UFl8udEGE_24626_26698.wav,TeleahMiranda_UC7zIxbN6IR8BA5PqeSnmtQ_UFl8udEGE,24626,26698,2072,6,the mic wasn't there like it was just,1,0,0,0,0,0,0,DY,2021-09-14 22:39:19.254745
TeleahMiranda_UC7zIxbN6IR8BA5PqeSnmtQ_UFl8udEGE_26938_27098.wav,TeleahMiranda_UC7zIxbN6IR8BA5PqeSnmtQ_UFl8udEGE,26938,27098,160,7,,0,0,0,0,0,1,0,DY,2021-09-14 22:40:15.899833
TeleahMiranda_UC7zIxbN6IR8BA5PqeSnmtQ_UFl8udEGE_27098_28634.wav,TeleahMiranda_UC7zIxbN6IR8BA5PqeSnmtQ_UFl8udEGE,27098,28634,1536,8,I don't think the quality was there,1,0,0,0,0,0,0,DY,2021-09-14 22:40:24.761819
TeleahMiranda_UC7zIxbN6IR8BA5PqeSnmtQ_UFl8udEGE_28794_43202.wav,TeleahMiranda_UC7zIxbN6IR8BA5PqeSnmtQ_UFl8udEGE,28794,43202,14408,9,so I decided to sit down show you guys my results I'll go ahead and throw in some clips of my reaction because I was actually pleasantly surprised I was really happy to take this test because I really wanted to find out my ancestry I've been told so many different things,1,0,1,0,0,0,0,DY,2021-09-14 22:42:02.455996
TeleahMiranda_UC7zIxbN6IR8BA5PqeSnmtQ_UFl8udEGE_43586_46362.wav,TeleahMiranda_UC7zIxbN6IR8BA5PqeSnmtQ_UFl8udEGE,43586,46362,2776,10,from both sides of my family that I'm just like hmm,1,0,0,0,0,0,0,DY,2021-09-14 22:42:10.487242
TeleahMiranda_UC7zIxbN6IR8BA5PqeSnmtQ_UFl8udEGE_46682_58506.wav,TeleahMiranda_UC7zIxbN6IR8BA5PqeSnmtQ_UFl8udEGE,46682,58506,11824,11,let's put it to the test so I went ahead I gave the government my DNA now they can clone me and here we are with my results as you can see I'm here baby boy he just woke up from a nap,1,0,1,0,0,0,0,DY,2021-09-14 22:42:42.472892
TeleahMiranda_UC7zIxbN6IR8BA5PqeSnmtQ_UFl8udEGE_58722_60802.wav,TeleahMiranda_UC7zIxbN6IR8BA5PqeSnmtQ_UFl8udEGE,58722,60802,2080,12,and he had some milk so he is,1,0,0,0,0,0,0,DY,2021-09-14 22:42:49.023201
TeleahMiranda_UC7zIxbN6IR8BA5PqeSnmtQ_UFl8udEGE_61026_67930.wav,TeleahMiranda_UC7zIxbN6IR8BA5PqeSnmtQ_UFl8udEGE,61026,67930,6904,13,chillin' right now so the very first thing I really wanted to start with was my background my ethnic background,1,0,0,0,0,0,0,DY,2021-09-14 22:43:02.340365
TeleahMiranda_UC7zIxbN6IR8BA5PqeSnmtQ_UFl8udEGE_68106_75450.wav,TeleahMiranda_UC7zIxbN6IR8BA5PqeSnmtQ_UFl8udEGE,68106,75450,7344,14,both of my parents are mixed my mom is mixed with Egyptian and white and my dad is mixed with,1,0,0,0,0,0,0,DY,2021-09-14 22:44:03.646746
TeleahMiranda_UC7zIxbN6IR8BA5PqeSnmtQ_UFl8udEGE_76010_80892.wav,TeleahMiranda_UC7zIxbN6IR8BA5PqeSnmtQ_UFl8udEGE,76010,80892,4882,15,black and white he's mostly black his mom was mixed black and white but his dad,1,0,0,0,0,0,0,DY,2021-09-14 22:44:13.972729
TeleahMiranda_UC7zIxbN6IR8BA5PqeSnmtQ_UFl8udEGE_81076_85222.wav,TeleahMiranda_UC7zIxbN6IR8BA5PqeSnmtQ_UFl8udEGE,81076,85222,4146,16,was black so both of my parents are of mixed race,1,0,0,0,0,0,0,DY,2021-09-14 22:45:45.434223
TeleahMiranda_UC7zIxbN6IR8BA5PqeSnmtQ_UFl8udEGE_85486_94682.wav,TeleahMiranda_UC7zIxbN6IR8BA5PqeSnmtQ_UFl8udEGE,85486,94682,9196,17,right off the bat I just assumed that my DNA results would come back mostly African European and I expected some Middle Eastern as well,1,0,0,0,0,0,0,DY,2021-09-14 22:45:56.809443
TeleahMiranda_UC7zIxbN6IR8BA5PqeSnmtQ_UFl8udEGE_95002_98234.wav,TeleahMiranda_UC7zIxbN6IR8BA5PqeSnmtQ_UFl8udEGE,95002,98234,3232,18,throughout my life I have been told that we are Jewish,1,0,0,0,0,0,0,DY,2021-09-14 22:47:32.432431
TeleahMiranda_UC7zIxbN6IR8BA5PqeSnmtQ_UFl8udEGE_98522_103018.wav,TeleahMiranda_UC7zIxbN6IR8BA5PqeSnmtQ_UFl8udEGE,98522,103018,4496,19,that we're Native American those are two things that I have been told,1,0,0,0,0,0,0,DY,2021-09-14 22:47:42.137223
TeleahMiranda_UC7zIxbN6IR8BA5PqeSnmtQ_UFl8udEGE_103162_112442.wav,TeleahMiranda_UC7zIxbN6IR8BA5PqeSnmtQ_UFl8udEGE,103162,112442,9280,20,from both sides of my family the Native American from both sides and then the Jewish from my mom's mom my mom's dad immigrated from Egypt to the United States my mom's mom,1,0,0,0,0,0,0,DY,2021-09-14 22:48:11.992790
TeleahMiranda_UC7zIxbN6IR8BA5PqeSnmtQ_UFl8udEGE_112698_125900.wav,TeleahMiranda_UC7zIxbN6IR8BA5PqeSnmtQ_UFl8udEGE,112698,125900,13202,21,I'm pretty sure her family has been here for generations and generations I assume that my dad's side of the family who's black I can assume that they've also been here for generations and generations and generations because of the slave trade that happened way way way back then,1,0,0,0,0,0,0,DY,2021-09-14 22:50:49.422296
TeleahMiranda_UC7zIxbN6IR8BA5PqeSnmtQ_UFl8udEGE_126052_133764.wav,TeleahMiranda_UC7zIxbN6IR8BA5PqeSnmtQ_UFl8udEGE,126052,133764,7712,22,so I can only assume that my relatives were slaves I can also assume that my relatives may have possibly been slave owners in the past,1,0,0,0,0,0,0,DY,2021-09-14 22:51:20.815886
TeleahMiranda_UC7zIxbN6IR8BA5PqeSnmtQ_UFl8udEGE_133900_142638.wav,TeleahMiranda_UC7zIxbN6IR8BA5PqeSnmtQ_UFl8udEGE,133900,142638,8738,23,as far as the Egyptian side I don't really know the Egyptian side of my family when people ask me what I am I do say I'm black white and Egyptian because that's exactly,1,0,0,0,0,0,0,DY,2021-09-14 22:52:03.965559
TeleahMiranda_UC7zIxbN6IR8BA5PqeSnmtQ_UFl8udEGE_142766_143990.wav,TeleahMiranda_UC7zIxbN6IR8BA5PqeSnmtQ_UFl8udEGE,142766,143990,1224,24,what I look like,1,0,0,0,0,0,0,DY,2021-09-14 22:52:13.254551
TeleahMiranda_UC7zIxbN6IR8BA5PqeSnmtQ_UFl8udEGE_144118_144726.wav,TeleahMiranda_UC7zIxbN6IR8BA5PqeSnmtQ_UFl8udEGE,144118,144726,608,25,but,1,0,0,0,0,0,0,DY,2021-09-14 22:52:23.335272
TeleahMiranda_UC7zIxbN6IR8BA5PqeSnmtQ_UFl8udEGE_144862_150682.wav,TeleahMiranda_UC7zIxbN6IR8BA5PqeSnmtQ_UFl8udEGE,144862,150682,5820,26,I actually don't know Arabic I don't know the Egyptian culture I don't know anything about being egyptian,1,0,0,0,0,0,0,DY,2021-09-14 22:52:56.382341
TeleahMiranda_UC7zIxbN6IR8BA5PqeSnmtQ_UFl8udEGE_151106_154922.wav,TeleahMiranda_UC7zIxbN6IR8BA5PqeSnmtQ_UFl8udEGE,151106,154922,3816,27,and I'm really proud to be Egyptian I think it's a beautiful culture,1,0,0,0,0,0,0,DY,2021-09-14 22:53:03.555879
TeleahMiranda_UC7zIxbN6IR8BA5PqeSnmtQ_UFl8udEGE_155266_158978.wav,TeleahMiranda_UC7zIxbN6IR8BA5PqeSnmtQ_UFl8udEGE,155266,158978,3712,28,way back from ancient Egypt to current day Egypt however,1,0,0,0,0,0,0,DY,2021-09-14 22:53:33.074188
TeleahMiranda_UC7zIxbN6IR8BA5PqeSnmtQ_UFl8udEGE_159346_168354.wav,TeleahMiranda_UC7zIxbN6IR8BA5PqeSnmtQ_UFl8udEGE,159346,168354,9008,29,I don't know anything about it I don't know what it is to be Egyptian all I know is that I am Egyptian my grandpa came from Egypt and I do wish I knew more Arabic,1,0,0,0,0,0,0,DY,2021-09-14 22:53:46.778782
TeleahMiranda_UC7zIxbN6IR8BA5PqeSnmtQ_UFl8udEGE_168522_176174.wav,TeleahMiranda_UC7zIxbN6IR8BA5PqeSnmtQ_UFl8udEGE,168522,176174,7652,30,or any Arabic for that matter and I do wish I knew that side of my family but I know some of them are still in Egypt and some of them actually live here in the states,1,0,0,0,0,0,0,DY,2021-09-14 22:54:00.973319
TeleahMiranda_UC7zIxbN6IR8BA5PqeSnmtQ_UFl8udEGE_176382_181954.wav,TeleahMiranda_UC7zIxbN6IR8BA5PqeSnmtQ_UFl8udEGE,176382,181954,5572,31,I think in Houston Texas I just never met them before and hopefully one day I get to meet them,1,0,0,0,0,0,0,DY,2021-09-14 22:54:13.076971
TeleahMiranda_UC7zIxbN6IR8BA5PqeSnmtQ_UFl8udEGE_182130_186690.wav,TeleahMiranda_UC7zIxbN6IR8BA5PqeSnmtQ_UFl8udEGE,182130,186690,4560,32,and then I'll insert some clips of my reaction as well but right now this is just an overview,1,0,0,0,0,0,0,DY,2021-09-14 22:54:22.225129
TeleahMiranda_UC7zIxbN6IR8BA5PqeSnmtQ_UFl8udEGE_186874_188526.wav,TeleahMiranda_UC7zIxbN6IR8BA5PqeSnmtQ_UFl8udEGE,186874,188526,1652,33,of everything that I am,1,0,0,0,0,0,0,DY,2021-09-14 22:54:28.535664
TeleahMiranda_UC7zIxbN6IR8BA5PqeSnmtQ_UFl8udEGE_188678_199906.wav,TeleahMiranda_UC7zIxbN6IR8BA5PqeSnmtQ_UFl8udEGE,188678,199906,11228,34,I've already seen these results yesterday was the day where I actually had a reaction and I didn't wanna film it and I couldn't wait because I was just super super excited I wouldn't have been home until about nine PM and I wasn't gonna film around that time either,1,0,1,0,0,0,0,DY,2021-09-14 22:55:09.007693
TeleahMiranda_UC7zIxbN6IR8BA5PqeSnmtQ_UFl8udEGE_200266_201138.wav,TeleahMiranda_UC7zIxbN6IR8BA5PqeSnmtQ_UFl8udEGE,200266,201138,872,35,so,1,0,0,0,0,0,0,DY,2021-09-14 22:55:15.188051
TeleahMiranda_UC7zIxbN6IR8BA5PqeSnmtQ_UFl8udEGE_201346_203818.wav,TeleahMiranda_UC7zIxbN6IR8BA5PqeSnmtQ_UFl8udEGE,201346,203818,2472,36,I'll just go ahead and insert some clips of my reaction-,1,0,0,0,0,0,0,DY,2021-09-14 22:55:22.575099
TeleahMiranda_UC7zIxbN6IR8BA5PqeSnmtQ_UFl8udEGE_204242_206674.wav,TeleahMiranda_UC7zIxbN6IR8BA5PqeSnmtQ_UFl8udEGE,204242,206674,2432,37,noah is crapping his pants right now,1,0,0,0,0,0,0,DY,2021-09-14 22:55:29.480389
TeleahMiranda_UC7zIxbN6IR8BA5PqeSnmtQ_UFl8udEGE_206994_207322.wav,TeleahMiranda_UC7zIxbN6IR8BA5PqeSnmtQ_UFl8udEGE,206994,207322,328,38,,0,0,0,0,0,1,0,DY,2021-09-14 22:55:34.097066
TeleahMiranda_UC7zIxbN6IR8BA5PqeSnmtQ_UFl8udEGE_208074_208594.wav,TeleahMiranda_UC7zIxbN6IR8BA5PqeSnmtQ_UFl8udEGE,208074,208594,520,39,sir,1,0,0,0,0,0,0,DY,2021-09-14 22:55:39.357010
TeleahMiranda_UC7zIxbN6IR8BA5PqeSnmtQ_UFl8udEGE_208906_209218.wav,TeleahMiranda_UC7zIxbN6IR8BA5PqeSnmtQ_UFl8udEGE,208906,209218,312,40,,0,0,0,0,0,1,0,DY,2021-09-14 22:55:43.002835
TeleahMiranda_UC7zIxbN6IR8BA5PqeSnmtQ_UFl8udEGE_209218_217978.wav,TeleahMiranda_UC7zIxbN6IR8BA5PqeSnmtQ_UFl8udEGE,209218,217978,8760,41,ew_unn you_unn stinky_unn ugh_unn,0,0,1,1,0,1,0,DY,2021-09-14 22:56:00.923779
TeleahMiranda_UC7zIxbN6IR8BA5PqeSnmtQ_UFl8udEGE_218186_224082.wav,TeleahMiranda_UC7zIxbN6IR8BA5PqeSnmtQ_UFl8udEGE,218186,224082,5896,42,now that that's taken care of let's get back into the video I'm gonna go ahead and share with you guys,1,0,0,0,0,0,0,DY,2021-09-14 22:56:11.504461
TeleahMiranda_UC7zIxbN6IR8BA5PqeSnmtQ_UFl8udEGE_224234_228262.wav,TeleahMiranda_UC7zIxbN6IR8BA5PqeSnmtQ_UFl8udEGE,224234,228262,4028,43,all of my percentages do the breakdown,1,0,0,0,0,0,0,DY,2021-09-14 22:56:20.878947
TeleahMiranda_UC7zIxbN6IR8BA5PqeSnmtQ_UFl8udEGE_228390_237826.wav,TeleahMiranda_UC7zIxbN6IR8BA5PqeSnmtQ_UFl8udEGE,228390,237826,9436,44,and then give you a little bit of information on some things that I found really interesting so the very first thing that comes up on my ancestry report is European,1,0,0,0,0,0,0,DY,2021-09-14 22:56:32.954201
TeleahMiranda_UC7zIxbN6IR8BA5PqeSnmtQ_UFl8udEGE_238050_244822.wav,TeleahMiranda_UC7zIxbN6IR8BA5PqeSnmtQ_UFl8udEGE,238050,244822,6772,45,I am thirty eight percent European thirty point three percent of that is north western European so British and Irish,1,0,0,0,0,0,0,DY,2021-09-14 22:56:44.845111
TeleahMiranda_UC7zIxbN6IR8BA5PqeSnmtQ_UFl8udEGE_244974_247922.wav,TeleahMiranda_UC7zIxbN6IR8BA5PqeSnmtQ_UFl8udEGE,244974,247922,2948,46,French and German and then broadly North Western European,1,0,0,0,0,0,0,DY,2021-09-14 22:56:52.750662
TeleahMiranda_UC7zIxbN6IR8BA5PqeSnmtQ_UFl8udEGE_248170_252794.wav,TeleahMiranda_UC7zIxbN6IR8BA5PqeSnmtQ_UFl8udEGE,248170,252794,4624,47,I know that my dad's mom I'm pretty sure,1,0,0,0,0,0,0,DY,2021-09-14 22:57:02.154961
TeleahMiranda_UC7zIxbN6IR8BA5PqeSnmtQ_UFl8udEGE_253458_256186.wav,TeleahMiranda_UC7zIxbN6IR8BA5PqeSnmtQ_UFl8udEGE,253458,256186,2728,48,I have been told that she is Irish,1,0,0,0,0,0,0,DY,2021-09-14 22:57:08.868277
TeleahMiranda_UC7zIxbN6IR8BA5PqeSnmtQ_UFl8udEGE_256626_258594.wav,TeleahMiranda_UC7zIxbN6IR8BA5PqeSnmtQ_UFl8udEGE,256626,258594,1968,49,and then my mom's,1,0,0,0,0,1,0,DY,2021-09-14 22:57:20.873433
TeleahMiranda_UC7zIxbN6IR8BA5PqeSnmtQ_UFl8udEGE_259066_262834.wav,TeleahMiranda_UC7zIxbN6IR8BA5PqeSnmtQ_UFl8udEGE,259066,262834,3768,50,mom's mom so my great grandma on my mom's side,1,0,1,0,0,0,0,DY,2021-09-14 22:58:01.067490
TeleahMiranda_UC7zIxbN6IR8BA5PqeSnmtQ_UFl8udEGE_263082_273866.wav,TeleahMiranda_UC7zIxbN6IR8BA5PqeSnmtQ_UFl8udEGE,263082,273866,10784,51,I know that she was like British and Irish thirty point three percent Northwestern European now the other European part of me is two point seven southern European so that includes,1,0,0,0,0,0,0,DY,2021-09-14 22:58:17.338226
TeleahMiranda_UC7zIxbN6IR8BA5PqeSnmtQ_UFl8udEGE_274106_277270.wav,TeleahMiranda_UC7zIxbN6IR8BA5PqeSnmtQ_UFl8udEGE,274106,277270,3164,52,Italy Malta span* Spain Portugal,1,0,0,0,0,0,0,DY,2021-09-14 22:58:26.481517
TeleahMiranda_UC7zIxbN6IR8BA5PqeSnmtQ_UFl8udEGE_277454_278839.wav,TeleahMiranda_UC7zIxbN6IR8BA5PqeSnmtQ_UFl8udEGE,277454,278839,1385,53,and then broadly southern European-,1,0,0,0,0,0,0,DY,2021-09-14 22:58:34.658808
TeleahMiranda_UC7zIxbN6IR8BA5PqeSnmtQ_UFl8udEGE_278991_287512.wav,TeleahMiranda_UC7zIxbN6IR8BA5PqeSnmtQ_UFl8udEGE,278991,287512,8521,54,point_unc eight_unc percent_unc Italian_unc point_unc two_unc percent_unc Spanish_unc and_unc portuguese_unc I_unc knew_unc it_unc,0,0,1,0,0,0,0,DY,2021-09-14 22:58:52.523262
TeleahMiranda_UC7zIxbN6IR8BA5PqeSnmtQ_UFl8udEGE_287640_291010.wav,TeleahMiranda_UC7zIxbN6IR8BA5PqeSnmtQ_UFl8udEGE,287640,291010,3370,55,I believe it came from the Egyptian side of my family,1,0,0,0,0,0,0,DY,2021-09-14 22:59:00.763278
TeleahMiranda_UC7zIxbN6IR8BA5PqeSnmtQ_UFl8udEGE_291442_297746.wav,TeleahMiranda_UC7zIxbN6IR8BA5PqeSnmtQ_UFl8udEGE,291442,297746,6304,56,so if you know geography you would know that the Mediterranean separates southern Europe and northern Africa,1,0,1,0,0,0,0,DY,2021-09-14 22:59:11.852030
TeleahMiranda_UC7zIxbN6IR8BA5PqeSnmtQ_UFl8udEGE_298138_301610.wav,TeleahMiranda_UC7zIxbN6IR8BA5PqeSnmtQ_UFl8udEGE,298138,301610,3472,57,and I honestly believe that part of our Egyptian side,1,0,0,0,0,0,0,DY,2021-09-14 22:59:20.204952
TeleahMiranda_UC7zIxbN6IR8BA5PqeSnmtQ_UFl8udEGE_302274_305290.wav,TeleahMiranda_UC7zIxbN6IR8BA5PqeSnmtQ_UFl8udEGE,302274,305290,3016,58,is also like Italian or,1,0,0,0,0,0,0,DY,2021-09-14 22:59:26.918026
TeleahMiranda_UC7zIxbN6IR8BA5PqeSnmtQ_UFl8udEGE_306242_310170.wav,TeleahMiranda_UC7zIxbN6IR8BA5PqeSnmtQ_UFl8udEGE,306242,310170,3928,59,Spanish Portuguese because it's right across the Mediterranean Sea,1,0,0,0,0,0,0,DY,2021-09-14 22:59:40.811432
TeleahMiranda_UC7zIxbN6IR8BA5PqeSnmtQ_UFl8udEGE_310426_314058.wav,TeleahMiranda_UC7zIxbN6IR8BA5PqeSnmtQ_UFl8udEGE,310426,314058,3632,60,so that's what I can assume now it's very possible that it came from the w-,1,0,0,0,0,0,0,DY,2021-09-14 22:59:56.023079
TeleahMiranda_UC7zIxbN6IR8BA5PqeSnmtQ_UFl8udEGE_314410_320290.wav,TeleahMiranda_UC7zIxbN6IR8BA5PqeSnmtQ_UFl8udEGE,314410,320290,5880,61,white- sides of my family the people who came from like Great Britain and Ireland and France and Germany,1,0,0,0,0,0,0,DY,2021-09-14 23:00:29.452238
TeleahMiranda_UC7zIxbN6IR8BA5PqeSnmtQ_UFl8udEGE_320530_322538.wav,TeleahMiranda_UC7zIxbN6IR8BA5PqeSnmtQ_UFl8udEGE,320530,322538,2008,62,but I really truly believe that it did,1,0,0,0,0,0,0,DY,2021-09-14 23:00:48.186638
TeleahMiranda_UC7zIxbN6IR8BA5PqeSnmtQ_UFl8udEGE_323306_328090.wav,TeleahMiranda_UC7zIxbN6IR8BA5PqeSnmtQ_UFl8udEGE,323306,328090,4784,63,come from the Egyptian side just because geographically that would make sense to me,1,0,0,0,0,0,0,DY,2021-09-14 23:01:54.551355
TeleahMiranda_UC7zIxbN6IR8BA5PqeSnmtQ_UFl8udEGE_328346_329148.wav,TeleahMiranda_UC7zIxbN6IR8BA5PqeSnmtQ_UFl8udEGE,328346,329148,802,64,now,1,0,0,0,0,0,0,DY,2021-09-14 23:02:00.440523
TeleahMiranda_UC7zIxbN6IR8BA5PqeSnmtQ_UFl8udEGE_329420_338133.wav,TeleahMiranda_UC7zIxbN6IR8BA5PqeSnmtQ_UFl8udEGE,329420,338133,8713,65,I knew that most of my map would cover Africa because I know my dad is black and I know my mom's dad came from Egypt so he is African,1,0,0,0,0,0,0,DY,2021-09-14 23:02:25.061769
TeleahMiranda_UC7zIxbN6IR8BA5PqeSnmtQ_UFl8udEGE_338253_341445.wav,TeleahMiranda_UC7zIxbN6IR8BA5PqeSnmtQ_UFl8udEGE,338253,341445,3192,66,so I'm thirty four point two percent sub saharan African,1,0,0,0,0,0,0,DY,2021-09-14 23:03:12.290873
TeleahMiranda_UC7zIxbN6IR8BA5PqeSnmtQ_UFl8udEGE_341565_346214.wav,TeleahMiranda_UC7zIxbN6IR8BA5PqeSnmtQ_UFl8udEGE,341565,346214,4649,67,now that is a l- a little bit less than how much European I am it's almost the same amount,1,0,0,0,0,0,0,DY,2021-09-14 23:03:21.925291
TeleahMiranda_UC7zIxbN6IR8BA5PqeSnmtQ_UFl8udEGE_346342_349770.wav,TeleahMiranda_UC7zIxbN6IR8BA5PqeSnmtQ_UFl8udEGE,346342,349770,3428,68,but I am twenty six point eight percent West African,1,0,0,0,0,0,0,DY,2021-09-14 23:03:31.035872
TeleahMiranda_UC7zIxbN6IR8BA5PqeSnmtQ_UFl8udEGE_350074_358186.wav,TeleahMiranda_UC7zIxbN6IR8BA5PqeSnmtQ_UFl8udEGE,350074,358186,8112,69,now if you know anything about the slave trade you know that most of the slaves did come from West Africa so I can only assume that my ancestors were slaves at one point,1,0,0,0,0,0,0,DY,2021-09-14 23:04:10.144384
TeleahMiranda_UC7zIxbN6IR8BA5PqeSnmtQ_UFl8udEGE_358402_364690.wav,TeleahMiranda_UC7zIxbN6IR8BA5PqeSnmtQ_UFl8udEGE,358402,364690,6288,70,I am at- ten point five percent Nigerian I'm_unc ten_unc point_unc five_unc percent_unc Nigerian_unc,1,0,1,0,0,0,0,DY,2021-09-14 23:04:26.127839
TeleahMiranda_UC7zIxbN6IR8BA5PqeSnmtQ_UFl8udEGE_364922_369002.wav,TeleahMiranda_UC7zIxbN6IR8BA5PqeSnmtQ_UFl8udEGE,364922,369002,4080,71,nine point eight percent Ghanian liberian and sierra leonean,1,0,0,0,0,0,0,DY,2021-09-14 23:05:26.583040
TeleahMiranda_UC7zIxbN6IR8BA5PqeSnmtQ_UFl8udEGE_369378_370626.wav,TeleahMiranda_UC7zIxbN6IR8BA5PqeSnmtQ_UFl8udEGE,369378,370626,1248,72,Sierra_unn,0,0,0,1,0,0,0,DY,2021-09-14 23:05:33.192185
TeleahMiranda_UC7zIxbN6IR8BA5PqeSnmtQ_UFl8udEGE_371090_372002.wav,TeleahMiranda_UC7zIxbN6IR8BA5PqeSnmtQ_UFl8udEGE,371090,372002,912,73,Leone_unn,0,0,0,1,0,0,0,DY,2021-09-14 23:05:41.583536
TeleahMiranda_UC7zIxbN6IR8BA5PqeSnmtQ_UFl8udEGE_372522_376746.wav,TeleahMiranda_UC7zIxbN6IR8BA5PqeSnmtQ_UFl8udEGE,372522,376746,4224,74,I am one point three percent Senegambian and Guinean,1,0,0,0,0,0,0,DY,2021-09-14 23:05:51.481039
TeleahMiranda_UC7zIxbN6IR8BA5PqeSnmtQ_UFl8udEGE_377178_385790.wav,TeleahMiranda_UC7zIxbN6IR8BA5PqeSnmtQ_UFl8udEGE,377178,385790,8612,75,I'm five point two percent broadly West African so like I said I believe that West African came from the slave trade and my ancestors who were,1,0,0,0,0,0,0,DY,2021-09-14 23:06:06.354070
TeleahMiranda_UC7zIxbN6IR8BA5PqeSnmtQ_UFl8udEGE_385982_393194.wav,TeleahMiranda_UC7zIxbN6IR8BA5PqeSnmtQ_UFl8udEGE,385982,393194,7212,76,more than likely slaves and then I saw that I'm five point one percent Congolese and southern East African now,1,0,1,0,0,0,0,DY,2021-09-14 23:06:18.461408
TeleahMiranda_UC7zIxbN6IR8BA5PqeSnmtQ_UFl8udEGE_393706_400698.wav,TeleahMiranda_UC7zIxbN6IR8BA5PqeSnmtQ_UFl8udEGE,393706,400698,6992,77,I don't know if that came from my dad's side of the family who is African American who is black or if that came from my,1,0,1,0,0,0,0,DY,2021-09-14 23:08:20.047139
TeleahMiranda_UC7zIxbN6IR8BA5PqeSnmtQ_UFl8udEGE_400866_402666.wav,TeleahMiranda_UC7zIxbN6IR8BA5PqeSnmtQ_UFl8udEGE,400866,402666,1800,78,mom's side of the family because,1,0,1,0,0,0,0,DY,2021-09-14 23:08:30.672161
TeleahMiranda_UC7zIxbN6IR8BA5PqeSnmtQ_UFl8udEGE_403018_404970.wav,TeleahMiranda_UC7zIxbN6IR8BA5PqeSnmtQ_UFl8udEGE,403018,404970,1952,79,it is south of the Sudan,1,0,0,0,0,0,0,DY,2021-09-14 23:08:37.011013
TeleahMiranda_UC7zIxbN6IR8BA5PqeSnmtQ_UFl8udEGE_405266_406978.wav,TeleahMiranda_UC7zIxbN6IR8BA5PqeSnmtQ_UFl8udEGE,405266,406978,1712,80,but Egypt is north of the Sudan,1,0,0,0,0,0,0,DY,2021-09-14 23:08:41.629252
TeleahMiranda_UC7zIxbN6IR8BA5PqeSnmtQ_UFl8udEGE_407498_409342.wav,TeleahMiranda_UC7zIxbN6IR8BA5PqeSnmtQ_UFl8udEGE,407498,409342,1844,81,and it's North East Africa,1,0,0,0,0,0,0,DY,2021-09-14 23:08:48.218143
TeleahMiranda_UC7zIxbN6IR8BA5PqeSnmtQ_UFl8udEGE_409550_412654.wav,TeleahMiranda_UC7zIxbN6IR8BA5PqeSnmtQ_UFl8udEGE,409550,412654,3104,82,I would say on a map it looks like North East Africa,1,0,0,0,0,0,0,DY,2021-09-14 23:08:56.093227
TeleahMiranda_UC7zIxbN6IR8BA5PqeSnmtQ_UFl8udEGE_412902_417410.wav,TeleahMiranda_UC7zIxbN6IR8BA5PqeSnmtQ_UFl8udEGE,412902,417410,4508,83,and so I don't know if any of this East African came from my,1,0,0,0,0,0,0,DY,2021-09-14 23:09:04.850604
TeleahMiranda_UC7zIxbN6IR8BA5PqeSnmtQ_UFl8udEGE_417922_421878.wav,TeleahMiranda_UC7zIxbN6IR8BA5PqeSnmtQ_UFl8udEGE,417922,421878,3956,84,mom's dad side of the family or my dad's side of the family,1,0,0,0,0,0,0,DY,2021-09-14 23:09:13.481951
TeleahMiranda_UC7zIxbN6IR8BA5PqeSnmtQ_UFl8udEGE_422142_422808.wav,TeleahMiranda_UC7zIxbN6IR8BA5PqeSnmtQ_UFl8udEGE,422142,422808,666,85,and he has,1,0,0,0,0,0,0,DY,2021-09-14 23:09:22.841870
TeleahMiranda_UC7zIxbN6IR8BA5PqeSnmtQ_UFl8udEGE_423032_425825.wav,TeleahMiranda_UC7zIxbN6IR8BA5PqeSnmtQ_UFl8udEGE,423032,425825,2793,86,African ancestry on both his mom and dad's side,1,0,0,0,0,0,0,DY,2021-09-14 23:09:44.184551
TeleahMiranda_UC7zIxbN6IR8BA5PqeSnmtQ_UFl8udEGE_426081_435354.wav,TeleahMiranda_UC7zIxbN6IR8BA5PqeSnmtQ_UFl8udEGE,426081,435354,9273,87,so I'm not sure where that came from but I feel like that came from my mom's side I knew that most of my map would be covered- would cover like all of Africa technically because I'm from both,1,0,0,0,0,0,0,DY,2021-09-14 23:10:14.630065
TeleahMiranda_UC7zIxbN6IR8BA5PqeSnmtQ_UFl8udEGE_435978_436526.wav,TeleahMiranda_UC7zIxbN6IR8BA5PqeSnmtQ_UFl8udEGE,435978,436526,548,88,North,1,0,0,0,0,0,0,DY,2021-09-14 23:10:20.584206
TeleahMiranda_UC7zIxbN6IR8BA5PqeSnmtQ_UFl8udEGE_436686_443954.wav,TeleahMiranda_UC7zIxbN6IR8BA5PqeSnmtQ_UFl8udEGE,436686,443954,7268,89,Africa and sub saharan Africa and so here it says I'm twenty four point nine percent Western Asian and North African,1,0,0,0,0,0,0,DY,2021-09-14 23:10:40.022395
TeleahMiranda_UC7zIxbN6IR8BA5PqeSnmtQ_UFl8udEGE_444210_447990.wav,TeleahMiranda_UC7zIxbN6IR8BA5PqeSnmtQ_UFl8udEGE,444210,447990,3780,90,twenty three point three percent of that is Arab Egyptian and Levantine,1,0,0,0,0,0,0,DY,2021-09-14 23:10:49.673914
TeleahMiranda_UC7zIxbN6IR8BA5PqeSnmtQ_UFl8udEGE_448214_451568.wav,TeleahMiranda_UC7zIxbN6IR8BA5PqeSnmtQ_UFl8udEGE,448214,451568,3354,91,seventeen point six percent of that is Egyptian,1,0,0,0,0,0,0,DY,2021-09-14 23:10:58.093774
TeleahMiranda_UC7zIxbN6IR8BA5PqeSnmtQ_UFl8udEGE_451760_456313.wav,TeleahMiranda_UC7zIxbN6IR8BA5PqeSnmtQ_UFl8udEGE,451760,456313,4553,92,three point five percent of that's coptic egyptian and two point two percent of that is broadly Arab,1,0,0,0,0,0,0,DY,2021-09-14 23:11:08.061447
TeleahMiranda_UC7zIxbN6IR8BA5PqeSnmtQ_UFl8udEGE_456489_462793.wav,TeleahMiranda_UC7zIxbN6IR8BA5PqeSnmtQ_UFl8udEGE,456489,462793,6304,93,Egyptian and Levantine it says three point five percent of my ancestry is coptic egyptian so it says making up,1,0,0,0,0,0,0,DY,2021-09-14 23:11:19.935760
TeleahMiranda_UC7zIxbN6IR8BA5PqeSnmtQ_UFl8udEGE_462921_472426.wav,TeleahMiranda_UC7zIxbN6IR8BA5PqeSnmtQ_UFl8udEGE,462921,472426,9505,94,over ten percent of Egypt's population copts are a Christian minority who share an ancient history with non Coptic Egyptians that dates back before the first Pharaohs,1,0,0,0,0,0,0,DY,2021-09-14 23:11:43.644690
TeleahMiranda_UC7zIxbN6IR8BA5PqeSnmtQ_UFl8udEGE_472706_472930.wav,TeleahMiranda_UC7zIxbN6IR8BA5PqeSnmtQ_UFl8udEGE,472706,472930,224,95,,0,0,0,0,0,1,0,DY,2021-09-14 23:11:51.638991
TeleahMiranda_UC7zIxbN6IR8BA5PqeSnmtQ_UFl8udEGE_472930_476770.wav,TeleahMiranda_UC7zIxbN6IR8BA5PqeSnmtQ_UFl8udEGE,472930,476770,3840,96,however after the seventh century conquest of Egypt by the rashidun Caliphate,1,0,0,0,0,0,0,DY,2021-09-14 23:12:09.023514
TeleahMiranda_UC7zIxbN6IR8BA5PqeSnmtQ_UFl8udEGE_476906_485954.wav,TeleahMiranda_UC7zIxbN6IR8BA5PqeSnmtQ_UFl8udEGE,476906,485954,9048,97,the Christian copts began to become genetically distinct from the Muslim majority population while the Coptic language was replaced by Egyptian Arabic outside of a strictly religious setting,1,0,0,0,0,0,0,DY,2021-09-14 23:12:21.041980
TeleahMiranda_UC7zIxbN6IR8BA5PqeSnmtQ_UFl8udEGE_486098_488578.wav,TeleahMiranda_UC7zIxbN6IR8BA5PqeSnmtQ_UFl8udEGE,486098,488578,2480,98,today most copts live in Egypt or Sudan,1,0,0,0,0,0,0,DY,2021-09-14 23:12:27.601394
TeleahMiranda_UC7zIxbN6IR8BA5PqeSnmtQ_UFl8udEGE_488706_492890.wav,TeleahMiranda_UC7zIxbN6IR8BA5PqeSnmtQ_UFl8udEGE,488706,492890,4184,99,but there are also large Coptic communities living in the United States Australia and Canada,1,0,0,0,0,0,0,DY,2021-09-14 23:12:37.749004
