filename,video_id,start_time,end_time,duration,id,transcription,usability,bg_music,bg_noise,other_voice,only_music,only_noise,other_sounds,annotator,annotate_date_YYYYMMDD
MikiRai_UC3f6OYvhpVpmTYgikEbF1g_Q74l5QbhAk4_576195_580179.wav,MikiRai_UC3f6OYvhpVpmTYgikEbF1g_Q74l5QbhAk4,576195,580179,3984,94,into my second year of college what are some deal breakers for you,1,0,0,0,0,0,1,DY,2021-07-08 20:21:29.250668
MikiRai_UC3f6OYvhpVpmTYgikEbF1g_Q74l5QbhAk4_580955_582387.wav,MikiRai_UC3f6OYvhpVpmTYgikEbF1g_Q74l5QbhAk4,580955,582387,1432,95,u- interesting question,1,0,0,0,0,0,0,DY,2021-07-08 20:21:42.073554
MikiRai_UC3f6OYvhpVpmTYgikEbF1g_Q74l5QbhAk4_582891_586915.wav,MikiRai_UC3f6OYvhpVpmTYgikEbF1g_Q74l5QbhAk4,582891,586915,4024,96,it's really funny because I think the type of person that I've liked,1,0,0,0,0,0,0,DY,2021-07-08 20:21:50.230819
MikiRai_UC3f6OYvhpVpmTYgikEbF1g_Q74l5QbhAk4_587723_593460.wav,MikiRai_UC3f6OYvhpVpmTYgikEbF1g_Q74l5QbhAk4,587723,593460,5737,97,has always been really similar and I'm like oh I don't have a type but they all kind of end up being kinda the same,1,0,0,0,0,0,0,DY,2021-07-08 20:22:01.365319
MikiRai_UC3f6OYvhpVpmTYgikEbF1g_Q74l5QbhAk4_593804_597133.wav,MikiRai_UC3f6OYvhpVpmTYgikEbF1g_Q74l5QbhAk4,593804,597133,3329,98,I think it's really unattractive to me when people don't work hard,1,0,0,0,0,0,0,DY,2021-07-08 20:22:10.324368
MikiRai_UC3f6OYvhpVpmTYgikEbF1g_Q74l5QbhAk4_597511_598051.wav,MikiRai_UC3f6OYvhpVpmTYgikEbF1g_Q74l5QbhAk4,597511,598051,540,99,um,1,0,0,0,0,0,0,DY,2021-07-08 20:22:15.747550
MikiRai_UC3f6OYvhpVpmTYgikEbF1g_Q74l5QbhAk4_598171_611685.wav,MikiRai_UC3f6OYvhpVpmTYgikEbF1g_Q74l5QbhAk4,598171,611685,13514,100,for their goals or they're not ambitious and don't have like a next set of goals for me at least I am constantly thinking about like how can I be a better person how can I give more what is the next thing I should be working on and it's really hard for me when,1,0,0,0,0,0,0,DY,2021-07-08 20:22:33.991490
MikiRai_UC3f6OYvhpVpmTYgikEbF1g_Q74l5QbhAk4_611789_614519.wav,MikiRai_UC3f6OYvhpVpmTYgikEbF1g_Q74l5QbhAk4,611789,614519,2730,101,the person that I am in a relationship with or,1,0,0,0,0,0,0,DY,2021-07-08 20:22:41.970674
MikiRai_UC3f6OYvhpVpmTYgikEbF1g_Q74l5QbhAk4_614695_621267.wav,MikiRai_UC3f6OYvhpVpmTYgikEbF1g_Q74l5QbhAk4,614695,621267,6572,102,were to be in a relationship with isn't also like that like they need to like also have the same mindset if that makes sense,1,0,0,0,0,0,0,DY,2021-07-08 20:22:54.922553
MikiRai_UC3f6OYvhpVpmTYgikEbF1g_Q74l5QbhAk4_621547_623875.wav,MikiRai_UC3f6OYvhpVpmTYgikEbF1g_Q74l5QbhAk4,621547,623875,2328,103,'m also just like not a huge fan of like,1,0,0,0,0,0,0,DY,2021-07-08 20:23:02.422500
MikiRai_UC3f6OYvhpVpmTYgikEbF1g_Q74l5QbhAk4_624483_625691.wav,MikiRai_UC3f6OYvhpVpmTYgikEbF1g_Q74l5QbhAk4,624483,625691,1208,104,facial hair,1,0,0,0,0,0,0,DY,2021-07-08 20:23:09.450653
MikiRai_UC3f6OYvhpVpmTYgikEbF1g_Q74l5QbhAk4_626947_631619.wav,MikiRai_UC3f6OYvhpVpmTYgikEbF1g_Q74l5QbhAk4,626947,631619,4672,105,I dunno personal preference were you a popular girl in high school,1,0,0,0,0,0,1,DY,2021-07-08 20:23:18.592841
MikiRai_UC3f6OYvhpVpmTYgikEbF1g_Q74l5QbhAk4_632507_634939.wav,MikiRai_UC3f6OYvhpVpmTYgikEbF1g_Q74l5QbhAk4,632507,634939,2432,106,I hope no one from my high school is watching this,1,0,0,0,0,0,0,DY,2021-07-08 20:23:26.718179
MikiRai_UC3f6OYvhpVpmTYgikEbF1g_Q74l5QbhAk4_635507_644195.wav,MikiRai_UC3f6OYvhpVpmTYgikEbF1g_Q74l5QbhAk4,635507,644195,8688,107,um I would say it was- I- uh- definitely like peaked in middle school middle school was when I felt like a very very cool person like all the boys liked me,1,0,0,0,0,0,0,DY,2021-07-08 20:23:50.960905
MikiRai_UC3f6OYvhpVpmTYgikEbF1g_Q74l5QbhAk4_644347_654955.wav,MikiRai_UC3f6OYvhpVpmTYgikEbF1g_Q74l5QbhAk4,644347,654955,10608,108,I was like this very extroverted person who was like friends with everyone I said hi to everyone and then when I got to high school I think I was so stressed trying to apply for college that,1,0,0,0,0,0,0,DY,2021-07-08 20:24:06.150231
MikiRai_UC3f6OYvhpVpmTYgikEbF1g_Q74l5QbhAk4_655067_659995.wav,MikiRai_UC3f6OYvhpVpmTYgikEbF1g_Q74l5QbhAk4,655067,659995,4928,109,I had zero energy to pretend to be this like extroverted person that I actually wasn't,1,0,0,0,0,0,0,DY,2021-07-08 20:24:17.023893
MikiRai_UC3f6OYvhpVpmTYgikEbF1g_Q74l5QbhAk4_660099_661763.wav,MikiRai_UC3f6OYvhpVpmTYgikEbF1g_Q74l5QbhAk4,660099,661763,1664,110,and so when I got to high school,1,0,0,0,0,0,0,DY,2021-07-08 20:24:24.071076
MikiRai_UC3f6OYvhpVpmTYgikEbF1g_Q74l5QbhAk4_662163_663187.wav,MikiRai_UC3f6OYvhpVpmTYgikEbF1g_Q74l5QbhAk4,662163,663187,1024,111,um I,1,0,0,0,0,0,0,DY,2021-07-08 20:24:34.038579
MikiRai_UC3f6OYvhpVpmTYgikEbF1g_Q74l5QbhAk4_663427_676283.wav,MikiRai_UC3f6OYvhpVpmTYgikEbF1g_Q74l5QbhAk4,663427,676283,12856,112,pretty much hung out with like the same couple of people I definitely spent a lot of my brunches and lunches just in the hospital trying to catch up on homework and studying I was just really nervous that I was not gonna get into college at all,1,0,0,0,0,0,0,DY,2021-07-08 20:24:52.000072
MikiRai_UC3f6OYvhpVpmTYgikEbF1g_Q74l5QbhAk4_676475_679227.wav,MikiRai_UC3f6OYvhpVpmTYgikEbF1g_Q74l5QbhAk4,676475,679227,2752,113,and so all of my time and energy was focused towards that,1,0,0,0,0,0,0,DY,2021-07-08 20:24:59.970298
MikiRai_UC3f6OYvhpVpmTYgikEbF1g_Q74l5QbhAk4_679443_682779.wav,MikiRai_UC3f6OYvhpVpmTYgikEbF1g_Q74l5QbhAk4,679443,682779,3336,114,how has it been adjusting to your new jobs,1,0,0,0,0,0,1,DY,2021-07-08 20:25:08.897076
MikiRai_UC3f6OYvhpVpmTYgikEbF1g_Q74l5QbhAk4_682891_693283.wav,MikiRai_UC3f6OYvhpVpmTYgikEbF1g_Q74l5QbhAk4,682891,693283,10392,115,thank you for asking it's been really really amazing um I definitely had I think when you like first make that switch the first like you know one month two months are pretty rough,1,0,0,0,0,0,0,DY,2021-07-08 20:25:25.923895
MikiRai_UC3f6OYvhpVpmTYgikEbF1g_Q74l5QbhAk4_693395_706011.wav,MikiRai_UC3f6OYvhpVpmTYgikEbF1g_Q74l5QbhAk4,693395,706011,12616,116,but uh- now that I'm past that phase I am really really happy to be doing the jobs that I am doing and contributing in the ways that I can be contributing twenty twenty I've been really conscious about making decisions that make,1,0,0,0,0,0,0,DY,2021-07-08 20:25:44.678475
MikiRai_UC3f6OYvhpVpmTYgikEbF1g_Q74l5QbhAk4_706139_716811.wav,MikiRai_UC3f6OYvhpVpmTYgikEbF1g_Q74l5QbhAk4,706139,716811,10672,117,me happy and that are in my own best interest um and not what like other people want me to do or what other people expect me to do and I have just never been happier,1,0,0,0,0,0,0,DY,2021-07-08 20:26:00.696232
MikiRai_UC3f6OYvhpVpmTYgikEbF1g_Q74l5QbhAk4_717027_719011.wav,MikiRai_UC3f6OYvhpVpmTYgikEbF1g_Q74l5QbhAk4,717027,719011,1984,118,my heart is really so full,1,0,0,0,0,0,0,DY,2021-07-08 20:26:08.118576
MikiRai_UC3f6OYvhpVpmTYgikEbF1g_Q74l5QbhAk4_719171_720679.wav,MikiRai_UC3f6OYvhpVpmTYgikEbF1g_Q74l5QbhAk4,719171,720679,1508,119,I'm really really happy,1,0,0,0,0,0,0,DY,2021-07-08 20:26:15.063203
MikiRai_UC3f6OYvhpVpmTYgikEbF1g_Q74l5QbhAk4_720799_728696.wav,MikiRai_UC3f6OYvhpVpmTYgikEbF1g_Q74l5QbhAk4,720799,728696,7897,120,thank you so so much for a hundred K on YouTube I honestly I cried I was like I can't believe we're here,1,0,1,0,0,0,0,DY,2021-07-08 20:26:49.997384
MikiRai_UC3f6OYvhpVpmTYgikEbF1g_Q74l5QbhAk4_728776_735472.wav,MikiRai_UC3f6OYvhpVpmTYgikEbF1g_Q74l5QbhAk4,728776,735472,6696,121,I hit a hundred K on YouTube and a hundred K on tik tok within like twenty four hours of each other and I was so so happy,1,0,0,0,0,0,0,DY,2021-07-08 20:27:05.646787
MikiRai_UC3f6OYvhpVpmTYgikEbF1g_Q74l5QbhAk4_735560_736785.wav,MikiRai_UC3f6OYvhpVpmTYgikEbF1g_Q74l5QbhAk4,735560,736785,1225,122,my heart is so full,1,0,0,0,0,0,0,DY,2021-07-08 20:27:11.402134
MikiRai_UC3f6OYvhpVpmTYgikEbF1g_Q74l5QbhAk4_737315_744027.wav,MikiRai_UC3f6OYvhpVpmTYgikEbF1g_Q74l5QbhAk4,737315,744027,6712,123,I constantly tell you guys this but I literally have like two friends and so you guys are such a blessing and,1,0,0,0,0,0,0,DY,2021-07-08 20:27:22.363372
MikiRai_UC3f6OYvhpVpmTYgikEbF1g_Q74l5QbhAk4_744571_755859.wav,MikiRai_UC3f6OYvhpVpmTYgikEbF1g_Q74l5QbhAk4,744571,755859,11288,124,I'm so lucky to have a community of friends like you guys so thank you so much for subscribing for watching my video for hanging out with me every week it really does mean a lot to me thank you for a hundred K,1,0,0,0,0,0,0,DY,2021-07-08 20:27:39.444911
MikiRai_UC3f6OYvhpVpmTYgikEbF1g_Q74l5QbhAk4_756187_761779.wav,MikiRai_UC3f6OYvhpVpmTYgikEbF1g_Q74l5QbhAk4,756187,761779,5592,125,I couldn't have done it without you and I'm so so excited for what the future is going to bring us but,1,1,0,0,0,0,0,DY,2021-07-08 20:27:51.225964
MikiRai_UC3f6OYvhpVpmTYgikEbF1g_Q74l5QbhAk4_762243_774812.wav,MikiRai_UC3f6OYvhpVpmTYgikEbF1g_Q74l5QbhAk4,762243,774812,12569,126,I think that's the end of this video if you like this video please please please give this video a big thumbs up and don't forget to hit that subscribe button and turn on that notification bell so that you don't miss my weekly uploads and yeah,0,1,0,0,0,0,0,DY,2021-07-08 20:28:10.001072
MikiRai_UC3f6OYvhpVpmTYgikEbF1g_Q74l5QbhAk4_774956_775989.wav,MikiRai_UC3f6OYvhpVpmTYgikEbF1g_Q74l5QbhAk4,774956,775989,1033,127,I'll talk to you guys next week,0,1,0,0,0,0,0,DY,2021-07-08 20:28:17.795350
MikiRai_UC3f6OYvhpVpmTYgikEbF1g_Q74l5QbhAk4_776445_776702.wav,MikiRai_UC3f6OYvhpVpmTYgikEbF1g_Q74l5QbhAk4,776445,776702,257,128,bye,1,0,0,0,0,0,0,DY,2021-07-08 20:28:29.556297
MikiRai_UC3f6OYvhpVpmTYgikEbF1g_Q74l5QbhAk4_776958_777262.wav,MikiRai_UC3f6OYvhpVpmTYgikEbF1g_Q74l5QbhAk4,776958,777262,304,129,,0,0,0,0,1,0,0,DY,2021-07-08 20:28:32.497931
MikiRai_UC3f6OYvhpVpmTYgikEbF1g_Q74l5QbhAk4_777510_777774.wav,MikiRai_UC3f6OYvhpVpmTYgikEbF1g_Q74l5QbhAk4,777510,777774,264,130,,0,0,0,0,1,0,0,DY,2021-07-08 20:28:35.633691
MikiRai_UC3f6OYvhpVpmTYgikEbF1g_Q74l5QbhAk4_778030_783710.wav,MikiRai_UC3f6OYvhpVpmTYgikEbF1g_Q74l5QbhAk4,778030,783710,5680,131,it's been seven hundred degrees in here since you came in,0,0,0,0,1,0,0,DY,2021-07-08 20:28:48.291395
MikiRai_UC3f6OYvhpVpmTYgikEbF1g_Q74l5QbhAk4_784046_792422.wav,MikiRai_UC3f6OYvhpVpmTYgikEbF1g_Q74l5QbhAk4,784046,792422,8376,132,[Music],0,0,0,0,1,0,0,DY,2021-07-08 20:29:03.310973
MikiRai_UC3f6OYvhpVpmTYgikEbF1g_Q74l5QbhAk4_793222_799158.wav,MikiRai_UC3f6OYvhpVpmTYgikEbF1g_Q74l5QbhAk4,793222,799158,5936,133,[Music],0,0,0,0,1,0,0,DY,2021-07-08 20:29:14.718870
MikiRai_UC3f6OYvhpVpmTYgikEbF1g_Q74l5QbhAk4_799310_801183.wav,MikiRai_UC3f6OYvhpVpmTYgikEbF1g_Q74l5QbhAk4,799310,801183,1873,134,[Music],0,0,0,0,1,0,0,DY,2021-07-08 20:29:19.370340
MikiRai_UC3f6OYvhpVpmTYgikEbF1g_Q74l5QbhAk4_801399_806855.wav,MikiRai_UC3f6OYvhpVpmTYgikEbF1g_Q74l5QbhAk4,801399,806855,5456,135,[Music],0,0,0,0,1,0,0,DY,2021-07-08 20:29:26.488238
