filename,video_id,start_time,end_time,duration,id,transcription,usability,bg_music,bg_noise,other_voice,only_music,only_noise,other_sounds,annotator,annotate_date_YYYYMMDD
MikiRai_UC3f6OYvhpVpmTYgikEbF1g_Q74l5QbhAk4_0_7755.wav,MikiRai_UC3f6OYvhpVpmTYgikEbF1g_Q74l5QbhAk4,0,7755,7755,0,hello you guys what's up we are back today with another video and today is actually Valentine's Day which is why I look,1,0,1,0,0,0,0,DY,2021-07-08 13:30:39.736334
MikiRai_UC3f6OYvhpVpmTYgikEbF1g_Q74l5QbhAk4_8331_21749.wav,MikiRai_UC3f6OYvhpVpmTYgikEbF1g_Q74l5QbhAk4,8331,21749,13418,1,kind of decent for once you're probably watching this video a day after Valentine's Day because I am the freaking master procrastinator and I do not film and edit things until the very last minute but in my full defense this is actually the f-,1,0,1,0,0,0,0,DY,2021-07-08 13:30:58.142807
MikiRai_UC3f6OYvhpVpmTYgikEbF1g_Q74l5QbhAk4_21893_31407.wav,MikiRai_UC3f6OYvhpVpmTYgikEbF1g_Q74l5QbhAk4,21893,31407,9514,2,fourth- time that I filmed this video the first time my mic wasn't on and so there was no audio the second time I looked like an actual freaking potato,1,0,0,0,0,0,1,DY,2021-07-08 13:31:29.973394
MikiRai_UC3f6OYvhpVpmTYgikEbF1g_Q74l5QbhAk4_32163_33243.wav,MikiRai_UC3f6OYvhpVpmTYgikEbF1g_Q74l5QbhAk4,32163,33243,1080,3,the third time,1,0,0,0,0,0,0,DY,2021-07-08 13:32:14.899048
MikiRai_UC3f6OYvhpVpmTYgikEbF1g_Q74l5QbhAk4_33859_46227.wav,MikiRai_UC3f6OYvhpVpmTYgikEbF1g_Q74l5QbhAk4,33859,46227,12368,4,okay so I uh- filmed all the Q and A's I attempted to film this Q and A like two three weeks ago and twenty twenty has just been such a great year but my headspace is like in a completely different space now and so,1,0,0,0,0,0,0,DY,2021-07-08 13:32:33.562227
MikiRai_UC3f6OYvhpVpmTYgikEbF1g_Q74l5QbhAk4_46475_61099.wav,MikiRai_UC3f6OYvhpVpmTYgikEbF1g_Q74l5QbhAk4,46475,61099,14624,5,my headspace in a completely different space now is that even something you can say I am just in a completely different headspace now and so watching my own video from two weeks ago really made me cringe so hard that means we're growing right so,1,0,0,0,0,0,0,DY,2021-07-08 13:33:07.830385
MikiRai_UC3f6OYvhpVpmTYgikEbF1g_Q74l5QbhAk4_61363_68531.wav,MikiRai_UC3f6OYvhpVpmTYgikEbF1g_Q74l5QbhAk4,61363,68531,7168,6,I'm back today I asked you guys again I'm sorry for the twelveth time if you guys had questions for me but I'm gonna jump right into these,1,0,0,0,0,0,0,DY,2021-07-08 13:33:19.681767
MikiRai_UC3f6OYvhpVpmTYgikEbF1g_Q74l5QbhAk4_68635_76931.wav,MikiRai_UC3f6OYvhpVpmTYgikEbF1g_Q74l5QbhAk4,68635,76931,8296,7,by the way if you don't already follow me on Instagram you should go follow me there as well as on my TikTok because I post content on there a lot more often than once a week so,1,0,0,0,0,0,1,DY,2021-07-08 13:33:39.058299
MikiRai_UC3f6OYvhpVpmTYgikEbF1g_Q74l5QbhAk4_77347_81259.wav,MikiRai_UC3f6OYvhpVpmTYgikEbF1g_Q74l5QbhAk4,77347,81259,3912,8,I'll see you there some of these are a little juicy so <lgh>,1,0,0,0,0,0,0,DY,2021-07-08 13:34:08.123397
MikiRai_UC3f6OYvhpVpmTYgikEbF1g_Q74l5QbhAk4_81499_84171.wav,MikiRai_UC3f6OYvhpVpmTYgikEbF1g_Q74l5QbhAk4,81499,84171,2672,9,how much money do you make as a nurse,1,0,0,0,0,0,0,DY,2021-07-08 13:34:15.022435
MikiRai_UC3f6OYvhpVpmTYgikEbF1g_Q74l5QbhAk4_84307_94387.wav,MikiRai_UC3f6OYvhpVpmTYgikEbF1g_Q74l5QbhAk4,84307,94387,10080,10,so if you wanna know how much money someone makes you can just google their job uh title and also what city they live in and it'll give you a pretty good idea of,1,0,0,0,0,0,0,DY,2021-07-08 13:34:30.224116
MikiRai_UC3f6OYvhpVpmTYgikEbF1g_Q74l5QbhAk4_94595_95915.wav,MikiRai_UC3f6OYvhpVpmTYgikEbF1g_Q74l5QbhAk4,94595,95915,1320,11,how much money they make,1,0,0,0,0,0,0,DY,2021-07-08 13:34:36.529211
MikiRai_UC3f6OYvhpVpmTYgikEbF1g_Q74l5QbhAk4_96067_102803.wav,MikiRai_UC3f6OYvhpVpmTYgikEbF1g_Q74l5QbhAk4,96067,102803,6736,12,um I do live in the Bay Area or near the Bay Area so if you look at that you'll get a pretty good idea of how much money I make,1,0,0,0,0,0,0,DY,2021-07-08 13:34:59.789704
MikiRai_UC3f6OYvhpVpmTYgikEbF1g_Q74l5QbhAk4_102955_111155.wav,MikiRai_UC3f6OYvhpVpmTYgikEbF1g_Q74l5QbhAk4,102955,111155,8200,13,I can tell you that when I started out as a new grad I worked in Los Angeles and I made I think it was like forty six dollars an hour,1,0,0,0,0,0,0,DY,2021-07-08 13:35:13.838568
MikiRai_UC3f6OYvhpVpmTYgikEbF1g_Q74l5QbhAk4_111315_117115.wav,MikiRai_UC3f6OYvhpVpmTYgikEbF1g_Q74l5QbhAk4,111315,117115,5800,14,um but that number quickly went up after my sixth month and then also my one year mark,1,0,0,0,0,0,0,DY,2021-07-08 13:35:24.212102
MikiRai_UC3f6OYvhpVpmTYgikEbF1g_Q74l5QbhAk4_117267_118683.wav,MikiRai_UC3f6OYvhpVpmTYgikEbF1g_Q74l5QbhAk4,117267,118683,1416,15,how did you graduate debt f-,1,0,0,0,0,0,1,DY,2021-07-08 13:35:36.181126
MikiRai_UC3f6OYvhpVpmTYgikEbF1g_Q74l5QbhAk4_118811_123943.wav,MikiRai_UC3f6OYvhpVpmTYgikEbF1g_Q74l5QbhAk4,118811,123943,5132,16,free- so I was extremely lucky to graduate uh college without any debt,1,0,0,0,0,0,0,DY,2021-07-08 13:35:54.439558
MikiRai_UC3f6OYvhpVpmTYgikEbF1g_Q74l5QbhAk4_124055_134483.wav,MikiRai_UC3f6OYvhpVpmTYgikEbF1g_Q74l5QbhAk4,124055,134483,10428,17,which means that I don't have any student loans or anything to pay off which is really really nice I can just focus on saving for my retirement and saving for my house and y'know those kinds of goals,1,0,0,0,0,0,0,DY,2021-07-08 13:37:10.440090
MikiRai_UC3f6OYvhpVpmTYgikEbF1g_Q74l5QbhAk4_134571_140767.wav,MikiRai_UC3f6OYvhpVpmTYgikEbF1g_Q74l5QbhAk4,134571,140767,6196,18,but the reason that I was able to graduate debt free was because when I was in high school I was a pretty ambitious high schooler I was,1,0,1,0,0,0,0,DY,2021-07-08 13:37:38.421421
MikiRai_UC3f6OYvhpVpmTYgikEbF1g_Q74l5QbhAk4_140879_146039.wav,MikiRai_UC3f6OYvhpVpmTYgikEbF1g_Q74l5QbhAk4,140879,146039,5160,19,pretty on top of all my stuff and I applied to so many scholarships,1,0,1,0,0,0,0,DY,2021-07-08 13:37:56.768515
MikiRai_UC3f6OYvhpVpmTYgikEbF1g_Q74l5QbhAk4_146151_150401.wav,MikiRai_UC3f6OYvhpVpmTYgikEbF1g_Q74l5QbhAk4,146151,150401,4250,20,every scholarship that I was eligible to apply for I basically applied for,1,0,0,0,0,0,0,DY,2021-07-08 13:38:06.313208
MikiRai_UC3f6OYvhpVpmTYgikEbF1g_Q74l5QbhAk4_150513_157002.wav,MikiRai_UC3f6OYvhpVpmTYgikEbF1g_Q74l5QbhAk4,150513,157002,6489,21,um the application for scholarships is pretty similar it's always like some kind of essay slash personal statement slash cover letter,1,0,0,0,0,0,0,DY,2021-07-08 13:38:17.025190
MikiRai_UC3f6OYvhpVpmTYgikEbF1g_Q74l5QbhAk4_157162_166763.wav,MikiRai_UC3f6OYvhpVpmTYgikEbF1g_Q74l5QbhAk4,157162,166763,9601,22,um in addition to your resume and then maybe like so- supplemental essay- but I basically applied for a bunch of scholarships I obviously didn't get all of them but the ones that I did get really did add up,1,0,0,0,0,0,0,DY,2021-07-08 13:38:31.785708
MikiRai_UC3f6OYvhpVpmTYgikEbF1g_Q74l5QbhAk4_166939_171251.wav,MikiRai_UC3f6OYvhpVpmTYgikEbF1g_Q74l5QbhAk4,166939,171251,4312,23,I also did receive scholarships from UCLA so that was extremely helpful,1,0,0,0,0,0,0,DY,2021-07-08 13:38:40.468721
MikiRai_UC3f6OYvhpVpmTYgikEbF1g_Q74l5QbhAk4_171363_193671.wav,MikiRai_UC3f6OYvhpVpmTYgikEbF1g_Q74l5QbhAk4,171363,193671,22308,24,in terms of cost of living my parents were very very amazing I'm very grateful that they helped me pay for my rent while I was in college I never lived on campus because living on campus if you didn't already know is extremely expensive I wanna say it's like fifteen K a year at UCLA ended up living off campus I lived in a triple for all three years I was at UCLA and my rent was anywhere from,1,0,0,0,0,0,0,DY,2021-07-08 13:39:43.229297
MikiRai_UC3f6OYvhpVpmTYgikEbF1g_Q74l5QbhAk4_193767_195715.wav,MikiRai_UC3f6OYvhpVpmTYgikEbF1g_Q74l5QbhAk4,193767,195715,1948,25,six hundred seven hundred dollars a month,1,0,0,0,0,0,0,DY,2021-07-08 13:39:49.680786
MikiRai_UC3f6OYvhpVpmTYgikEbF1g_Q74l5QbhAk4_196211_205807.wav,MikiRai_UC3f6OYvhpVpmTYgikEbF1g_Q74l5QbhAk4,196211,205807,9596,26,um and that's living with two other girls in the same room so just keep that in mind but we were also in Westwood which is kind of a very nice bougie part of LA and then in terms of actual,1,0,0,0,0,0,0,DY,2021-07-08 13:40:04.928480
MikiRai_UC3f6OYvhpVpmTYgikEbF1g_Q74l5QbhAk4_206087_216649.wav,MikiRai_UC3f6OYvhpVpmTYgikEbF1g_Q74l5QbhAk4,206087,216649,10562,27,like living expenses so like food or um buying clothes or like going shopping and buying things that I wanted I have always worked pretty much since it was legal for me to work,1,0,0,0,0,0,0,DY,2021-07-08 13:40:21.205251
MikiRai_UC3f6OYvhpVpmTYgikEbF1g_Q74l5QbhAk4_216881_223154.wav,MikiRai_UC3f6OYvhpVpmTYgikEbF1g_Q74l5QbhAk4,216881,223154,6273,28,even before it was legal for me to work as a kid I was like selling pencils to my classmates I was,1,0,0,0,0,0,0,DY,2021-07-08 13:40:32.655751
MikiRai_UC3f6OYvhpVpmTYgikEbF1g_Q74l5QbhAk4_223338_228450.wav,MikiRai_UC3f6OYvhpVpmTYgikEbF1g_Q74l5QbhAk4,223338,228450,5112,29,uh dog sitting for other people and when I turned sixteen I started working at a bakery so I,1,0,0,0,0,0,0,DY,2021-07-08 13:40:44.567086
MikiRai_UC3f6OYvhpVpmTYgikEbF1g_Q74l5QbhAk4_228738_245514.wav,MikiRai_UC3f6OYvhpVpmTYgikEbF1g_Q74l5QbhAk4,228738,245514,16776,30,was a barista and um also was like a cashier also worked in some labs and then when I went to college I also continued to work part time and so all that money is my money to spend um and I've never had to ask my parents for money- think I've been really wise with my monetary decisions because all the money is like money,1,0,0,0,0,0,0,DY,2021-07-08 13:41:11.549810
MikiRai_UC3f6OYvhpVpmTYgikEbF1g_Q74l5QbhAk4_245610_247402.wav,MikiRai_UC3f6OYvhpVpmTYgikEbF1g_Q74l5QbhAk4,245610,247402,1792,31,that is super hard earned to me,1,0,0,0,0,0,0,DY,2021-07-08 13:41:17.852904
MikiRai_UC3f6OYvhpVpmTYgikEbF1g_Q74l5QbhAk4_247490_254179.wav,MikiRai_UC3f6OYvhpVpmTYgikEbF1g_Q74l5QbhAk4,247490,254179,6689,32,so for example my first ever job I made eight dollars an hour and so it really put into perspective like hey if I'm gonna buy this,1,0,0,0,0,0,0,DY,2021-07-08 13:41:28.786660
MikiRai_UC3f6OYvhpVpmTYgikEbF1g_Q74l5QbhAk4_254307_262003.wav,MikiRai_UC3f6OYvhpVpmTYgikEbF1g_Q74l5QbhAk4,254307,262003,7696,33,forty dollar thing I have to work five hours is that really worth it for me to purchase item do you plan on always being a nurse,1,0,0,0,0,0,1,DY,2021-07-08 13:41:59.547535
MikiRai_UC3f6OYvhpVpmTYgikEbF1g_Q74l5QbhAk4_262347_262531.wav,MikiRai_UC3f6OYvhpVpmTYgikEbF1g_Q74l5QbhAk4,262347,262531,184,34,,0,0,0,0,0,1,0,DY,2021-07-08 13:42:03.147671
MikiRai_UC3f6OYvhpVpmTYgikEbF1g_Q74l5QbhAk4_262819_274371.wav,MikiRai_UC3f6OYvhpVpmTYgikEbF1g_Q74l5QbhAk4,262819,274371,11552,35,the great thing about nursing is that it is such a flexible career there are so many things that you can do with it you can work in a hospital you can work in a clinic you can do you can work remotely you can work,1,0,0,0,0,0,0,DY,2021-07-08 13:42:48.921732
MikiRai_UC3f6OYvhpVpmTYgikEbF1g_Q74l5QbhAk4_274467_288459.wav,MikiRai_UC3f6OYvhpVpmTYgikEbF1g_Q74l5QbhAk4,274467,288459,13992,36,with insurance companies the opportunities are really endless you can also do so many things to advance your career I will definitely always a hundred percent be working as a nurse in some capacity or another it just might look a little bit different than it did before,1,0,0,0,0,0,0,DY,2021-07-08 13:43:10.000747
MikiRai_UC3f6OYvhpVpmTYgikEbF1g_Q74l5QbhAk4_288691_292147.wav,MikiRai_UC3f6OYvhpVpmTYgikEbF1g_Q74l5QbhAk4,288691,292147,3456,37,are you actually happy or is it just a front that you put up,1,0,0,0,0,0,1,DY,2021-07-08 13:43:20.500055
MikiRai_UC3f6OYvhpVpmTYgikEbF1g_Q74l5QbhAk4_292403_294181.wav,MikiRai_UC3f6OYvhpVpmTYgikEbF1g_Q74l5QbhAk4,292403,294181,1778,38,I actually get this question quite f-,1,0,0,0,0,0,0,DY,2021-07-08 13:43:38.920765
MikiRai_UC3f6OYvhpVpmTYgikEbF1g_Q74l5QbhAk4_294373_308982.wav,MikiRai_UC3f6OYvhpVpmTYgikEbF1g_Q74l5QbhAk4,294373,308982,14609,39,frequently- because I think I look pretty positive online um and if you meet me in person you'll realize that I'm pretty pretty similar I'm a little bit more sarcastic I'm a little bit more savage in person but otherwise my personality is pretty similar,1,0,0,0,0,0,1,DY,2021-07-08 13:44:20.770117
MikiRai_UC3f6OYvhpVpmTYgikEbF1g_Q74l5QbhAk4_309327_314313.wav,MikiRai_UC3f6OYvhpVpmTYgikEbF1g_Q74l5QbhAk4,309327,314313,4986,40,um I will say that depending on who I'm hanging out with I definitely match their energy level,1,0,0,0,0,0,0,DY,2021-07-08 13:44:30.994582
MikiRai_UC3f6OYvhpVpmTYgikEbF1g_Q74l5QbhAk4_314441_323467.wav,MikiRai_UC3f6OYvhpVpmTYgikEbF1g_Q74l5QbhAk4,314441,323467,9026,41,um so if you're like a super outgoing happy person then I'll match you on that energy level and if you're like quiet and more reserved then I'm also going to act like that,1,0,0,0,0,0,0,DY,2021-07-08 13:44:44.814636
MikiRai_UC3f6OYvhpVpmTYgikEbF1g_Q74l5QbhAk4_323723_326091.wav,MikiRai_UC3f6OYvhpVpmTYgikEbF1g_Q74l5QbhAk4,323723,326091,2368,42,I will say that I have been happier,1,0,0,0,0,0,0,DY,2021-07-08 13:44:52.198793
MikiRai_UC3f6OYvhpVpmTYgikEbF1g_Q74l5QbhAk4_326515_330555.wav,MikiRai_UC3f6OYvhpVpmTYgikEbF1g_Q74l5QbhAk4,326515,330555,4040,43,in this last month in twenty twenty than I have been in a very,1,0,0,0,0,0,0,DY,2021-07-08 13:45:01.058812
MikiRai_UC3f6OYvhpVpmTYgikEbF1g_Q74l5QbhAk4_330899_332931.wav,MikiRai_UC3f6OYvhpVpmTYgikEbF1g_Q74l5QbhAk4,330899,332931,2032,44,very very long time so,1,0,0,0,0,0,0,DY,2021-07-08 13:45:10.014462
MikiRai_UC3f6OYvhpVpmTYgikEbF1g_Q74l5QbhAk4_333219_333427.wav,MikiRai_UC3f6OYvhpVpmTYgikEbF1g_Q74l5QbhAk4,333219,333427,208,45,,0,0,0,0,0,1,0,DY,2021-07-08 13:45:13.768487
MikiRai_UC3f6OYvhpVpmTYgikEbF1g_Q74l5QbhAk4_333755_338807.wav,MikiRai_UC3f6OYvhpVpmTYgikEbF1g_Q74l5QbhAk4,333755,338807,5052,46,and I've been going to the gym every day like Who am I twenty twenty new year new me,1,0,0,0,0,0,0,DY,2021-07-08 13:45:34.257421
MikiRai_UC3f6OYvhpVpmTYgikEbF1g_Q74l5QbhAk4_338991_346459.wav,MikiRai_UC3f6OYvhpVpmTYgikEbF1g_Q74l5QbhAk4,338991,346459,7468,47,how do you balance your career in nursing and on YouTube <lgh> um this is a great question I think,1,0,0,0,0,0,1,DY,2021-07-08 13:45:47.171773
MikiRai_UC3f6OYvhpVpmTYgikEbF1g_Q74l5QbhAk4_346899_348659.wav,MikiRai_UC3f6OYvhpVpmTYgikEbF1g_Q74l5QbhAk4,346899,348659,1760,48,you know there is,1,0,0,0,0,0,0,DY,2021-07-08 13:45:54.737570
MikiRai_UC3f6OYvhpVpmTYgikEbF1g_Q74l5QbhAk4_349027_352987.wav,MikiRai_UC3f6OYvhpVpmTYgikEbF1g_Q74l5QbhAk4,349027,352987,3960,49,always time to do the things that you're really passionate about right,1,0,0,0,0,0,0,DY,2021-07-08 13:46:04.317908
MikiRai_UC3f6OYvhpVpmTYgikEbF1g_Q74l5QbhAk4_353315_364179.wav,MikiRai_UC3f6OYvhpVpmTYgikEbF1g_Q74l5QbhAk4,353315,364179,10864,50,you make time for the things that matter and for me making content is something that makes me so so happy and I love sharing my journey with you guys and so that's something that's always a priority for me,1,0,0,0,0,0,0,DY,2021-07-08 13:46:33.989987
MikiRai_UC3f6OYvhpVpmTYgikEbF1g_Q74l5QbhAk4_364355_367971.wav,MikiRai_UC3f6OYvhpVpmTYgikEbF1g_Q74l5QbhAk4,364355,367971,3616,51,um in terms of how I actually block out my time I have a very,1,0,0,0,0,0,0,DY,2021-07-08 13:46:47.076254
MikiRai_UC3f6OYvhpVpmTYgikEbF1g_Q74l5QbhAk4_368123_373779.wav,MikiRai_UC3f6OYvhpVpmTYgikEbF1g_Q74l5QbhAk4,368123,373779,5656,52,um wonderful Google Calendar that's pretty loose I uh don't always follow my own schedule that I make,1,0,0,0,0,0,0,DY,2021-07-08 13:46:57.848320
MikiRai_UC3f6OYvhpVpmTYgikEbF1g_Q74l5QbhAk4_373971_374903.wav,MikiRai_UC3f6OYvhpVpmTYgikEbF1g_Q74l5QbhAk4,373971,374903,932,53,um but,1,0,0,0,0,0,0,DY,2021-07-08 13:47:03.962308
MikiRai_UC3f6OYvhpVpmTYgikEbF1g_Q74l5QbhAk4_375031_379863.wav,MikiRai_UC3f6OYvhpVpmTYgikEbF1g_Q74l5QbhAk4,375031,379863,4832,54,it is really nice because I plan out like hey I'm working Tuesday Thursday Saturday which means that I can,1,0,0,0,0,0,0,DY,2021-07-08 13:47:22.367024
MikiRai_UC3f6OYvhpVpmTYgikEbF1g_Q74l5QbhAk4_379991_387475.wav,MikiRai_UC3f6OYvhpVpmTYgikEbF1g_Q74l5QbhAk4,379991,387475,7484,55,film on Wednesday and then do editing on Friday or whatever it is I do kind of have to plan it out in advance especially- because my schedule can be a little bit more unpredic-,1,0,0,0,0,0,0,DY,2021-07-08 13:47:46.130618
MikiRai_UC3f6OYvhpVpmTYgikEbF1g_Q74l5QbhAk4_387643_387811.wav,MikiRai_UC3f6OYvhpVpmTYgikEbF1g_Q74l5QbhAk4,387643,387811,168,56,able- ,0,0,0,0,0,0,0,DY,2021-07-08 13:47:56.388463
MikiRai_UC3f6OYvhpVpmTYgikEbF1g_Q74l5QbhAk4_387995_391243.wav,MikiRai_UC3f6OYvhpVpmTYgikEbF1g_Q74l5QbhAk4,387995,391243,3248,57,tell us a fun fact about you that we would not know,1,0,0,0,0,0,1,DY,2021-07-08 13:48:11.393042
MikiRai_UC3f6OYvhpVpmTYgikEbF1g_Q74l5QbhAk4_391547_395387.wav,MikiRai_UC3f6OYvhpVpmTYgikEbF1g_Q74l5QbhAk4,391547,395387,3840,58,a fun fact I'm not really like fun person oh,1,0,0,0,0,0,0,DY,2021-07-08 13:48:21.001154
MikiRai_UC3f6OYvhpVpmTYgikEbF1g_Q74l5QbhAk4_395843_408003.wav,MikiRai_UC3f6OYvhpVpmTYgikEbF1g_Q74l5QbhAk4,395843,408003,12160,59,I cannot I repeat I cannot poop in public comment down below if you are the same way oh my god I have to poop like in my house like on my toilet like you know,1,0,0,0,0,0,1,DY,2021-07-08 13:48:43.400961
MikiRai_UC3f6OYvhpVpmTYgikEbF1g_Q74l5QbhAk4_408291_415699.wav,MikiRai_UC3f6OYvhpVpmTYgikEbF1g_Q74l5QbhAk4,408291,415699,7408,60,in the comfort of my home when I'm like traveling I have a hard time pooping so I think in the last like two years working as a nurse I have pooped,1,0,0,0,0,0,0,DY,2021-07-08 13:48:56.138651
MikiRai_UC3f6OYvhpVpmTYgikEbF1g_Q74l5QbhAk4_415979_417451.wav,MikiRai_UC3f6OYvhpVpmTYgikEbF1g_Q74l5QbhAk4,415979,417451,1472,61,at work once,1,0,0,0,0,0,0,DY,2021-07-08 13:49:01.685787
MikiRai_UC3f6OYvhpVpmTYgikEbF1g_Q74l5QbhAk4_417755_424003.wav,MikiRai_UC3f6OYvhpVpmTYgikEbF1g_Q74l5QbhAk4,417755,424003,6248,62,because I really couldn't hold it but otherwise otherwise I'm like literally cannot <lgh> what are your insecurities huh,1,0,0,0,0,0,1,DY,2021-07-08 13:49:13.651297
MikiRai_UC3f6OYvhpVpmTYgikEbF1g_Q74l5QbhAk4_425139_429083.wav,MikiRai_UC3f6OYvhpVpmTYgikEbF1g_Q74l5QbhAk4,425139,429083,3944,63,I think my biggest insecurity is like my personality,1,0,0,0,0,0,0,DY,2021-07-08 13:49:22.385899
MikiRai_UC3f6OYvhpVpmTYgikEbF1g_Q74l5QbhAk4_429363_437235.wav,MikiRai_UC3f6OYvhpVpmTYgikEbF1g_Q74l5QbhAk4,429363,437235,7872,64,I'm like a very introverted person and I can put on a front for a couple of hours for like three four hours um but beyond that,1,0,0,0,0,0,0,DY,2021-07-08 13:49:45.204244
MikiRai_UC3f6OYvhpVpmTYgikEbF1g_Q74l5QbhAk4_437563_438899.wav,MikiRai_UC3f6OYvhpVpmTYgikEbF1g_Q74l5QbhAk4,437563,438899,1336,65,oh my god,1,0,0,0,0,0,0,DY,2021-07-08 13:49:50.824542
MikiRai_UC3f6OYvhpVpmTYgikEbF1g_Q74l5QbhAk4_439539_446075.wav,MikiRai_UC3f6OYvhpVpmTYgikEbF1g_Q74l5QbhAk4,439539,446075,6536,66,I'm like an introvert and so I like to stay at home I'm a homebody and I just like to- I really need my alone time,1,0,0,0,0,0,0,DY,2021-07-08 13:50:02.881243
MikiRai_UC3f6OYvhpVpmTYgikEbF1g_Q74l5QbhAk4_446155_455859.wav,MikiRai_UC3f6OYvhpVpmTYgikEbF1g_Q74l5QbhAk4,446155,455859,9704,67,and the people that I really love and are close with I could spend forever with them but everyone else it's like super exhausting and draining for me to hang out with people so I do wish I was a little bit better,1,0,0,0,0,0,0,DY,2021-07-08 13:50:17.448653
MikiRai_UC3f6OYvhpVpmTYgikEbF1g_Q74l5QbhAk4_456067_456827.wav,MikiRai_UC3f6OYvhpVpmTYgikEbF1g_Q74l5QbhAk4,456067,456827,760,68,at that,1,0,0,0,0,0,0,DY,2021-07-08 13:50:23.729392
MikiRai_UC3f6OYvhpVpmTYgikEbF1g_Q74l5QbhAk4_457163_460491.wav,MikiRai_UC3f6OYvhpVpmTYgikEbF1g_Q74l5QbhAk4,457163,460491,3328,69,now we're getting into the relationship tea,1,0,0,0,0,0,0,DY,2021-07-08 13:50:43.562881
MikiRai_UC3f6OYvhpVpmTYgikEbF1g_Q74l5QbhAk4_460883_461123.wav,MikiRai_UC3f6OYvhpVpmTYgikEbF1g_Q74l5QbhAk4,460883,461123,240,70,,0,0,0,0,0,1,0,DY,2021-07-08 13:50:47.433844
MikiRai_UC3f6OYvhpVpmTYgikEbF1g_Q74l5QbhAk4_461707_467323.wav,MikiRai_UC3f6OYvhpVpmTYgikEbF1g_Q74l5QbhAk4,461707,467323,5616,71,um I got a question asking me why don't you ever share stuff about your relationships,1,0,0,0,0,0,1,DY,2021-07-08 13:51:06.595129
MikiRai_UC3f6OYvhpVpmTYgikEbF1g_Q74l5QbhAk4_467747_468127.wav,MikiRai_UC3f6OYvhpVpmTYgikEbF1g_Q74l5QbhAk4,467747,468127,380,72,,0,0,0,0,0,1,0,DY,2021-07-08 13:51:10.231514
MikiRai_UC3f6OYvhpVpmTYgikEbF1g_Q74l5QbhAk4_468247_479471.wav,MikiRai_UC3f6OYvhpVpmTYgikEbF1g_Q74l5QbhAk4,468247,479471,11224,73,so if you follow me on Instagram I've been on Instagram for like three ish years now and I very ever rarely share anything about my personal life um and especially not about my relationships,1,0,0,0,0,0,0,DY,2021-07-08 13:51:40.914477
MikiRai_UC3f6OYvhpVpmTYgikEbF1g_Q74l5QbhAk4_479591_481815.wav,MikiRai_UC3f6OYvhpVpmTYgikEbF1g_Q74l5QbhAk4,479591,481815,2224,74,I don't know I think I've just always felt like,1,0,0,0,0,0,0,DY,2021-07-08 13:52:17.762515
MikiRai_UC3f6OYvhpVpmTYgikEbF1g_Q74l5QbhAk4_481927_496567.wav,MikiRai_UC3f6OYvhpVpmTYgikEbF1g_Q74l5QbhAk4,481927,496567,14640,75,it's not really my information to share like not everybody wants to be put on blast or be in the public eye I am always scared because you never know how things can turn out or what things will happen and so I don't want to put any information out there and then,1,0,0,0,0,0,0,DY,2021-07-08 13:52:56.536293
MikiRai_UC3f6OYvhpVpmTYgikEbF1g_Q74l5QbhAk4_496679_498215.wav,MikiRai_UC3f6OYvhpVpmTYgikEbF1g_Q74l5QbhAk4,496679,498215,1536,76,have it turn out to be some s-,1,0,0,0,0,0,0,DY,2021-07-08 13:53:04.057181
MikiRai_UC3f6OYvhpVpmTYgikEbF1g_Q74l5QbhAk4_498327_499647.wav,MikiRai_UC3f6OYvhpVpmTYgikEbF1g_Q74l5QbhAk4,498327,499647,1320,77,candalous- info,1,0,0,0,0,0,0,DY,2021-07-08 13:53:22.233719
MikiRai_UC3f6OYvhpVpmTYgikEbF1g_Q74l5QbhAk4_499767_506539.wav,MikiRai_UC3f6OYvhpVpmTYgikEbF1g_Q74l5QbhAk4,499767,506539,6772,78,if you guys know what I mean but I also feel like my relationships are a really big part of my life and make me,1,0,0,0,0,0,0,DY,2021-07-08 13:53:50.438695
MikiRai_UC3f6OYvhpVpmTYgikEbF1g_Q74l5QbhAk4_506939_514731.wav,MikiRai_UC3f6OYvhpVpmTYgikEbF1g_Q74l5QbhAk4,506939,514731,7792,79,who I am and it explains a lot of the like y'know the changes that I go through and the emotions that I feel and so I am,1,0,0,0,0,0,0,DY,2021-07-08 13:54:30.551107
MikiRai_UC3f6OYvhpVpmTYgikEbF1g_Q74l5QbhAk4_515555_515749.wav,MikiRai_UC3f6OYvhpVpmTYgikEbF1g_Q74l5QbhAk4,515555,515749,194,80,,0,0,0,0,0,1,0,DY,2021-07-08 13:54:35.642472
MikiRai_UC3f6OYvhpVpmTYgikEbF1g_Q74l5QbhAk4_515877_522533.wav,MikiRai_UC3f6OYvhpVpmTYgikEbF1g_Q74l5QbhAk4,515877,522533,6656,81,I am going to start sharing a lot more information with you guys about what's going on because it's just such a big part of my li-,1,0,0,0,0,0,0,DY,2021-07-08 13:56:30.378505
MikiRai_UC3f6OYvhpVpmTYgikEbF1g_Q74l5QbhAk4_522661_531855.wav,MikiRai_UC3f6OYvhpVpmTYgikEbF1g_Q74l5QbhAk4,522661,531855,9194,82,so we'll start right now in this video I'm going to answer a couple questions about relationships that I have never answered before so,1,0,0,0,0,0,0,DY,2021-07-08 20:19:30.038578
MikiRai_UC3f6OYvhpVpmTYgikEbF1g_Q74l5QbhAk4_532015_532459.wav,MikiRai_UC3f6OYvhpVpmTYgikEbF1g_Q74l5QbhAk4,532015,532459,444,83,,0,0,0,0,0,1,0,DY,2021-07-08 20:19:34.284143
MikiRai_UC3f6OYvhpVpmTYgikEbF1g_Q74l5QbhAk4_532715_533035.wav,MikiRai_UC3f6OYvhpVpmTYgikEbF1g_Q74l5QbhAk4,532715,533035,320,84,okay,1,0,0,0,0,0,0,DY,2021-07-08 20:19:43.446485
MikiRai_UC3f6OYvhpVpmTYgikEbF1g_Q74l5QbhAk4_533467_543651.wav,MikiRai_UC3f6OYvhpVpmTYgikEbF1g_Q74l5QbhAk4,533467,543651,10184,85,well we'll- we'll start slowly how many relationships have you been in some of you guys think I have never been in a relationship but the answer is that I have been in,1,0,0,0,0,0,0,DY,2021-07-08 20:20:00.143192
MikiRai_UC3f6OYvhpVpmTYgikEbF1g_Q74l5QbhAk4_543811_545051.wav,MikiRai_UC3f6OYvhpVpmTYgikEbF1g_Q74l5QbhAk4,543811,545051,1240,86,two relationships,1,0,0,0,0,0,0,DY,2021-07-08 20:20:06.279018
MikiRai_UC3f6OYvhpVpmTYgikEbF1g_Q74l5QbhAk4_545323_551855.wav,MikiRai_UC3f6OYvhpVpmTYgikEbF1g_Q74l5QbhAk4,545323,551855,6532,87,they're both really long relationships one was five years and the other one- three years so,1,0,0,0,0,0,0,DY,2021-07-08 20:20:17.730463
MikiRai_UC3f6OYvhpVpmTYgikEbF1g_Q74l5QbhAk4_552015_554787.wav,MikiRai_UC3f6OYvhpVpmTYgikEbF1g_Q74l5QbhAk4,552015,554787,2772,88,there's that some juicy tea for you,1,0,0,0,0,0,0,DY,2021-07-08 20:20:27.396351
MikiRai_UC3f6OYvhpVpmTYgikEbF1g_Q74l5QbhAk4_555043_558475.wav,MikiRai_UC3f6OYvhpVpmTYgikEbF1g_Q74l5QbhAk4,555043,558475,3432,89,how old were you when you had your first romantic relationship,1,0,0,0,0,0,1,DY,2021-07-08 20:20:36.193010
MikiRai_UC3f6OYvhpVpmTYgikEbF1g_Q74l5QbhAk4_559219_569939.wav,MikiRai_UC3f6OYvhpVpmTYgikEbF1g_Q74l5QbhAk4,559219,569939,10720,90,so I'm gonna not consider middle school love because I don't think that really counts but my first like actual boyfriend was when I was a freshman in high school,1,0,0,0,0,0,0,DY,2021-07-08 20:20:52.982842
MikiRai_UC3f6OYvhpVpmTYgikEbF1g_Q74l5QbhAk4_570267_572443.wav,MikiRai_UC3f6OYvhpVpmTYgikEbF1g_Q74l5QbhAk4,570267,572443,2176,91,and I dated him for five years so,1,0,0,0,0,0,0,DY,2021-07-08 20:21:00.213324
MikiRai_UC3f6OYvhpVpmTYgikEbF1g_Q74l5QbhAk4_573187_573523.wav,MikiRai_UC3f6OYvhpVpmTYgikEbF1g_Q74l5QbhAk4,573187,573523,336,92,,0,0,0,0,0,1,0,DY,2021-07-08 20:21:09.080805
MikiRai_UC3f6OYvhpVpmTYgikEbF1g_Q74l5QbhAk4_573931_575859.wav,MikiRai_UC3f6OYvhpVpmTYgikEbF1g_Q74l5QbhAk4,573931,575859,1928,93,yeah all the way into college,1,0,0,0,0,0,0,DY,2021-07-08 20:21:19.331697
