filename,video_id,start_time,end_time,duration,id,transcription,usability,bg_music,bg_noise,other_voice,only_music,only_noise,other_sounds,annotator,annotate_date_YYYYMMDD
chammies_UCeBBtB3WtkZIFSBF2MWFcLQ_5YIRHk6JZk_506577_508593.wav,chammies_UCeBBtB3WtkZIFSBF2MWFcLQ_5YIRHk6JZk,506577,508593,2016,94,<cs>,1,0,0,0,0,0,0,RP,2021-06-07 17:42:07.377166
chammies_UCeBBtB3WtkZIFSBF2MWFcLQ_5YIRHk6JZk_508873_514353.wav,chammies_UCeBBtB3WtkZIFSBF2MWFcLQ_5YIRHk6JZk,508873,514353,5480,95,wow that accent was actually horrible accents are not my forte so embarrassing,1,0,0,0,0,0,0,RP,2021-06-07 17:42:19.616923
chammies_UCeBBtB3WtkZIFSBF2MWFcLQ_5YIRHk6JZk_514737_516717.wav,chammies_UCeBBtB3WtkZIFSBF2MWFcLQ_5YIRHk6JZk,514737,516717,1980,96,it is what it is question_unc seven ,1,0,1,0,0,0,0,RP,2021-06-07 17:42:40.167993
chammies_UCeBBtB3WtkZIFSBF2MWFcLQ_5YIRHk6JZk_516893_520159.wav,chammies_UCeBBtB3WtkZIFSBF2MWFcLQ_5YIRHk6JZk,516893,520159,3266,97,how has being asian american affected your relationship with your parents,1,0,0,0,0,0,0,RP,2021-06-07 17:43:10.770423
chammies_UCeBBtB3WtkZIFSBF2MWFcLQ_5YIRHk6JZk_520359_520587.wav,chammies_UCeBBtB3WtkZIFSBF2MWFcLQ_5YIRHk6JZk,520359,520587,228,98,,0,0,0,0,0,1,0,RP,2021-06-07 17:43:15.587668
chammies_UCeBBtB3WtkZIFSBF2MWFcLQ_5YIRHk6JZk_520731_530613.wav,chammies_UCeBBtB3WtkZIFSBF2MWFcLQ_5YIRHk6JZk,520731,530613,9882,99,I feel really lucky that luckily it hasn't affected it too much with mine like you know you could see it going really bad like my parents would fight and I think like the biggest thing is they just don't understand a lot of things they don't understand that like,1,0,0,0,0,0,0,RP,2021-06-07 17:46:09.986493
chammies_UCeBBtB3WtkZIFSBF2MWFcLQ_5YIRHk6JZk_530749_533223.wav,chammies_UCeBBtB3WtkZIFSBF2MWFcLQ_5YIRHk6JZk,530749,533223,2474,100,for example there are a lot of friendships and relationships you may have,1,0,0,0,0,0,0,RP,2021-06-07 17:46:19.299217
chammies_UCeBBtB3WtkZIFSBF2MWFcLQ_5YIRHk6JZk_533929_536721.wav,chammies_UCeBBtB3WtkZIFSBF2MWFcLQ_5YIRHk6JZk,533929,536721,2792,101,where you're gonna have conversations about race and it's gonna be,1,0,0,0,0,0,0,RP,2021-06-07 17:46:39.071152
chammies_UCeBBtB3WtkZIFSBF2MWFcLQ_5YIRHk6JZk_537033_541037.wav,chammies_UCeBBtB3WtkZIFSBF2MWFcLQ_5YIRHk6JZk,537033,541037,4004,102,pretty difficult for you to navigate and some friendships that you might have to let go,1,0,0,0,0,0,0,RP,2021-06-07 17:46:53.251812
chammies_UCeBBtB3WtkZIFSBF2MWFcLQ_5YIRHk6JZk_541197_545785.wav,chammies_UCeBBtB3WtkZIFSBF2MWFcLQ_5YIRHk6JZk,541197,545785,4588,103,'cause you just have different views on things and like I never really realized this until I think,1,0,0,0,0,0,0,RP,2021-06-07 17:47:21.026485
chammies_UCeBBtB3WtkZIFSBF2MWFcLQ_5YIRHk6JZk_546265_548689.wav,chammies_UCeBBtB3WtkZIFSBF2MWFcLQ_5YIRHk6JZk,546265,548689,2424,104,college I realized oh shoot like,1,0,0,0,0,0,0,RP,2021-06-07 17:47:28.639442
chammies_UCeBBtB3WtkZIFSBF2MWFcLQ_5YIRHk6JZk_549513_551545.wav,chammies_UCeBBtB3WtkZIFSBF2MWFcLQ_5YIRHk6JZk,549513,551545,2032,105,arce is something you have to talk about and like,1,0,0,0,0,0,0,RP,2021-06-07 17:47:43.310686
chammies_UCeBBtB3WtkZIFSBF2MWFcLQ_5YIRHk6JZk_552625_557465.wav,chammies_UCeBBtB3WtkZIFSBF2MWFcLQ_5YIRHk6JZk,552625,557465,4840,106,racism and if your friend like your close friend doesn't get it it could be really tricky and-,1,0,0,0,0,0,0,RP,2021-06-07 17:48:00.146374
chammies_UCeBBtB3WtkZIFSBF2MWFcLQ_5YIRHk6JZk_558009_572617.wav,chammies_UCeBBtB3WtkZIFSBF2MWFcLQ_5YIRHk6JZk,558009,572617,14608,107,and hard and sad and hurtful it's hard to know what to do with all those feelin's I never experienced this and my parents felt bad like oh_unn we_unn didn't_unn know_unn like_unn that_unn would_unn happen_unn we_unn didn't_unn know_unn how_unn to_unn handle_unn that_unn or_unn warn_unn you_unn and I was like oh_unn my_unn gosh_unn no_unn like_unn don't_unn feel_unn bad_unn it's_unn okay_unn and I think sometimes yeah it can just be tricky when I'm trying to explain things like Oh_unn,1,0,0,1,0,0,0,RP,2021-06-07 17:49:38.967269
chammies_UCeBBtB3WtkZIFSBF2MWFcLQ_5YIRHk6JZk_572761_578649.wav,chammies_UCeBBtB3WtkZIFSBF2MWFcLQ_5YIRHk6JZk,572761,578649,5888,108,today_unn this_unn thing_unn happened_unn to_unn me_unn and_unn it_unn really_unn sucked_unn or like if I try to make a joke because you know humor is a good way to like to kind of deal with,1,0,0,1,0,0,0,RP,2021-06-07 17:50:17.725123
chammies_UCeBBtB3WtkZIFSBF2MWFcLQ_5YIRHk6JZk_579353_581473.wav,chammies_UCeBBtB3WtkZIFSBF2MWFcLQ_5YIRHk6JZk,579353,581473,2120,109,some struggles in life <unk>,1,0,0,0,0,0,0,RP,2021-06-07 17:50:37.771917
chammies_UCeBBtB3WtkZIFSBF2MWFcLQ_5YIRHk6JZk_582097_582849.wav,chammies_UCeBBtB3WtkZIFSBF2MWFcLQ_5YIRHk6JZk,582097,582849,752,110,and,1,0,0,0,0,0,0,RP,2021-06-07 17:50:43.718312
chammies_UCeBBtB3WtkZIFSBF2MWFcLQ_5YIRHk6JZk_583681_591929.wav,chammies_UCeBBtB3WtkZIFSBF2MWFcLQ_5YIRHk6JZk,583681,591929,8248,111,my parents sometimes don't get it they're just kinda like okay_unn like_unn you_unn guys_unn talk_unn about_unn stuff_unn like_unn that_unn do_unn you_unn wanna_unn chill_unn and like it's not bad like I know they just kind of get tired like say it a lot but,1,0,0,1,0,0,0,RP,2021-06-07 17:51:54.301090
chammies_UCeBBtB3WtkZIFSBF2MWFcLQ_5YIRHk6JZk_592401_597157.wav,chammies_UCeBBtB3WtkZIFSBF2MWFcLQ_5YIRHk6JZk,592401,597157,4756,112,other than that they're really supportive and they're always willing to at least listen which is really awesome and helpful,1,0,0,0,0,0,0,RP,2021-06-07 17:52:29.532772
chammies_UCeBBtB3WtkZIFSBF2MWFcLQ_5YIRHk6JZk_597437_597823.wav,chammies_UCeBBtB3WtkZIFSBF2MWFcLQ_5YIRHk6JZk,597437,597823,386,113,so,1,0,0,0,0,0,0,RP,2021-06-07 17:52:34.929861
chammies_UCeBBtB3WtkZIFSBF2MWFcLQ_5YIRHk6JZk_598055_604079.wav,chammies_UCeBBtB3WtkZIFSBF2MWFcLQ_5YIRHk6JZk,598055,604079,6024,114,so that's the way it's affected my relation with my parents <sfx> question eight is how do you feel about your heritage now,1,0,0,0,0,0,0,RP,2021-06-07 17:53:10.864907
chammies_UCeBBtB3WtkZIFSBF2MWFcLQ_5YIRHk6JZk_604183_612095.wav,chammies_UCeBBtB3WtkZIFSBF2MWFcLQ_5YIRHk6JZk,604183,612095,7912,115,I'll say I'm really proud of it now like I said in middle school I didn't identify with it in high school I was a little close for like uh_unn yeah_unn I'm_unn asian_unn it's_unn fine_unn I_unn guess_unn it wasn't like ooh,1,0,0,1,0,0,0,RP,2021-06-07 17:54:33.236675
chammies_UCeBBtB3WtkZIFSBF2MWFcLQ_5YIRHk6JZk_612199_616279.wav,chammies_UCeBBtB3WtkZIFSBF2MWFcLQ_5YIRHk6JZk,612199,616279,4080,116,then when I got to college I actually I went to Ithaca college I took a class by Dr. House ,1,0,0,0,0,0,0,RP,2021-06-07 17:54:52.090850
chammies_UCeBBtB3WtkZIFSBF2MWFcLQ_5YIRHk6JZk_616399_618967.wav,chammies_UCeBBtB3WtkZIFSBF2MWFcLQ_5YIRHk6JZk,616399,618967,2568,117,intro to culture in communications and rhetoric,1,0,0,0,0,0,0,RP,2021-06-07 17:55:01.050431
chammies_UCeBBtB3WtkZIFSBF2MWFcLQ_5YIRHk6JZk_619087_625583.wav,chammies_UCeBBtB3WtkZIFSBF2MWFcLQ_5YIRHk6JZk,619087,625583,6496,118,and that was so eye opening for me because I didn't even know like Asian Americans and that sounds weird like I didn't* even know Asian Americans were a group,1,0,0,0,0,0,0,RP,2021-06-07 17:55:19.342121
chammies_UCeBBtB3WtkZIFSBF2MWFcLQ_5YIRHk6JZk_625687_625952.wav,chammies_UCeBBtB3WtkZIFSBF2MWFcLQ_5YIRHk6JZk,625687,625952,265,119,,0,0,0,0,0,1,0,RP,2021-06-07 17:55:25.296530
chammies_UCeBBtB3WtkZIFSBF2MWFcLQ_5YIRHk6JZk_626120_626625.wav,chammies_UCeBBtB3WtkZIFSBF2MWFcLQ_5YIRHk6JZk,626120,626625,505,120,that,1,0,0,0,0,0,0,RP,2021-06-07 17:55:31.860491
chammies_UCeBBtB3WtkZIFSBF2MWFcLQ_5YIRHk6JZk_627321_629089.wav,chammies_UCeBBtB3WtkZIFSBF2MWFcLQ_5YIRHk6JZk,627321,629089,1768,121,were oppressed because um ,1,0,0,0,0,0,0,RP,2021-06-07 17:55:48.593620
chammies_UCeBBtB3WtkZIFSBF2MWFcLQ_5YIRHk6JZk_629393_637737.wav,chammies_UCeBBtB3WtkZIFSBF2MWFcLQ_5YIRHk6JZk,629393,637737,8344,122,model minority myth I totally bought into that I'm like oh_unn I_unn guess_unn Asian_unn Americans_unn are_unn doin'_unn fine_unn I_unn don't_unn really_unn see_unn anything_unn wrong_unn beside_unn the_unn weird_unn microaggressions_unn but in that class I <unk> learned,1,0,0,1,0,0,0,RP,2021-06-07 18:03:29.963451
chammies_UCeBBtB3WtkZIFSBF2MWFcLQ_5YIRHk6JZk_638017_638577.wav,chammies_UCeBBtB3WtkZIFSBF2MWFcLQ_5YIRHk6JZk,638017,638577,560,123,shoot,1,0,0,0,0,0,0,RP,2021-06-07 18:03:36.816459
chammies_UCeBBtB3WtkZIFSBF2MWFcLQ_5YIRHk6JZk_638849_643773.wav,chammies_UCeBBtB3WtkZIFSBF2MWFcLQ_5YIRHk6JZk,638849,643773,4924,124,I was like I already knew like I said okay females is definitely a group that has problems I can see I get treated way differently,1,0,0,0,0,0,0,RP,2021-06-07 18:04:37.380468
chammies_UCeBBtB3WtkZIFSBF2MWFcLQ_5YIRHk6JZk_643901_647733.wav,chammies_UCeBBtB3WtkZIFSBF2MWFcLQ_5YIRHk6JZk,643901,647733,3832,125,I am not valued as much as others because I'm a female but later I realized,1,0,0,0,0,0,0,RP,2021-06-07 18:05:11.455945
chammies_UCeBBtB3WtkZIFSBF2MWFcLQ_5YIRHk6JZk_647861_651345.wav,chammies_UCeBBtB3WtkZIFSBF2MWFcLQ_5YIRHk6JZk,647861,651345,3484,126,oh my gosh like I'm also not valued because I'm Asian American,1,0,0,0,0,0,0,RP,2021-06-07 18:05:40.924177
chammies_UCeBBtB3WtkZIFSBF2MWFcLQ_5YIRHk6JZk_652001_652857.wav,chammies_UCeBBtB3WtkZIFSBF2MWFcLQ_5YIRHk6JZk,652001,652857,856,127,oh,1,0,0,0,0,0,0,RP,2021-06-07 18:05:53.254519
chammies_UCeBBtB3WtkZIFSBF2MWFcLQ_5YIRHk6JZk_653025_658513.wav,chammies_UCeBBtB3WtkZIFSBF2MWFcLQ_5YIRHk6JZk,653025,658513,5488,128,great so but it was really eye opening like i said cause then i started reading more into it and I started volunteering for like,1,0,0,0,0,0,0,RP,2021-06-07 18:10:54.339217
chammies_UCeBBtB3WtkZIFSBF2MWFcLQ_5YIRHk6JZk_658689_672269.wav,chammies_UCeBBtB3WtkZIFSBF2MWFcLQ_5YIRHk6JZk,658689,672269,13580,129,ithaca pan asian American Film Festival and really getting into wanting to like spread Asian American culture and specifically I sometimes visited the vietnamese club on campus so that was really awesome to learn more about my culture and heritage and where I came from and now I would say yes I,1,0,0,0,0,0,0,RP,2021-06-07 18:11:47.008582
chammies_UCeBBtB3WtkZIFSBF2MWFcLQ_5YIRHk6JZk_672421_677201.wav,chammies_UCeBBtB3WtkZIFSBF2MWFcLQ_5YIRHk6JZk,672421,677201,4780,130,am pretty proud to be Asian American and specifically Vietnamese American I think it's,1,0,0,0,0,0,0,RP,2021-06-07 18:12:07.458758
chammies_UCeBBtB3WtkZIFSBF2MWFcLQ_5YIRHk6JZk_677377_681817.wav,chammies_UCeBBtB3WtkZIFSBF2MWFcLQ_5YIRHk6JZk,677377,681817,4440,131,really awesome and cool and it's like Who I am it's part of my identity and it's-,1,0,0,0,0,0,0,RP,2021-06-07 18:12:27.743551
chammies_UCeBBtB3WtkZIFSBF2MWFcLQ_5YIRHk6JZk_682993_697745.wav,chammies_UCeBBtB3WtkZIFSBF2MWFcLQ_5YIRHk6JZk,682993,697745,14752,132,it's just cool I guess man oh yeah and also on terms of being adopted I also like got to be on this adoptee panel which was really fun and to talk to other doctors who kind of felt the same way and get a lot of similar questions as me but now I think it's really cool and it like makes it unique it gives me a new perspective on life ,1,0,0,0,0,0,0,RP,2021-06-07 18:13:42.005586
chammies_UCeBBtB3WtkZIFSBF2MWFcLQ_5YIRHk6JZk_698273_703297.wav,chammies_UCeBBtB3WtkZIFSBF2MWFcLQ_5YIRHk6JZk,698273,703297,5024,133,the last question is what is your favorite part about being asian american slash your heritage,1,0,0,0,0,0,0,RP,2021-06-07 18:14:03.896125
chammies_UCeBBtB3WtkZIFSBF2MWFcLQ_5YIRHk6JZk_703505_706401.wav,chammies_UCeBBtB3WtkZIFSBF2MWFcLQ_5YIRHk6JZk,703505,706401,2896,134,I would say my favorite part about being vietnamese specifically is,1,0,0,0,0,0,0,RP,2021-06-07 18:14:18.757296
chammies_UCeBBtB3WtkZIFSBF2MWFcLQ_5YIRHk6JZk_706625_715481.wav,chammies_UCeBBtB3WtkZIFSBF2MWFcLQ_5YIRHk6JZk,706625,715481,8856,135,banh mi_unc love_unc it it's my favorite food my friend took me to this really good place called best baguette it's actually in <unk> but I think they also have a location in Portland,1,0,1,0,0,0,0,RP,2021-06-07 18:15:27.586372
chammies_UCeBBtB3WtkZIFSBF2MWFcLQ_5YIRHk6JZk_715617_717969.wav,chammies_UCeBBtB3WtkZIFSBF2MWFcLQ_5YIRHk6JZk,715617,717969,2352,136,it's this specific kind of Vietnamese sandwich it is,1,0,0,0,0,0,0,RP,2021-06-07 18:15:55.588874
chammies_UCeBBtB3WtkZIFSBF2MWFcLQ_5YIRHk6JZk_718097_719889.wav,chammies_UCeBBtB3WtkZIFSBF2MWFcLQ_5YIRHk6JZk,718097,719889,1792,137,four dollars and fifty cents for a sandwich,1,0,0,0,0,0,0,RP,2021-06-07 18:16:21.506986
chammies_UCeBBtB3WtkZIFSBF2MWFcLQ_5YIRHk6JZk_720049_723921.wav,chammies_UCeBBtB3WtkZIFSBF2MWFcLQ_5YIRHk6JZk,720049,723921,3872,138,sometimes their sandwiches you can get for less that is an incredible deal and I ,1,0,0,0,0,0,0,RP,2021-06-07 18:16:39.389003
chammies_UCeBBtB3WtkZIFSBF2MWFcLQ_5YIRHk6JZk_724081_727561.wav,chammies_UCeBBtB3WtkZIFSBF2MWFcLQ_5YIRHk6JZk,724081,727561,3480,139,love saving and good deals and the sandwich is amazing,1,0,0,0,0,0,0,RP,2021-06-07 18:16:49.631373
chammies_UCeBBtB3WtkZIFSBF2MWFcLQ_5YIRHk6JZk_727857_739685.wav,chammies_UCeBBtB3WtkZIFSBF2MWFcLQ_5YIRHk6JZk,727857,739685,11828,140,best baguette hands down is my favorite banh_cs mi_cs I've ever had and I've had some like in New York City I had some in Ithaca I tried some here oh my gosh don't even get me started there's a bunch of banh_cs mis_cs that are whitewashed you're like,1,0,0,0,0,0,0,RP,2021-06-07 18:17:45.570843
chammies_UCeBBtB3WtkZIFSBF2MWFcLQ_5YIRHk6JZk_739861_745653.wav,chammies_UCeBBtB3WtkZIFSBF2MWFcLQ_5YIRHk6JZk,739861,745653,5792,141,what_unn the_unn heck_unn is_unn that_unn if it's not on a baguette_unc you need to question whether you should get it and,1,0,1,1,0,0,0,RP,2021-06-07 18:18:44.240429
chammies_UCeBBtB3WtkZIFSBF2MWFcLQ_5YIRHk6JZk_745813_746201.wav,chammies_UCeBBtB3WtkZIFSBF2MWFcLQ_5YIRHk6JZk,745813,746201,388,142,I would,1,0,0,0,0,0,0,RP,2021-06-07 18:18:58.568835
chammies_UCeBBtB3WtkZIFSBF2MWFcLQ_5YIRHk6JZk_746729_748465.wav,chammies_UCeBBtB3WtkZIFSBF2MWFcLQ_5YIRHk6JZk,746729,748465,1736,143,if its not on a baguette just <sfx>,1,0,0,0,0,0,0,RP,2021-06-07 18:19:12.752210
chammies_UCeBBtB3WtkZIFSBF2MWFcLQ_5YIRHk6JZk_749225_759105.wav,chammies_UCeBBtB3WtkZIFSBF2MWFcLQ_5YIRHk6JZk,749225,759105,9880,144,know that that's not the traditional banh mi 'cause banh mi was like a fusion of France and Vietnam so it has the Vietnamese flavor and meat inside and then it has the French baguette,1,0,0,0,0,0,0,RP,2021-06-07 18:20:04.312834
chammies_UCeBBtB3WtkZIFSBF2MWFcLQ_5YIRHk6JZk_759321_764177.wav,chammies_UCeBBtB3WtkZIFSBF2MWFcLQ_5YIRHk6JZk,759321,764177,4856,145,um my favorite one is the barbecue pork if anyone ever goes to get one it's amazing,1,0,0,0,0,0,0,RP,2021-06-07 18:20:16.936611
chammies_UCeBBtB3WtkZIFSBF2MWFcLQ_5YIRHk6JZk_764401_765169.wav,chammies_UCeBBtB3WtkZIFSBF2MWFcLQ_5YIRHk6JZk,764401,765169,768,146,but,1,0,0,0,0,0,0,RP,2021-06-07 18:20:23.181297
chammies_UCeBBtB3WtkZIFSBF2MWFcLQ_5YIRHk6JZk_765529_774019.wav,chammies_UCeBBtB3WtkZIFSBF2MWFcLQ_5YIRHk6JZk,765529,774019,8490,147,besides the banh_cs mi_cs sandwich specifically I think it's just really awesome to share cultures I love that I'm able to share that Vietnamese heritage a lot of people here who may not know about it,1,0,0,0,0,0,0,RP,2021-06-07 18:21:01.656823
chammies_UCeBBtB3WtkZIFSBF2MWFcLQ_5YIRHk6JZk_774147_776403.wav,chammies_UCeBBtB3WtkZIFSBF2MWFcLQ_5YIRHk6JZk,774147,776403,2256,148,and I think the cool thing about being API,1,0,0,0,0,0,0,RP,2021-06-07 18:21:17.304897
chammies_UCeBBtB3WtkZIFSBF2MWFcLQ_5YIRHk6JZk_776563_776677.wav,chammies_UCeBBtB3WtkZIFSBF2MWFcLQ_5YIRHk6JZk,776563,776677,114,149,,0,0,0,0,0,0,0,RP,2021-06-07 18:21:23.698904
chammies_UCeBBtB3WtkZIFSBF2MWFcLQ_5YIRHk6JZk_776821_782953.wav,chammies_UCeBBtB3WtkZIFSBF2MWFcLQ_5YIRHk6JZk,776821,782953,6132,150,it's so diverse and so I'm always still learning about all the different Asian american cultures and then all the subcultures within them it's like,1,0,0,0,0,0,0,RP,2021-06-07 18:21:53.555910
chammies_UCeBBtB3WtkZIFSBF2MWFcLQ_5YIRHk6JZk_783353_789081.wav,chammies_UCeBBtB3WtkZIFSBF2MWFcLQ_5YIRHk6JZk,783353,789081,5728,151,you'll never be able to stop learning about all of them and sharing what you know about some of it with other people,1,0,0,0,0,0,0,RP,2021-06-07 18:22:13.831747
chammies_UCeBBtB3WtkZIFSBF2MWFcLQ_5YIRHk6JZk_789393_790393.wav,chammies_UCeBBtB3WtkZIFSBF2MWFcLQ_5YIRHk6JZk,789393,790393,1000,152,and that's like,1,0,0,0,0,0,0,RP,2021-06-07 18:22:26.950848
chammies_UCeBBtB3WtkZIFSBF2MWFcLQ_5YIRHk6JZk_790737_796089.wav,chammies_UCeBBtB3WtkZIFSBF2MWFcLQ_5YIRHk6JZk,790737,796089,5352,153,my favorite part about being Asian American -so that's it for the video I hope you all enjoyed it,1,0,0,0,0,0,0,RP,2021-06-07 18:22:55.492275
chammies_UCeBBtB3WtkZIFSBF2MWFcLQ_5YIRHk6JZk_796545_801161.wav,chammies_UCeBBtB3WtkZIFSBF2MWFcLQ_5YIRHk6JZk,796545,801161,4616,154,yeah I hope you all have a great rest of may and that you're all staying* staying safe,1,0,0,0,0,0,0,RP,2021-06-07 18:23:28.425534
chammies_UCeBBtB3WtkZIFSBF2MWFcLQ_5YIRHk6JZk_801681_804097.wav,chammies_UCeBBtB3WtkZIFSBF2MWFcLQ_5YIRHk6JZk,801681,804097,2416,155,-k you so much for watching_unc and_unc I'll_unc see_unc you_unc next_unc month_unc,1,1,0,0,0,0,0,RP,2021-06-07 18:24:10.851862
chammies_UCeBBtB3WtkZIFSBF2MWFcLQ_5YIRHk6JZk_804209_817713.wav,chammies_UCeBBtB3WtkZIFSBF2MWFcLQ_5YIRHk6JZk,804209,817713,13504,156,bye_unc,0,1,0,0,0,0,0,RP,2021-06-07 18:24:49.181520
chammies_UCeBBtB3WtkZIFSBF2MWFcLQ_5YIRHk6JZk_818049_819177.wav,chammies_UCeBBtB3WtkZIFSBF2MWFcLQ_5YIRHk6JZk,818049,819177,1128,157,,0,0,0,0,1,0,0,RP,2021-06-07 18:24:54.950320
